Helpful Vote,Contributions,Overall Rating,Summary Heading,Summary,Date of Stay,Room tip,Trip Type,Manager Response,Location Rating,Cleanliness Rating,Service Rating,Value Rating,Rooms Rating,Sleep Quality Rating,Review Number,Index
none,2 contributions,5.0 of 5 bubbles,Robintravels,"We recently stayed at The Ayres hotel for the 3rd time in a year. I see a Doctor for treatment across the street at UCI Medical Center. Each stay has been fabulous, with absolutely no complaints! The General Mgr, Christine, sees to it that your needs and requests are always met. Her customer service is outstanding! She genuinely wants to make your stay a very pleasant experience. Brian drove me in the shuttle to my medical appointments (all complimentary). He's a super nice guy! During your stay, look for Reanna, at the front desk. She is the best!! She is always very pleasant, striving to give the best customer service possible. Another front desk employee, always willing to help is Christopher. They offer a complimentary breakfast in the morning, and Mon - Thurs from 5-7, in",March 2017,none,none,"Robin, I can't thank you enough for your outstanding review of the Hotel and my staff; it is posted for all the staff to read.  We try to treat all guests with the same warmth and caring attitudes but when we have such friendly and positive guests such as yourself; it makes it all the more easy to build a great relationship.  I know we will see you again in the future and until then, take care and know we are thinking of you and your family!! Very sincerely, Christine",none,none,none,none,none,none,611,101
1 helpful vote,9 contributions,5.0 of 5 bubbles,Pleasantly Pleased,"I have nothing but amazing things to say about the Ayres in Orange. Was amazingly beautiful, the staff was super nice, the rooms were beautiful and newly remodeled, the 'continental' breakfast was more like a little restaurant with amazing FREE food! The location is perfect with the shopping mall across the street, Disney 2 miles away, and the freeway close by! I would recommend this hotel any day to anyone!",March 2017,none,none,"Thank yo so much gabbylane for your recommendation to potential future guests!  I appreciate your kind words and am ""pleased"" that you so enjoyed the Ayres Hotel Orange!! Sincerely, Christine Smith General Manager",none,none,none,none,none,none,612,101
none,1 contribution,5.0 of 5 bubbles,A great experience,"From the moment I walked through the doors was treated with a friendly professional attitude, I was greeted at the front desk and was politely asked about the nature of my visit and immediately upon finding out that I might be coming back with a larger group promptly put me in contact with those that could help me plan.  I loved the way I was treated both as I was leaving or arriving and the genuine smiles that they had on their face, it made some long days feel better.",March 2017,none,none,"JMRaymer, I am pleased to know that we were able to make your stay a ""great experience"" for you!   Treating guests with respect, warmth and in a professional manner seems like an easy thing to do; but it doesn't always happen everywhere so I will thank my staff for their continued high level of guest service.  We do hope to see you back with your larger group and until then take care. Sincerely, Christine Smith General Manager",none,none,none,none,none,none,613,101
2 helpful votes,2 contributions,3.0 of 5 bubbles,"Descent, compare to others its got free parking , free breakfast , very close to disney, close to freeway, free wifi","The negative is the mattress is very soft, you cant take your breakfast food to eat in your room. Its a descent hotel , for the price its ok, rooms were clean too, they got lots of space to park, i would come back.",March 2017,none,none,"Thank you for your review.  I am so sorry the mattress was too soft for you; it is difficult for one type of mattress to please everyone and their sleep preferences.  Should you stay again, please request a ""bed board"" when you make your reservation; we will be happy to place it between the mattresses and box spring to help firm up the mattress. Sincerely, Christine Smith Manager",none,none,none,none,none,none,614,101
none,1 contribution,5.0 of 5 bubbles,Great place to stay,Staff was great. The breakfasts were very good. The rooms were clean and comfortable. Located in a pretty central location with shopping and food places close. We enjoyed our stay here and will definitely stay here again on our next California trip.,March 2017,none,none,none,none,none,none,none,none,none,615,101
none,1 contribution,5.0 of 5 bubbles,Fantastic Stay at Ayres Hotel Orange!,"My family stayed at Ayres Hotel Orange for 5 nights over Spring Break.  Asked for a top floor room and was given one on the fourth floor facing the pool.  Definitely get a room facing the pool since the other side faces the highway.  The hotel was exceptionally clean in all areas: room, pool, lobby, breakfast area, and gym.  The staff was very friendly and helpful.  The location was very convenient - around 10 minutes from Disneyland and 20 minutes to the nearest beach (Newport).  Parking in front fills up pretty quickly but there is ample covered parking in the back.  There were a lot of other families with small children so my kids were happy to meet new friends.  The room was spacious and well-appointed.  We had a view of the Disneyland fireworks from our room.  The breakfast",March 2017,none,none,"Wow, thanks Michael for you ""fantastic"" review of the Hotel.  Spring break has kept us hopping with more families than usual; and it is always fun to watch the kids interact and have such a great time away from home.  I am very happy the hotel and staff exceeded your expectations and we do hope to see you again in the future.  Again, thank you! Sincerely, Christine Smith General Manager",none,none,none,none,none,none,616,101
none,8 contributions,5.0 of 5 bubbles,Great hotel and staff,The staff was very friendly and made us feel very welcome during our stay. The rooms were clean never had a problem with house keeping. When we asked for extra blankets they brought them to us right away. This was our second time staying here and we will stay here again.,March 2017,none,none,"Thank you Wednesday S; you are now officially a ""wonderful return guest.""  Thank you for noting our guest service, my staff strives to meet and exceed our guest's expectations and I will post your comments as I do all guest comments, so they know they did a gerat job taking care of you and your family. Sincerely, Christine Smith General Manager",none,none,none,none,none,none,617,101
none,1 contribution,5.0 of 5 bubbles,Excellent,"Highly pleased with the service, cleanliness, comfy beds and delicious breakfast,  my kids wanted to ""live there"" lol staying at this hotel again for sure , the only thing I recommend if you have kids is to maybe take your own car instead of the tram because ita not much more to park at Disney and when you and your kids are tired at the end of day it takes really long on the way back to drop you off.",March 2017,none,none,"Thank you bettyt797 for taking your time to write an ""excellent"" review of the Hotel.  I am so pleased that the hotel met your expectations and proved to be the perfect place for your family's Disneyland trip.  We hope to see you again next year! Sincerely, Christine Smith General Manager",none,none,none,none,none,none,618,101
none,1 contribution,4.0 of 5 bubbles,SES,"would have liked brewed decaf coffee at breakfast, otherwise meal was very good and workout facilities adequate given the lack of competition. nice idea for the happy hour, although I did not partake.",March 2017,none,none,"Thank you for taking the time to review our hotel, we appreciate your and all our guests feedback.  We do hope to see you again in the future! Sincerely, Christine Smith General Manager",none,none,none,none,none,none,619,101
4 helpful votes,6 contributions,5.0 of 5 bubbles,Excellent Hotel,"We booked this hotel as we could not get into the hotel of our choice for two nights, once we arrived we wanted to stay longer! Friendly staff, spotlessly clean, large bath towels, very comfortable room and bed, FREE hot buffet breakfast and wine in the evenings what could be better? Oh, FREE parking! We will be back later in the year and cannot wait! We were worried about proximity to the roads but couldn't hear a thing in our room and the blackout curtains made sleeping very cosy.",January 2017,none,none,"Thank you LoudJezebel very much for taking your time to review the Ayres Hotel Orange.  I am so glad you tried us out and will be come a repeat guest.We look forward to seeing you and your family on your next visit to Orange. Sincerely, Christine Smith General Manager",none,none,none,none,none,none,620,101
2 helpful votes,2 contributions,3.0 of 5 bubbles,Despite some small problems it was good,"We stayed 4 nights and while we were there the service was good.  We requested rooms together but the hotel gave them away because they were full (don't know why that mattered).  They also ran out of cribs on the first night.  It was not a big deal and we received a crib the second night.  Finally, the gas was siphoned from our van the first night so make sure you park in a well lit and occupied area.  Aside from these things the staff was good and helpful.  The rooms were clean and roomy with comfortable beds and good tv's. The breakfast was good but the same every day (scrambled eggs, pancakes, hash-browns, bacon, fruit, yogurt, and pastries)  In all we would stay there again.",March 2017,none,none,"Dear wteancum, Thank you very much for your comments, we always appreciate our guest's feedback.  The hotel does try as best as possible to pre-block all requests but when a another guest who was to check out of the room we have other guests blocked into, decides to stay another night, their request to stay in the same room is granted first.  I am so sorry we were not able to honor your request to be closer.  I am also really sorry about your gas being siphoned, I spoke to Orange PD and apparently many hotels are experiencing this same problem.  We have asked our security company to spend a little extra time patrolling our parking structure and parking lots.  And lastly, thank you for staying with us in the future!! Sincerely, Christine Smith General Manager",none,none,none,none,none,none,621,101
none,1 contribution,5.0 of 5 bubbles,Great Stay,"Beautiful hotel close to amusement parks, sporting venues, and restaurants. Enjoyed the stay, which was our first stay at a Ayres Hotel. We will stay at this chain if traveling near one in the future.",March 2017,none,none,"Thank you, thank you, thank you!! Christine Smith General Manager",none,none,none,none,none,none,622,101
14 helpful votes,124 contributions,5.0 of 5 bubbles,Family visit to Disneyland,"Spent 5 nights here in February 2017. Large spacious 2 bed queen rooms , comfortable beds , no noise from adjoining rooms , or outside road noise .  Plenty of storage , fridge in room.   Free Buffett breakfast on site . Free parking , found spaces easily every night .  close to Disney , quick journey not much traffic when we were there .   Close to the outlets.   Would definitely stay here again.",February 2017,none,none,"Thank you MMJ-07, I really appreciate your review and that you found the Ayres Hotel Orange to meet all your needs while visiting our area.  We will look forward to seeing you again in the future should your travels bring you back our way. Sincerely, Christine Smith General Manager",none,none,none,none,none,none,623,101
none,1 contribution,1.0 of 5 bubbles,Sleep deprived,The room was too bright woke up early morning after I had long day at work i addressed  this concern to management and got no help but attitude very rude and wasn't listening about the sleep deprevation,March 2017,none,none,"Dear Guest, Again, I will extend my apologies for you not being able to sleep even though you had the blackout drapes drawn in your room.  Per our conversation, I explained that when the blackout drapes are completely closed the sleeping rooms are pitch black.  I told you that we have airline crews that are day sleepers and the drapes meet with their stringent contract requirements regarding no light being let into rooms.   I also explained to you that since the Hotel opened we have never had a guest complain that there was too much light in the room when the blackout drapes are closed.  Lastly, I told you that I did not feel the hotel was in any way at fault for you not being able to sleep and I would not honor a discount in your rate per your request. Respectfully, Christine Smith General Manager",none,none,none,none,none,none,624,101
19 helpful votes,13 contributions,5.0 of 5 bubbles,Business Trip Expo West,"Excellent quiet hotel close to Anaheim Convention Center. Many restaurant choices within walking distance as well. Staff was excellent, free breakfast was very good. Starbucks on the corner! Will stay again.",March 2017,none,none,Thank you Andrew for your kind review of the Ayres Hotel Orange!  I am happy to hear you enjoyed your stay and will be cak for a future stay. Sincerely Christine Smith Manager,none,none,none,none,none,none,625,101
none,1 contribution,5.0 of 5 bubbles,Ayres hotel,Had a great stay at the ayres hotel. Really nice and clean inside and out. The kids loved that bath tub. Had a decent hot breakfast buffet also. Only thing I wished they had was more equipment for the workout room other then that 👌👌👌,March 2017,none,none,"Thank you Steve for taking your time to review the Ayres Hotel Orange.  I am glad you and your family enjoyed the hotel and we do hope to see you again int he future!! Sincerely, Christine Smith General Manager",none,none,none,none,none,none,626,101
none,1 contribution,5.0 of 5 bubbles,Amazing!,"This place was awesome and at such a great price, you can't beat it. They went above and beyond to help out with all accommodations for a surprise I had planned. Room was squeaky clean which was one of the most important things to us. Free HBO and WiFi and very cozy rooms. Definitely would recommend to anyone visiting Disneyland. Quick 5 minute Uber/Lyft or drive, and don't have to deal with downtown traffic.",February 2017,none,none,"Dear BakerTB11, My staff was very happy to help you out with your surprise; we have been really enjoyed being a part of all kinds of surprises in the past.  The hotel has helped with marriage proposals, Christmas trees in rooms upon check-in, romantic requests of champagne and flowers, kids birthday surprises, etc..  We are open to help with any and all (has to be legal) surprises our guests want to do for their families or significant other. thank you for choosing the Ayres Hotel Orange.  Sincerely, Christine Smith General Manager",none,none,none,none,none,none,627,101
none,4 contributions,5.0 of 5 bubbles,Outstanding Surprise!,"Who would have guess that this close to many treasure to visit in Orange was this lovely and exceptionally manicured hotel. It was immaculate, warm colors and very spacious and happy. The employees all smiles and greeted you and the breakfast was amazing and FRESH. We are going to recommend it to any family also that is going to Disneyland. Don't waste your money on those crap hotels close to Disney. This is a quiet respite after any long day and reasonably priced.",February 2017,none,none,"Dear Franny_9 Thank you for touting the cleanliness of the hotel along with the friendliness of my staff.  We work hard to please our guests while they are here, so they will one day return to the Ayres Hotel Orange.  Again, thank you! Christine Smith General Manager",none,none,none,none,none,none,628,101
3 helpful votes,6 contributions,5.0 of 5 bubbles,Clean Spacious Friendly Breakfast Comfortable Breakfast Wine,This is the cleanest hotel I have been in.  The rooms are spacious. There is a partition between the beds for rooms with 2 beds. The beds are comfortable. The rooms are quiet. Towels are white are large. The bathroom is large with a large shower tub. Electrical outlets now have 2 plugs with 2 USB outlets. Very friendly staff members. Tasty fresh cooked breakfast. Wine in the evening with cookies.  I will stay at this hotel and any of the Ayres Hotel brand.,February 2017,none,none,"Dear Never Leave You...T And we are so happy to hear you will"" never leave"" the Ayres Hotel as nothing less than a Satisfied Guest!  Please do try our other Ayres Hotels, located as far north as Paso Robles California, as far west as Seal Beach, as far south as Alpine and as far east as Ontario and Moreno Valley.  Thank you for becoming a loyal customer! Sincerely, Christine Smith General Manager",none,none,none,none,none,none,629,101
none,1 contribution,5.0 of 5 bubbles,Anaheim Ducks Throwback Hockey Tournament,"The hotel room was clean, quiet, well laid out, comfortable and everything worked properly.  We enjoyed our stay and won our tournament!  We took advantage of the in-room refrigerator and microwave, as well as the coin-operated laundry to wash my uniform between games.",February 2017,none,none,"Thank you Larry for your great review of the Ayres Hotel Orange.  My staff ad I are happy that you and your family found us the perfect hotel for the tournament.  We do hope to see you back when participating in upcoming tournaments. Sincerely, Christine Smith General Manager",none,none,none,none,none,none,630,101
none,1 contribution,5.0 of 5 bubbles,Excellent customer service.,"It was a great room, that had complimentary buffet style breakfast. The room was clean and well equipped with a microwave and a refrigerator.  The only thing I did not like and we should have asked for was getting joining rooms, which we didn't get even though we booked two rooms for that trip.",February 2017,none,none,"samcM3691UB Thank you for your ""excellent"" review!  Yes, the hotel will block adjoining or connecting rooms when requested by our guests; those reservations receive priority blocking of rooms.  After requests are met, all other reservations are blocked as best as possible, if we  see multiple reservations with the same name we try to block close by but it also depends on stay-over guests and what rooms are left. I am sorry Sam that we were not able to get your rooms closer this time.  Just request in the future and gain, thank you! Sincerely, Christine Smith General Manager",none,none,none,none,none,none,631,101
none,1 contribution,5.0 of 5 bubbles,Great hotel,"This is our 2nd time staying at Ayres and both stays were great! Very clean, family friendly, great pricing, great staff and a very nice relaxing atmosphere. Ayres is definitely our hotel of choice if available.",February 2017,none,none,"Thank you macky8799!  My staff and I are very happy to hear we are now a ""repeat"" guest!  Thank you for making Ayres your #1 choice! Sincerely, Christine Smith General Manager",none,none,none,none,none,none,632,101
none,8 contributions,5.0 of 5 bubbles,Great hotel!,"I really enjoyed staying here. It's a quaint hotel beautiful lobby lovely breakfast and large comfortable rooms. They also have quite a good fitness center with free weights, weight machine and cardio. The pool area includes a hot tub. A very nice hotel!",February 2017,none,none,"Thank you travelwhenican; you are a fellow traveler after my own heart!  I am very pleased that your found our hotel to be ""great"", and hope to see you again on future journeys. Sincerely, Christine Smith General Manager",none,none,none,none,none,none,633,101
35 helpful votes,28 contributions,4.0 of 5 bubbles,Spacious & Sparkling Clean!,"My daughter and I stayed at the Ayres while touring nearby Chapman University. This was my second visit, and found it consistent with the first. It is a convenient, clean property with welcoming touches - just the thing when you're traveling  and need everything to be easy. I love how cookies and beverages (including wine for adults) await afternoon/early evening arrivals. Parking is right out front and free, front desk staff is friendly, and rooms are comfortable and...roomy. The only negative I found is proximity to dining options. While the location, being near freeways, is handy for traveling it's not really walkable. I like being at hotel where you can go downstairs or next door for dinner. While there is a nearby Mexican restaurant, we checked in on a Monday and it was",February 2017,none,none,"Dear CaliforniaGal408, Thank you for your wonderful review!  I am so sorry that Anepalco's was not open during your stay, yes they are closed on Mondays.  If I may suggest walking down to the Outlets of Orange (2 long blocks from hotel), for dinner on your next visit.  There is a large number of restaurants from fast food to fine dining, and our area is very safe to walk around throughout the day or evening.   Again thank you for being a loyal Chapman parent! Sincerely, Christine Smith General Manager",none,none,none,none,none,none,634,101
none,1 contribution,5.0 of 5 bubbles,Great hotel in every aspect,"Spacious rooms, freshly made breakfast (cooks right in front of you), close to Disneyland. Updated rooms. Clean rooms. I have no complaints. Rooms are larger than your average hotel room. Pullout couch. Continental breakfast. Great pool and hot tub area.",February 2017,none,none,"Thank you Michael for your ""great"" review of the Ayres Hotel Orange!!  HOpe to see you again in the near future! Sincerely, Christine Smith General Manager",none,none,none,none,none,none,635,101
none,1 contribution,4.0 of 5 bubbles,ALWAYS A PLEASASNT STAY,"I travel for business. Easy in and out an free breakfast to get the day moving.  Everyone is pleasant and hotel is clean and comfortable.  Parking is easy. Although I did not use, there is a nice small pool and whirlpool..",February 2017,none,none,"Thank you George for taking your time to let us know you appreciate our hotel!  We will see you on your next business trip to the area. Sincerely, Christine Smith General Manager",none,none,none,none,none,none,636,101
none,1 contribution,5.0 of 5 bubbles,Wedding stay,"It's a great hotel, friendly, helpful, clean, great choices for breakfast and fun extra surprises! Like fresh cookies, wine and beer tastings in the lobby in the evenings. Had lots of family staying here with us,so we had a suite, it was great for everyone to gathered together!",February 2017,none,none,"First, congratulations on your new marriage!!!  My staff and I are happy to know we helped make the wedding memorable for you and your guests.  And thank you for taking the time to write a review and let us know that everything went well for this special event. Sincerely, Christine Smith General Manager",none,none,none,none,none,none,637,101
none,1 contribution,5.0 of 5 bubbles,Terrific hotel,"Modern, clean, well designed, comfortable rooms, nice exercise room, great breakfast included, great value. Highly recommended for business or personal and well located. Hope to return there again in future.",February 2017,none,none,"Thank you, thank you, thank you Jeff!!",none,none,none,none,none,none,638,101
4 helpful votes,10 contributions,4.0 of 5 bubbles,Conveniently located hotel right on the freeway,"Despite directly on busy streets it is very quiet hotel. However, without green spaces around the hotel. Rooms spacious and clean. Wlan could be better, but always worked. Breakfast extensive but monotonous.",February 2017,none,none,none,none,none,none,none,none,none,639,101
255 helpful votes,926 contributions,5.0 of 5 bubbles,Very nice hotel,We stayed here for 2 nights for a friend's wedding. Very spacious room with very comfortable bed and clean. Also very spacious washroom. The staff are very friendly and helpful. There is complimentary breakfast. It is less than 10 mins walk to the Orange outlet where you can find a big variety of shops. It is 8 mins by car from the French Estate where the wedding is. Free parking and very close to the highway.,February 2017,none,none,"Thank you, thank you for your nice review.  I am very happy you enjoyed your stay while here for a wedding.  We do work with the French Estates to provide wedding groups with a great rate and am glad you enjoyed the Ayres Hotel Orange. Sincerely, Christine Smith General Manager",none,none,none,none,none,none,640,101
3 helpful votes,19 contributions,5.0 of 5 bubbles,A Real Jewel Near Disneyland,"We were visiting friends in Orange, CA and needed a hotel. Based upon the great reviews on Tripadvisor  we selected this hotel. It was a really good decision.  This is not one of those ""cookie cutter"" hotels. It has a lovely European feel to it in looks and ambiance. That said, the room was large (un-European size), very well appointed and comfortable. The included breakfast was a very nice buffet. Everything was fresh. AND, the breakfast room is large and comfortable. Plenty of tables and chairs -- not cramped like some other places. AND the breakfast hours are generous -- 6:30 - 10:00 AM during the week (I'm not sure what the weekend hours are). In the morning, at breakfast, we did see a number of families with children, obviously headed to Disneyland. So the secret is out.",February 2017,none,none,"Thank you Bob for your great review, and yes ""the secret is out.""  The hotel enjoys a varied clientele from Disney families, UCI patients and families, corporate and university guests and people visiting friends in the area, such as yourself.  The Ayres Family definitely does not build""cookie cutter"" hotels with each hotel a little different in theme and decor; thank you for noticing!!!  We do hope to see you again the next time you visit your friends! Sincerely, Christine Smith General Manager",none,none,none,none,none,none,641,101
