Helpful Vote,Contributions,Overall Rating,Summary Heading,Summary,Date of Stay,Room tip,Trip Type,Manager Response,Location Rating,Cleanliness Rating,Service Rating,Value Rating,Rooms Rating,Sleep Quality Rating,Review Number,Index
none,1 contribution,5.0 of 5 bubbles,"Clean, Comfortable and Roomy","The accommodations were clean, comfortable and roomy.  And the location is excellent; we were visiting our student at Chapman University.  The breakfast service was also very high quality..  Easy on/off freeway access as well.",March 2023,none,none,none,none,none,none,none,none,none,1,101
none,1 contribution,5.0 of 5 bubbles,Great People and Great Service!,Hotel is very clean and staff are super friendly!  Great amenities and spacious rooms. The hotel is perfectly located to Chapman University and the beautiful town of Orange.  Lots to do and see and this is a great choice to stay!,March 2023,none,none,none,5.0 of 5 bubbles,none,none,none,none,none,2,101
none,1 contribution,5.0 of 5 bubbles,Great visit!!!,Our family had a great stay this past weekend at the Ayres Hotel Orange. We will definitely make this our new go to hotel. It is very spacious for big families traveling. Breakfast was amazing and there restaurant and bar in the evening was amazing. Can't wait until our next vacation. Thanks guys!!!,February 2023,none,Traveled with family,none,none,none,none,none,none,none,3,101
none,1 contribution,5.0 of 5 bubbles,Excellent Concierge,"Greeted By a Welcoming Concierge named Ree, She was very Helpful with Places to eat nearby & other Family places to visit. Smooth check in & Great Customer Service! I would definitely recommend staying here😊",January 2023,none,none,none,none,none,none,none,none,none,4,101
10 helpful votes,9 contributions,5.0 of 5 bubbles,"Great property, exceptional staff.","My daughter is a student at a local university and I stay at this property every time I visit her, which is about 4 times a year.  The rooms are large and spacious. My husband is able to set himself up to work very comfortably at the sitting area in the room.  They offer a complimentary full breakfast buffet, with both hot and cold options. The variety is quite impressive. The staff during breakfast are all very pleasant and helpful, offering to take away our dishes as soon as we are done, even though it is a buffet, and help is not typically expected. There is a gentleman who is great, and a young woman named Natalie who is honestly exceptionally sweet and lovely. With all the people who much come in and out of the hotel all the time, she somehow consistently knows I am a",February 2023,none,none,none,none,none,none,none,none,none,5,101
3 helpful votes,2 contributions,5.0 of 5 bubbles,Ayers  Hotel Review,We stayed at Ayers Hotel Orange a few weeks ago when we went to Disneyland. It is a short drive to the Toy Story parking lot. The rooms were very clean and spacious. We enjoyed the free breakfast and friendly staff.,February 2023,none,none,none,none,none,none,none,none,none,6,101
2 helpful votes,2 contributions,5.0 of 5 bubbles,"Nice hotel, nice staff",This is for the Orange Ca. Great for family. We  stayed  stayed there while our granddaughter was having surgery at Children’s  Hospital Orange County. I would highly recommend.  Our granddaughter was even able to go for a swim in the middle of February.,February 2023,none,Traveled with family,none,none,none,none,none,none,none,7,101
none,1 contribution,5.0 of 5 bubbles,Nice place to stay;Very clean!,The room was very nice. The bed was very comfortable. The hotel is kept very clean. The room's refrigerator made a continuous high pitched noise that I had to unplug at night to be able to sleep. The TV picture kept fading out.,February 2023,none,Traveled solo,none,none,none,none,none,none,none,8,101
none,2 contributions,5.0 of 5 bubbles,Ayres is the way!,"Really enjoy staying at Ayres Orange when I come to visit my son at Chapman. Quiet hotel,  Clean, big rooms. Free parking, breakfast included. All staff is great.  Thank you for a another great stay!",February 2023,none,Traveled as a couple,none,none,none,none,none,none,none,9,101
none,2 contributions,5.0 of 5 bubbles,Always a comfortable stay at the Ayres Orange!,"I have stayed at the Ayres Orange a few times now and I have always enjoyed my stay. The pillows and bed are comfortable, the location is great for Chapman families, and they even give a discount for Chapman families since we're there so often! The staff is helpful and friendly, too. I highly recommend giving the Ayres Orange a try!",February 2023,"There is a little bit of street noise, but it wasn't unbearable.",none,none,5.0 of 5 bubbles,none,none,none,none,none,10,101
1 helpful vote,2 contributions,5.0 of 5 bubbles,Perfect stay in Orange,"Staff was busy when I checked in, but they greeted me with a friendly hello and told me they'd be right with me. The check in process was quick and easy, the room was nice and spacious, well thoughtout design. The beds were comfy and the view was nice. Breakfast was delicious and we got a discount card for use at their on-site restaurant. Didn't get a chance to use it this trip, but we're planning on making this our regular place to stay when in the area.",February 2023,none,none,none,none,none,none,none,none,none,11,101
24 helpful votes,40 contributions,5.0 of 5 bubbles,Wonderful place to stay with kids,A very comfortable stay we had during our two night trip to his part of LA. The hotel has a very inviting ambience the moment your enter it. The rooms are spacious and well designed. The basin and bath area are in a separate section which is good. There is ample closet space to hang clothes. The beds are very comfortable.  The free breakfast is very good although I would have appreciated more variety.  Overall value for money.,February 2023,none,none,none,none,none,none,none,none,none,12,101
1 helpful vote,15 contributions,5.0 of 5 bubbles,Clean and Comfortable,This was a fantastic hotel. Everything was clean and in great condition. Our two queen beds had a half-wall between them which was nice. We loved the breakfast--there were lots of options and the fresh items rotated throughout our stay. Hotel staff was friendly and helpful.   We stayed here because it is close to Chapman. There is no Ayres-run shuttle to Disney but the front desk provided us with information on how to request a (cheap! cheaper than an Uber) shuttle that also took us back to the hotel at night.,January 2023,none,none,none,none,none,none,none,none,none,13,101
none,none,5.0 of 5 bubbles,Great Business and Family Hotel,"Our out-of-town employees stay at this Ayres when visiting our company HQ.  It is very nice, large rooms and ample items for breakfast.  Many families stay here, I assume they are visiting Disney etc.  I prefer this Ayres over the sister Ayres adjacent the Anaheim Regional Transportation Center and Honda Center.",January 2023,none,none,none,none,none,none,none,none,none,14,101
none,none,5.0 of 5 bubbles,Great Experience! One of the Cleanest Hotels!,"Upon arrival was greated very pleasantly.  During my two night stay received excellent customer service, from front desk representative Athena. The rooms very spacious anf extremely clean. Beds and pillows we very comfy, I highly recommend this hotel and will come again!",December 2022,none,none,none,none,none,none,none,none,none,15,101
21 helpful votes,44 contributions,5.0 of 5 bubbles,Excellent value,"Stayed there while visiting a friend in the hospital - had a very spacious, spotless room that was really quiet as well - would definitely stay there again if I was in the area.  Literally across the street from UCI Medical Center.",November 2022,none,none,none,none,none,none,none,none,none,16,101
none,2 contributions,5.0 of 5 bubbles,Great place to stay away from home,"I stayed here with my daughter for a softball tournament for 5 days and our experience was top notch. The customer service was amazing at the front desk, the restaurant, as well as our room service. This hotel is very clean and accommodating from the smallest things like silverware to go or extending our stay as we did. Today’s day in age I believe good customer service has become very challenging to reach but this hotel has done just that. I highly recommend staying here as I know we will in the future. Thank you!",November 2022,none,none,none,none,none,none,none,none,none,17,101
none,none,5.0 of 5 bubbles,Thank you Ayres Hotel Orange,"We slept through the night very comfortably and woke up every morning feeling well rested. Starting the day with satisfying complementary breakfast was also a plus. Great stay in a comfortable, clean, safe, and friendly environment. We hope to visit again soon.",November 2022,none,none,none,none,none,none,none,none,none,18,101
none,1 contribution,5.0 of 5 bubbles,Delighted,"We are a Chapman University family attending a function at the school & was pleasantly surprised at the service, and friendliness of the staff at the hotel.  Breakfast was fantastic (fruit, yogurt, juices, dry cereals, coffee, tea, bagels, bread, danish, scrambled eggs, hot cakes and the proteins change everyday (longanisa, sausage links, bacon) . . didn’t have to worry about finding breakfast!  Room was clean, spacious for 3 people (I like the bed divider between the 2 beds we had), microwave oven, small refrig. coffeemaker with packages to make the coffee, water cups, ice jug, guest laundry ($4/load to wash, $4/load to dry).  I love the front desk/Lobby area (places to sit, faux fireplace, table to play cards or board games if you brought any, a quiet place to read,",November 2022,none,none,none,none,none,none,none,none,none,19,101
none,1 contribution,5.0 of 5 bubbles,GREAT and CLEAN Hotel,"GREAT, CLEAN AND VERY NICE HOTEL!! My family and I only stay at this Hotel as we travel for business and personal. From the front desk when arriving great customer service, Athena, William, Liam, Brian and Christopher are all very professional and have great personalities. The cleaning ladies in addition knowing they have security Michael and the parking lot has lots of lighting. The breakfast in the morning is delicious Yolanda in the breakfast area is welcoming. The Gym is very clean and has a great overall workout selection. The pool and spa area is nice and relaxing! The dinner at Spoons is fresh and great food options. I would highly recommend staying at this Hotel!",November 2022,none,none,none,none,none,none,none,none,none,20,101
none,1 contribution,5.0 of 5 bubbles,Visiting a Chapman college student,"Ayres  is always our first “go to” when we stay in Orange.  People and service are great, rooms perfect for our visit.  Breakfast had good clean options that was appreciated.  Parking was good, as was location to see our college kid.",November 2022,none,none,none,none,none,none,none,none,none,21,101
66 helpful votes,45 contributions,5.0 of 5 bubbles,"Great service, great breakfast, great hotel.","This is our second stay at Ayres Hotel Orange.  We are from Canada and we specifically seek out this hotel.  It is extremely clean and very quiet.  The rooms are big as is the bathroom.  You have a small fridge and microwave in your room too.  The staff are so great to deal with and the breakfast is fantastic.  The morning breakfast team are always so pleasant and the food is hot and yummy.    They have a pool with a hot tub and a fitness centre that is well equipped.  They also have laundry on the 2nd and 4th floors.  If I have one area that they could improve on is their pillows.  They are extremely soft and flatten easily.  They do give you four pillows on the bed, but stacking 2 is almost too much.  I found a pillow in the closet that was more firm, but it too was very flat",October 2022,none,none,none,none,none,none,none,none,none,22,101
none,27 contributions,5.0 of 5 bubbles,One of the best among many hotels around the world,"This was a big surprise. We did not even know this hotel existed. We got them in a package on our trip to Disneyland. I love the tall bed, everything is clean and new, nice staff, nice little pool. Breafkast was awesome, lots of tables and variety of food. They had sausages, scranbled eggs, panckakes, fruit, yogust, cereal, milk and fruit juices, bacon, you name it.  The hotel was not very far from Disneyland also, and they had a shuttle to Disneyland, but we decided to drive and park at the Toy Story parking lot. By the check in they have a little shop for snacks and other necessities. They do not have an ATM but there is one at the hotel next to it, the Alo Hotel.   The parking is covered, and huge. I did not use they gym but it was also impressive. If you want to enjoy your",October 2022,none,none,none,none,none,none,none,none,none,23,101
none,none,4.0 of 5 bubbles,October 9th- October13th,Asked for tv color to ve fixed one night had to reached in am Christopher took care of it fixed next day. Asked for new pillows Christopher took care ofput. Asked for service for our room Christopher took care of it.Breakfast staff two young ladies super awesome. Cons asked for service new linens one day same linens just remade bed had same coffee stain. In shower used wash clothes left in shower. Housekeeping knocked at 8:15am day we leaving awoke us and asked what time we checking out.,October 2022,none,none,none,none,none,none,none,none,none,24,101
none,1 contribution,5.0 of 5 bubbles,Trip to Disney,"My husband and I came to celebrate our one year anniversary at Disney and this hotel was by far the best. We stay at different hotels a lot and this by far was the best location. We enjoyed the delicious buffet style breakfast, housekeeping was amazing and the front desk staff was professional and helpful. Will definitely stay here again.",October 2022,none,none,none,none,none,none,none,none,none,25,101
175 helpful votes,570 contributions,4.0 of 5 bubbles,Nice hotel close to shopping,"This is a nice and clean hotel. The room is very comfortable and roomy, pool and hot tub was in great condition and the hot breakfast was good.  It's located within walking distance to the outlet malls and a few restaurants but if you are looking for walking distance to the Honda Centre stay at the other one.",October 2022,none,none,none,none,none,none,none,none,none,26,101
15 helpful votes,50 contributions,4.0 of 5 bubbles,Wonderful stay in Orange,"We were happy with our one week stay at Ayres. We chose this hotel for our Disney vacation. The property was clean, well maintained and had lots of parking spaces. Check-in and check-out was a breeze. Our room was huge and had everything we needed except for a safe.   We enjoyed having breakfast every morning as well. The people working at the restaurant were always friendly. There wasn't a lot of options for breakfast but that's ok coz it was just a bonus for us, we didn't really go there for the breakfast.   We also tried the hotel's restaurant for dinner and we were satisfied with the food. There's also a lot of restaurants nearby so you have options if you want variety.  We were on the 4th floor -- it was a little bit noisy as it was by the freeway so you can definitely hear",September 2022,none,none,none,none,none,none,none,none,none,27,101
none,1 contribution,5.0 of 5 bubbles,"Fantastic, better than expected","The room was great. The place as a whole was kept well clean. The breakfast was sooooo good, and we loved it. The room service worked great as well. Parking was a little out of the way, but free, so very good. If you are looking at the hotel for ease of access to Disneyland, prepare to travel a bit, but honestly a great hotel. I found it far better than I expected it to be.",September 2022,none,none,none,none,none,none,none,none,none,28,101
none,5 contributions,5.0 of 5 bubbles,Very pleasant experience,I came here with about 31 other women for a scrapbooking weekend. The space was more than adequate and that in itself was a pleasant experience. My room was immaculate…the entire property is very very clean. Someone is always cleaning. Front desk is very helpful. One small complaint…I ate at Spoons two nights in a row. The second night I ordered nachos and there was a hair in it. I didn’t say anything…just grossed me out. Next morning at the breakfast Ayres serves…there was a hair in my food. Two times is NOT okay!,September 2022,none,none,none,none,none,none,none,none,none,29,101
none,1 contribution,5.0 of 5 bubbles,The staff was very friendly and accommodating.  Will definitely stay at Ayres in the future.,"My room was very spacious, clean and comfortable.  The breakfast was delicious and the coffee was very good!  I would definitely recommend this hotel to anyone and will make sure to book this place on a future trip.",September 2022,none,none,none,none,none,none,none,none,none,30,101
none,2 contributions,3.0 of 5 bubbles,Needs improvement,Pros: Quiet and clean hotel. Good location as well. Spacious rooms. Free parking.  Cons: Very limited breakfast. Uncomfortable beds - they're not hard enough. Very small refrigerator. No Safe inside our room. Phone is not working. You have to pay almost 35% more if you want to extend your stay.  Front Desk Receptionists are not nice except William R.; he's nice and professional. Housekeepers are much better than Front Desk employees. Some of the housekeepers are nice and friendly.,September 2022,none,none,"Dear Valued Guest,  Thank you for taking the time to rate and review your recent stay! We are thrilled to see you were satisfied with the spaciousness and cleanliness of our guest rooms. I sincerely apologize for any inconvenience you encountered regarding the offerings at our complimentary breakfast,  the service you received from our team, and the comfort of our mattresses. Our goal is to provide exceptional experiences, and we are disappointed we did not successfully do that for you this time. Your feedback is appreciated, and we hope to have the chance to welcome you back for an improved visit soon.  Sincerely,  Luis Lopez General Manager",none,none,none,none,none,none,31,101
none,1 contribution,5.0 of 5 bubbles,Excellent Time at the Ayres Hotel Orange,"I just returned home from a five day stay at the wonderful Ayres Hotel.  It was comfortable, fun, and a real treat.  the team at Ayres is very friendly, knowledgeable and accomodating, notably the front desk people - all just excellent. I was treated like a VIP, and everything was just a pleasure.  Mr. Brian Lattimer, and Christopher, and all the wonderful team of associates at Ayres made my stay an exceptional treat.  I thank them and hope to visit again soon and often.  Bravo Ayres.  I'll be back.",September 2022,none,none,none,none,none,none,none,none,none,32,101
none,1 contribution,5.0 of 5 bubbles,Business Stay,The hotel is very nice and the staff were all so very nice and pleasant. My stay was wonderful and I will definitely be returning to stay at the beautiful hotel. Every staff member greeted me as I passed by and so that was very welcoming.,September 2022,none,none,none,none,none,none,none,none,none,33,101
none,1 contribution,4.0 of 5 bubbles,Stingy with the bacon,"This is a great hotel, it's always our favorite spot. This time though, the breakfast staff put limits on the bacon, 2 per guest, dont you dare go back for seconds!! That was a first for us. Didn't really appreciate the breakfast lady, she was a bit rude about it.",September 2022,none,none,none,none,none,none,none,none,none,34,101
none,5 contributions,5.0 of 5 bubbles,A lot of bang for your buck!,"This was my first experience with an Ayres Hotel & it will definitely NOT be my last! I have zero complaints. This hotel is modern & clean with big beautiful rooms, a very friendly & helpful staff, and a delicious complimentary breakfast. I will be back!",September 2022,none,none,none,none,none,none,none,none,none,35,101
none,1 contribution,5.0 of 5 bubbles,Underrated!!,"This hotel is surely not the resort style but their services exceeded the services of any hotel resort I stayed at. I was so delighted at how friendly, efficient and professional the staff were! Anywhere from the housekeeping, breakfast staff to receptionists, all of them are intentional and feels like family! The rooms are exceptionally clean. The amenties like microwave and mini fridge made all the difference when you have little ones who are still milk drinkers. The hotel is small, making access to everything much easier. This is such a great find! They surely exceeded my expectations.",September 2022,none,none,none,none,none,none,none,none,none,36,101
none,1 contribution,5.0 of 5 bubbles,Hotel Guest/ Castillo,"I booked reservations at this hotel many times. Very well maintained establishment. Cleanliness was great, internet good, very cozy beds, lighting and aroma in rooms great, staff and management are also great. Only time I had an issue was because of a guest that was next door to me but staff and management helped me out. They will do their best to accommodate you if you have any issues. So I would definitely recommend booking at this hotel.",September 2022,none,none,none,none,none,none,none,none,none,37,101
3 helpful votes,37 contributions,5.0 of 5 bubbles,Love this hotel,"This place is so clean and wonderful.  Great accommodations, so clean. Came her for Chapman University which is close.  Great full cooked breakfast. Plenty of space in the room. Staff is friendly and accommodating.  Great find. Will be back.",August 2022,none,none,none,none,none,none,none,none,none,38,101
none,1 contribution,5.0 of 5 bubbles,The best hotel I have stayed in.,"All the staff was very friendly and understanding, and the hotel is very clean The location was good I troped my daughter off at Chapman University. The breakfast was enjoyable, room service was on time. My daughter enjoyed the pool and I even found time to work out at the gym, I will stay again.",August 2022,none,none,none,none,none,none,none,none,none,39,101
none,1 contribution,5.0 of 5 bubbles,Wonderful Hotel,"Booked a weekend stay at Ayres Hotel Orange and I must say we loved every minute spent at he hotel.  Our room was beautiful, large and very updated. The complimentary breakfast was delicious and had a great selection of food to choose from. The staff were very friendly and knowledgeable and got us checked in and out very quickly.  I highly recommend this hotel and we will definitely book again when in we are in town.",August 2022,none,none,none,none,none,none,none,none,none,40,101
319 helpful votes,12 contributions,3.0 of 5 bubbles,Okay stay,The hotel room is okay but beddings are very thin and cheap. It’s quite noisy because it’s right by the freeway and we had someone above our floor stumping loudly into the night and early morning! Breakfast is included which was nice. The front desk people are always rude. They chit chat with each other all the time and did not pay much attention to service the customers.,August 2022,none,none,"Dear Christine Chen,  Thank you for taking the time to write a review based on your recent stay! I sincerely apologize for any inconvenience you encountered regarding our bedding and the service you received from our team. We strive to provide exceptional experiences and are disappointed that we fell short this time. Your feedback is appreciated as we can use it as a tool to improve for the future. We hope to have the opportunity to welcome you back for an improved visit sometime soon.  Sincerely,  Luis Lopez General Manager",none,none,none,none,none,none,41,101
2 helpful votes,3 contributions,5.0 of 5 bubbles,Gem of a hotel!,Very nice hotel.  Great location. Very close to outlet mall if you like to shop and lots of restaurants. The room was huge and very clean.  William at the front desk was so accommodating and friendly. Never stayed at an Ayres Hotel but definitely would stay at here again!,August 2022,none,none,none,none,none,none,none,none,none,42,101
38 helpful votes,56 contributions,5.0 of 5 bubbles,"Amazing Hotel - Great Staff, Location, Breakfast and Spacious Rooms","My husband and I stayed here and I was very impressed. I messaged beforehand to ask about storing our luggage as we were going to arrive before check in. They messaged back right away and said we could check in if the room was ready (it wasn't, but they stored our luggage for us). I had requested a higher up floor, but when we checked in, they had us on the main floor. I asked to be moved higher up, and they were able to move us to the 3rd of 4 floors which was greatly appreciated. The room was VERY spacious with so much room for storage and lots of counter space. As advertised, there was a microwave, coffee maker, and fridge that actually kept everything cold (and we had it jam packed). The shower was very nice, and hot with a huge tub. The AC worked perfectly. I found the bed",July 2022,none,none,none,none,none,none,none,none,none,43,101
none,1 contribution,5.0 of 5 bubbles,Great place to stay,"We stayed at the Ayres Hotel Orange for 7 days and had a great experience.  It was a clean hotel and at a time when many hotels are cutting corners, this hotel didn't seem to do that.  Every staff member we interacted with was extremely friendly and helpful. Plus they had an outstanding breakfast included in the cost of the hotel.",July 2022,none,none,none,none,none,none,none,none,none,44,101
