Helpful Vote,Contributions,Overall Rating,Summary Heading,Summary,Date of Stay,Room tip,Trip Type,Manager Response,Location Rating,Cleanliness Rating,Service Rating,Value Rating,Rooms Rating,Sleep Quality Rating,Review Number,Index
41 helpful votes,36 contributions,4.0 of 5 bubbles,A good place to stay when in Orange,"Large room with comfortable bed; no discernible road noise despite being close to the freeway. Free wifi which extended to the end of my late check out which I appreciate. My only gripe is that there are no glasses or coffee cups, just disposable cups. A very small point to be fair and something I find in many US hotels.",May 2016,none,none,"CoffeeAddict, Thank you for your review and I do hope you found Starbucks around the corner.  I appreciate your comment regarding the hotel not having real cups and glasses in the rooms.  This was a decision by our Corporate office with the support of Ayres General Managers based on wanting to supply guaranteed clean cups and glasses in our rooms.  should you stay with us again, please request ceramic cups and the hotel will be happy to supply them in your room.   Again, thank you! Sincerely, Christine Smith General Manager",none,none,none,none,none,none,904,101
3 helpful votes,7 contributions,5.0 of 5 bubbles,Great location for a Chapman University visit,"I always stay here when visiting my daughter at Chapman.  It is clean, rooms are very nice and you can drive to campus WITHOUT navigating the highway!  I will miss not staying here in the future, as my daughter has now graduated.",May 2016,none,none,"First, congratulations Mom on your daughter receiving her diploma; I am sure she worked hard the last four years and I wish her the best in her job search and future.  Thank you for your review and although your daughter is no longer at Chapman, we hope you you stay again should you find yourself in our area for other reasons. Sincerely, Christine Smith General Manager",none,none,none,none,none,none,905,101
none,2 contributions,5.0 of 5 bubbles,Great stay during a Disneyland visit,"We recently went down to SoCal for a weekend at Disneyland and we wanted a nice hotel that was just far away enough from the parks to not be crawling with kids. This is not the closest Ayres to the parks but they still gave us a $20/night discount for showing our annual Disney passes. BTW, I have nothing against kids staying with their families in hotels, I just prefer a quieter place in the evening. And this place fit the bill, didn't see or hear a single little tyke the whole time we were there.  The first evening we were there my husband and I went for a soak in the hot tub and had the place entirely to ourselves. The pool looked nice too but the weather was a little too cool to make a swim sound appealing. The room itself was very comfortable, soft mattress, which I really",May 2016,none,none,none,none,none,none,none,none,none,906,101
13 helpful votes,22 contributions,5.0 of 5 bubbles,Beautiful hotel!,"AYRES always has beautiful hotels, and this was no exception.  As expected, and the reason for booking with them, we had a LOVELY room.  BUT .... this hotel sits on a very, very busy street and our room FACED that street.  We got NO SLEEP from the constant traffic noise.  A MISERABLE night in a VERY NICE ROOM.",May 2016,none,none,"Terri,  Thank you for your great review, but let me apologize for the noise.  Our windows are triple pane and the rooms are very quiet; but once in awhile a guest will hear the traffic so I can appreciate your comment.  Should you wish to stay again please request a room facing the pool which are away from traffic.  Again, my apologies. Sincerely,  Christine Smith General Manager",none,none,none,none,none,none,907,101
none,1 contribution,5.0 of 5 bubbles,Excellent stay! Great location! Great staff!,We love staying at this hotel because it is very nice and we can walk to the Angels baseball games. The breakfast they provide is superb! The customer service is excellent! We got to the hotel to check in and realized we had made reservations at the wrong hotel. The staff was so helpful and told us they had a room available for us and even called the other Ayers property and cancelled the reservation for us with no charge. They went over and above the call of duty for us and we greatly appreciated that!,May 2016,none,none,"Dear bdh005 Thank you for reviewing the Ayres Hotel Orange; and highlighting our great location to Angels Stadium.  We are finding more and more guests staying with us on game days so they can avoid the stress of driving in the crazy traffic around the stadium and instead enjoy a leisurely walk, stopping for a cold one at the Golden Road Brewery and coming back for a great night's sleep on our Ayres Dream Sleeper mattresses. See you for the next game!! Sincerely, Christine Smith General Manager",none,none,none,none,none,none,908,101
none,1 contribution,4.0 of 5 bubbles,Great Hotel,"There are so many positive things to say about this hotel: good location, nice staffs, free wifi. The parking space was plenty and free. The room is nice, clean and modern.  There is one negative thing: exercise room was small, it needs to have more equipments.",May 2016,none,none,none,none,none,none,none,none,none,909,101
3 helpful votes,3 contributions,5.0 of 5 bubbles,Great hotel for out-of-town wedding guests!,"This is a  very nice hotel at reasonable rates.  The staff were welcoming, pleasant and helpful.  We especially enjoyed gathering with family each morning for a delicious complimentary breakfast at one of the large tables.",April 2016,none,none,"Thank you for choosing the Ayres Hotel Orange for your family gathering! Sincerely, Christine Smith General Manager",none,none,none,none,none,none,910,101
1 helpful vote,4 contributions,5.0 of 5 bubbles,Always a PERFECT stay,"This hotel is such a wonderful place to stay.  I'm always traveling to Orange County on business and by the end of the day you just want to get to your room and relax.  I'm always greeted by such wonderful staff.  Christopher is such a sweetie and provides Platinum Customer Service.  Whenever I'm in town for business, this hotel is ALWAYS my 1st choice.  The rooms are so clean, beds are comfortable and I always feel at home when I'm there.  Thanks Ayres Hotel Orange for always making my stay there perfect.",May 2016,none,none,"Thank you for your review.  I had Christopher read your review and thanked him for providing ""Platinum Customer"" service to you and all our guests.  I love the word ""platinum"", I think we will use that to describe the top tier of customer service and make that our goal for all staff members.  And please accept my thanks for making the Ayres Hotel Orange your home when in the area on business! Sincerely, Christine Smith General Manager",none,none,none,none,none,none,911,101
none,1 contribution,5.0 of 5 bubbles,LOVED IT!,"Great stay! We enjoyed the pool, the beds and the breakfast in mornings. Hands down we will be going back to Ayres Hotel Orange! Customer service was great. Really enjoyed the stay and beds were wonderful.",May 2016,none,none,"Thank you Sonia, so glad you enjoyed out Ayres Dream Sleeper Mattresses! Sincerely, Christine Smith General Manager",none,none,none,none,none,none,912,101
none,4 contributions,5.0 of 5 bubbles,Perfect family vacation hotel,"The Ayers has several really great things going for it:  -Excellent Location, it couldn't be easier to get on the freeway to Disney parking.I've stayed at dozens of the hotels near the park, if your hotel is on the harbor or katella youre likely charged a resort parking fee and you have to deal with stop and go traffic, you may think you are getting close to the park but unless you are walking distance it's going to be slower than this perfectly located hotel. Took us about 5 min to get to the Mickey and friends lot.  Free hot breakfast, plus cookies and fresh fruit in the lobby. There is also a managers reception, we missed it since it was from 5-7pm. Saves money not eating all meals in park.   Beautiful bathrooms in room with big soaking tub\shower.   Spacious room, clean and",May 2016,none,none,Thank you Jordan for your great review of our hotel!  I was glad to hear that we met and exceeded your expectations and help make your Disney vacation memorable.  We hope to see you and your family next year! Sincerely Christine Smith General Manager,none,none,none,none,none,none,913,101
none,8 contributions,5.0 of 5 bubbles,Excellent hotel,Ayres Hotel Orange is a beautiful new hotel close to Disneyland.  The rooms are  spacious and beautifully appointed. The staff were very attentive.  Great hot breakfast and parking included. Will return on our next visit.,April 2016,none,none,"Sherry, Thank you, thank you, thank you for taking the time to review and give the Ayres Hotel Orange such a great review! Sincerely, Christine Smith General Manager",none,none,none,none,none,none,914,101
5 helpful votes,14 contributions,5.0 of 5 bubbles,Clean Friendly Comfortable Visit!,"We were here from May 7 - 11with 2 rooms for a family of 5.  Our contact with the hotel was back in Feb of 2016 when we booked on hotels.com.  We email them through their website to request room that are high floors and across each other since we will be checking in at around 9pm at night.  Allen the ASM emailed me back within 24 hrs to let me know the rooms has been blocked for me.  What a speedy reply back from a hotel staff!  Upon our arrival Gary had checked us in but unfortunately one of the rooms tenant extended their stay.  We had booked for 2 King room, so Gary gave us the 2 Queen room next room over even though it would cost more money free of charge.  I understand that rooms block are not guarantee so I had no problems at all.  But they did try their best to resolve",May 2016,none,none,"Thank you lilmousemouse! And thank you for introducing yourself and family to me when you were checking out.  I am so glad we met and exceeded your expectations and that we were able to help make your Disney adventure a great experience all around!  And yes we did run out of fruit one day due to the lacrosse team inhaling their breakfast and I really appreciate you understanding the situation.  It was our pleasure to  be provide you and your family with great service and we do hope to see you on your next trip to Disneyland!!  Sincerely, Christine Smith General Manager",none,none,none,none,none,none,915,101
none,8 contributions,5.0 of 5 bubbles,Cozy Hotel,"This is my third time stay at he Ayres Hotel Orange during my business visits to Orange County. Being away from home for 3 nights, I am always looking for a place that I can call home away from home and Ayres Hotel Orange has done that for me. The cozy rooms allow me to get a restful night each day and ready for business. I usually don't eat much for breakfast but when swing by it usually has variety and sure looks good. The evenings are my favorite time because you get the complimentary wine, beer and other beverages as well as the delicious cookies, oh and I love the juicy oranges. I am always greeted by the front desk with smiles. Check-in and Check-out always swift. The rooms are like new every time and very clean. The high ceilings make it look so large. Housekeeping does a",May 2016,none,none,"Thank you prosperd200 for your wonderful review of the Ayes Hotel Orange!  We have achieved our goal in your case, of making our guests feel at home when staying with us! I will be sure to post your review in all departments so my staff can see their hard work has been appreciated!  While a good paycheck is always a reward for a job well done, for my employees, the accolades and positive acknowledgement of their job performance means a great deal to them.  Thank you!! Sincerely, Christine Smith General Manager",none,none,none,none,none,none,916,101
none,1 contribution,4.0 of 5 bubbles,Disneyland Trip for the Family,"I stayed here last year for the Tinkerbell half marathon, and enjoyed my stay then, so I thought it would be a good choice for our family trip to Disneyland this year. The hotel is very clean, the staff is friendly, and it's a fairly quiet hotel for being close to UC Irvine Medical Center.  The parking is free, and so is wifi.  Pus, they provide complimentary breakfast (eggs, bacon/sausage, hash browns/fried potatoes, pancakes, fresh fruit, yogurt, bagels, pastries/bagels, cereals, coffee/tea, and a variety of juices).  It's only one or two exits away from Disneyland, but the hotel shuttle is a much better deal for $5/person, and, if you want to see a baseball game, Angels stadium is right down the street as well.  I'll definitely stay here again in the future.",May 2016,none,none,"Pixedust7 Thank you  for your kind review of the Ayres Hotel Orange!  Your review covered the highlights of the Hotel and I appreciate your time in relating them to future guests.  See you the next time you are in our area!   Sincerely, Christine Smith General Manager",none,none,none,none,none,none,917,101
none,1 contribution,5.0 of 5 bubbles,Excellent Hotel,"The hotel staff went above and beyond to ensure we had an excellent stay and the hotel exceeded my expectations. Very clean room, wonderful breakfast, and the complimentary beer & wine bar was a nice surprise for happy hour. I definitely give the Ayres Orange 5 stars!",May 2016,none,none,Thank you zparker! I so appreciate when guests take the time to review our hotel.  It is wonderful for my staff to see that guests appreciate their hard work.  Thank you! Christine Smith General Manager,none,none,none,none,none,none,918,101
none,3 contributions,5.0 of 5 bubbles,Great Hotel,"Very classy, spacious and comfortable rooms. The bathroom was large with a nice Jacuzzi Tub. The beds were so comfortable. Loved the free breakfast,WiFi and parking. The staff was very pleasant and knowledgeable.",May 2016,none,none,"Thank you are your kind comments!  I am very glad you enjoyed that Ayres Hotel Orange and appreciate your review. Sincerely, Christine Smith General Manager",none,none,none,none,none,none,919,101
3 helpful votes,8 contributions,5.0 of 5 bubbles,"Great rooms, wonderfully appointed","Breakfast ""freshness"" is a hit or miss experience, depending on whether you're the early birds or the late sleepers.  Later in the morning, you'll find cold eggs and burned pancakes.  Maybe picking nits here; wouldn't keep me from staying there again.",May 2016,none,none,"Yikes, burned pancakes, not acceptable.  Even though not a normal practice by any means I will remind staff that no matter how busy, do not overcook the pancakes and keep the eggs warm!  Thank you for your feedback and I am glad you enjoyed the hotel overall. Sincerely, Christine Smith General Manager",none,none,none,none,none,none,920,101
16 helpful votes,21 contributions,5.0 of 5 bubbles,Favorite Place to Stay,My daughter attends Chapman and she loves to stay here.  The dream sleeper beds are the so comfortable and the rooms are spacious and quiet.  The breakfast is excellent and very fresh.  Evening cookies are a sweet treat.,May 2016,none,none,"Thank you Dale!  It is always great to hear from our Chapman University parents as we strive to be your home away from home the four years your children attend Chapman.  Don't forget, book at least 7 months in advance for your daughter's Graduation Weekend! We will see you on your next visit! Sincerely, Christine Smith General Manager",none,none,none,none,none,none,921,101
none,1 contribution,5.0 of 5 bubbles,Love this place!,"I have been staying here since it opened and it still looks new, feels new, smells new! The staff is wonderful and accomodating and the rooms are clean, comfortable and spacious. There is a fitness center, business center, pool and hot tub.  Some rooms have bathtubs and the tubs are nice big soaking tubs not the usual tubs designed for a child. I travel to Orange County frequently and this is my hotel of choice!!",May 2016,none,none,"Thank you, thank you, thank you for your great review!  I am happy that we met and exceeded your expectations!  We do hope to see you the next time you visit our area! Sincerely, Christine Smith General Manager",none,none,none,none,none,none,922,101
none,1 contribution,4.0 of 5 bubbles,Great Time,"Spent two days there, the room was very nice and we loved it. Comfortable bed, free parking and good breakfast. The hotel had just about everything we could ever have needed.  Only problem was with ART transportation to and from Disneyland. At end of night VERY late to pick guests up from the park; up to 40 min to 1 hour wait standing at stop where the transit was meant to pick people up.",May 2016,none,none,none,none,none,none,none,none,none,923,101
1 helpful vote,1 contribution,5.0 of 5 bubbles,Provided with early check in,"Excellent, spacious room. Very clean. Spacious vanity and shower. Staff very helpful with local advice as to local travel and local restaurants. Will certainly stay again to visit Grandson at Chapman University.",May 2016,none,none,none,none,none,none,none,none,none,924,101
4 helpful votes,29 contributions,4.0 of 5 bubbles,Wonderful breakfast,"The best outdoor setting to enjoy the great breakfast feast. Very clean, very friendly staff. Would definitely stay again. Our room was comfortable, even the roll out bed was good. Pool felt warm and we enjoyed the hot tub, too.",August 2015,none,none,"Dear Marge Thank you for reviewing the hotel, I was very happy you enjoyed our service, staff and hotel.  We do look forward to seeing you in the future!! Sincerely, Christine Smith General Manager",none,none,none,none,none,none,925,101
2 helpful votes,6 contributions,5.0 of 5 bubbles,Perfect,"Perfect for the cheap price. Tastefull large rooms, looks brand new, nice restaurant and close to Disneyland! Nice little warm massagepool and swimmingpool in the back. Clean and stylish enviroment. A lot of parkinglots. So worth the price!!",May 2016,none,none,"Thank you Orjan for your kind review.  I am pleased your found great value for the price you paid.  Happy travels in the future! Sincerely, Christine Smith General Manager",none,none,none,none,none,none,926,101
1 helpful vote,1 contribution,5.0 of 5 bubbles,Excellent Hotel,"We were visiting Chapman University and stayed at the Ayres Hotel for 3 nights. We love this hotel. Everything was clean, modern and new. Beds were very comfortable, the spaciousness of the room was great, even had a small divider between the beds for privacy. The breakfast food was very good, a lot of healthy choices even for the gluten free people like me! The Ayres made us fell very welcome and we will be staying here every time we visit Chapman.",April 2016,none,none,"Thank you again, I also received your personal email thanking the hotel for your great stay.    And we will look forward to seeing you the next four years of your son's education at Chapman University. Sincerely, Christine Smith General Manager",none,none,none,none,none,none,927,101
1 helpful vote,1 contribution,5.0 of 5 bubbles,Excellent hotel,Clean and friendly would go again!! We even had a room with the Disneyland fireworks! It was perfect! The breakfast was good and fruit very fresh. We weren't able to make the reception in the evening due to our plans but we could smell the cookies as we left!,April 2016,none,none,"Thank you jdille for your review!  Next time ask the front desk to save you some cookies for when you return to the hotel later in the evening, we are happy to do so! Sincerely, Christine Smith General Manager",none,none,none,none,none,none,928,101
1 helpful vote,1 contribution,5.0 of 5 bubbles,Friendly Staff and Service,"I had the opportunity to see my room before making a choice on my preference.  Much appreciated!  I was also given the chance to use some of the amenities, like the pool and spa which were excellent and well maintained!",April 2016,none,none,none,none,none,none,none,none,none,929,101
24 helpful votes,36 contributions,5.0 of 5 bubbles,Lovely,"King suite! Nice sheets, comfy bed! Chilled water and  Cookies in the afternoon! Nice breakfast offered until 10am. Large shower. Large amount of storage! Really clean. Quiet hotel, no doors slamming, like other hotels! Little oasis by the pool! Very helpful and friendly staff. Convent to highways, visited downtown and Santa Ana .",May 2016,none,none,"Thank you Cherylr for your comprehensive and kind review, you covered all the best points of staying at the Ayres Hotel Orange. Thank you!!! Christine Smith General Manager",none,none,none,none,none,none,930,101
522 helpful votes,1373 contributions,5.0 of 5 bubbles,Excellent choice,"We just needed a nice night stay and this was perfect. Great bed, quiet room , and a very good breakfast in the morning. Diagonal from uc Irvine hospital just off the I-22. The bathroom was spacious , Too bad at these rates, fresh water was not available in the room . Had to go to front desk and pay. We'll be back.",May 2016,none,none,"Dear Guest, Thank you for your kind review of the Ayres Hotel Orange!  I am sorry we do not provide complimentary water in the rooms.  We do have water in the lobby where guests can fill up their water bottles or thermos; but I appreciate that no all guests carry those when they travel.  Again, thank you for your review and we do hope to see you in the future! Sincerely, Christine Smith General Manager",none,none,none,none,none,none,931,101
10 helpful votes,17 contributions,5.0 of 5 bubbles,Great hotel for business or tourist,"I like every thing in the hotel, the room, the staff, the breakfast (delicious). Near to many marts. Ideal for tourist or business. Calm for rest. Beautiful and comfortable hotel. Near to Irvine and Los Angeles.",May 2015,none,none,"Dear 40Almeida, Thank you for pointing out that the Ayres Hotel Orange is perfect for both business and leisure!  We do feel we have the perfect location for both Disneyland and the guest doing business in the area. WE do hope to see you in the future! Sincerely, Christine Smith General Manager",none,none,none,none,none,none,932,101
8 helpful votes,3 contributions,5.0 of 5 bubbles,"Great stay, clean rooms, nice for families.","Our family stayed there for a week while visiting LA, really nice access to the I-5, close to Disney and if you don't mind driving an extra few minutes, a much nicer experience for the money than more ""central"" locations.",April 2016,none,none,Dear Miquel. Thank you for taking the time to review our hotel!  WE appreciate the feedback and I will make sure my employees see your reviews as well as all others. Tank you! Christine Smith General Manager,none,none,none,none,none,none,933,101
1 helpful vote,8 contributions,5.0 of 5 bubbles,Best hotel in the area!,"We've stayed at several hotels in this area over the past few years, and this Ayres property tops the rest. Beautiful room, comfortable bed, nice amenities, and an excellent breakfast! Our room faced the I-5 Freeway, but there was absolutely no noise. The hotel is convenient to the Angels' Stadium, the Honda Center and even Disneyland. We definitely will stay here again!",April 2016,none,none,"Dear pjurney, I am so glad the Ayres Hotel Orange lived up to your expectations!  Thank you for the review, we appreciate all our guests who let us know how we are doing! Sincerely, Christine Smith General Manager",none,none,none,none,none,none,934,101
9 helpful votes,9 contributions,5.0 of 5 bubbles,Love the new hotel!,"We really enjoyed our visit at the newer location in Orange.   Room is nice & big, like the storage & separation of the restroom and of course the large bath tub!  It is close to the freeways, The Block at Orange, Angel stadium & of course Disneyland!",April 2016,none,none,"Dear Wendy, Thank you, thank you, thank you!! Christine Smith General Manager",none,none,none,none,none,none,935,101
none,1 contribution,5.0 of 5 bubbles,Family Vacation,Highly recommend the Ayers Orange Hotel.  We have stayed here several times while visiting our son at Chapman University.  The rooms are spacious and inviting and the staff is friendly and helpful.  The location is great and within walking distance to the Orange Outlets.  Free wi-fi and parking.,April 2016,none,none,"Dear Lynn, Thank you for your review, we love our Chapman Parents!!  We hope to see you until your son graduates and then continue visiting us when you are in the area! Sincerely, Christine Smith General Manager",none,none,none,none,none,none,936,101
none,2 contributions,5.0 of 5 bubbles,Wedding Party,"The staff were professional and accommodating. Our after party from the wedding fell through, so they allowed us to continue to celebrate and spend family time together in the dining area. They even baked us a large tray of cookies for the entire family! They went above and beyond to help us enjoy this special event. There rooms are clean and spacious. There breakfast is probably the best I've ever had from any hotel.",April 2016,none,none,"Dear sjgarcia216, I am so happy to hear we provided a great wedding experience for all!  It is always wonderful so be part of such happy occasions and help to make them memorable. Thank you for letting us know we accomplished our goal! Sincerely, Christine Smith General Manager",none,none,none,none,none,none,937,101
none,2 contributions,5.0 of 5 bubbles,One day stay,"Building location was great, parking was great, service was great, staff was absolutely wonderful. a bar and lounge would be great. the breakfast in the morning was great. Staff from all shifts were friendly and professional.",April 2016,none,none,"Thank you, thank you, thank you!!! Christine Smith General Manager",none,none,none,none,none,none,938,101
