Helpful Vote,Contributions,Overall Rating,Summary Heading,Summary,Date of Stay,Room tip,Trip Type,Manager Response,Location Rating,Cleanliness Rating,Service Rating,Value Rating,Rooms Rating,Sleep Quality Rating,Review Number,Index
2222 helpful votes,2277 contributions,5.0 of 5 bubbles,Absolutely First Class Hotel,"Our first visit to an Ayres Hotel, but it will certainly not be the last. The service from checking in to checking out was amazing. The hotel staff couldn’t do enough to make guests feel welcomed. The rooms were first class and cleaned spotlessly everyday. The breakfast was more than adequate. The free WiFi was also excellent, something our children really liked!!! I would certainly recommend this hotel in a heartbeat.",April 2018,none,none,"Thank you for your ""first class"" recommendation!!  We hope you stay with us again so we can welcome you back with our warm hospitality! Sincerely, Christine Smith",none,none,none,none,none,none,334,101
5 helpful votes,24 contributions,4.0 of 5 bubbles,Very nice hotel near Chapman University,"I stayed at the Ayres Hotel Orange with my son during a college tour of Chapman University. It is a visually appealing hotel with friendly staff. My son left his phone charger and they arranged to mail it to us. The complimentary breakfast is tasty and substantial. Eggs, bacon, hashbrowns, yogurt, fruit, cereal.  There is happy hour with complimentary sodas and wine. The sundry, snack & gift shop nook is a nice convenience. There is an atmosphere of environmental responsibility that went that little bit too far. For example, there was a sign at the entrance of the dining room for the complimentary breakfast telling guests not to bring food to their room to minimize food waste. The reason for the Average rating is because the cups in the room were Earthwise single-use, plastic",March 2018,none,none,"Dear soon to be College Parent, Thank you for taking the time to review the hotel so thoroughly, I appreciate hearing your comments!  First I am so sorry the sign for breakfast was not clear.  We do encourage our guests to ""take all the food they want, but eat all the food you take.""  Our request to not take food to the sleeping rooms is not intended to minimize food waste, but instead stop food being accidentally mashed into carpets, spills in the hallways and elevators and uncovered leftovers attracting ants (unfortunately these scenarios happen every day).  I absolutely agree that one use plastic glasses are not environmental friendly.  The hotel opened using glass glasses but after the 60 Minutes show a few years ago that highlighted how unsanitary glass glasses can be in hotel rooms, the majority or our guests requested wrapped plastic glasses, we could not convince our guests that our glass glasses were clean.  Last but not least I am checking with Housekeeping as to our towels and sheets as we pride ourselves in adhering to the Ayres Standard of providing a quality product.  Again, thankyo very much for your insight and comments. Sincerely, Christine Smith General Manager",none,none,none,none,none,none,335,101
122 helpful votes,1935 contributions,4.0 of 5 bubbles,Good location for Disneyland,"The Ayres Orange is convenient to both Disneyland and the John Wayne airport (SNA).  The rooms are large and comfortable,p.  The free hot breakfast is delicious and so much better than the usual hotel buffet.  There’s a social hour in the evening with wine, beer and sodas, which was very welcome after a long day with Mickey and Minnie.  Staff was very friendly and helpful.",March 2018,none,none,"Thank you very much for your kind review of the Ayres Hotel Orange.  We appreciate both your comments and patronage!!  Hope to see you again on your next trip to see Mickey and Minnie! Sincerely, Christine Smith General Manager",none,none,none,none,none,none,336,101
2 helpful votes,11 contributions,5.0 of 5 bubbles,Beautiful hotel & friendly staff,"We stayed at this beautiful hotel that just felt comfortable from the moment we got there to the moment we left. It’s only 3 miles away from Disneyland without the Disneyland hotel prices.   We had a yummy complimentary breakfast each morning.  Each day there was a breakfast meat (sausage or bacon) hash browns or potatoes, fresh fruit, pastries, yogurt and more.  The rooms were beautiful & very spacious, we stayed in suite that even had a small balcony which was a nice surprise.  We will definitely be staying here for all of our future Disneyland trips. This hotel is a true Gem.",March 2018,none,none,"Thank you Tammy for a great review, myself and my staff enjoyed having you stay with us and loved the Disney themed cookies your daughter made!!  We hope to welcome you back int he near future and thank you for choosing the Ayres Hotel Orange! Sincerely, Christine Smith Manager",none,none,none,none,none,none,337,101
33 helpful votes,47 contributions,5.0 of 5 bubbles,Very nice hotel out of the resort area,"The room was spacious, clean and quiet.  No resort fees.  No parking fees.  Hot breakfast is included.  10 minutes from the convention center.  The whole hotel looks new.  There is a restaurant next door and many more choices a few blocks away.  We had a very nice stay.  We would definitely stay here again.",March 2018,none,none,"Dear ARG805,  Thank you for taking time to write such a nice review of the hotel.  We value our guest's comments, both positive and the rare negative; and will continue to strive to offer the very best in customer service and the best in cleanliness and quality of product.  Thank you. Sincerely, Christine Smith General Manager",none,none,none,none,none,none,338,101
24 helpful votes,47 contributions,5.0 of 5 bubbles,Wonderful place to stay,"I am so glad we chose this hotel.  It was nice and clean everywhere we went.  Beds were pretty firm, which isn’t my favorite. But I think more people than not prefer them.  the bathroom was huge and I loved that the vanity area was separate so someone could get ready while someone else used the restroom or shower. The breakfast was honestly the best hotel breakfast I have ever had. Actual crispy bacon (most places it’s soggy and fatty) and fresh pancakes every single day. Not frozen steamed like most places. It was conveniently located to many places which was nice. Staff was so nice and helpful anytime we needed anything.  Loved that they had free WiFi, breakfast and parking, along with amazing rates.  You can’t beat it.  I also saw security checking cars in the evening so it",March 2018,none,none,"Dear oktraveler76, Thank you for your kind review!  Can I hire you to help with ""public relations?""  Seriously though, I am so happy to hear that we met and exceeded your expectations in terms of service and quality of product.  My staff and I hope to welcome you back in the near future. Sincerely, Christine Smith General Manager",none,none,none,none,none,none,339,101
9 helpful votes,16 contributions,5.0 of 5 bubbles,Large Room!,We were there for four nights while visiting Disneyland. The shuttle was reasonable and timely. Our room was larger than expected and super clean. The the breakfast was decent - with nice options. I would definitely recommend this hotel to anyone looking for somewhere to stay in the in Anaheim area. Staff was friendly and accommodating. Due to late nights at Disney it would have been nice if the pool area would have been open earlier that 10am.,March 2018,none,none,"Thank you, thank you, thank you!  I really appreciate your review and am glad you enjoyed the hotel.  Next time you visit just ask the desk to open the pool earlier for you, as long as the chemicals are disbursed and cleaning is done we are happy to open it a little early.  Tell the desk Christine said it was OK.  Take care for now! Sincerely, Christine Smith General Manager",none,none,none,none,none,none,340,101
10 helpful votes,35 contributions,4.0 of 5 bubbles,Great night stay,Having a daughter at Chapman University I am always trying to find a nice place that is nearby. I felt Ayres was perfect for this kind of stay or for business. The rooms were so clean and nicely decorated. The shower was a prefab type but was brand new. Different then I am used to. Slept great in the bed with great pillows. Very quiet night. Felt like a boutique hotel. I compare it with the DoubleTree by Hilton. Free parking here is a plus and being smaller it is much quicker to get in and out of hotel! Love that. Price was right too!,March 2018,none,none,"Dear lisamarie98, It was our pleasure to have you stay with us while visiting your daughter at Chapman University!  We hope to see you often during the next couple of years that your daughter will be in college, and don't forget; the year she graduates make your reservation at least 6 months in advance.  All 3 Ayres Hotels near Chapman fill up quickly for Graduation Weekend.  Take care for now! Sincerely, Christine Smith General Manager",none,none,none,none,none,none,341,101
3 helpful votes,4 contributions,5.0 of 5 bubbles,A friendly place of peace and quiet,"I stayed at the Ayers Hotel Orange for my medical visit to UC Irvine.  All the staff were so friendly, I have to compliment them on that.  The room was clean, quiet, and comfortable.  The USB wall outlets where you could charge your electronics was a real plus.  I can't even think of any negatives.",March 2018,none,none,"Radiopeg, I am so glad you could not think of any negatives!  and yes, I agree, my staff is friendly really enjoy interacting with all our guests!  Hopefully your next visit to us will be for a non-medical reason and we will look forward to welcoming you back! Sincerely, Christine Smith General Manager",none,none,none,none,none,none,342,101
12 helpful votes,17 contributions,5.0 of 5 bubbles,Very clean and nice hotel,"We stayed here for three days for our biannual trip to Disneyland. I wanted to  stay off the Disney strip so we picked this place, primarily because we have always had great experiences at Ayres hotels. This location is newer than most and actually has an elevator which is nice. The hotel is lovely and very clean. The parking is ample and the breakfast is good. We stayed on the freeway side and I thought I was going to lose my mind the first day because it was loud. By the second day I couldn't even hear the noise anymore. Clean, modern, friendly, free parking,free wifi and free breakfast!! You can't go wrong choosing this hotel for your stay.",March 2018,none,none,"Dear LLLfromAZ, Thank you for taking the time to write such a nice review of the hotel.  I apologize your sleep was disturbed the first night but happy tohear it went away the last nights of your stay.  I appreciate your recommendation to potential future guests and hope to be able to welcome you back again in the future. Sincerely, Christine Smith General Manager",none,none,none,none,none,none,343,101
none,3 contributions,5.0 of 5 bubbles,Ayers Hotel Orange CA,"One word says it all ..... “Amazing” yet I must add !!! Reservations, Check-in - Convenience of Room - Room pristine - Room Amenities - Parking .... and BEST of all professional and warm Staff makes up AMAZING!  640 Radio Guru’s John & Ken .... thanks for highlighting Ayers Hotel of Orange CA",March 2018,none,none,"Dear Wonderful Guest, Thank you very much for your ""AMAZING"" review of the Ayres Hotel Orange.  I am so glad we meet all your needs and exceeded your expectations!  Take care for now and we do hope to see you again in the near future. Sincerely, Christine Smith General Manager",none,none,none,none,none,none,344,101
7 helpful votes,6 contributions,4.0 of 5 bubbles,Not bad,"The hotel was not bad. The room was clean and the hotel was convenience to the Anaheim Convention center. I flew in for a convention. The hotel was courteous enough to receive in a ton of boxes that were shipped. However, I received a nasty gram that said unless I remove my boxes I would be charged $500 dollars. I did not appreciate that, especially since we had a block of rooms in which we paid around $12k dollars for! The breakfast was okay. Nothing to write home about.",March 2018,none,none,"Thank you for your review of the hotel.  Yes a note was left in your room advising you that if the boxes were left after your departure you would then be charged a $500 disposal fee.  The hotel accepted 25 boxes, each 2 1/2 ft x 2 1/2 ft and stored them several days prior to your group's arrival.  The note was left only after the hotel was told the boxes would be removed by Thursday evening, they were not and messages left on voice mail went unanswered.  At no time did anyone from your group communicate with the desk as to what was happening with the boxes, even after the note was left.  We luckily had a vacant meeting room over the weekend where the boxes could be stored, and where you were able to repackage for FedEx to pick up on Monday. The majority of other Anaheim hotels accepting boxes for the trade show charge a per day fee per box, the Ayres Hotel graciously chose not to charge any of our trade show guests for storing boxes.  Again, thank you for your review.",none,none,none,none,none,none,345,101
1 helpful vote,2 contributions,4.0 of 5 bubbles,Great location and excellent services,"Had to make an extra booking and called the hotel directly, was able to talk to the GM and she help me to get an extra room immediately.  Am impressed with their services and throughout my stay the staff are all extremely friendly and was able to answer all of my questions with a big smile.  Room are huge if compared to other hotel in the area, I had a wonderful time at Ayres Orange.",March 2018,none,none,"Albert, It was my pleasure to help you get a room at the hotel during the very busy Natural Products Convention in the area.  I am happy to hear you enjoyed the hotel and we would love to welcome you and company back again next year! Sincerely, Christine Smith General Manager",none,none,none,none,none,none,346,101
1 helpful vote,1 contribution,5.0 of 5 bubbles,Personalized and Excellent Service,The Ayres Hotel Orange is part of a collection of family owned and operated boutique hotels.  It shows in the pride the general manager Christine Smith and staff take in ensuring guests are treated like family.   Thank you for a great experience.,March 2018,none,none,"Thank you Cynthia for your review!  I really enjoyed talking to you and learning about your business and sharing some of the Ayres Family history with you.  Should you travel this way in the future, we look forward to welcoming back to the Ayres Hotel Orange! Sincerely, Christine Smith General Manager",none,none,none,none,none,none,347,101
none,1 contribution,5.0 of 5 bubbles,"Great location, wonderful staff, beautiful hotel",The staff was friendly and helpful. Our room and the hotel was very clean and comfortable. Close proximity to Disneyland.  The breakfast offered a lot of different options. Would definitely stay here again. Loved it!,March 2018,none,none,"Thank you ""LovingAyres!"" I am so happy to hear how much you loved the hotel and all of our amenities.  We do hope we will be able to welcome you back on your next trip to Disneyland!  Take care for now. Christine Smith General Manager",none,none,none,none,none,none,348,101
none,4 contributions,5.0 of 5 bubbles,Great value for money and location,"Stayed for one night and was very pleased.  Clean room, friendly service. Can’t ask for more  Just the complimentary breakfast was a bit down, but I don’t expect hotels offer extraordinary meals for the price you paid  I’d consider this hotel again if I come back",March 2018,none,none,"Thank you jhonnux, I appreciate you taking the time to write a review of your stay at the Ayres Hotel Orange.  And thank you in advance for considering to stay with us again should you return to the Orange/Anaheim area! Safe travels, Christine Smith General Manager",none,none,none,none,none,none,349,101
none,3 contributions,5.0 of 5 bubbles,Excellent Customer Service,"I booked a reservation at the last minute. The hotel was beautiful, the Staff was amazing especially the Director of Sales. Johanna Belfer.   I will recommend this hotel to everyone that is traveling to Orange County. The location is great.  Thank you so much!",February 2018,none,none,"Thank you onblessedgal!!  I agree that my staff and Jhoanna are all amazing, we take great pride in our guest service skills and work hard to make every guest feels special.  We do hope to welcome you back again int he near future!  Take Care. Christine Smith General Manager",none,none,none,none,none,none,350,101
none,2 contributions,5.0 of 5 bubbles,Amazing!,"We stayed at the Ayres Hotel Orange from 2/23/18 to 2/26/18.  Let me just say that the cleanliness of the hotel and the friendly staff made our stay extremely enjoyable.  The complimentary breakfast was also excellent.  The management at the hotel does a great job making sure everything is done to a T.  The cleanliness of this hotel is second to none.  The beds are very comfortable and the room/bathroom is spacious.  It is also conveniently close to the I-5.  Next time we visit the area, we will definitely be staying at this hotel!  Thank you Ayres Hotel Orange!  See you next time!",February 2018,none,none,"JessicaC, I am so pleased to hear that you will be a returning guest the next time you and your family visit our area, that means a lot to myself and my staff!  Thank you for recognizing our superior level of cleanliness and overall comfort of our rooms.  And see you next time! Sincerely, Christine Smith General Manager",none,none,none,none,none,none,351,101
15 helpful votes,13 contributions,5.0 of 5 bubbles,Always a Fantastic Stay!,"Ayres Orange is our go to hotel when in Orange County. The staff is friendly, welcoming and very gracious. The hotel is super clean, quiet, and updated. The breakfast is a terrific perk with good food! Can't recommend the Ayres properties enough. Make the reservation - you won't be disappointed.",February 2018,none,none,"Thank you, thank you, thank you Rob!!  And thank you for recommending Ayres Hotels to potential future guests! Christine Smith Manager",none,none,none,none,none,none,352,101
none,10 contributions,5.0 of 5 bubbles,Wonderful Hotel,"Loved our stay here!!! There was hot breakfast everyday and complimentary happy hour with wine, beer and cookie every M-Th. Free parking. The front desk were very helpful and always smile on their faces. The facilities are clean especially the room. Housekeepers are nice as well. Very happy with our first stay here. Highly recommended! 10 mins drive from Disney",February 2018,none,none,none,none,none,none,none,none,none,353,101
none,1 contribution,5.0 of 5 bubbles,We stayed because it was close to Disneyland!,"The hotel was very clean, and staff was friendly! The rooms were very spacious and was enough room for my toddler to run around. The bathrooms on the main floor do not have changing tables, which was inconvenient  when i wanted to change my toddler after breakfast.  There was something for everyone at the complimentary breakfast, and the cooks were accommodating.",February 2018,none,none,none,none,none,none,none,none,none,354,101
none,1 contribution,5.0 of 5 bubbles,Great hotel!!,"This was our second stay at the Ayres Orange, and we really like the hotel!  The breakfast is good, rooms are clean, the beds are comfortable, and the large soaking bathtub is so nice after a long day at Disney!  The Disney shuttle comes every hour and is located just outside the neighboring ALO hotel (which is only a few steps away), and the shuttle was much more reliable this stay than our previous.  The staff is extremely friendly and helpful, too!  We are annual pass holders, and this is our new go-to hotel.  Wifi was reliable, too, which is necessary when I need to work.",February 2018,none,none,none,none,none,none,none,none,none,355,101
none,1 contribution,5.0 of 5 bubbles,I wouldn’t Choose any other place...,"After a sudden change of plans, living situation and the whole 9 yards - I found this hidden gem “ Ayres Hotel “ since Summer of 2017   Pregnant w/ 3 kids which doesn’t come often as I-am still running my small business in OC - driving back and forth from Las Vegas every other week... thinking I should find a small place to rent locally-well that didn’t happen...  I was staying at the Sheraton n found Ayres at Orange at the Block — from there, problem solved...  The Staff are amazing, from Cory to Chris, Christine and 4 other amazing Ladies at the Frontdesk and the 4 breakfast crew in the kitchen who makes the place so much more special.   The rooms are very roomy and comfy. We have been bringing our infant since he was less than 2 weeks old, every other week since. I work",February 2018,none,none,"And we look forward to welcoming you back each and every time you and your family check in.  We love watching your son grow up, but a little quickly.  Time goes by too fast!  Thank you for your review and for choosing the Ayres Hotel Orange as your ""Home away from Home!"" Christine Smith General Manager",none,none,none,none,none,none,356,101
1 helpful vote,4 contributions,5.0 of 5 bubbles,Nice Clean Hotel,"friendly staff, overall nice hotel and location great nice wine and happy hour complimentary week days breakfast great but after many stays, need to update or change up  would recommend to everyone, great stay",February 2018,none,none,"Thank you codyjayfox for your review!  I am pleased to let you know that after many many months of the same breakfast items being severed we are sitting down with our breakfast cooks to see how we can change up the menu a bit.  Take care and wehope to see you again soon. Sincerely, Christine Smith General Manager",none,none,none,none,none,none,357,101
none,1 contribution,2.0 of 5 bubbles,Great hotel BUT...,Great hotel and location with a nice breakfast but our room was near the elevator and the on the street so it was very noisy.  We also had noise from the room above at 11 pm.  Called the front desk and they took care of the loud group above us.  Ayres should seriously consider better sound insulation in future build outs.,February 2018,none,none,"Dear IC, Thank you for taking the time to write a review of the Ayres Hotel Orange.  I appreciate that your overall review was good, highlighting our location and breakfast but I would like to apologize for you having to endure a loud group of guests above you.  The dates you stayed we did have a wedding party who did celebrated a little too loudly as we had several complaints.  I have forwarded your comments to our corporate office as we are building three new Ayres Hotels in Southern California in the next year. Sincerely, Christine Smith General Manager",none,none,none,none,none,none,358,101
1 helpful vote,4 contributions,5.0 of 5 bubbles,Fantastic,"Loved the Ayres Orange. Pay attention to the address, The City Drive. There’s an Ayers close to here on Kattela. Loved: good wine at happy hour, perfect WiFi (easily streamed the Olympics), oranges in the lobby, all staff really friendly, very clean, free parking, full great breakfast. I almost don’t want to share this so I can get a room next time! but honestly these guys are hitting it out of the park, they deserve this.",February 2018,none,none,"Thank you Makooda7 for your wonderful review of the Ayres Hotel Orange (and yes, not to be confused with the Ayres Hotel Anaheim).  I am so happy to hear you enjoyed your stay and that we exceeded your expectations.  We will look forward to welcoming you back in the near future!.  Sincerely, Christine Smith General Manager",none,none,none,none,none,none,359,101
none,1 contribution,5.0 of 5 bubbles,Pleasant hotel,"The location and amenities were perfect. The room was clean and as others have mentioned, their breakfast buffet is outstanding. The front desk staff was friendly and accommodating. Very nice experience, we will definitely stay there again if we are in the area.",February 2018,none,none,"Thank you bjfierro! I really appreciate it when guests take the time to review our hotel, it means a lot when their sentiments are genuine.  I will post this review as I do with all reviews, for our team to read and know their work ethic and attention to detail are appreciated,  Again, thank you! Sincerely, Christine Smith Manager",none,none,none,none,none,none,360,101
13 helpful votes,11 contributions,5.0 of 5 bubbles,"Clean, comfortable, reasonable!","We return to this hotel whenever in the Anaheim area because it is always clean, breakfast is great, front desk personnel are very pleasant, and for the area, the price is reasonable for the great value!!! Keep it up, Ayres!!",February 2018,none,none,"Thank you Susan, we will ""keep it up!""  And thank you for mentioning what a great value staying with us is: parking, breakfast and WiFi all included in our competitive rates.  Take care for now and we look forward to your next visit! Sincerely, Christine Smith General Manager",none,none,none,none,none,none,361,101
none,1 contribution,5.0 of 5 bubbles,Business trip,"Hotel is always clean, breakfast is great and people are nice.  Can't beat the hotel, close to almost everything.  We had a great time at the hotel nice an quiet even when families were present.  If you are going to Disney, Angels or Duck check out Ayres.",February 2018,none,none,"Dear Travelhistorian, Thank you very much for your kind review of the Ayres Hotel Orange.  And thank you for mentioning our location; we are indeed close to the Honda Center, Angel's Stadium, Disney Resort and the Outlets of Orange.  We hope your next trip will be for leisure and look forward to welcoming you back.  Take care! Sincerely, Christine Smith General Manager",none,none,none,none,none,none,362,101
