Helpful Vote,Contributions,Overall Rating,Summary Heading,Summary,Date of Stay,Room tip,Trip Type,Manager Response,Location Rating,Cleanliness Rating,Service Rating,Value Rating,Rooms Rating,Sleep Quality Rating,Review Number,Index
76 helpful votes,183 contributions,5.0 of 5 bubbles,Great Location,"I've stayed at this hotel numerous times.  They book up often - probably 1/4-1/3 of the times I try to stay here.  There is very convenient parking for this hotel in two levels of the basement.  Either elevator then takes you to the hotel - either the lobby end or the opposite end.  The rooms each have a living room and a bedroom, unless you get one of the enormous corner suites.  The rooms are very quiet and comfortable.  This place has a great fitness center, generously sized, with 3 treadmills, 2 ellipticals, 1 recumbent bike, and free weights.  It includes wipes for the machines, towels, and a water bubbler.  Outside there's a heated lap pool.  It is so beautiful, surrounded by palm trees, grass, and lawn chairs.  Lovely even when the air temps are only in the 60's.  The",April 2014,none,none,none,none,none,none,none,none,none,868,136
88 helpful votes,246 contributions,5.0 of 5 bubbles,Very Nice Hotel,"I love embassy Suites.  I stay at one whenever I travel if they are near by.  The rooms were spacious and clean.  The room I stayed in had a Kuerig, which was super convenient.  The workout room had about 4 treadmills and 2 ellipticals.  There was a bike, but it was broken.  There was a wide range of free weights, ab machine, medicine balls, and a bench.  Water and towels were provided as well.  I would go and work out around 5-6am and it was always packed! The breakfast was delicious with fresh made to order omelettes and the hot special of the day.  One of the days they had strawberry pancakes with REAL strawberries! The staff was friendly.    Side notes: Internet worked well in my room. Free parking under hotel in garage  Plenty of places to eat in walking distance",February 2014,none,none,none,none,none,none,none,none,none,869,136
none,1 contribution,5.0 of 5 bubbles,Nice Hotel!!,My family loves to stay at Embassy Hotels. Breakfast is very good. Lots of choices. Rooms are very clean. Very short walk to the mall. Many restaurants close by. Free parking. 15 minute drive to Disneyland.,March 2014,none,none,none,none,none,none,none,none,none,870,136
none,1 contribution,5.0 of 5 bubbles,Excellent Hotel!,"Loved staying here. My experience started with Devin from the front desk, although we never got to meet him, but he was very helpful and made my stay extra special for my family and I on my nephew's 8th birthday. At check in we had Robert, who was also very nice and very welcoming. Finally we had Claire who attended us (also a front desk agent)she was magnificent! Oh, I don't want to forget the 2 ladies that made our omelettes, very fun to talk to while they cook! Great staff and facility! Thank you guys for making it special for us! We cannot wait to visit again!   J.Siam",March 2014,none,none,none,none,none,none,none,none,none,871,136
none,1 contribution,3.0 of 5 bubbles,Brea Embassy Suites: As expected,"This is just what you might expect at an Embassy Suites. The standard layout, room, and amenities. The free Made-to-Order breakfast was not as robust as I remembered it in the past, but there were enough options available (though the quality of breads and muffins was just fair)  Parking is free, but challenging to locate, as the hotel shares a parking structure with the shopping mall.   There were accessible no power plugs near the bed. Having to unplug a lamp in order to plug-in my phone is just not acceptable in this day and age.",March 2014,none,none,none,none,none,none,none,none,none,872,136
none,1 contribution,5.0 of 5 bubbles,Love the breakfast!,"The breakfast is tasty.  It's nice to have the variety each morning of our stay!  This is top-notch quality.    Not only was the staff nice they were prompt with any request.    The atmosphere is awesome!  Very clean and beautiful!  There were so many amenities included with the price.  It's nice to not be ""nickled and dimed"" for everything.",March 2014,none,none,none,none,none,none,none,none,none,873,136
15 helpful votes,41 contributions,5.0 of 5 bubbles,Nice place to stay in Brea,"This is a great place as a SoCal jumping-off spot, most of the LA/Orange-County attractions are reachable within 40 minutes (traffic permitting). Plenty of retail and food options within walking distance. Fridays and Claim Jumper are over the road or I would recommend a 10 minute walk to BJs at the other side of the mall.   The breakfast was great though as we were on vacation we felt a bit rushed during the weekdays to finish in time before items were cleared away. There were no non-smoking king rooms available however the 2 x double worked ok. The outside painting and redecorating along with the constant gantry movement and painters peering in the room periodically was rather disruptive.  Both the noise and the paint/plastic shrouded windows detracting from the overall",March 2014,none,none,none,none,none,none,none,none,none,874,136
6 helpful votes,17 contributions,3.0 of 5 bubbles,Good Staff- Average Hotel,"Just finsihed my stay at the Embassy for work travels. The hotel is okay, needs updating but still pretty clean. The staff is very friendy and helpful and were very quick to respond to anything we needed. The breakfast is pretty typical, oatmeal, cereal, omlette bar, toast etc...The hotel is in a very nice area, Brea Mall is right behind it and there is many great shopes just across the street.  Overall descent hotel.",March 2014,none,none,none,none,none,none,none,none,none,875,136
none,1 contribution,4.0 of 5 bubbles,"Nice, but could be better","You will get your money's worth if you stay at this hotel. It was convenient and offered a lot in the surrounding area if I wanted something different. There is a mall and a target close by for those who need something really quick or want to shop. Would stay here again, but would not invite family to visit if they could not fix the couches because my family was uncomfortable even if staying for a few hours.",March 2014,none,none,none,none,none,none,none,none,none,876,136
81 helpful votes,174 contributions,4.0 of 5 bubbles,Best night of sleep I've had!,"Hands down the most comfortable bed I think I've ever had on a trip - business or pleasure.  This Embassy Suites might be a little older and in need of a little refreshing, but the rooms are nice and it was very quiet even though there was a lot going on during my 5 day stay including a volleyball conference and some other convention.  Lots of people at the hotel, but I didn't know it.  No noise issues.  Service at the front desk was outstanding.  The free breakfasts were great - omelets, pancakes, etc.    Located in a nice area with access to grocery, shopping mall, and restaurants.  I would definitely choose this again.",March 2014,none,none,none,none,none,none,none,none,none,877,136
51 helpful votes,86 contributions,3.0 of 5 bubbles,Embassy Suites always a winner for family stay,"The staff worked hard to make sure my stay was comfortable. The sofa bed was broken the night we arrived, but they took care of it the very next morning. Very friendly front desk and maintenance. I would like to have known that they pool heater was broken, kids froze! but you can't tell kids they can't swim b/c of a heater!  The room I had smelt and was musty. Definitely needed to get an update, but when your tired with kids, you roll with it.  The location is so convenient. Food and stores everywhere. I'd stay again. Great value.",March 2014,none,none,none,none,none,none,none,none,none,878,136
3 helpful votes,22 contributions,5.0 of 5 bubbles,Love this Embassy,"The staff always does their best to help you and take care of you.  I stay here when I visit Brea for business.  I have nothing but good things to say.  Sometimes it is very busy due to the good nature of the hotel, they get some college sports teams staying there, weddings, several meeting or conventions, but it never feels packed or overcrowded.  Very well organized.",March 2014,none,none,none,none,none,none,none,none,none,879,136
none,1 contribution,5.0 of 5 bubbles,Best Place to stay in Orange County!,"Excellence as expected from a Hilton property.  A very friendly staff, clean and updated hotel, and a great location.  If you are looking for a comfortable 'home away from home', this hotel would make a great choice.",March 2014,none,none,none,none,none,none,none,none,none,880,136
none,1 contribution,5.0 of 5 bubbles,Perfect location,"I was in town for business and found the location to be perfect. Walking distance to several shops, a mall and restaurants. Short drive to office and other shopping and dining options. Clean, good service, easy to park and get luggage in and out. The premium room was a great value and bed was very comfortable.",March 2014,none,none,none,none,none,none,none,none,none,881,136
20 helpful votes,81 contributions,4.0 of 5 bubbles,"Nice hotel, good service, good location","Stayed here on business for two nights. The overall impression of the property is excellent.  It is getting a little tired, maybe, but impressive still.  Check in was quick and easy, the rooms are very large 2-room suites. The included breakfast is nicer than most with great selection at a buffet and an omelet bar for made to order selections.  There are countless restaurant options within walking distance.... and it feels like a safe, higher end neighborhood be explore comfortably.  The hotel is nestled up into the Brea Mall which is a nice large mall.  I will look for an excuse to be here with my wife sometime.",March 2014,none,none,none,none,none,none,none,none,none,882,136
4 helpful votes,35 contributions,3.0 of 5 bubbles,"friendly staff, but noisey rooms and poorr Wifi","The staff at the front desk and bar area were very friendly and helpful during my week long stay, the room are large and pleasant, but you hear a lot of noise from other guests. The wifi connection was very poor and had to purchase a mobile wifi to keep connected with work and family. more geared to tourist than business I suspect. Breakfast was self serve and was ok for what it was.",February 2014,none,none,none,none,none,none,none,none,none,883,136
none,1 contribution,5.0 of 5 bubbles,Best Value,"Embassy Suites Brea was the best Hotel experience I've had in years. Great suite room, great value and it includes a full Breakfast and complimentary cocktail hour. The convention services for our business meetings were hassle free. The food was excellent and very reasonably priced. Thumbs way up for this Hotel!",February 2014,none,none,none,none,none,none,none,none,none,884,136
11 helpful votes,38 contributions,4.0 of 5 bubbles,"Friendly, clean and quiet","I was very impressed with the friendliness and high quality service provided by all the front desk staff during my recent 5 night stay. I have never had better service anywhere. They dealt with all my requests promptly and professionally.   I thought the layout of the rooms was exceptional and afforded a very quiet, restful sleep with the separation of the bedroom from the hallways. The room was clean and well-appointed - no complaints there!  As a woman staying alone, I felt very safe in the hotel and to go for walks by myself in the vicinity of the hotel. There is a big mall right across the road for convenient shopping. There are several restaurants nearby and the hotel provides a substantial breakfast included in the price of the room.   I only had two negative experiences",February 2014,none,none,none,none,none,none,none,none,none,885,136
6 helpful votes,31 contributions,5.0 of 5 bubbles,Great hotel,"We just held our annual convention at this hotel and all of our attendees were very happy with the hotel, the location and the staff.  I personally like to stay at Embassy Suites when I travel and I have to say the décor of this hotel was one of my favorites.  The beds were extremely comfortable and the rooms were nicely furnished.  The meals we had were excellent as well.",February 2014,none,none,none,none,none,none,none,none,none,886,136
68 helpful votes,60 contributions,2.0 of 5 bubbles,dark and depressing with paper-thin walls,"Check-in service was good and the bed was reasonably comfortable--if only I could sleep with the noise coming in from the neighbors, whose conversations late into the night came through with clarity I'm sure they did not intend. The living area of the suite faces onto the motel-style walkway that leads to the rooms, so that you must keep the blinds down unless you want everyone walking by to see you as they walk by. This means that the living area is perpetually dark, as the only window that can let in light is in the other room (the bedroom). I found this extremely depressing and unpleasant and by the end of my stay I positively FLED with a feeling of desperation to get to some sunlight. The hotel's cheap and ugly atrium style lets in little light, giving the entire place a",February 2014,none,none,none,none,none,none,none,none,none,887,136
1 helpful vote,3 contributions,5.0 of 5 bubbles,Trip to Orange County  02/2014,We have stayed at the Embassy Suites Hotel in Brea  several times on our visit to Orange County and have always received great service and the rooms have always been great.  The complimentary breakfast is one of the better ones we have enjoyed.  The only complaint would be that it ends a little early at 9:00am making it a struggle to get down too.,February 2014,none,none,none,none,none,none,none,none,none,888,136
none,1 contribution,1.0 of 5 bubbles,I'll never use getaroom!,"I booked a King bed in a Non-smoking room. When we arrived, the hotel had us in a king SMOKING room.  I have asthma!!!!! I I would never agree to a SMOKING room. My husband and I had planned a getaway for Valentines's Day and our birthdays which coincide. The Embassy Suites offered us a double bed non-smoking room. That really Is Not what we Paid For.  We were charged and paid for Nothing!!!!!",February 2014,none,none,none,none,none,none,none,none,none,889,136
42 helpful votes,54 contributions,4.0 of 5 bubbles,Can't say enough good things about it!,"I had a great business stay.  This is the nicest E.S. I've seen.  The hotel has an Egyptian theme, and there are attractive extras in artwork and decorating details.  The atrium has a large pond with fish, and an Egyptian fountain.  The rooms also have extras--looks like silk drapes, and granite thoughout the bathroom--in good condition and clean.   Location is accross the street from a mall with a lot of dining options.   I ordered room service and it arrived in less than 30 minutes.  The menu (in room and in restaurant) has a pretty good variety, and reasonable prices.  I had a fantastic chinese salad--very fresh and again reasonably priced. Business center is big--not crammed in a corner.  Free made to order breakfast was good, as usual.   All the staff that I came in contact",February 2014,none,none,none,none,none,none,none,none,none,890,136
none,1 contribution,5.0 of 5 bubbles,Very good place to stay,I was there for the business trip with 50 other co-workers. It was very good. Lots of good looking space in the dining area to have small meetings. I think this hotel is perfect for business and vacation. I would go there again.,February 2014,none,none,none,none,none,none,none,none,none,891,136
28 helpful votes,11 contributions,5.0 of 5 bubbles,incredible top notch,this hotel is my home away from home i stay here as often as i can and I love it here.the staff at the front desk are exceptional especially Devin who greets me with a smile and a kind word every time.you should clone him.the hot tub and pool are great and i love the breakfast.the same lady makes my omelet every time.change nothing this hotel is incredible,February 2014,none,none,none,none,none,none,none,none,none,892,136
none,1 contribution,5.0 of 5 bubbles,suite hotel,"This hotel was completely booked and yet our check-in was swift and friendly. The desk clerk gladly gave us printed directions to the wedding reception venue. The room was so quiet, even when the atrium lobby was full of breakfast diners.Tthe free parking garage on the lower level was a pleasant perk!",January 2014,none,none,none,none,none,none,none,none,none,893,136
none,2 contributions,4.0 of 5 bubbles,Very Good Stay,"I really enjoyed my stay at this hotel. It's gorgeous, and the staff is very friendly and courteous. The breakfast is not very vegan/vegetarian friendly though. I requested a tofu scramble for breakfast days before my arrival, and they were very accommodating in buying the tofu, but it was very obvious that they'd never made it before, and there seemed to be no effort or desire to learn. There was no scramble and no seasoning, just blocks on the grill. The internet is also costly, which I was not informed of prior to my arrival. It was $9.95 per day, per unit. So 2 laptops is $20 per day. Insanity! I didn't pay it, I just used the business center.",January 2014,none,none,none,none,none,none,none,none,none,894,136
none,1 contribution,5.0 of 5 bubbles,Embassy Suites,Very enjoyable stay. Everything was convenient and most staff was very friendly and helpful. Very clean environment.  Food was delicious and dining experience was good. Convenient to where we needed to go.,January 2014,none,none,none,none,none,none,none,none,none,895,136
none,1 contribution,4.0 of 5 bubbles,"Great location, but...","Great location but they should heat the swimming pool.  Fitness center is nice...how about an upright bicycle?  Breakfast was very average and if you come at the wrong time, you can have a long wait for an omelet or specially cooked breakfast",January 2014,none,none,none,none,none,none,none,none,none,896,136
none,1 contribution,5.0 of 5 bubbles,Nice Hotel,"My wife and I always enjoy staying at the Embassy Suites.  We like the big suites and the great breakfast and cocktail hour.  The granite tile in the showers is awesome.  Since the bed is in the back area we never here people in the hall ways.  We saw one customer with a small dog, we did not know pets were allowed or we would have brought our small Shitzu with us.  My company had our Holiday party there and the staff, food and drinks were excellent.  We would stay there again and would recommend it to all of our friends and business partners.",January 2014,none,none,none,none,none,none,none,none,none,897,136
14 helpful votes,55 contributions,4.0 of 5 bubbles,Not a bad choice,"My family chose to stay at this hotel while attending the BCS game in Pasadena. We did not want to be located in the heart of the action but neither be so far removed as to spend all of our time driving to the events. The hotel was well situated among dining and retail establishments with easy access to ground transportation routes. We had a minor situation with the HVAC system (which we reported) but because of the full occupancy of the hotel we decided against pressing for another room as the current room met our needs for sleeping arrangements. I am quite sure under other circumstances the staff could have easily handled a request to swap rooms if we had so requested. Parking was sufficient and convenient. Breakfast was a little disappointing, seemed more institutional in",January 2014,none,none,none,none,none,none,none,none,none,898,136
12 helpful votes,24 contributions,4.0 of 5 bubbles,A nice place to stay,"Really good breakfast. Big shopping is close. Room was very good, the only exception was the hide a bed was old, hard and very uncomfortable.  Master bed was excellent. Nice layout and good service. Fyi. Breakfast starts at 7 am on the weekends.  We weren't notified of this but just an inconvenience is all.",January 2014,none,none,none,none,none,none,none,none,none,899,136
none,1 contribution,5.0 of 5 bubbles,Great stay,"We stayed at this hotel for a wedding in Fullerton.  The group rate was fantastic.  The breakfast we had in the mornings and the drinks in the evenings practically made the room free.  The food was great, the room was big and clean.  I would definitely stay here again.",January 2014,none,none,none,none,none,none,none,none,none,900,136
none,1 contribution,5.0 of 5 bubbles,Great Stay,"We had a great experience.  We are local and wanted to spend some time together away from the kids and our stay was just what we expected.  We would definitely recommend this hotel to others.  There are several Embassy Suite locations in Orange County and each is slightly different but all are very nice and have the same warm, expansive feeling.  The Anaheim location has the beautiful atrium iconic of the chain but the décor is different than Brea which gives each a distinctive feel.  The Santa Ana location was created from a pre-existing building and is the most attractive from the outside especially and not the usual exterior box look of most locations.  Bigger balconies and a cool Spanish mission look with nice landscaping too.  Embassy Suites is a great value and we will be",January 2014,none,none,none,none,none,none,none,none,none,901,136
1 helpful vote,3 contributions,5.0 of 5 bubbles,excellent price and great hotel,"price was excellent for the week we were there and very clean free parking and in a very clean safe area. great helpful staff all around. very convenient to all attractions, convention center and sports stadiums",January 2014,none,none,none,none,none,none,none,none,none,902,136
none,5 contributions,5.0 of 5 bubbles,Great Hotel,The holel service was very good and the location excellent for our needs. We were attending a wedding near Brea and the hotel's location and easy to access to the shops at the mall came in very handy. Our breakfast was very good and the evening reception was appreciated.,January 2014,none,none,none,none,none,none,none,none,none,903,136
none,1 contribution,2.0 of 5 bubbles,Unmitigated external room noise and poorly maintained room carpet,Excessive external room noise - poor insulation - located next to stairs with teens running up and down stairs after hours - hotel staff did not respond to complaint.  Carpet was badly stained and should have been replaced.  Hotel staff was unresponsive upon complaint.,January 2014,none,none,none,none,none,none,none,none,none,904,136
none,3 contributions,5.0 of 5 bubbles,Hotel Stay at Brea,"Hotel suite was very spacious and clean. The complimentary breakfast could be improved, but overall, a very good hotel. Will return when opportunity arises. This hotel was right next to the Brea Mall. Can walk out your door and go shopping at any of the major stores, Including JC Penny's, Nordstrom and Macy's",January 2014,none,none,none,none,none,none,none,none,none,905,136
none,16 contributions,5.0 of 5 bubbles,Best Stay EVER!,"This location is excellent, near the mall and other attractions.  When you walk into this Embassy Suite you walk into a WORLD of Luxury.  This Embassy Suite reminds me of the luxury hotels in Vegas minus the smoke casino.  The complimentary breakfast and evening refreshments allow you to enjoy your stay at the hotel and relax with your family.  I am super impressed by this location.  Five STAR services.",January 2014,none,none,none,none,none,none,none,none,none,906,136
none,1 contribution,5.0 of 5 bubbles,Very Pleasant,"Stayed for five nights over New Years.  Very convenient for many Los Angeles area attractions.  Staff was incredibly helpful during stay.  Room was clean, even if furniture/carpet is dated and showing signs of wear.  Matress on fold-out couch was thin and not comfortable, but kids did not seem to mind.",January 2014,none,none,none,none,none,none,none,none,none,907,136
none,1 contribution,5.0 of 5 bubbles,"Pleasant, enjoyable experience","Convenient and upscaled, safe location; can walk to the Mall right behind hotel, or across the street to Target, restaurants among other stores... Easy getting in/out to various Highways nearby... Friendly service; family loved this place!",December 2013,none,none,none,none,none,none,none,none,none,908,136
125 helpful votes,227 contributions,4.0 of 5 bubbles,Nice,We had just a single night stay but the hotel staff was very friendly.  The hotel was clean and well kept.  I was a little leary because it is an older hotel.  The rooms are very spacious and the two rooms make it nice to have a few others come in for a cocktail while still getting the privacy in the bedroom to finish getting ready.  No drawers or any storage space in the bathroom but the countertop had a good amount of space on it.  The rooms have a small safe & plenty of closet space.  The location is good it has easy freeway access.  You have a few restaurant choices close by because it is next to the mall.  Target & a very yummy Mediterranean restaurant right across the street that you can walk to easy.  Embassy’s generally have the breakfast buffet in the morning this hotel,December 2013,none,none,none,none,none,none,none,none,none,909,136
3 helpful votes,4 contributions,1.0 of 5 bubbles,"Me with 2 Yr old baby, forced to stay in smoking room","Even after multiple requests, beggings, forced us since ""you booked via priceline and don't expect much"", according to the manager on duty. He insisted no other room was available, which was a lie: I did a new booking attempt online via Hilton and rooms were available. So unethical, heartless people. My daughter has started allergic kind of reactions, already.",January 2014,none,none,none,none,none,none,none,none,none,910,136
