Helpful Vote,Contributions,Overall Rating,Summary Heading,Summary,Date of Stay,Room tip,Trip Type,Manager Response,Location Rating,Cleanliness Rating,Service Rating,Value Rating,Rooms Rating,Sleep Quality Rating,Review Number,Index
1 helpful vote,1 contribution,4.0 of 5 bubbles,Nice Trip,"Comfortable accommodations, courteous & friendly staff, food was excellent.  Location was within walking distance to very nice restaurants and we were comfortable walking even in the evening.  Great little boutiques and friendly people.",October 2017,none,none,none,none,none,none,none,none,none,315,136
none,1 contribution,5.0 of 5 bubbles,Terrific hotel,"The hotel was very clean, great location, staff was really helpful. Easy underground parking. The breakfast buffet was bountiful and delicious.  The pool was a great place to unwind and relax with a swim.",September 2017,none,none,none,none,none,none,none,none,none,316,136
none,1 contribution,5.0 of 5 bubbles,Highly recommended,"Good location with eady access to a mall and various restaurants. Friendly and helpful staff. Nice lobby, and well-equipped guest rooms and meeting rooms. Good food selections of free breakfast and enjoyable happy hour service.",September 2017,none,none,none,none,none,none,none,none,none,317,136
2 helpful votes,13 contributions,4.0 of 5 bubbles,Nice hotel in a nice location,Stayed the weekend at this hotel and it was a modern decor. The breakfast is good as well as the location. The bed was comfortable but the room was a little dusty. I would recommend this hotel for anyone visiting the Brea or Fullerton area.,October 2017,none,none,none,none,none,none,none,none,none,318,136
none,1 contribution,4.0 of 5 bubbles,Deceptively good restaurant,"Paul, the waiter, was professional, engaging and willing to work with my dietary needs. The food was excellent. The steak was prepared as I would expect from a four or five star restaurant.  There was a problem with the room and was quickly taken care of. The gym is someone inadequate possessing three ellipticals, three treadmills and a rack of dumbbells. Definitely could use some machines TV connections not work on the used.",September 2017,none,none,none,none,none,none,none,none,none,319,136
3 helpful votes,26 contributions,5.0 of 5 bubbles,Great hotel for business or fun,"I enjoyed this hotel's breakfast variety. The building is under renovation but still beauitful and operational. Professional staff, great location and easy to locate. Next to the Brea Mall, easy under ground parking.",September 2017,none,none,none,none,none,none,none,none,none,320,136
141 helpful votes,165 contributions,4.0 of 5 bubbles,"Clean, Convenient, Spacious","I appreciate the extra living space offered by Embassy Suites properties.  This hotel offered the extra room to spread out and work, and is also conveniently located adjacent to the Brea Mall, offering lots of quick and casual dining options - a huge difference at the end of a long work day.  The lobby and atrium areas were very clean and well kept, and it looks like the meeting space is being refreshed.  Free breakfast is of average quality - a 2.5 on a 5.0 scale.  The rooms are clean and okay - wasn't new, and wasn't too old.  The bed was ok - a little tired and squeaky.  Noise wasn't an issue.  Free parking in the garage was also a nice feature.  I'd return because of the convenience.",September 2017,none,none,none,none,none,none,none,none,none,321,136
1 helpful vote,2 contributions,5.0 of 5 bubbles,Location and Staff Make for a Wonderful Stay,"Every year I stay at this hotel from August through the end of October. The location is perfect, with access to the mall, restaurants, and a 24 Hour Fitness--all within walking distance.  But what really makes this hotel great is the staff! Every morning I look forward to the positive energy and smiling face of Rachel in the breakfast area. And in the evening, the hotel offers free happy hour from 5:30 p.m. until 7:30 p.m. Justin, Jessie, and the beautiful Kim go out of their way to be accommodating to whatever I need, even anticipating my needs before I even verbalize them!  And a special thanks to Emily (front desk) who helped me free myself from a tangle-resistant round hairbrush that became so ensnared in my hair that she literally had to cut me free after working on it for",August 2017,none,none,none,none,none,none,none,none,none,322,136
none,1 contribution,5.0 of 5 bubbles,Wonderful Location,This location was a beautiful site. clean and very presentable even with some construction was being done. I didn't feel it happening and was not noticeable. All staff was courteous and kind and very helpful.,September 2017,none,none,none,none,none,none,none,none,none,323,136
59 helpful votes,41 contributions,4.0 of 5 bubbles,Another Good Stay,"Our return to this hotel was better than ever!  We were there 4 nights, had a corner room on 6th floor overlooking the pool, quiet and very clean. Staff is very friendly, smiles everywhere.  The complimentary breakfast is now more enclosed, the selections have increased and the food was great.  The included cocktail hour was moved to a corner space on the lobby floor, not as accessible as before.  They are continuing a remodel, so we DID have to walk a maze of tables from our elevator to the lobby on our side of the bldg.  The other side was open and we could have taken the lobby elevator and passed by  the rooms on our floor, but we preferred to use the one closest to our room.  We requested additional coffee cups (paper) and coffee pods and got them daily.  The lighting isn't",September 2017,none,none,none,none,none,none,none,none,none,324,136
6 helpful votes,14 contributions,4.0 of 5 bubbles,Very nice,"The Embassy Suites in Brea is clean and efficient. The breakfast is nice. No Gluten free nor dairy free options, sadly. But our overall experience was very good. Polite and accommodating staff for a large hotel.",September 2017,none,none,none,none,none,none,none,none,none,325,136
2 helpful votes,1 contribution,5.0 of 5 bubbles,"embassy suites hotel brea, california","Excellent service in bar and breakfast areas.  Had only one complaint-poor lighting in living room.  Otherwise, excellent stay of 5 nights.  Previous stay of 7 nights very good also. servers in bar and restaurant were exceptional.",September 2017,none,none,none,none,none,none,none,none,none,326,136
2 helpful votes,1 contribution,5.0 of 5 bubbles,Love this hotel,"I've have stayed here on business periodically for 6 years.  I have never been disappointed by anything.   Clean room, friendly staff, nice facility, wonderful location, delicious room service, fresh and satisfying breakfast, decent internet, and more.",September 2017,none,none,none,none,none,none,none,none,none,327,136
1 helpful vote,4 contributions,5.0 of 5 bubbles,Wonderful stay,I have stayed at many Embassy Suites. The Brea One is one of my favorite. The staff is so professional and pleasant. They will make you feel at home. The front desk employees always so pleasant and helpful. The entire hotel staff is one of the best service I encounter. I always enjoy my stay their.,September 2017,none,none,none,none,none,none,none,none,none,328,136
64 helpful votes,430 contributions,4.0 of 5 bubbles,Great for Groups,I have stayed here twice in the last year. Both times were because my kids had games in California and the team stayed here. Our most recent trip was after the full renovation and I must say it is perfect for large groups. They have a very friendly staff and the rooms are perfect for up to a family of four. They serve a great breakfast buffet in the morning that comes with the price of the room. It is in a great area right off the highway and right next to a mall. They have plenty of parking in their garage and have a pool.,September 2017,none,none,none,none,none,none,none,none,none,329,136
1 helpful vote,3 contributions,5.0 of 5 bubbles,Above Excellent,"The location, cleanliness and comfort of the beds are outstanding.  The staff went out of their way to make sure we had everything we needed from arrival to checkout.    Breakfast in the morning was very good.  I would highly recommend this hotel in Brea to everyone.",August 2017,none,none,none,none,none,none,none,none,none,330,136
none,1 contribution,5.0 of 5 bubbles,Happily Stay Here Again,We had a excellent experience. Room was large and clean. Complimentary breakfast was very good. Staff was pleasant and courteous. Lobby was beautiful and welcoming. Underground parking was plentiful. We would happily stay here again.,August 2017,none,none,none,none,none,none,none,none,none,331,136
none,1 contribution,4.0 of 5 bubbles,N.O.meets L.A.,Overall the our hotel stay was good. The room was nice & spacious. I love suites with separate rooms. The made to order breakfast was great and staff was friendly. The only issue was our room hot at night. I would have expected the room to be warm during the day than night. I explained the room temperature to the front desk staff but she didn't seem interested in what I was saying!,August 2017,none,none,none,none,none,none,none,none,none,332,136
1446 helpful votes,697 contributions,4.0 of 5 bubbles,"Suite life here and it includes ""cooked to order"" breakfast.","High floor and ""penthouse"" suites located on the upper four corners. Comfortable beds and do go down elevators and on the south side is the pool.  Quality of housekeeping, breakfast and the pool area is delightful. Centrally located and  within walking distance of the Brea Mall.   Excellent on-site restaurant and sports bar for ""that someone who needs to catch the game."" Thanks for the wonderful ""cooked to order"" breakfast and coffee.",January 2017,none,none,none,none,none,none,none,none,none,333,136
146 helpful votes,350 contributions,4.0 of 5 bubbles,"Good stay at mini-suite hotel, would come back","This hotel, with its large atrium and surrounding rooms on 7 floors, is a bit dated now.  Still, it is well designed, so that the noise level in the sleeping rooms is very low.    The included breakfast buffet (with omelette line) is quite good.  (Breakfast is worth about $20 a person, so consider that when planning.) Ask the staff about the best times to avoid the rush.  Tables can be hard to get.  With the two-room design, one night owl can watch TV while another sleeps early or late.  The outer room has a small desk and a couch that folds out for kids or a single extra person.  It also has a small bar with fridge and sink.  The bath is nothing special but functional.    The bed was moderately firm and pillows varied from overfilled to thin.  Closet space is limited so be",August 2017,none,none,none,none,none,none,none,none,none,334,136
1 helpful vote,1 contribution,5.0 of 5 bubbles,Great hotel and I highly recommend. Staff went out of their way to handle our requests.,"Rooms were clean and have been updated.  Complimentary breakfast had good quality and variety.  At Managers Reception, the bartender remembered what we ordered the previous night.  Our family looks forward to staying here again.",August 2017,none,none,none,none,none,none,none,none,none,335,136
1 helpful vote,1 contribution,2.0 of 5 bubbles,Over charged!,Carpet was stained. Rust in shower. My credit card was charged $86 more than what my hotel confirmation said when I reserved my stay. Even after sending my email confirmation they said they could not give me that exact same rate. I will never stay at this hotel again!,August 2017,none,none,none,none,none,none,none,none,none,336,136
8 helpful votes,54 contributions,5.0 of 5 bubbles,CSUF FRESHMAN Move-In Day,"Our 1st stay at the Embassy Suites in Brea was fantastic.  Booked via HILTON On-Line. Room Selection and Digital Check-in worked fine. All was ready at front desk upon arrival.  Parking was 'Tight' on the Wednesday evening we arrived as there was an event in progress. We circled underground lot 3 times before finding a vacant spot.  Bring Patience.  Our stay was excellent, the moment we arrived from our 6.5 hr. trip, greeted by Host Mr. Erick to the morning Housekeeping & Kitchen staff and hearty morning breakfasts.   We were on the 5th Floor facing JCPennys on the mall side.  We found the room to be quiet each night and comfortable for a family of 3 adults.   Bathroom is clean and well lit with a shower that had great water pressure. We arose to start our days with the",August 2017,none,none,none,none,none,none,none,none,none,337,136
1 helpful vote,2 contributions,3.0 of 5 bubbles,Not A Happy Camper,"This is the first time that I was dissatisfied, hopefully it's the last time. The cleanliness was not what I'm use to. The pool was closed and the hot tub didn't function properly. The bars drinks were not as good as previous experiences.",August 2017,none,none,none,none,none,none,none,none,none,338,136
1 helpful vote,9 contributions,5.0 of 5 bubbles,Wonderful Oasis,"What a gem. We had not expected such a delightful hotel in Brea. The pool area was perfect for the fact we had a 5 year old with us. Unlike many hotels who have a concrete area and nothing else, this hotel has a wonderful grassy area with shade, tables and lounge chairs. Plenty of towels and the area was very nicely manicured. The staff at this hotel were very helpful and friendly. The breakfast was amazing - lots of food even at 9 am and all of it hot and fresh.",August 2017,none,none,none,none,none,none,none,none,none,339,136
2 helpful votes,11 contributions,5.0 of 5 bubbles,Weekend Getaway,"The location is perfect for a quick getaway and the staff member are excellent, from the lobby to housekeeping and staff in between! The room that we have are really clean and smell fresh! They have some remodeling going on at the hotel and can't wait to go back and see the new look.",August 2017,none,none,none,none,none,none,none,none,none,340,136
none,1 contribution,5.0 of 5 bubbles,Highly recommend,Very nice hotel with upgrades. Bed was really comfortable. High quality television. I had a room with a balcony and it was wonderful! The embassy breakfast is the best yoinwill find anywhere. I hope to stay here again.,August 2017,none,none,none,none,none,none,none,none,none,341,136
1 helpful vote,3 contributions,5.0 of 5 bubbles,Beautiful accommodations in Brea,"This hotel was very quiet, comfortable, and beautiful! The complimentary breakfast has a wide variety of delicious choices  and the breakfast area is bright and cheerful. The hotel is conveniently located near the Brea mall and other shops and restaurants.  The staff, without exception were delightful and very accommodating.  We were visiting town for a family funeral, and this was the perfect lodging for our family of 9.  Our request for our rooms to be placed together was honored, as well as an early check-in for funeral related events.   We will definitely choose to stay here again when we visit the area in the future!",August 2017,none,none,none,none,none,none,none,none,none,342,136
69 helpful votes,255 contributions,4.0 of 5 bubbles,Restful Stay,This was a stay for pleasure and necessity. We were taking my mother-in-law to a 9:00 am Dr. Appt but live 75 miles away. This was an excellent choice. close to her and her doctor. Also the Brea Mall is next door. An easy walk to enter and shop...which we did. We ate dinner in the restaurant. We were surprised at the selection and quality of the food. I had Beef Wellington and my wife had an appetizer. The food was good. We would definitely stay here again. The staff was extremely helpful and very friendly.,August 2017,none,none,none,none,none,none,none,none,none,343,136
4 helpful votes,30 contributions,5.0 of 5 bubbles,Perfect location for North Orange County family reunion!,"Perfect location for our visit to a family reunion.  Breakfast was great, especially the inlet station.  Need to keep some food items stocked better. Room was clean but could use some touch up paint here and there since it was recently renovated.",August 2017,none,none,none,none,none,none,none,none,none,344,136
1 helpful vote,1 contribution,5.0 of 5 bubbles,Great hotel,Stayed here July - August 2017 for a family vacation.  Everything was great!  Hotel was very clean and updated.  Breakfast area was large so even with a big crowd it was easy to navigate.  The pool area was very attractive and felt secluded despite being in the middle of a city.,August 2017,none,none,none,none,none,none,none,none,none,345,136
none,3 contributions,5.0 of 5 bubbles,An outstanding experience,"The hotel is kept immaculately clean. The a/c was silent and excellent. Each member of the staff was cheerful, helpful, courteous, and capable. The beds are very comfortable. The bathroom is well supplied. The splendid complimentary breakfast is very well done.",July 2017,none,none,none,none,none,none,none,none,none,346,136
1 helpful vote,1 contribution,5.0 of 5 bubbles,Embassy Suites Brea,"Nice and quiet, centrally located. Very friendly and helpful staff. A bit crowded at complementary breakfast (probably with some non-hotel guests), but excellent variety and quality of food service. Gym better than most, but still a bit lean on equipment.",July 2017,none,none,none,none,none,none,none,none,none,347,136
4 helpful votes,2 contributions,2.0 of 5 bubbles,Poor Housekeeping,"If you like poor service, including housekeeping rolling eyes at you when asking for additional blankets then this is the hotel for you. The gym is also poor and is in a make shift room with very little equipment.",July 2017,none,none,none,none,none,none,none,none,none,348,136
99 helpful votes,211 contributions,4.0 of 5 bubbles,Typical Embassy Suites,Stayed at the Embassy Suites in Brea on a business trip for three nights and it met my need quite well. I have stayed at many Hilton properties over many years and this is a very typical Embassy Suites. They include a nice cooked to order breakfast and a happy hour (which I never make it back in time for). The room was generally quiet and clean. Complimentary parking is available in an underground deck with elevator service directly to the lobby and all floors. The location is convent to the highway and shopping in the area.,August 2017,none,none,none,none,none,none,none,none,none,349,136
2 helpful votes,4 contributions,5.0 of 5 bubbles,Beautiful Hotel,"Took my girl scout troop here for an overnight stay and it was perfect.  The hotel made sure to accommodate my need for joined rooms. The free breakfast is a value for a big group.  This location has tons of shopping and restaurants nearby. It's close to the Disneyland, Knotts Berry Farm and Raging Waters.",July 2017,none,none,none,none,none,none,none,none,none,350,136
none,1 contribution,5.0 of 5 bubbles,YaYa Approved!!!,"Cool, clean, comfortable, yum yum food and convenient to shopping with our grand babies. Helpful staff, pool/spa, shuttle, bar, WiFi and nice desk/sitting area to work from. Really enjoyed our stay. Thank you.",July 2017,none,none,none,none,none,none,none,none,none,351,136
none,8 contributions,5.0 of 5 bubbles,CA trip for Baseball Stadiums,"Although close to Disneyland, expect around a 30 minute drive.  Nice, clean area.  Easy on/off interstates.  We weren't in the room much, so didn't take advantage of the hotel's amenities.  Breakfast was good as always at an Embassy Suite.  I would stay at this hotel again.   Note: there is construction going on right now.",July 2017,none,none,none,none,none,none,none,none,none,352,136
1 helpful vote,2 contributions,4.0 of 5 bubbles,Wedding weekend,"Penthouse suite was beautiful. However, the A.C. units.are too loud in ALL rooms. Penthouse had no towel hooks in the bathroom, the toilet room was too small for that huge of a bathroom. Pillows were mushy and way too soft.",July 2017,none,none,none,none,none,none,none,none,none,353,136
none,1 contribution,5.0 of 5 bubbles,Great place,"When we stay at other hotels, this is the one that we compare it to.  Everything's not perfect (always room for improvement) but we've never had any major problems in our several stays over the years.  The recently remodeled rooms and lobby are nice.  Rooms are clean and nice to stay in. Parking can be a bit of an issue on holidays especially if you drive an SUV that will only fit on parking level 1 due to height restrictions but most times this isn't an issue. The complementary breakfast is one of the bests we've had but the new lay-out has a few issues they should work out.",July 2017,none,none,none,none,none,none,none,none,none,354,136
11 helpful votes,29 contributions,5.0 of 5 bubbles,"Great property, fantastic staff","I've now stated twice at this property, and as a business person who travels with my spouse, this hotel is really a great choice for me.  Very nice suites, great pool and gym, free cook to order breakfast, and manager reception each evening.  I'm very pleased with everything at the Brea Embassy Suites.  For the past two years I've spent 60+ nights per year at a competitor, and I'm now seriously considering making this hotel as my ""go to""",July 2017,none,none,none,none,none,none,none,none,none,355,136
none,1 contribution,2.0 of 5 bubbles,Pull out bed is terrible,"Pros: Great breakfast, fantastic restaurant, responsive staff, beautiful atrium interior of the hotel.  Cons: The room was dim, several things didn't work and the pull out bed is a terrible spring mattress that was completely unacceptable.",July 2017,none,none,none,none,none,none,none,none,none,356,136
8 helpful votes,3 contributions,5.0 of 5 bubbles,"Hilton at Brea, California","The hotel is in a great location (near Disney Land) -- the layout is unique -- free happy hour at 5:30pm and a great breakfast buffet -- that's hard to top!  The hotel was a great venue for our family gathering (22 people). Sean, the person greeting us at front desk, he was very polite to customers, and his attitude makes people feel comfortable. His professional, attentive, and friendly behavior directly contributes to customers having a positive  impression stay at Embassy Suites. The waitress (she is short) who works at the breakfast buffet, she always has a friendly smile, a soft voice and a good attitude focused on serving the customers. With employees like Sean and the breakfast buffet lady, they make people feel comfortable which goes a long ways towards retaining and",July 2017,none,none,none,none,none,none,none,none,none,357,136
none,2 contributions,2.0 of 5 bubbles,Rude staff,Breakfast staff is rude. Felt like they were trying to rush you in and out. Also felt like they were watching everything you did like you were a theif. Food was average. Also to many unattended children in food area messing around making it hard to get to buffet.,July 2017,none,none,none,none,none,none,none,none,none,358,136
none,1 contribution,5.0 of 5 bubbles,Family Vacation,"We stayed four days; with three kiddos (1, 9 & 11) & everything was GREAT!!!!   The front desk checked in on us by phone & then went out of there way to come up to our Sutie to make sure we were ok when our little one accidentally pushed the RED ""medical assistance"" needed button on the phone.  We were so embarrassed; but the gentleman from the front desk was so nice about our mishap. We plan on returning soon.",July 2017,none,none,none,none,none,none,none,none,none,359,136
none,1 contribution,5.0 of 5 bubbles,Family,We always stay at embassy suites and never have a problem.. Its across the street from the mall and lots of places to eat.. The hotel has lots of parking the rooms are clean the pool is nice and big breakfast is great!,July 2017,none,none,none,none,none,none,none,none,none,360,136
none,1 contribution,3.0 of 5 bubbles,Squeaky doors and leaky showers keep you up at night? Don't think about staying here than!,200 dollar a night room shouldn't have the same qualities a $75 dollar room ata cheap motel have that's all I have to say about that you can figure out the rest by the title of this review bye the hotel is going under construction and you hear loud banging on every floor as early as 7:00 am so if you need peace and quiet this isn't the right embassy suites right now,July 2017,none,none,none,none,none,none,none,none,none,361,136
none,2 contributions,4.0 of 5 bubbles,Nice hotel,"Our room was clean and staff was courteous. We were hoping to check in early, but were told early check in could not be guaranteed. Embassy Suites Staff made it possible the morning of check in day! My only recommendation would be to allow early check in.",June 2017,none,none,"Dear Y6975ZIheathert,  Thank you for staying with us and for taking the time to review our hotel! It is greatly appreciated. We hope you will come back to visit our new-look venue again soon!  Sincerely, Team Embassy Suites, Brea North-Orange County",none,none,none,none,none,none,362,136
none,2 contributions,5.0 of 5 bubbles,Will be my first choice when I'm in Brea!,I have zero complaints. Everything was clean and the staff was friendly and helpful. I appreciated being able to check in early as my international flight arrived several hours before check in. Thanks!,June 2017,none,none,"Dear 740marissac,  Thank you for staying with us and for taking the time to review our hotel! It is greatly appreciated. We hope you will come back to visit our new-look venue again soon!  Sincerely, Team Embassy Suites, Brea North-Orange County",none,none,none,none,none,none,363,136
