Helpful Vote,Contributions,Overall Rating,Summary Heading,Summary,Date of Stay,Room tip,Trip Type,Manager Response,Location Rating,Cleanliness Rating,Service Rating,Value Rating,Rooms Rating,Sleep Quality Rating,Review Number,Index
none,1 contribution,3.0 of 5 bubbles,Average Hotel,"Complimentary breakfast better than Holiday Inn,  Air Conditioning in each of the suites did not work properly.  Beware if its hot outside you might not get a good night's sleep.  Other than that the rooms were decent,  location next to the mall and Target.",September 2015,none,none,none,none,none,none,none,none,none,627,136
none,2 contributions,5.0 of 5 bubbles,Excellent Hotel as always,Staying at an Embassy Suites is always a good choice.  This one is no exception; the room was clean and quiet.  The amenities at the site were very nice and the location was near everything you need. The breakfast service is amazing; good selection with good food.  I'd recommend staying here to anyone.,September 2015,none,none,none,none,none,none,none,none,none,628,136
104 helpful votes,621 contributions,3.0 of 5 bubbles,Well Worn,"My wife and I like to stay here now and again on minivacations usually twice a year or so for the last several years. Regrettably we can readily see the toll of time that has accumulated.  The common spaces still look pretty good but the rooms could really use some tender loving care. We received a complementary upgrade via Hilton Honors to room 722.  A room with a name, Cheops!  Pretty cool!  Located on the top floor on the corner, it should've been a tremendously gorgeous room.  Unfortunately the curtains are not hung properly and do not open as intended.  The sliding glass will only open with Herculean effort. The combination of those two issues make it difficult to enjoy the view!  The bathroom is WAY cool with the huge tube and glass shower and the sitting area spacious!  A",September 2015,none,none,none,none,none,none,none,none,none,629,136
none,5 contributions,1.0 of 5 bubbles,Beware of Room 209,"When staying at Major chain hotel, you would expect a certain level for your hotel room.  You do not expect to find a room with an electric outlet partly covered with wall paper, hole in the ceiling, paint peeling off the door and some white fuzzy stuff growing on the carpet.   When checking out, I let the manager on duty, Jimmy G. know about the condition of the room and was promised a gift card for a free night in 2 weeks.  It is over a month later and still no gift card or return call.",July 2015,none,none,none,none,none,none,none,none,none,630,136
4 helpful votes,21 contributions,5.0 of 5 bubbles,they CATER to your every need!!!,"THIS by far one niecest of motels and amenities....My niece booked family the rooms for her wedding.  WE had major visits in lovely areas.  Breakfast with made to order omelets.  Quality family time sitting and visiting in lovely areas of the restaurant. The pool side is lovely and we were together there often.  Friendly and accommodating in everyway, whether it be room change, more towels, etc.  OUTSTANDING...the location is to die for....so MUCH to see, SHOP and visit!!!  Best location ever.  LOVED IT!!!",September 2015,none,none,none,none,none,none,none,none,none,631,136
48 helpful votes,170 contributions,5.0 of 5 bubbles,Great Place!!,Stayed here for over 3 Weeks &  was delighted by the overall experience. Probably one of the best staff I have ever met. The suite type (2rooms) are incredible n very clean!! The Breakfast has a very good variety apart from the custom dish they can offer you each day!! The evening happy hours everyday at 17:30hrs sets in the mood!! Go for it!!,September 2015,none,none,none,none,none,none,none,none,none,632,136
none,1 contribution,2.0 of 5 bubbles,Smelled so Bad!,I normally stay at this hotel when ever I travel for work. Up until the last trip it was actually halfway descent. I scored it poorly because the last time I went my room stunk so bad I actually thought about finding another hotel. The smell was a mix between mildew and smoke in a non-smoking room. There was a large stain above my head board and I found ants in my bed. When asking to change rooms the staff told me they were sold out for the night. Not sure who does the quality control there but that room definitely should not have been a room that was available to book.,September 2015,none,none,"Teresa, I apologize that you did not enjoy your stay with us. You should not have had to experience a bad smell in your room.  We hope you will give us another opportunity in the future.  Thank you.",none,none,none,none,none,none,633,136
none,4 contributions,2.0 of 5 bubbles,Hotel falling apart,"Icemakers not working, Jacuzzi not working, breakfast cook getting orders wrong, Front desk inattentive on check-in, face stuck in the I-Phone. Breakfast gestapo demanded my breakfast card, hotel room key did not suffice, had to go back to my room to find the card, lots of challenges in the property.",September 2015,none,none,"I apologize that you did not have a great stay with us.  This is not normal from what most of our guest's experience.  I do have to let you know that we will be going through a major renovation at the end of this year.  I hope you will give us another opportunity to make it right next time.  Thank you,",none,none,none,none,none,none,634,136
none,1 contribution,3.0 of 5 bubbles,Good name but old hotel,"It looked like an Embassy Suites but one that is in need of a lot of work. The beds were very clean but the carpet smelled old. We tried the hot tub and only two jets were working and it was dirty. It also smelled like urine around it. Somebody must have complained because next morning it was closed for a while. When we went back the water had been cleaned and the smell was gone but the jets were still not working except two. Also, the balcony door was so hard to slide open that my wife was not able to do it.",September 2015,none,none,Thank you for your review of our hotel.  I happy to let you know that we will be going through a major renovation at the end of this year.  We hope you will be back soon to visit us.,none,none,none,none,none,none,635,136
none,1 contribution,5.0 of 5 bubbles,Desk clerk,Devin Okono went over and above in customer service. He helped us get an upgraded room by speaking with the cleaning service. He personally managed our luggage at the desk and to the room. He would not take a tip even when my husband tried to hand it to him. His timeliness helped us attend a pre-wedding family function that we would have missed.,September 2015,none,none,Thank you for your really nice review.  Yes I agree Devin is fabulous he is one of our best employee's.  Please visit us again.,none,none,none,none,none,none,636,136
none,2 contributions,5.0 of 5 bubbles,Great value & service,"It's such a great value for what you pay for the suite. Rooms are extremely spacious, clean and very comfortable. Free hot breakfast in the morning & free happy hour in the evening is just awesome. Only complain is that they charge $27 a day for parking in certain locations. But overall, the stay is worth it!",September 2015,none,none,Thank you for your nice review.  I wanted to let you know that we offer complimentary parking for all of our guest(s).  I'm curious to know where they charge $27 for parking.  We hope to see you again in the future.,none,none,none,none,none,none,637,136
none,1 contribution,5.0 of 5 bubbles,nice place,"staff very professional and accommodating, shopping and dinning lots to choose from. Close to freeways and easy acces to amusement parks. not far from beaches . Had ample parking for guest. many different restaurants to choose from. All within walking distance. The only discouraging thing wad some idiot decided to turn on fire alarm at 2:30 A.M. Just hope they caught the person who was so inconsiderate and fine him or her enough they will have to think before they act out in this manner again. Not hotels fault for sure but was annoying",August 2015,none,none,"Thank you for your very nice review.  I agree with you our hotel staff always makes the guest's stay a special experience.  The location of this hotel is always nice with the shopping mall right across the street and very accessible to the freeways.  I am truly sorry you had to experience the fire alarm that went off at 2 in the morning.  Hopefully, you will give us another opportunity when your in the North Orange County area.",none,none,none,none,none,none,638,136
552 helpful votes,1836 contributions,4.0 of 5 bubbles,"Nice, comfortable and quite hotel","Stayed here a few nights for business and the hotel was very good.  Rooms were quite, spacious and comfortable.  I liked they had fridge and microwave in room.  The wifi was good - fast with strong signal.    The hotel is in a great location next to mall and lots of great places to eat nearby.  Check-in was fast and there is covered parking in the structure.    I will be staying here again when in the area.",September 2015,none,none,Thank you for your review.  We are happy to hear you enjoyed your stay with us.  We hope to see you again when your in the North Orange County area.,none,none,none,none,none,none,639,136
none,1 contribution,3.0 of 5 bubbles,Mediocre,Accommodations are standard and lacking amenities for bathroom. I ask twice for additional bedding for sofa bed that should have already been in our room. Front desk often answerers the phone for housekeeping and that is frustrating.,August 2015,none,none,Thank you for your review.  I understand your frustration that front desk answers the phone calls for housekeeping.  The reason why we do that is so we can make sure we answer all the phone calls and to provide a better service for our guest's. We hope to see you again in the future.,none,none,none,none,none,none,640,136
29 helpful votes,134 contributions,3.0 of 5 bubbles,Consistency is a good thing,"Staying for business for a few days, I found this Embassy to be consistent with other Embassy's. The hotel was clean, gathering area comfortable and checkin to be easy. The mall is literally a few steps away, however no time to shop.   The room was clean, decor was acceptable, mattress very comfortable and pillows were plenty   Room was nicely stocked but I missed my complimentary  bottle of water for the night. Love the towels, plush and absorbent.   Recommendations would be to add electrical plug ins   I had a difficult time plugging in and charging devices.  Also I was uncomfortable with the bathroom door opening at the bedside. It felt weird when I closed it and it felt weird when sleeping with it open- but I'm sure the building is older and not recently designed.   Cook to",August 2015,none,none,Thank you for taking the time to give us a review.  I understand it can get frustrating when there is not enough electrical plug ins for your devices.  I wanted to let you know we will be going through a major renovation at the end of this year. Hopefully you will give us another opportunity in the future.,none,none,none,none,none,none,641,136
none,1 contribution,1.0 of 5 bubbles,REQUEST THE ROOM THAT DOESN'T HAVE FLOOD PROBLEMS...,"Would have enjoyed the stay more if the air conditioning worked properly and the tub didn't leak, prohibiting taking a bath.  The staff are friendly and cordial, but kept telling me ""it's being fixed.""",August 2015,none,none,"I apologize that you did not have a nice stay with us. If you could please call or email me, so we can discuss this stay further I would really appreciate it. I wanted to let you know we will be going through a major renovation at the end of this year. Hopefully you will give us another opportunity in the future.",none,none,none,none,none,none,642,136
5 helpful votes,24 contributions,5.0 of 5 bubbles,Great place - Noisy equipment on roof,"Top floor rooms are normally the quietest.  However, in locations with tight building codes - like thse in California - rooftop equipment can transmit noise to the rooms below.  When checking into this facility, be sure to ask for the opportunity to check out any top-floor rooms for noise transmitted from roof-top equipment.  A few rooms in this facility are a bit noisy - this won't bother most folks, but bothers some.  Otherwise, this is a great place to stay.",August 2015,none,none,"Thank you for your review!!  I apologize that you had a noisy room.  Hopefully the next time your in the North Orange County area you give us another opportunity.    Sincerely,",none,none,none,none,none,none,643,136
none,1 contribution,5.0 of 5 bubbles,AWESOME hotel for a Disneyland stay -- if you have a car!,"We LOVED this Embassy Suites! Breakfast was the best of ANY E.A. we've ever stayed at. Pool open until 10pm for kids!!! Amazing! Very clean, comfortable, and QUIET. Target and other shopping directly across the street. No shuttle to Disneyland, though, as it's 30 miles away, but that didn't bother us at all.",July 2015,none,none,"Dear Valued Guest,   It is great to hear you had a 1st class stay with us!  Thank you for taking the time to review our hotel!  We hope you will come back to visit us again soon!    Sincerely,",none,none,none,none,none,none,644,136
none,2 contributions,5.0 of 5 bubbles,Great accommodations,"Staff was very kind and have great hospitality. Although the room was booked a smoking room, they did offer to call me if a non smoking room came available which I thought was thoughtful. It was clean and everything I expected. It had a balcony, and it was quiet.Breakfast was a great added bonus. I plan to stay here again.",July 2015,none,none,It is great to hear you had a fantastic stay with us!  Thank you for taking the time to review our hotel!  We hope you will come back to visit us again soon!,none,none,none,none,none,none,645,136
30 helpful votes,96 contributions,5.0 of 5 bubbles,great bang for the buck,"Nice people. nice place. Far from the maddening crowds. But that's MY kind of place and near great shopping , great golf, and Yolanda Linda with many active centurions . Loved it. Would go back to this area in a heart beat.",January 2015,none,none,"Dear Valued Guest,   Thank you for taking the time to review our hotel!  We hope you will come back to visit us again soon!    Sincerely,",none,none,none,none,none,none,646,136
2 helpful votes,3 contributions,1.0 of 5 bubbles,No security and smokey rooms. Avoid it!,"I do not recommend this hotel: 1) There is no security in the garage. According to the police, they respond to thefts at least once per week. The third row bench seat was stolen from our vehicle! The hotel offered my family complementary bottles of water for our trouble. 2) The non-smoking rooms stink of old smoke and whatever scent they use to try to cover it up. 3) The bathroom door cannot be opened all the way. It hits the bed before reaching the half-way point. 4) The breakfast lady demands the single card given to your room. In other words, the entire family has to wait in line together. If it is the last day of your stay, she takes the card before everyone has had breakfast. 5) They forgot to leave towels in the room, making it difficult to have a quick turn-around for an",July 2015,none,none,"I apologize that you did not have a nice stay with us. If you could please call or email me, so we can discuss this stay further I would really appreciate it. I wanted to let you know we will be going through a major renovation at the end of this year. Hopefully you will give us another opportunity in the future.   Thank you,",none,none,none,none,none,none,647,136
none,1 contribution,4.0 of 5 bubbles,Nice Stay,"Room was very clean.  Ordered from room service and the food was delicious. I didn't partake in the happy hour, because I was at a wedding at that time. I also left early so I didn't eat the complimentary breakfast, but it smelled delicious.  I would definitely stay there again and I would recommend it to my family and friends.",July 2015,none,none,"Thank you for taking a moment to share your experience. I am really glad you enjoyed your wedding event. We hope to see you the next time you're in Orange County area.   Sincerely,",none,none,none,none,none,none,648,136
12 helpful votes,11 contributions,4.0 of 5 bubbles,Embassy in Brea,"This hotel is very convenient for while visiting areas around Anaheim and Orange County. Our business took us to various areas around Anaheim and Newport. It was easy to access the freeways close by and the Brea Mall is adjacent. There are restaurants, grocery, specialty and service type stores all around. LAX takes about1-1/2 hour drive on a weekday and about 45 minutes on weekend. We liked that it was not in the congestion of Anaheim hotels and away from crowds and local traffic. The breakfast and cocktail hour is always good. This location is clean and staff is friendly.",July 2015,none,none,"Dear Valued Guest,   It is great to hear you had a wonderful stay with us. Thank you for taking the time to review our hotel!  We hope you will come back to visit us again soon!    Sincerely,",none,none,none,none,none,none,649,136
none,1 contribution,5.0 of 5 bubbles,An Exceptionally relaxing experience,I would highly recommend the Brea Embassy Suites.  It is an incredibly relaxing experience.  you are provided at least 2 rooms in each suite and the courtyard is beautiful.  It makes you want to stay at the hotel instead of going to some other destination.,July 2015,none,none,"Thank you so much for your nice review. I am happy to hear that you enjoyed your room accommodations.  We hope to see you in the future and thank you for staying with us.  Cordially,",none,none,none,none,none,none,650,136
26 helpful votes,88 contributions,1.0 of 5 bubbles,Felt Unwelcome,"So far in my travels in USA and Europe I have stayed at several Hilton group of hotels. Mostly Hamptons and Hiltons. I rarely have to write a bad review about any one them. This Embassy suites in Brea totally disappointed me.  I tried to check in at this Embassy suites at 3:00PM. Rooms were not ready and usual check in time is 4:00PM. Fully understandable. I requested for a pre check in so that I can come late at night and not have to worry about check in at late night hours. The receptionist obliged but would not let me know my room number. No, I don't want the keys. I just want to know my room number. I can't do that was the answer. If I had checked on line then  I would have known my room number 24 hours in advance. I fail to connect the logic here. I can know my room number",July 2015,none,none,"I apologize that you did not have a welcome check-in with us.  I wanted to let you know we will be going through a major renovation at the end of this year. Hopefully you will give us another opportunity in the future. Thank you,",none,none,none,none,none,none,651,136
none,1 contribution,4.0 of 5 bubbles,Great Service,This was my second time to reserve a room at Embassy Suites in Brea.  Both times I had a very positive experience and great customer service.  I will always stay at this hotel in Brea if I have another business meeting to attend.,July 2015,none,none,Thank you for your review and choosing the Embassy Suites in Brea.  It is very nice of you to stay with us every time you have a meeting in the area.  We hope to see you in the future and thank you for staying with us.,none,none,none,none,none,none,652,136
16 helpful votes,13 contributions,2.0 of 5 bubbles,If looking for a hotel that doesn't accept pets look elsewhere,Our family of 8 stayed in two rooms.  The rooms were alright but we had wanted connecting rooms.  The hotel let someone in one of the rooms extend their stay so that was our first negative.  Second negative was the lady at breakfast checking card.  She would keep asking for our card every time we went from one side to the other.  It was annoying to say the least.  Third negative was the lady with a non-service dog.  The dog was not on a leash and was able to run around on the 6th floor terrorizing my kids.  I called twice to complain and was told a manager would contact me.  I never received any communication from the manager regarding this situation.  I noticed a front desk person walking with the lady back to her room so they knew about her dog and didn't care.  Fourth,July 2015,none,none,"I apologize that you did not have a nice stay with us. If you could please call or email me, so we can discuss this stay further I would really appreciate it. I wanted to let you know that we do accommodate service dogs.  Hopefully you will give us another opportunity in the future. Thank you,",none,none,none,none,none,none,653,136
none,1 contribution,5.0 of 5 bubbles,"Perfect ""home away from home""","This was the first time that my sister and I stayed at this hotel. On our previous visits to the area, we had always stayed at a competitor's hotel in Buena Park. We found the Embassy Suites to be a vast improvement. It had everything that we needed; a sofa sleeper so our niece and nephew could stay with us during our visit, a refrigerator for storing supplies, complimentary breakfast, helpful staff, clean and well-maintained facilities, convenient location, restaurants and shops within walking distance, etc. We visit my brother and his family every year and plan to make this our ""go-to"" hotel.",July 2015,none,none,"""Home away from home""  Thank you for choosing the Embassy Suites in Brea.  We are happy to hear you and your family enjoyed all the amenities the hotel offered.  We hope to see you again when your here to visit your brother and his family.  Thank you,",none,none,none,none,none,none,654,136
none,3 contributions,5.0 of 5 bubbles,Great Location,"I love this hotel, all the wonderful amenities of Embassy Suites with arguable the best location. You are next to a great mall in Brea, 1/2 mile away from downtown Brea and all the wonderful stuff there, down the street from Disneyland and Knox (10-15 min), its everything you want",July 2015,none,none,Thank you for your review.  We are happy you liked all the amenities and the location of the hotel.  We hope to see you in the future and thank you for staying with us.,none,none,none,none,none,none,655,136
1 helpful vote,1 contribution,3.0 of 5 bubbles,Good Hotel but Needs Updating,"I've stayed at this hotel too many times to count over the past 15 years.  It has the potential to be amazing.  When it comes to location, you couldn't ask for a better place.  It's located right outside the Brea Mall and less than a mile from other shopping, civic center, community center, restaurants, movie theaters, bars, and the Improv Comedy Club.  The only real downside is that the hotel is in desperate need of remodeling.  The furnishings have definitely seen better days.",July 2015,none,none,"I am glad to hear you enjoyed the location of our hotel.  I wanted to let you know we will be going through a major renovation at the end of this year. Hopefully you will give us another opportunity in the future. Thank you,",none,none,none,none,none,none,656,136
1 helpful vote,1 contribution,5.0 of 5 bubbles,FABULOUS STAFF & ACCOMMODATIONS,Very enjoyable stay. We stayed for one week and never had a issue. I highly recommend upgrading with the breakfast that was out of this world! If you have AAA it's only $9 for the week per family member. Most hotels cost $15 per day per family member. Great pool and fitness room.,June 2015,none,none,"Thank you for your review.  We are happy you enjoyed your one week stay with us and the AAA upgrade.  We hope to see you in the future and thank you for staying with us.  Sincerely,",none,none,none,none,none,none,657,136
none,1 contribution,5.0 of 5 bubbles,Excellent,"Embassy Suites is our choice hotel and has been for many years. This was my first time staying at this property but I was very impressed. Not over crowded, very comfortable and the location was great.",June 2015,none,none,"Thank you for always choosing Embassy Suites hotels.  We really appreciate your business.  Please come back soon.  Sincerely,",none,none,none,none,none,none,658,136
none,1 contribution,5.0 of 5 bubbles,Embassy Suites Brea CA,"This is a great hotel. Staff is friendly and helpful. Great location next to Mall, restaurants, good places to walk outside. The hotel is very quiet even when full which it often is. Lots of free parking too.",June 2015,none,none,"Thank you for your nice review and we hope you'll be back real soon.  Sincerely,",none,none,none,none,none,none,659,136
33 helpful votes,59 contributions,4.0 of 5 bubbles,Good Value,"We had a four night stay for a family memorial/reunion. Upon checking in, one room's living area, although appearing clean, smelled of vomit.  After a long day of travel, my daughters were too tired to do anything.  The next morning, it was reported to the front desk.  Perhaps they tried to clean, during the day, but later, we asked for a new room.  Our request was immediately accomodated., but no one should have ever been put in the room.   Regardless of our room issure, if this is the area of Orange County you need to be in, this is a great place to stay.  The atrium style hotel is inviting which leaves a large area for the great breakfast that is included in the room rate.  Omlets are made to order.  A complementary happy hour with snacks is also good.  The pool area is not",July 2015,none,none,"Thank you for your review.  I am sorry that you and your family had to experience a room that had a really bad smell.  In the future, we hope you will give us another opportunity to make your stay very enjoyable.",none,none,none,none,none,none,660,136
