Helpful Vote,Contributions,Overall Rating,Summary Heading,Summary,Date of Stay,Room tip,Trip Type,Manager Response,Location Rating,Cleanliness Rating,Service Rating,Value Rating,Rooms Rating,Sleep Quality Rating,Review Number,Index
3 helpful votes,5 contributions,3.0 of 5 bubbles,Santa Ana Coast Hotel,"Unfriendly place to stay. Fair room, fair amenities, and no trouble with noise. However, staff was extremely rude at this hotel. Management lacked people skills and front desk clerk, Alexis, lacks customer service etiquette. Warning all credit card users, this hotel charges a deposit of $100 prior to your stay. Watch your credit card statement because this hotel charged our card several times for this deposit.",June 2016,none,none,"Hello,  Thank you for taking the time and filling out the guest survey.  I am glad that you like the hotel but I am very unhappy that the staff did not take better care of you.  I will be looking into this more and talking with the front desk staff and manager.  Thank you again for your feedback  Doug Mills General Manager Clarion Inn & Suites John Wayne Airport",none,none,none,none,none,none,187,143
29 helpful votes,20 contributions,4.0 of 5 bubbles,Reservationist a gem!,"Geez, I haven't even stayed there yet! I made a reservation for this coming July 12 for two nights with Rosemary. She was really great to deal with. professional, funny and knowledgeable. As a hotelier myself, I know the value of the having the knowledge and the personality that it takes to begin a great stay.  Well done Rosemary!",July 2015,none,none,Thank you so much for taking the time and letting me know about your experience with Rose.  We look forward to seeing you soon.,none,none,none,none,none,none,188,143
10 helpful votes,9 contributions,4.0 of 5 bubbles,No More Continental Breakfast,"We have stayed at this hotel for years and was surprised to find out at check-in that it no longer offers free breakfast.  I ONLY stay at Choice Hotels, and that is one of the reasons.  It's very convenient and the kids love it. I factor this in when looking at prices knowing I would have to spend extra money if we all needed to get breakfast. When I booked, the website didn't say anything about it.  The desk clerk gave me 2 vouchers good for either a bagel or a pre-packaged egg muffin and choice of juice or milk.  This helped however the next morning they had an understandably stressed guy trying to get many guest's breakfast.  I literally spent 15 minutes at the counter while he peeked around telling me to hang on.  My dad wanted only coffee and after the 15 minutes I finally",June 2016,none,none,none,none,none,none,none,none,none,189,143
71 helpful votes,73 contributions,3.0 of 5 bubbles,a great stop for a night,Spent a night here after flying in. Had stayed here before when it was under a different name. Many upgrades and improvements. It is close to the airport and has many businesses and restaurants close by.,May 2016,none,none,none,none,none,none,none,none,none,190,143
none,1 contribution,4.0 of 5 bubbles,Get away,"Hotel itself was nice and a good location for Orange County Airport. Staff is overworked and seems stressed. Big problem with our shuttle to the airport though..... we needed to catch the first shuttle at 6:00 to make our flight time and the driver never showed up. We waited 15 minutes and finally we were saved by another hotel guest who just happened to be returning her rent-a-car and was willing to drop us off. The desk person said she would let her manager know, but nothing has come of that so far. For the return shuttle after our trip, they don't schedule you in ahead, so you have to call. When I did, I was put on hold for almost 20 minutes before a very helpful lady said she would send their driver, who did come to get us. I will say though that the price for their ""park",June 2016,none,none,none,none,none,none,none,none,none,191,143
none,7 contributions,4.0 of 5 bubbles,Excellent Place To Stay!,Very clean and modern.  Loved the snack bar in the lobby!  Staff even gave me a ride to Staples to pick up some printing.  Look forward to staying here again! And walking distance for some fast food if you're in the mood.  Cable reception was very good.,May 2016,none,none,none,none,none,none,none,none,none,192,143
4 helpful votes,32 contributions,3.0 of 5 bubbles,Too Much Fun,"Stayed here over a weekend, while I was jamming with my band in Tustin, nearby. The room was really clean, modern, and acceptable. Front desk, check-in/service was very good as well. Now here's the good and the bad.   This place was packed and there was a total and complete party atmosphere at this place. There was some sort of a Lacrosse tournament going on, and teams were staying here. That means a bunch of 18-21 yr. old Dudes, ready to party. Not only that, but I betcha' the place was sold out, and EVERYONE was partying it up! Not that we minded this, as we were pretty much doing the same, but if I came here with small kids, or for a romantic getaway, I'd RUN AWAY quickly. Fun yes, peaceful, nope.  This being said, I would look forward to staying here again, just for the",May 2016,none,none,"Thank you for taking the time to review your recent stay at our hotel. I'm glad to hear you had such a wonderful experience! Please note however that we are absolutely NOT a party friendly hotel, and do our utmost to curtail the noise after the 10pm quiet hour. I apologize for the unsightly mess in the back parking lot near our dumpsters while you were here. That unfortunate aftermath of the renovations process has since been removed. Thank you for allowing us to be a part of your visit to the area, and we hope to see you again.  Sincerely, Andre Neuman Assistant General Manager",none,none,none,none,none,none,193,143
68 helpful votes,119 contributions,4.0 of 5 bubbles,Pretty Good,"This hotel is clean, and the bed was comfortable. The front desk staff were friendly, as were the shuttle bus drivers, to and from the airport. For the price, it's a good deal. Of note, however, is that there is no free breakfast at all. They have packaged meals for sale. Also of note is that the shuttle pick-up area for the John Wayne airport is confusing if you aren't used to it. Be sure to call the hotel and get detailed instructions.",May 2016,none,none,"Thank you for taking the time to review your recent stay at our hotel. I'm delighted to hear that your overall stay experience was wonderful! I apologize for any trouble you had finding the ground transportation area at the airport. We do encourage our guests to give us a call so we can help guide you to the correct area to meet our shuttle. Thank you very much for allowing us to be a part of your visit to the area, and we hope to see you again soon!  Sincerely, Andre Neuman Assistant General Manager",none,none,none,none,none,none,194,143
1 helpful vote,1 contribution,3.0 of 5 bubbles,Clean rooms but poor front desk service,Booked based on continental breakfast due to business schedule which they took away and didn't notify me.  Lady argued with me that it was removed from a website which was untrue as I just had pulled it up.  Anyway stood at desk to check out and waited a few minutes for two woman to aknowledge me. They didn't. Took a customer who walked up minutes later for check out before helping me even though I had been standing there with my luggage and key in hand.  Not impressed.,May 2016,none,none,"Thank you for taking the time to review your recent stay at our hotel. I apologize for the impression the front desk staff left you with. We generally receive wonderful compliments for their service, and I'm truly sorry this was not the case for you. Since we opened our new bistro the complimentary breakfast information has been pulled from 99% of the websites out there and we are working with the remaining few to correct the information. I apologize that the desk agent checking you in was unaware of the exceptions. I apologize as well for the inattentiveness of the agents working the morning of your check out. I'm very surprised to hear you were let to stand there at the desk without being acknowledged, and I'll be speaking with the staff regarding this to ensure it does not happen again. I truly hope you'll allow us another chance to provide you with an excellent stay experience.   Sincerely, Andre Neuman Assistant General Manager",none,none,none,none,none,none,195,143
126 helpful votes,230 contributions,3.0 of 5 bubbles,Should have read the small print,Nothing special about my suite or the Hotel....no breakfast and no restaurants around....plenty of fast food joints...no recognition of being a diamond elite member....not even a bottle of water....I should have stayed at another Choice hotel..econo lodge would be better.,May 2016,none,none,"Thank you for taking the time to review your recent stay at our hotel. I apologize for your stay being anything less than excellent. While we have eliminated the complimentary continental breakfast, we have replaced it with the wonderful breakfast menu served from our new bistro. For our guest's convenience the bistro also has a great dinner menu served until 11pm. While there are plenty of fast fod places nearby, there is also an excellent entertainment shopping center nearby with 20+ restaurants to choose from. It's very easy to find if you're driving, and we offer free shuttle service to and from there (when available) if you're not driving.   I truly apologize that you were not recognized for your Diamond Elite membership. We value all of our guests, but none more so than our Diamond Elite members. We're aware of how many stays it takes each year to reach that level and we truly appreciate your loyalty to the brand. Please allow me to extend a belated but sincerely meant Thank you.  Warm regards, Andre Neuman Assistant General Manager",none,none,none,none,none,none,196,143
10 helpful votes,17 contributions,1.0 of 5 bubbles,Robbed at 3am in my room,"My son and three friends were robbed while they slept in their room on May 8 at the Clarion.  My son woke up at 3 am to someone at the bedside table stealing his phone and watch.  His friend's wallet was also stolen.  The hotel management was evasive in acknowledging the incident, even though the police responded. The hotel management has taken no action or accepted responsibility for the security breach.  My family will never stay in a Clarion or Choice Hotel property again.",May 2016,none,none,"Dear valued guest: As you, we were disappointed and shocked by the events of the evening.  This has never occurred at this location even though any hotel can be targeted, whether it’s a 3 star or 5 star property.  As with all safety or security incident, we look to first thoroughly investigate the events by having a direct conversation with the people involved, checking the readings from the lock and ensuring that a police report is filed.  In this specific situation, when the hotel team was informed of the incident, the managers started the investigation process immediately gathering more information, contacted the local police department asking for more presence in the area, informed the corporate office of the incident with a corporate team member being dispatched to the property to assist in the investigation and following up with the guests onsite.  Additionally, at our urging, we had one of the occupants file a report with the police department a couple of days after the event in question to ensure all proper steps were taken; until that time, no one from the room had filed a report.  We did not attempt to comment on the situation until we had all the facts.  But after hearing the story from 1 of the occupants, inspecting our lock system and reading the lock logs, it was evident that the room was not accessed using any type of room key.  We could only assume at this point that the room door was left ajar allowing access.  For this reason and overall safety of our guests, we highly suggest that they use the latch lock and the deadbolt which are provided in all the rooms as a necessary precaution.  We, as a hotel team and company, will continue to make safety a priority and look for opportunities to improve our operation and to educate our team and guests on hotel safety and security.  General Manager",none,none,none,none,none,none,197,143
137 helpful votes,301 contributions,1.0 of 5 bubbles,The website lies...no free breakfast and nothing was said at checkin.,"I have stayed here many times.  Not again. Despite what the website states, and what my printout had, they discontinued the free breakfast.  And there was no comment about that when I checked in.  I do not eat much, but a bowl of cereal and OJ was always nice.  The hotel is comfortable, but the lack of communication is deceptive. I do not return to places where they lie by omission.   This should have been disclosed at check in.    I expect more from a hotel...and especially one where I am a gold card member.  Goodbye Clarion .  There are other hotels nearby.",April 2016,none,none,"Thank you for taking the time to review your recent stay at our hotel. I apologize for the complimentary breakfast having been discontinued. Once our bistro opened in our lobby roughly a month ago we did take the listing for it off of the webpages so as not to mislead our guests, and we have been working with our guests who had made reservations prior to our pulling that from the webpages to satisfy them. I truly apologize if you showed us your reservation confirmation listing the breakfast as included and we did not help you with it. Our bistro does offer many wonderful selections for both breakfast and dinner, and many of our guests find it to be a wonderfully convenient alternative to going out for meals. I truly hope you'll return to us in the future and give us another chance to provide your with an excellent stay experience.  Sincerely, Andre Neuman Assistant General Manager",none,none,none,none,none,none,198,143
4 helpful votes,9 contributions,5.0 of 5 bubbles,Very Pleased!!!,"What a gorgeous hotel.  Recently renovated.  Rooms are terrific.  Very quaint location with a pool and hot tub.  Staff was particularly friendly and helpful.  Newly remodeled Bistro restaurant offered a great touch to breakfast and dinner.  I am not a fan of the tired hotel buffet and this place offered the variety I like.  The food here was cooked to order, hot, and fantastic.  I applaud this hotel for a job well done.  This is my new hotel for business trips in Santa Ana.",April 2016,none,none,"Thank you for taking the time to review your recent stay at our hotel. I'm absolutely thrilled to hear your stay was such an excellent experience! Thank you so much for allowing us to be a part of your visit to the area, and we look forward to continuing to serve you in the future.  Sincerely, Andre Neuman Assistant General Manager",none,none,none,none,none,none,199,143
13 helpful votes,11 contributions,3.0 of 5 bubbles,Decent,"The hotel was exactly what you pay for. The rooms are pretty decent sized, however, the hotel was a bit outdated. Meaning it could just use a bit of a renovation. The location is perfect since it's just off of the freeway and it's not too far from Disneyland if you plan on visiting. Plus, it's way better pricing than anything closer to the Anaheim park.",March 2016,none,none,"Thank you for taking the time to review your recent stay at out hotel. I'm glad to hear that in general you enjoyed your stay with us. We're actually in the finishing stages of a $1,000,000 renovation, and we should be finished in the near future. Unfortunately it's the last of the exterior touches that remain to be finished such as repainting the buildings, which gives the overall look a bit of a black eye. We'll have this completed in the near future however, and I truly hope you'll return to us in the future to see the difference the last few finishing touches make.  Sincerely, Andre Neuman Assistant General Manager",none,none,none,none,none,none,200,143
5 helpful votes,2 contributions,1.0 of 5 bubbles,Don't give them your money,"I stayed at this hotel in March 2016.  I came in very late with no reservation.  They took my card and said I would be charged $98.  In my room which was musty and humid I turned on the crappy air conditioning that I would expect in a $30 hotel.  It worked poorly, kept me up most the night.  In the morning I found they charged me $209.  When I complained they said ""oh that is the deposit, it will be reversed"".  So I was charged $300 for a $30 room.  Better to sleep in the car or on the beach.  I will never stay at another Clarion Hotel ANYWHERE EVER.",March 2016,none,none,"Thank you for taking the time to review your recent stay at our hotel. I truly apologize for your experience with us. Our computer system does automatically authorize a $100 room deposit in addition to the room charges, and I apologize if our desk staff did not explain that prior to processing your card at check in. The deposit is released on our end at check out, and it generally takes your issuing bank 3 to 7 business days to reflect that release depending on their policies. I apologize as well for the air conditioner not working well. We are currently shopping venders for replacement units for some of the rooms, and I'm sorry to hear you received one of the few rooms that needs one. I truly hope you'll give us another chance to provide you with an excellent stay experience.   Sincerely, Andre Neuman Assistant General Manager",none,none,none,none,none,none,201,143
none,2 contributions,5.0 of 5 bubbles,Great stay. 3 rooms reserved,"We stayed to attend a funeral, had to reserve 3 rooms. We arrived at 2pm and the clerk was good enough to let us into all the rooms early. The rooms have been updated, very clean and comfortable. They are painting the outside of the hotel, so there is a bit of construction to walk around, but nothing major and it didn't smell like paint, so we were quite pleased. The breakfast consisted of: fruit, boiled eggs, milk/other, egg/sausage sandwiches that could be micro. would have liked a toaster, but that's fine. Also, had little muffins and coffee. For the price, in this area of S.CA, it's well worth it. We would return, for sure.",March 2016,none,none,"Thank you for taking the time to review your recent stay at our hotel. I'm absolutely thrilled to hear you had such an excellent experience with us! We're growing ever closer to finishing up the last few projects, including the repainting, and we look forward to having it all behind us. The new bistro is now complete and will be officially opening this coming Monday, and we look forward to offering our guests an excellent selection for breakfast, lunch and dinner. We appreciate the opportunity to serve you during your time here, and we hope to see you again in the future.  Sincerely, Andre Neuman Assistant General Manager",none,none,none,none,none,none,202,143
2 helpful votes,23 contributions,4.0 of 5 bubbles,California Dreamin,Stayed two nights in this hotel. They were remodeling the breakfast area. The staff went over and above to compensate for the remodeling. This hotel was close to restaurants and the staff was very helpful in giving us directions to the restaurants. The room was excellent. I sat out on the balcony and read a book and it was very peaceful. I highly recommend this hotel.,February 2016,none,none,"Thank you for taking the time to review your stay at our hotel. I'm absolutely thrilled to hear your stay was such a wonderful experience! I'm happy to say our breakfast area remodel is complete, and the new bistro is being officially opened this coming Monday. Thank you so much for allowing us to be a part of your visit to the area, and we hope to see you again soon!  Sincerely, Andre Neuman Assistant General Manager",none,none,none,none,none,none,203,143
7 helpful votes,18 contributions,3.0 of 5 bubbles,Upgrade moving right along.,"Only 8-10 rooms left to upgrade, then the outside. We were a bit concerned until we got to our room. It was like new. Includes a microwave, fridge and coffee pot. Also, free shuttle from airport, but you need to pre-schedule. We got in near midnight and the shuttle was waiting for us.  Very friendly front desk staff on late and morning shifts. The Continental breakfast is one of the victims of the remodeling. None of the ubiquitous waffles found everywhere, but the Jimmy Dean  sausage breakfast sandwich plus fruit, yogurt, etc., did the job.I don't recall the completion date but I believe they are also adding a restaurant, which will be nice.   When the shuttle driver called in sick we driven my the General Manager, a very nice guy, whose name I do not recall.",February 2016,none,none,"Thank you for taking the time to review your stay at out hotel. I'm delighted to hear that overall your stay was a very pleasant experience! Since your stay we have completed most of the work, and at this point are well underway to finishing the repainting of the exterior as well. Our new bistro is opening on a limited scale this weekend and will hit full swing this coming Monday. Our GM, Doug Mills, is a wonderful manager and is always happy to help out our guests. Thank you for allowing us to be a part of your visit to the area, and we hope to see you again soon!  Sincerely, Andre Neuman Assistant General Manager",none,none,none,none,none,none,204,143
93 helpful votes,205 contributions,3.0 of 5 bubbles,Not What I was Expecting from Clarion,"It is hard to accurately rate this hotel, as they are apparently undergoing a remodel of sorts.  It looks like they are trying out paint schemes in the courtyard area; the place otherwise looks like it already has 20 coats of paint. The lobby looks like it recently had been updated, check in was fast and friendly.  The room we were in had also been updated - and perhaps upgraded, with new bathroom flooring and fixtures, and a pleasant feel throughout the room.  Just not a lot of places to sit. The pool area is pleasant, surrounded by tall palms.  The water was nice and clear, but a lot of sand & debris at the bottom of the pool and hot tub.  Not very inviting...it Is February, but it is 80 degrees out today.  The concrete deck surface is worn to the point of being uncomfortable",February 2016,none,none,"Thank you for taking the time to review your stay at our hotel. Since your stay we have very nearly completed the renovations, and will be finishing the work in the very near future. Our breakfast has been moved back into the lobby, and as of this coming Monday will be being served out of our new bistro. A great deal has changed in the last couple months, and I truly hope we'll see you again in the near future!  Sincerely, Andre Neuman Assistant General Manager",none,none,none,none,none,none,205,143
67 helpful votes,183 contributions,1.0 of 5 bubbles,Old and undergoing renovations,"Nothing in advertisement prepared us for the shape this Clarion was in. Couldn't use the heated pool or hot tub due to debris from roof construction. The ""breakfast"" which was set up in a stripped hotel room had no seating. The food was flavourless, kind of like food tastes when you have a bad cold. This place needs help, until then avoid it. The drone of construction equipment during the whole day was annoying & despite complaining about the drunks yelling, arguing & slamming doors until after 1:30am no help from staff. We won't return.",January 2016,none,none,"Thank you for taking the time to review your stay at our hotel. I truly apologize for your stay being anything less than excellent. Since the time of your stay we have completed 99% of all the work and we will have it all finished in the very near future. Our breakfast has since been relocated back into the lobby, and our new bistro is open and ready to serve our guests. I'm very sorry for your previous stay, and I wholeheartedly invite you to return to experience the difference all of our hard work has made since then.  Sincerely, Andre Neuman Assistant General Manager",none,none,none,none,none,none,206,143
7 helpful votes,31 contributions,4.0 of 5 bubbles,Don't always believe all the reviews,After reading some reviews i was very leery about my stay. Upon arrival i was promptly greeted by the desk clerk and she checked me in. We went to out room on the 3rd floor at the rear of the building upon unloading as i knew already about the renovations being done. The workers were there working wasn't to noisy but a little messy as to be expected when you are renovating. As the day/night progressed noted that the Construction workers checked out early and left for the weekend so no weekend noise.Pool/Spa area was clean and spacious. We were here for a Disneyland trip and was pleasantly surprised as the drive is not to far and you are between John Wayne Airport and Disneyland and hotel is very easy to gain freeway access so commute was minimal.So a definite recommend if going,January 2016,none,none,"Thank you for taking the time to review your stay at our hotel. I'm delighted to hear that even with the renovations going at that time your stay was a great experience! We are now in the final phase of the renovations and will have them completed in the very near future. Thank you for making us a part of your visit to the area, and we hope to see you again soon!  Sincerely, Andre Neuman Assistant General Manager",none,none,none,none,none,none,207,143
