Helpful Vote,Contributions,Overall Rating,Summary Heading,Summary,Date of Stay,Room tip,Trip Type,Manager Response,Location Rating,Cleanliness Rating,Service Rating,Value Rating,Rooms Rating,Sleep Quality Rating,Review Number,Index
73 helpful votes,194 contributions,3.0 of 5 bubbles,Decent but not extraordinary.,"The staff was very helpful.  The room was nice and the wifi was good.  The parking lot was a little challenging to work with.  And if you do not go real slow when you exit to the street, you may scrap the front of your car.  The free breakfast consisted only of a bagel, muffin and coffee, tea or juice.  This is my first Choice hotel without a more substantial rial free breakfast.",July 2017,none,none,"Dear Donald, Thank you so much for providing your feedback from your stay. I am pleased to learn that you enjoyed your room and the WiFi, while my staff was able to accommodate and delight you. I do apologize for the inconvenience of our driveway, however, as I do agree that it can be a challenge. We hope to have you return with us once our breakfast room is completed so you may be able to partake in our full breakfast buffet. Thank you again for your time, have a blessed day.  Warm regards,  Scott Young General Manager",none,none,none,none,none,none,110,143
none,1 contribution,5.0 of 5 bubbles,Great serves !!!!!,This hotel is very up to date and serves is great Sandra is one of the front desk lady's and was very helpful on getting me a ride to airport booked and booking a room again. The rooms are very clean and the food at hotel is good also definitely recommend this hotel to people staying in the area,July 2017,none,none,"Thank you so much for your feedback on both your stay and Sandra's service. I am so pleased to hear that you enjoyed your stay and look forward to your hopeful return sometime in the near future. We appreciate you choosing to stay with us, have a blessed day!  Warm regards,  Scott Young General Manager",none,none,none,none,none,none,111,143
6 helpful votes,6 contributions,4.0 of 5 bubbles,A decent option for a work stay,"I stayed in this hotel for 4 days and 5 nights and it was a pleasant, comfortable and quiet experience. The staff are very friendly, mixing the right amount of professionalism with natural good humour. Rooms are sizeable, comfortable and clean. My only slight quibble would be the sound of the (necessary) air conditioning which was akin to a WW2 bomber in terms of noise. Food and service was overall excellent. I would recommend it as a decent option for a work stay.",July 2017,none,none,"Thank you so much for your feedback from your stay, we are so pleased to hear that you enjoyed your stay, and I have addressed your concerns with the air conditioning with my maintenance team. We will be looking to replace. Thank you again for your time, and we look forward to your return on your next business trip. Have a blessed day!  Warm regards,  Scott Young General Manager",none,none,none,none,none,none,112,143
none,3 contributions,3.0 of 5 bubbles,"very friendly, helpful front desk and food service staff","First time to stay here.  Advertisement notes restaurant on site - not actually a restaurant, and was scheduled to close soon.  Front desk staff helpful to get me checked in in time to get food order in and the food service staff were kind enough to deliver to my room so I could get my things up to the to the room and get settled.  Flatbread was enough for an army.  Room decor needs some updating and was disturbed by neighbors very loud shower water noise at midnight",July 2017,none,none,"Dear Lorraine, Thank you so much for choosing to stay at our facility, we are glad you chose us. We appreciate your kind words regarding our staff members and I will be sure to inform them of your feedback. I am sorry to hear about your neighbors and hope this does not deter you from choosing to stay with us in the future. We would love another opportunity to serve you on your next visit to the Orange County area. Please do not hesitate to contact us directly, have a blessed day!  Warm regards,  Scott Young General Manager",none,none,none,none,none,none,113,143
none,1 contribution,5.0 of 5 bubbles,Helpful Service,"I can't recommend this hotel enough.  I travel quite a bit for business and have never met a front desk that works so hard to meet the needs of guests.  I had some fairly difficult problems with my check in due to some bank issues, and Sandra was there to work with me through the whole thing until I was eventually able to get set up with a wonderful room for the week.",July 2017,none,none,"Thank you so much for taking the time to send us your feedback from your experience with us. I was so delighted to share your kind words with Sandra and am so pleased to hear that she was able to accommodate you. We cannot thank you enough for your time and business, and look forward to your return on your next trip to the Orange County area. Please do not hesitate to contact us for any assistance.  Warm regards,  Scott Young General Manager",none,none,none,none,none,none,114,143
26 helpful votes,65 contributions,1.0 of 5 bubbles,DONT stay here....mgmt is horrible and corporate isnt much better!,"I booked a room here (used to be great when it was Comfort Suites) for a couple of nights on their Choice hotels website...GUARANTEEING the lowest price.....well I found a lower price on a different website..when called out on it.,..they lied and lied....and delayed the refund to my credit card for over a week until I threatened legal action..  There are plenty of great hotels on that street ..near the airport and all priced about the same. DONT STAY AT THIS DUMP.",June 2017,none,none,"Dear Jim K,  Thank you again for your continued patience while we were figuring out and resolving this matter with both your bank and our merchant processing. We truly value your understanding and as frustrating as this event must have been, our hope is that this does not deter you from choosing to stay with Choice Hotels in the future. We hope to be of service to you in the future, have a blessed day.  Warm regards,  Scott Young General Manager",none,none,none,none,none,none,115,143
none,1 contribution,5.0 of 5 bubbles,Monicaaaaaa,"Ranae always makes me and anyone I'm with feel so welcomed. Always smiling always pleasant. Always a quick check in, always a good time.                           It's dope that they have a fridge inside the room. Good people good time nahmsayin 🤘🏻",June 2017,none,none,"Thank you so much for your kind words, I am delighted to share them with Ranee and the rest of the team. We are pleased to hear that you enjoyed your stay, and cannot wait for you to return on your next visit. Have a blessed day!  Warm regards,  Scott Young General Manager",none,none,none,none,none,none,116,143
none,5 contributions,5.0 of 5 bubbles,My experience,"I've stayed at many hotels/suites before due to work & vacations. Clarion Inn & suites is my place to go when in the area. I love the atmosphere this workplace offers. Everyone is so helpful and nice, Sandra at the front desk is awesome. I appreciate her assistance, not everyone has the power to change a bad day to a good day but she definitely has! Love love love! & the food is amazing !!",June 2017,none,none,"Dear Aleessiah,  Thank you so much for your kind words, I am so pleased to hear that you regularly enjoy your stay with us and look forward to celebrating your kind words with Sandra and the team. We look cannot wait to see you return, and I would love an opportunity to personally meet you as well. Please do not hesitate to ask for me directly. Have a blessed day!  Warm regards,  Scott Young General Manager",none,none,none,none,none,none,117,143
none,1 contribution,5.0 of 5 bubbles,Great Place - Great Service!,I stay here all of the time.  The rooms are clean and well taken care of.  The front desk staff is always attentive and Sandra always goes the extra mile to make sure everything is taken care of.  Thank you Clarion Suites.,May 2017,none,none,"Thank you so much for providing your feedback, as well as your continued business. We appreciate you choosing to regularly stay with us, as we would love to make you feel like this is your home away from home. Please do not hesitate to ask for me directly on your next visit so I may personally greet you. Have a blessed day.  Warm regards,  Scott Young General Manager",none,none,none,none,none,none,118,143
none,1 contribution,4.0 of 5 bubbles,Thank you Sandra,"I stayed at this Clarion Inn 5 to 6 times over a 4 months period. During my stay I was welcomed by Sandra at the reception desk. She recognized that I was coming there after a long flight from NY/NJ area and gave me a quiet room for my stay. Her friendly response and their clean and quiet rooms were the main reason I was encouraged to stay again at the same hotel even if there are several other hotels on the same street there.  When I visited the next time Sandra immediately recognized me and welcome me with my name! After that, every time I visited Orange Country I stayed there.    I travel nearly 300+ days/year and it always great to meet nice smiling individuals after long hard working day/travel. Thank you Sandra for welcoming me with smile and offering to help every time I",April 2017,none,none,"Thank you so much for your kind words. Sandra will be so pleased to hear that her level of service was appreciated. Our goal is to exceed your expectations on every visit, and I will be utilizing your feedback to provide excellent service in every aspect. Hopefully our entire staff can memorize your face and greet you by name on your next visit. Thank you again for your time and sending us your feedback, we look forward to your return.  Warm regards,  Scott Young General Manager",none,none,none,none,none,none,119,143
none,1 contribution,5.0 of 5 bubbles,Thank you everyone there!,Jessica and Heriberto were great.  Service and room accomodations were wonderful.   Keep up the great work. I will be sure to book whenever I cone back to Orange County!  Thanks for a wonderful and comfortable stay guys!!!,May 2017,none,none,"Thank you for your kind words, we truly appreciate feedback as it allows us to capitalize on mistakes and celebrate our accomplishments. I will be sure to share your words with Jessica and Heriberto, and we look forward to another opportunity to provide you with top-notch service. Please do not hesitate to contact us directly. Have a blessed day!  Warm regards,  Scott Young General Manager",none,none,none,none,none,none,120,143
1 helpful vote,2 contributions,5.0 of 5 bubbles,NICE & CONVENIENT,"Loved this hotel, we were only in town for 1 night but it was perfect! Close to the OC Observatory, room was very clean and the beds were AMAZING, no complaints. Breakfast provided which was also very good. Will definitely be back.",April 2017,none,none,"Thank you for taking the time to provide us your feedback. We strive to provide excellent service through every aspect, and feedback such as yours allows us to better understand and track our progress. My team and I are excited and hopeful for your return to the Orange County area, and I would love to personally greet you, should you choose to stay with us in the future. Please do not hesitate to contact us for any assistance, have a blessed day!  Warm regards,  Scott Young General Manager",none,none,none,none,none,none,121,143
none,1 contribution,5.0 of 5 bubbles,Great place to stay,"Very clean, the staff was friendly.  Good location and the rooms were very spacious.   Jessica and Sandra were very helpful in our needs.  the hot tub and pool was very clean.  There was more than enough parking.  Would stay there again.",May 2017,none,none,"Thank you for providing your feedback from your recent stay. Feedback such as yours allows us to both celebrate our accomplishments and improve where needed. Both Sandra and Jessica will be so pleased to hear of your kind words, and we look forward to another opportunity to serve you on your next trip to Orange County. Have a blessed day!  Warm regards,  Scott Young General Manager",none,none,none,none,none,none,122,143
none,1 contribution,4.0 of 5 bubbles,Front desk staff makes you feel at home,I travel to Orange County for work almost once a month. Sandra at the front desk greats me with a smile and is always helpful and welcoming. It makes it an easy decision for me to stay here every time I am in town.,May 2017,none,none,"Thank you for choosing our facility as your hotel of choice on your trips to Orange County. We are so pleased to accommodate you, and I will be sure to celebrate your kind words with Sandra. We look forward to continuing to serve you in the future, please ask for me on your next trip so I may personally greet you. Have a blessed day!  Warm regards,  Scott Young General Manager",none,none,none,none,none,none,123,143
none,1 contribution,5.0 of 5 bubbles,Great value & staff is wonderful,"Convenient location to John Wayne airport, Costa Mesa, OC & Anaheim. Rooms are clean and pool gathering areas very nice. I stay here a lot and the staff is very attentive to guest's needs. Rane, Sandra, Jessica, Joe, Jesus & George have been wonderful to myself and other guests. All very helpful. New management has this property headed in the right direction.",May 2017,none,none,"Thank you so much for taking time to provide us with your feedback. I am so pleased to hear that you enjoy your stay with us on a regular basis, and the entire team will be pleased to learn of your kind words. We look forward to your return, and I would love to personally meet you during your next stay. Please do not hesitate to contact me directly.  Warm regards,  Scott Young General Manager",none,none,none,none,none,none,124,143
1 helpful vote,1 contribution,5.0 of 5 bubbles,Great place,I've stayed here multiple times and always come back thanks to Sandra. She makes checking in so much easy and has an amazing attitude. I've stayed loyal because of her.  When you book call and ask for her trust me she's the best. New management has really picked this place up as well!,May 2017,none,none,none,none,none,none,none,none,none,125,143
none,1 contribution,5.0 of 5 bubbles,Best in town,"Sandra makes this the best hotel ever. Platinum member because if her!! Recommend this hotel above all in this area. New management has really picked up the place as well. Safer parking, good breakfast, and best of all - always clean rooms!",May 2017,none,none,"Thank you so much for taking the time to provide us with your feedback. Feedback such as yours allows us to both improve where needed and celebrate our accomplishments, which I will be celebrating such accomplishments with Sandra. I am so pleased to hear that you continue to enjoy your stay and we appreciate you continuing to stay with us as we strive to better our service. I hope to be able to meet you in person on your next stay with us, please do not hesitate to ask for me. Have a blessed day.  Warm regards,  Scott Young General Manager",none,none,none,none,none,none,126,143
42 helpful votes,57 contributions,4.0 of 5 bubbles,"Great place, comfortable stay!","Fast and really easy check in. Decent size room very clean. Clean bathroom as well. Nice pool area. Good wifi and phone service. Local and close to everything but you need a car to get around. Friendly helpful staff. Good bedding super comfortable with clean sheets. Great shower pressure and towel quality,  also very clean. Good house keeping. Plenty of lighting in room. Quiet environment.",May 2017,none,none,"Thank you so much for providing us your feedback. I am so pleased to hear that you enjoyed your stay, and will be celebrating your kind words with my entire staff. We hope to be of service to you again in the future, and will await your return. Have a blessed day.  Warm regards,  Scott Young General Manager",none,none,none,none,none,none,127,143
none,2 contributions,5.0 of 5 bubbles,Great for business,Sandra at the front desk is wonderful. She is courteous and always greet you with a smile.  Great location close to businesses in OC. Room is great with convenient amenities.  They have hotel shuttle too. Recommended fit business traveler.,May 2017,none,none,"Dear Rich,   Thank you for taking the time to fill out our online survey with such positive feedback!   I have shared your comments with Sandra, and she joins me in thanking you for your kind words.  We take pride in our hotel and the services we provide and we are so glad you enjoyed your stay.  We are looking forward to providing you the same pleasant accommodations and service the next time you are in town.  Kind regards,  Scott Young",none,none,none,none,none,none,128,143
none,1 contribution,5.0 of 5 bubbles,I love this place,Thanks to the front desk they made me feel at home Renee thanks for making us feel apart of hotel i will stay again soon for a trip to disneyland we went to roscoes and to the heritage museum it was great so much interesting things to see thanks of see you soon.,May 2017,none,none,"Dear Alesha,  Thank you for taking the time to share your experience with us!  I appreciate all of the positive feedback you have shared with us. I have shared your feedback with Ranee, and she joins me in thanking you for your kind words. It is such a pleasure to hear that your recent stay with us was satisfactory.  Thank you for your business and we hope to see you soon!  Scott Young General Manager Clarion Inn & Suites Orange County John Wayne Airport 714.966.5200",none,none,none,none,none,none,129,143
none,1 contribution,5.0 of 5 bubbles,Ranee & Jessica are the best!!,Ranee & Jessica make you feel so welcomed and will go out of their way for you. They treat you like a family member or friend. Two great people. The hotel is clean and well kept. We have been coming here for the past few months for business trips.All our employees prefer to stay at the Clarion compared to many other hotels. Thanks Clarion for taking care of our team!!,April 2017,none,none,none,none,none,none,none,none,none,130,143
9 helpful votes,25 contributions,4.0 of 5 bubbles,Extremely friendly and helpful staff,"From check-in to check-out, we found the staff extremely friendly.  Renaa in reception was very feiendly and helpful.  She allowed us to stay until 2pm because our flight wasn't scheduled to leave out of John Wayne Airport until 4:30pm.  Ginger was running the mini-cafe, and she was so nice and friendly. The hotel was very quiet, and our room was very clean and comfortable.",April 2017,none,none,"Thank you for your delightful feedback from your recent stay. We truly value your input, and I have shared your feedback with my entire team, including Ranee and Ginger. We hope to be able to be of service to you in the future, should your travel needs ever bring you back to the Orange County area. Have a blessed day.  Warm regards,  Scott Young General Manager",none,none,none,none,none,none,131,143
28 helpful votes,42 contributions,1.0 of 5 bubbles,Daughter wedding,Service is non existent. Yesterday told maids 3 times to make the room yet no service when we returned. Mattress is worn out extremely uncomfortable crunched  when sitting felt the springs. Don't stay here!,April 2017,none,none,"Thank you so much for your feedback from your recent stay. Feedback such as yours allows us to improve in areas that need it, and rest assured I have addressed your concerns with my housekeeping team to ensure this does not happen again. I hope this does not deter you from choosing to stay with us again in the future, we would love another opportunity to serve you. Should you choose to return to the Orange County area, please do not hesitate to contact me directly. Thank you again for your time.  Warm regards,  Scott Young General Manager",none,none,none,none,none,none,132,143
none,1 contribution,5.0 of 5 bubbles,Quiet and friendly,"3nights of good sleep...Sandra and her colleagues were very helpful with directions and suggestions.  Location was excellent for attending WWWY festival at the Observatory.  If you like shopping, the South Coast Plaza is close by.",April 2017,none,none,"Hello,  Thank you for taking the time to fill out our online survey with such positive feedback!  I have shared your comments with Sandra and my team, and they join me in thanking you for your kind words.  We take pride in our hotel and the services we provide and we are so glad you enjoyed your stay.  We are looking forward to providing you the same pleasant accommodations and service the next time you are in town.  Kind regards,  Scott Young General Manager Clarion Inn & Suites John Wayne Airport 714-966-5200",none,none,none,none,none,none,133,143
3 helpful votes,7 contributions,4.0 of 5 bubbles,Great stay!,"Lovely third floor room overlooking the courtyard w pool. Room was comfy and clean. Location was easy to get to and convenient to area attractions. General manager visited w guests in the breakfast area, offering personal assistance w any problems/concerns w their stay. Would def stay here again.",March 2017,none,none,"Thank you so much for taking the time to send us your feedback. We are so pleased to hear that you enjoyed your stay and are hopeful for your return to our property sometime in the near future. Please do not hesitate to contact me directly for any assistance, we appreciate your business.  Warm regards,  Scott Young General Manager",none,none,none,none,none,none,134,143
128 helpful votes,389 contributions,1.0 of 5 bubbles,Scared!!,"We stayed at the John Wayne location prior to flying out the next morning. We had a 3:30AM wake up call to get ready. I got my shower and my husband was getting his. While I was getting ready our door opened. I kicked the door shut and ran to the other side of the room. Thank goodness I had the upper lock on the door or whoever it was outside would have gotten into our room.  I looked out of the door’s peep hole to see a man standing there. We called the front desk and after apologizing over and over was told Security has taken care of the matter. We saw the Security guard checking doors as we were leaving and asked what had happened.  She said someone was given the wrong room. When checking out the front desk clerk, and apologizing, said someone had checked in and instead of",March 2017,none,none,"Thank you so much for providing your feedback from your recent stay. I am so sorry to hear that you had experienced this sort of event during your stay with us. Please know that we take these matters very seriously, and this has been immediately addressed with my entire staff, and best practices and preventative measures have been put in play to ensure this does not happen again. I am pleased that you and I were able to briefly discuss last week what had occurred, and have addressed both your concerns and resolution with my corporate offices for you. I hope to be of service to you in the near future, please do not hesitate to contact me directly for any assistance.   Warm regards,  Scott Young General Manager",none,none,none,none,none,none,135,143
1 helpful vote,10 contributions,5.0 of 5 bubbles,Staff was helpful and kind,"I got to the hotel to let them know I'd be checking in late. The hotel had no information on my reservation, although I had email confirmation from Booking.com.  Sandra, at the desk, gave me the phone number to contact Booking.com.  After waiting for approx. 45 minutes, a live person answered, acknowledged my reservation, and said he would inform Clarion Inn right away.  9 hours later, the hotel still had not heard from Booking.com about my reservation.  In the meantime, Sandra used very kind judgment and professionalism - she held a room for me.  She went the extra mile to contact the next person at the desk, Jessica, telling her my situation.  When I arrived late at night, hoping that there'd be a room for me, Jessica greeted me, fully knowing the situation, gave me my room",March 2017,none,none,"Thank you so much for your kind words and feedback from your recent stay. I am so pleased to hear that my team was able to meet your expectations, and have celebrated your wonderful words with both Sandra and Jessica. We value your input as it allows us to know areas of improvement, but also areas that we are excelling in. We hope to be of service to you in the future, should your travel needs bring you back to the Orange County area, and I would love to meet you in person on your next visit. Please do not hesitate to contact us directly for any assistance.  Warm regards,  Scott Young General Manager",none,none,none,none,none,none,136,143
none,1 contribution,5.0 of 5 bubbles,Pan am BJJ tournament,Forgot to request proper bed option when hotel wad booked. Sandra went above and beyond to still find us proper bed accommodations at check in. Even checked us in super early so we could get ready for the tournament.,March 2017,none,none,"Thank you so much for taking the time to send us your feedback. I am so pleased to hear that Sandra was able to accommodate your needs while staying with us. I will be sure to share your kind words with Sandra, and we hope you choose to stay with us upon your next trip to the Orange County area.   Warm regards,  Scott Young General Manager",none,none,none,none,none,none,137,143
