Helpful Vote,Contributions,Overall Rating,Summary Heading,Summary,Date of Stay,Room tip,Trip Type,Manager Response,Location Rating,Cleanliness Rating,Service Rating,Value Rating,Rooms Rating,Sleep Quality Rating,Review Number,Index
18 helpful votes,6 contributions,2.0 of 5 bubbles,Rude desk clerk,"We stayed at this Comfort Inn March 3 and we arrived at the John Wayne Airport at 10:30 pm and were told there was no driver for the shuttle.  My husband had called prior to booking the hotel to ask about a shuttle but was not told the shuttle stopped at 9:30. Lyft was $32.  Room was very clean.  Upon check out, we were asked to surrender the room key.  We travel at least once a month and never surrender the card key, we destroy them for our own cyber security.  The woman at the desk was so rude, even called me a B——. She finally ran from the desk and had another employee speak with us. We will not be returning",March 2023,Choose another place to stay,none,none,none,none,none,none,none,none,1,143
2 helpful votes,4 contributions,5.0 of 5 bubbles,Awesome place to stay - Comfort Inn,"The service was amazing. The friendliest staff I have ever encountered.  Teresa and Anna (breakfast crew) were super excellent. Accommodating us at every turn. Front desk staff were always friendly and extremely helpful with anything we asked about. Oh, they even give complimentary popcorn 🍿 yummy. The cleaning staff were so nice and efficient. Can I take them home with me? Rooms were very clean, hot tub was toasty warm, oh snd the breakfasts were excellent.  Lots to choose from - even banana nut waffles. I can say a lot more about this wonderful place but you get the picture. It's definitely worth staying here.",November 2022,none,Traveled as a couple,none,none,none,none,none,none,none,2,143
none,1 contribution,5.0 of 5 bubbles,Incredible Stay,"We stayed here for my friends graduation ceremony for 4 nights, a long weekend getaway. They were incredible! Sandra checked us in and found out we were celebrating. The next day when we arrived back to our hotel there was a full complimentary bottle of champagne, two glasses, and a certificate celebrating my friend's achievement.   The room was very clean, the complementary continental breakfast tasty, a fun weekend happy hour with free appetizers, and customer service top-notch. Highly recommend!",February 2023,none,Traveled with friends,none,none,none,none,none,none,none,3,143
none,none,1.0 of 5 bubbles,worst experience ever,This was probably the worst hotel we have ever had they passed our room multiple times to clean we had horrible service the Wi-Fi was horrible and didn't work. we went to the pool and the pool was dirty and no one cleaned it the bathroom door was broke and the paint came off and was all on the floor the tv did not work and the guide was broke.,February 2023,none,none,none,2.0 of 5 bubbles,none,none,none,none,none,4,143
6 helpful votes,4 contributions,1.0 of 5 bubbles,Worst stay we’ve ever had,"The “free” airport shuttle runs 8am-1pm which is useless since check in is at 3pm.  This isn’t disclosed until you call and they tell you they can’t help you and don’t want to.  The shuttle was the main reason we booked this place.  Front desk woman Sandra was very rude and told us we should have called 2-3 days before to see if the shuttle driver wanted to work.  We spent $300 more than we budgeted on taxis and a rental car to and from the airport.  The staff is so rude and unhelpful.  We had a toilet that wouldn’t flush and the front desk said they couldn’t help, they would move us.  We booked multiple rooms for family, so we didn’t want to move.  Around 10pm a man knocked and handed me a plunger and told me to plunge it.  There was a man in the parking lot trying to break",January 2023,none,none,none,none,none,none,none,none,none,5,143
1 helpful vote,35 contributions,1.0 of 5 bubbles,Incompetent staff,"I booked a stay for my senior parents from Dec 19 - Jan 9 via Priceline. According to Priceline, I needed to book only up until the Jan 9 to get a discounted rate. Since my parents were staying until Jan 12 in the US, I booked a second reservation from Jan 9 - 12.  When I spoke to the hotel staff (a middle-aged blonde lady) the week before Jan 9 to confirm my reservation and to pay for early check-in, I was told that on the 9th, all my parents needed to do was come to their office to switch their keys; they wouldn't have to check-out (only to check back in) since I'm also paying $50 for early check-in.  However, on Jan 8, I was told by Betsy (unapologetically and arrogantly) that our second reservation was not possible because California law only allowed a maximum of 21 days.",December 2022,none,none,none,none,none,none,none,none,none,6,143
none,1 contribution,3.0 of 5 bubbles,Not that close to airport!,"This motel calls itself ""Orange County John Wayne Airport"" but it really isn't.  It's further inland than the airport.  If you need to be close to John Wayne, this may not be your motel.  It is clean, but showing signs of wear. Breakfast is a ""grab and go"" unlike other Comfort Inns that have a full hot breakfast.  The rooms are all exterior and the upstairs halls have ceramic tiles.  Luggage or housekeeping carts sound like thundering elephants as they are pushed/dragged across the tiles.  I wanted to be closer to the airport and would not stay here again.",December 2022,Similar lodging much closer to John Wayne Airport.,Traveled as a couple,none,1.0 of 5 bubbles,none,none,none,none,none,7,143
none,none,5.0 of 5 bubbles,Decent hotel,"Being on a budget, I looked for the lesser expensive hotels. The Comfort Inn was very nice. Very clean and the staff were very friendly. The breakfast buffet was very nice. I highly recommend. Did not try the pool or hot tub, too cold outside.",November 2022,none,none,none,none,none,none,none,none,none,8,143
56 helpful votes,90 contributions,5.0 of 5 bubbles,Best Ever stay,"The Hotel was very clean the staff were above and beyond helpful kind courteous,  the facility was great had everything there including the Best breakfast I've  ever had at a hotel. Threasa  and Anna out did themselves daily as it was alway hot tidy clean friendly and helpful. Our Maid was outstanding and very good at keeping room neat and tidy front desk very helpful as well in directions and info 5 star plus for this place I will stay here again",October 2022,Get room close to pool and lobby close to everything,Traveled on business,none,5.0 of 5 bubbles,none,none,none,none,none,9,143
none,1 contribution,5.0 of 5 bubbles,Halloweekend Visit,"Sandra the front desk host was amazing and helpful! She helped my girlfriend and I check in quickly and gave us all the information we needed, and even helped us find things we needed for our dinner later that night. She definitely made our trip a lot better! The room, pool, and area were also nice and comfortable.",October 2022,none,Traveled as a couple,none,none,none,none,none,none,none,10,143
none,1 contribution,5.0 of 5 bubbles,Warm hospitality and such a homely feeling.,"I reached the hotel around midnight, was received by the beautiful & humble “Miss Sandra” in the lobby, who helped me do the check-in very smoothly and also guided me to my room and not just was she a great help, she also told me about the rules and regulations of the place and very humbly attended to my needs whenever I was in any need. I found my room clean and well maintained so it was very satisfying and relaxing after a long day of exhaustion to just fall there, but after a while i felt the need of some snack and water, So I went to the lobby and there was Miss Sandra who attended again to my needs. Although it was 3 o’clock in the night but the staff was yet very attentive and helpful towards me. Overall it was a great stay.. the place and the staff both were beyond my",October 2022,none,none,none,none,none,none,none,none,none,11,143
none,none,5.0 of 5 bubbles,Relaxation,"I enjoyed my stay at the Comfort Suites. The rooms were very clean, the beds were comfortable and the free breakfast was hot and good...The staff is very friendly and willing to go the extra mile.Thanks Sandra for making me feel welcome and special! .The security is diligent in doing their job..and are also willing to assist you with needs. Sandra checked me in and was very informative and friendly. Their family of staff members are altogether welcoming and possess extraordinary customer service ..",October 2022,none,none,"Dear Valued Guest, Thank you so much for taking the time to share your feedback on your recent stay. We are all so happy to hear you had enjoyed your stay, and everyone had taken such great care of you. we all work hard to be sure our guest are well taken care of during their stay.  It was a pleasure hosting you, and we hope to see you again on your next visit to the Santa Ana area.  Best Regards, Sandy Warner General Manager",none,none,none,none,none,none,12,143
4 helpful votes,9 contributions,5.0 of 5 bubbles,"Friendly, Professional Staff","We stayed at this hotel while my son was hospitalized at Hoag Hospital. The hotel was easily accessible from Hw 55. This is an older hotel, but the rooms were nice and clean. The price was extremely reasonable.  The staff was amicable, particularly the breakfast staff, maids, and front desk. They have a nice pool and spa and an adequate gym. They also have an airport shuttle service and free parking. The property is safe; they gave security and surveillance cameras. It's close to restaurants.  I recommend this hotel.",September 2022,none,none,"Dear Valued Guest, Thank you for taking the time to leave your feedback. I was happy to hear that you had time to stop in and to enjoy the breakfast, and had enjoyed your stay with us on your recent stay.   Again we all thank you for your feedback, and we hope you will chose to stay with us again on your next visit to the Santa Ana area",none,none,none,none,none,none,13,143
none,1 contribution,5.0 of 5 bubbles,quiet Time for the both of us,We’ve actually stayed here three or four times yes it’s been four times every time my children have a party at the house we go and stay at the comfort suites it’s clean it’s quiet sometimes there’s a couple issues but all in all it’s a great place to stay breakfast is really good the girls that work in the front office have great attitudes even though some people give them a really hard time they maintain themselves very professional my husbandAnd I just want to thank you so much sincerely Laura Alverez,July 2022,none,none,none,none,none,none,none,none,none,14,143
2 helpful votes,12 contributions,1.0 of 5 bubbles,Front desk Betty is rude and charges fraudulent late fees!,"I was charged a $100 late check out fee when I did not even check out late! Beware of the fraudulent charges added for no reason!! Betty at the front desk is the rudest person that makes the company look bad!! I called from the room to ask why the were calling me at 10am and she said, “We did not call you!” I told her that why are they calling me at 10am when checkout is not till later and she said check out is at 12:30 and hung up on me. I called back and I told I asked why she hung up on me if I was asking her a question and her answer was that because she had answered my question and then she hung up.  I left on time and when I leave the property we receive an alert for a $100 late charge fee. This extremely disappointing and even though I do business in the area my",April 2022,none,none,none,none,none,none,none,none,none,15,143
none,1 contribution,5.0 of 5 bubbles,Good services,"I just want to say thank to Priscilla the head of CLC, and vero they was really nice at the reception. Both of them need a raise I recommend Comfort Inn It's a very quiet place and the food is very good",April 2022,none,none,none,none,none,none,none,none,none,16,143
7 helpful votes,35 contributions,2.0 of 5 bubbles,Comfort in the Hood,"We stay at comfort inns all over the country and with the exception of this hotel and one other 20mi. from Jack Frost, in 15 years, we have experienced a consistently dependable choice hotel product-Clean, welcoming and safe.   From the first moments in the room this march, we smelled a putrid urine smell from the A/C and the furnishings were quite dated-I had to switch rooms.   The gap under the door is alarming. I didnt loke that at all and stuffed a towel there.  As this was a working trip, I relied on the internet to get a little work done. The internet is nonexistent. They provide a username and password but it is an unsecured network and you never have to enter it-so why bother? The internet is terribly weak.  The TV is another excercise in frustration. The regular",March 2022,none,none,none,none,none,none,none,none,none,17,143
1 helpful vote,4 contributions,2.0 of 5 bubbles,Nice people! HORRIBLE internet. Iffy breakfast,"We were going to be here for three days just for sleeping while we were out and about doing other things. Unfortunately I got covid (not here, before I got here). So I'm staying another six days. Fortunately the people here have been WONDEFUL!  But they advertise free internet but that's FALSE advertising. Many, many phone calls over three days I was able to get sufficient for email (my IP address was input to their system so that the dozens or hundreds of times each day that I'm disconnected I don't need to login again). I spent hours on the phone including with senior engineers only to realize the property doesn't pay enough for more than one person (okay, don't know how many) to get access at once. Zoom calls failed spectacularly! I have references.   The first two mornings",March 2022,none,none,none,none,none,none,none,none,none,18,143
2 helpful votes,1 contribution,1.0 of 5 bubbles,WARNING: DO NOT STAY HERE,"Keeping this short. Hotel does not have enough trained staff to keep you and your property safe. My room was broken into and I lost a bunch or my property. Staff were not helpful and the GM refused to come back to the hotel after hours to address the break-in. Homeless people were also free to roam around the premises, and tried to break into my room in the middle of the night. The hotel would only refund me the 1 night I got my stuff stolen and not the other night because “nothing bad happened”. These people do not care about you and your personal safety. I also got bed bugs. You have been warned.",July 2021,none,none,none,none,none,none,none,none,none,19,143
7 helpful votes,2 contributions,1.0 of 5 bubbles,Thieves!!!,Beware!!! This hotel tried to steal my purse and phone! Had to threaten to call police to get my property back. Worst hotel experience of my life. Stay at your own risk and double check everything or they will rip you off.,March 2021,none,none,none,none,none,none,none,none,none,20,143
2 helpful votes,1 contribution,5.0 of 5 bubbles,Heriberto was amazing!,Heriberto went out of his way to make this the best stay ever! Will only ever come back if he’s here. An asset to the company. He helped me and my fiancée get a room when they didn’t accept his card and was super generous and nice the whole time! Thank you!,September 2020,none,none,"Dear Lmske177,  Thank you for choosing the Comfort Inn & Suites as a choice of destination on your recent visit to Santa Ana. We take pride in our hotel and the services we provide, and we are delighted to hear Heriberto exceeded your expectations. We look forward to welcoming you back to our facility on your next visit to town.",none,none,none,none,none,none,21,143
188 helpful votes,831 contributions,4.0 of 5 bubbles,Great value if you're using Orange County / John Wayne Airport,"Just north of Santa Ana Airport (SNA), just off at the Dyer Road exit of Highway 55, is a road named ‟Hotel Terrace.” No surprise – there are six hotels along this road, all of them part of major chains. Again no surprise – as they are all close to an airport, thus catering to people who only need a roof over their heads just before or just after a flight – their emphasis will be on efficiency & value over warmth & charm. Furthermore, since the business model of Comfort Inns continues to be providing value for your stay, you'll get value instead of warmth.  My room had full bath, AC, phone, coffee maker, fridge, microwave, hair dryer, iron & board, and TV with 28 channels. It was clean, quiet, and well-maintained. The staff were polite and professional. Free amenities included",July 2020,none,none,none,none,none,none,none,none,none,22,143
15 helpful votes,17 contributions,5.0 of 5 bubbles,AMAZING HOTEL with OUTSTANDING STAFF,"Jessica is GREAT! Jessica always has a smile to greet you and is on top of everything no matter how busy she is you as a guest never feel ignored. She has OUTSTANDING people skills and goes AVOVE & BEYOND what is expected of her to assure all her guests are taken care of. THANK YOU  ALSO, Scott the manager is friendly and makes sure all is up to par with his property. He also greets all with a smile.    WE THANK YOU SOOO MUCH!!!  Sincerly, Roberto & Jennifer Hernandez RM #122",April 2020,none,none,none,none,none,none,none,none,none,23,143
64 helpful votes,36 contributions,5.0 of 5 bubbles,"Reasonable hotel, great customer service","I thoroughly enjoyed my two-night stay at this property.  Everybody was so friendly and genuine.  They deserve 5 stars for how they care for their property and their customers.  I interacted with a couple front desk staff and breakfast room staff, they were all very nice and sincere.  I booked this hotel in the last minute and did not expect too much.  I was pleasantly surprised. The hotel is not new but is well-maintained and clean.  My room was clean and quiet.  The breakfast was good.  The staff in the breakfast room greeted me daily with happy smile on their face.  I appreciated having free coffee and quality tea in the lobby area, a nice gesture for tired travelers.  The location is near freeways and some shopping areas are within short driving distance.",February 2020,none,none,"Dear HappyWife, Thank you so much for taking the time to send us your delightful feedback. I am so pleased to hear you enjoyed your experience with us and made sure that I celebrated your kind words with my entire team. We hope to be of service to you again in the near future and hope to have you back sometime soon. Have a blessed day!  Warm regards,  Scott Young General Manager",none,none,none,none,none,none,24,143
2 helpful votes,1 contribution,5.0 of 5 bubbles,Great service,A lady by the name of Adilene working the front desk was very nice with a beautiful smile and got me my room within minutes. Booking my room was last minute so I did not carry my phone charger with me tonight so I called the front desk to ask if they carry chargers and Adilene happened to have her personal charger that was compatible with my phone. She did not hesitate to let me borrow it for an hour. She definitely went the extra mile on making sure her guests were happy. Thank you for a good experience while staying here on short notice Adilene. I will most likely return here whenever I’m in town for business.,February 2020,none,none,"Dear Alberttorres93, Thank you so much for taking the time to send us your feedback on your recent stay with us. I am so pleased to hear of your experience with Adilene during your stay and made sure to celebrate your kind words with her. We are here for you, and we hope to have you back sometime soon so we may be of service to you again. Have a blessed day.  Warm regards,  Scott Young General Manager",none,none,none,none,none,none,25,143
2 helpful votes,1 contribution,4.0 of 5 bubbles,President Day weekend,"Came to visit with family, our stay was great. The hot tub and fire pit was the perfect way to end our evenings. We have stayed here before and will definitely be coming back for another visit. The room was quite and clean. Staff was friendly and helpful.",February 2020,none,none,"Dear JennymL9289DE, Thank you for taking the time to send us your feedback on your stay with us. We are pleased you were able to take advantage of our hot tub and fire pit while staying with us and hope to have you back sometime soon to experience them again. Have a blessed day and stay safe!  Warm regards,  Scott Young General Manager",none,none,none,none,none,none,26,143
2 helpful votes,1 contribution,4.0 of 5 bubbles,Nice place to stay,Reasonable rates. Convenient to airport with shuttle.  Free parking if you are driving. Convenient to freeway and local sites.   Friendly and attentive. staff. Room is clean and the bed is comfortable.  I would definitely stay again.,January 2020,none,none,"Dear Born_n_Bama, Thank you for taking the time to send us your feedback, as well as choosing to stay with us. We are pleased you found us convenient to your traveling needs and hope to be of service to you again in the near future. Have a blessed day.  Warm regards,  Scott Young General Manager",none,none,none,none,none,none,27,143
10 helpful votes,5 contributions,5.0 of 5 bubbles,Great stay w/ perks!,"The airport shuttle, breakfast buffet and fire pit are just the beginning of the great amenities this place offers. Add to that a very reasonable rate and clean/comfortable rooms and it’s a winner every time!",December 2019,none,none,none,none,none,none,none,none,none,28,143
2 helpful votes,2 contributions,4.0 of 5 bubbles,Great stay,Best Comfort Inn I’ve been to in a awhile! The selections at breakfast were absolutely great!! Staff has been very helpful and nice. Rooms are clean cleaning staff are nice as well and make sure you have everything you need! I would recommend this hotel and pricing isn't bad at all!,December 2019,none,none,"Dear Kaylynsimons, Thank you so much for taking the time to send us your thoughts. We are so pleased you enjoyed your stay with us, my staff works very hard to earn our guest's complete satisfaction, and I will be sure to celebrate your kind words with them. We hope to see you back sometime soon, have a blessed day!  Warm regards,  Scott Young General Manager",none,none,none,none,none,none,29,143
82 helpful votes,54 contributions,4.0 of 5 bubbles,Good basic airport hotel,Nothing fancy but has ask you need for an overnight airport stay at a reasonable price. An older hotel (think stippled walls and ceiling with gloss paint) but has been updated nicely. Hot breakfast with real orange juice.,November 2019,none,none,"Dear covecutie, Thank you so much for taking the time to send us your thoughts. We are so pleased you enjoyed your stay with us, and appreciate our recent updates to our facility. I will be sure to celebrate your kind words with my entire staff. We hope to see you back sometime soon, have a blessed day!  Warm regards,  Scott Young General Manager",none,none,none,none,none,none,30,143
5 helpful votes,2 contributions,5.0 of 5 bubbles,Best Comfort Inn I’ve been to in a awhile!,Best Comfort Inn I’ve been to in a awhile!  The selections at breakfast were absolutely great!! Staff has been remarkably helpful with any questions I have about the area.  Cleanliness of the rooms haven been stupendous.  One of the lower priced hotels in the area.  Would define our stay again in the near future.,November 2019,none,none,"Dear donaldj4809, Thank you so much for taking the time to send us your thoughts. We are so pleased you enjoyed your stay with us, and found our staff helpful. I will be sure to celebrate your kind words with them. We hope to see you back sometime soon, have a blessed day!  Warm regards,  Scott Young General Manager",none,none,none,none,none,none,31,143
4 helpful votes,2 contributions,5.0 of 5 bubbles,Best customer service ever !,I been to a couple comfort inns this one specific one was very clean. Its was very quit and I enjoy my stay so much. The lady's in the front desk were very helpful and very nice to me and family thank you very much .will definitely be back soon .,October 2019,none,none,"Dear alegrialiliana, Thank you so much for taking the time to send us your thoughts on your recent stay with us. I am so pleased to hear that you enjoyed your stay with us and will be sure to celebrate your kind words with my front desk ladies. We hope to have you back soon and hope you have a blessed day.  Warm regards,  Scott Young General Manager",none,none,none,none,none,none,32,143
68 helpful votes,118 contributions,3.0 of 5 bubbles,Nice outdoor space.,"The front desk attendant was very friendly and helpful. The room had a slight musty smell that I believe came from the air conditioner. The room and bathroom were clean and the bed was comfortable. The WiFi worked well. They have a very nice outdoor area with a pool, jacuzzi, and fire pit. There was a large selection for breakfast  which was very nice!!  The breakfast room was large enough plus you could eat outside. Would stay there again.",September 2019,none,none,none,none,none,none,none,none,none,33,143
