Helpful Vote,Contributions,Overall Rating,Summary Heading,Summary,Date of Stay,Room tip,Trip Type,Manager Response,Location Rating,Cleanliness Rating,Service Rating,Value Rating,Rooms Rating,Sleep Quality Rating,Review Number,Index
none,1 contribution,5.0 of 5 bubbles,Ray,I stayed 4 nights very clean housekeeping staff were amazing. Ricardo didnt real grasp the whole service the guest thing yet maybe that's why they put him on the night shift.  Jessica was great the manager really responded to my concerns about Ricardo very well.  Gaby thank you for your great service you represent your company very well.  I am in town twice a month and will be staying here from now on when I visit.  Thank you all!,October 2018,none,none,"Dear Ray, Thank you for choosing to stay at the Clarion. We appreciate your feedback and not only do we apologize for your less than satisfying encounter, we appreciate the opportunity to improve our service for the better. We hope to be of service to you again in the near future and hope to see you back sometime soon. Have a blessed day.  Warm regards,  Scott Young General Manager",none,none,none,none,none,none,59,143
1 helpful vote,4 contributions,5.0 of 5 bubbles,My week stay,"This facility is located in a really good location, also enexpensive, very clean and even quite.  Upon arrival Steven showed fast service, a friendly attitude, was very helpful and is extremely handsome ... 😏😏😍if I may say so myself..  If anyone is thinking about coming to this area this is most definitely a for sure reason to come and relax.",October 2018,none,none,"Dear Destiny, Thank you for choosing the Clarion. We appreciate your kind words and hope to be of service to you on your next visit to the area. Have a blessed day!  Warm regards,  Scott Young General Manager",none,none,none,none,none,none,60,143
2 helpful votes,8 contributions,4.0 of 5 bubbles,"Nice, affordable stay. Will come back Alain.","Clean rooms, affordable rates, nice pool area, good breakfast. Located well to get to Disneyland, Angels Baseball, Newport Beach, Huntington Beach, Interstate 5 and 405, Pac highway 1. Helply and frienly staff. Will surely come back again.",September 2018,none,none,"Dear Andreas R., Thank you so much for taking the time to send us your thoughts. We are so pleased you found your accommodations convenient to the area around here and are hopeful you will be back to stay with us in the near future. Have a blessed day.  Warm regards,  Scott Young General Manager",none,none,none,none,none,none,61,143
none,1 contribution,5.0 of 5 bubbles,Customer Service,"We bring a large group here each year for a conference.  The staff is always so accommodating, especially Adi and Miriam who did whatever it took to work with our charter bus driver and help out with keeping 50 high school students happy.  Delicious and personalized breakfast is also a great perk.",September 2018,none,none,"Dear Chrismiss72018, Thank you so much for continuing to return to stay with us. It is always a delight to accommodate you and your group's needs. Adi and Miriam were so thrilled to read your kind words, and we look forward to being of service to you for many more times to come. Have a blessed day,  Scott Young General Manager",none,none,none,none,none,none,62,143
none,1 contribution,5.0 of 5 bubbles,Thank you for the service,"The rooms are always the front seat are really nice good price clean pool good break fast, thanks Steven at the front desk for checking me in fast , they also have security so I don’t worry about getting my window busted",September 2018,none,none,"Dear Michelle,  Thank you for choosing to stay at the Clarion Inn & Suites. We appreciate the feedback you have shared with us and Steven joins me in thanking you for your kind words. We look forward to providing you with the same pleasant accommodations and services the next time you're in town.",none,none,none,none,none,none,63,143
31 helpful votes,46 contributions,5.0 of 5 bubbles,Quick overnight,Needed a room for one night and this was a good option.  The room was clean and the bed was very comfortable.  The staff was quite friendly and the WiFi quite fast.  Parking was free and there were many options for dining and shopping within a few minutes drive.,August 2018,none,none,"Dear Denverflier, Thank you so much for taking the time to send us your thoughts from your recent stay. We are pleased you found you enjoyed your stay with us and hope to have you back soon on your next quick overnight trip to the area. Have a blessed day.  Warm regards,  Scott Young General Manager",none,none,none,none,none,none,64,143
none,1 contribution,5.0 of 5 bubbles,Our Experience,Our experience at the Clarion was great! We will continue to make this one of our regular locations. Customer service is great and the rooms are nice and clean!  Thanks for your hospitality!  Lisa Young and Raymond Beckett.,August 2018,none,none,"Dear Lisa and Raymond, Thank you for choosing to stay at the Clarion Inn & Suites, we appreciate your time and value your business. Our hope is to earn your continued loyalty and look forward to accommodating your every need. Thank you again for your time, we look forward to your return.  Warm regards,  Scott Young General Manager",none,none,none,none,none,none,65,143
21 helpful votes,62 contributions,3.0 of 5 bubbles,Was Very Affordable and I Can't Complain About our Stay,"We were in the area for the the Junior National Swim Meet, so finding an affordable hotel for the week took some looking.  However , we were able to book this place for a pretty reasonable price and really can't complain about the accommodations.  Our room was clean when we arrived and the staff did a great job of cleaning the room every day.  The place was in a great location for us as we were close to the beach, the mountains, and oh yeah the pool were our daughter was swimming in Irvine.  Were were literally no more than 20 minutes to any of these places.  There were plenty of places to dine around the area and traffic was heavy at times, but nothing too outrageous.  Check in was easy, the room and common areas were clean, and they had a security guard patrolling the park lot",August 2018,none,none,"Dear Adam,  We appreciate you taking the time to share your experience from your recent stay at the Clarion Inn & Suites. Our facility strives to provide our guests with a unique experience and we are delighted to hear we were able to provide you with a clean environment at a reasonable price. My staff joins me in thanking you for your kind words, as we always want you to leave wanting to come back. We appreciate your patience while we continue to complete renovations at our facility and apologize for any inconvenience you may have had experienced with our fitness center being out of service. We hope you choose to return with us on your next visit to Santa Ana.",none,none,none,none,none,none,66,143
none,1 contribution,5.0 of 5 bubbles,Excellent Hotel!,This hotel was wonderful! The staff was very friendly and very helpful! Very close proximity to the airport as well as the beach! I would recommend this hotel to anyone! The breakfast selection was great as well!,August 2018,none,none,"Dear Christi M, Thank you so much for your wonderful comments, we are so pleased you enjoyed your stay with us and truly appreciate your time in sending us your thoughts. We value your business and look forward to your return in the near future.   Warm regards,  Scott Young General Manager",none,none,none,none,none,none,67,143
none,9 contributions,4.0 of 5 bubbles,Great Place and Location to Stay,"Upon arrival we were warmly welcomed by the staff (Steven), He was also able accommodate and early check in. The breakfast was better than I remembered, with fresh berries and even granola. The staff was friendly and helpful throughout the stay. Thank you!More",August 2018,none,none,"Dear Serge T, Thank you for taking the time to send us your feedback from your recent stay. We appreciate you choosing to return to stay with us, and are pleased you found our temporary breakfast options have improved. We hope to have you back again once we complete construction on our breakfast room at the end of this month. Have a blessed day,  Scott Young General Manager",none,none,none,none,none,none,68,143
none,4 contributions,4.0 of 5 bubbles,A Great Place to Stay,We thought the made to order continental breakfast was very good. Everything was fresh and there was a good variety. The staff was extremely friendly and made us feel comfortable. The bed was so comfortable and the pillows were too!,August 2018,none,none,"Dear Majestic78957, Thank you for taking the time to send us your feedback from your stay with us. We are please to learn of your pleasant experience and hope to be of service to you again in the near future.  Warm regards,  Scott Young General Manager",none,none,none,none,none,none,69,143
173 helpful votes,788 contributions,5.0 of 5 bubbles,Great location for my work trip,"I stayed here twice on back to back weeks recently.  I was pleased with my room each week.  The pool, hot tub and fire pit were great to hang out in and near.  The breakfast in the morning was good. Fill out a slip of paper to get free breakfast sandwich each morning, I had sausage, egg and cheese muffin.  Coffee is a little hidden, it is behind the counter. The staff was amazing, check in and check out was a breeze.   Housekeeping was great, the rooms were extremely clean every day.  The lady that works in the evening at the snack counter was fantastic. She had a great personality and was great to talk to in the evening.",August 2018,none,none,"Dear Craig C, Thank you for choosing to return to stay with us again on your second work trip. We are pleased you enjoyed your trip both times and look forward to being of service to you on many more pleasant trips. Please do not hesitate to contact us for any assistance.  Warm regards,  Scott Young General Manager",none,none,none,none,none,none,70,143
48 helpful votes,60 contributions,5.0 of 5 bubbles,Going to balboa island and oc fair.,Stayed at the clarion inn in Santa Ana. The pool and Jacuzzi and fire pit were awesome. Staff super nice. Great value. Will stay here again. Free hot breakfast and close to everything. Can't go wrong.,August 2018,none,none,"Dear Reyeshhh, Thank you so much for choosing to stay at the Clarion Inn & Suites. We are pleased to have been able to be a part of your OC Fair experience and hope to be your hotel of choice on your next visit to the OC Fair. Please do not hesitate to contact us for any assistance, have a blessed day.  Warm regards,  Scott Young General Manager",none,none,none,none,none,none,71,143
5 helpful votes,5 contributions,4.0 of 5 bubbles,Laid back hotel and awesome staff,"My apartment was being fumigated and at the same time the Orange County fair was going on, so every hotels price was almost doubled. I stayed a couple of nights and ran into a staff member named “Steven” who was very helpful. He mentioned that being a choice hotels member  they will match any price and also if I stay 2 nights i can receive a $50 gift card. I don’t know about you, but how can you pass up that deal! I will definitely be staying here for now on and in the suite.",August 2018,none,none,"Dear kyleahughes8, Thank you so much for allowing us the opportunity to provide you with superior service. I will be sure to celebrate your kind words with Steven, and we hope to be of service to you and your lodging needs on your next visit to the Orange County area. We appreciate your time and business, have a blessed day.  Warm regards,  Scott Young General Manager",none,none,none,none,none,none,72,143
none,2 contributions,2.0 of 5 bubbles,My rating for this property is poor to Don't stay Here,"The quality of this property has declined over the years and is badly in need of renovation. The ""Suite""  I was booked into smelled, was dark, and the carpet was dirty.       I showed a photo of the third step from top bottom staircase coming loose. We'll see what happens there. Thanksgiving 2017 only one elevator worked. The ""breakfast"" was minimal consisting of a bagel and whatever else one wanted on it.    I won't be staying there again......",July 2018,none,none,"Dear todrgeorge, Thank you for taking the time to send us your thoughts from your stay. We apologize you had to experience such an unsatisfactory time at our facility. As you might have noticed while with us, we are currently working to complete renovations on all our guestrooms and the public spaces, which will include and fix all of your concerns. We appreciate your patience with us during this time, and appreciate your patience with our temporary continental breakfast options while we work to complete renovations on our brand new breakfast room. We hope you choose to return to stay with us once everything is completed, so you may be able to have a better, more bright experience at our facility. Thank you again for your time.  Warm regards,  Scott Young General Manager",none,none,none,none,none,none,73,143
none,1 contribution,3.0 of 5 bubbles,Not pleased with check in,We arrived at 4:15 pm and they said it would be 25 minutes until our room would be clean and ready. Check in is supposed to be at 3:00 pm. We got into our room at 5:00 pm. Everything else was fine.  Would stay here again.,July 2018,none,none,"Dear salvaged1979, Thank you for taking the time to send us your thoughts from your recent stay. You are correct, check-in time is 3pm. While I do not know the exact reason as to why you had to wait so long, rest assured, your concerns were immediately addressed with my staff to ensure we do not allow this to happen in the future. I apologize for any inconveniences this might have caused you. We appreciate you choosing to stay with us and hope to have another opportunity to serve you in the near future. Have a blessed day.  Warm regards,  Scott Young General Manager",none,none,none,none,none,none,74,143
79 helpful votes,160 contributions,5.0 of 5 bubbles,Nice Hotel close to OC Airport with a good breakfast,"We stayed here so we could get a jump on our flight home early the next morning and we were surprised at what we found.  This hotel has recently been updated and the rooms looked like new.  The hotel staff was kind and the hot free breakfast was a bonus.  The airport shuttle runs every 30 minutes as long as you let the front desk know when you need the shuttle.  The shuttle ride is about 10 minutes to the airport.  It also has a nice pool.  Best of all, the price was good for an airport hotel.",July 2018,none,none,"Dear Scuba-Duner, Thank you for choosing to stay at the Clarion Inn & Suites. We are so pleased you thoroughly enjoyed your stay with us, and we hope to be of service to you and your lodging needs on your next visit to the OC area. Have a blessed day.  Warm regards,  Scott Young General Manager",none,none,none,none,none,none,75,143
155 helpful votes,227 contributions,2.0 of 5 bubbles,"Noisy, hotel is tired","Very noisy hotel. The property is tired, rooms are being improved.  Good location to the freeways. Common areas were dirty. The pool is very close to all rooms, so you hear a lot of noise in the evening hours.",July 2018,none,none,"Dear csolsen2, Thank you so much for choosing the Clarion for your recent stay. We appreciate your patience with us while we work to complete our current upgrades to our facility. We apologize for any noise inconveniences you had experienced while with us, and hope we may be able to better serve you in the near future once we complete our renovation. Thank you for bringing these matters to our attention, so we may have an opportunity to improve our service for the future.   I appreciate your time, and again, hope we might have another opportunity in the future to better serve you. Have a blessed day.  Warm regards,  Scott Young General Manager",none,none,none,none,none,none,76,143
32 helpful votes,68 contributions,5.0 of 5 bubbles,Nice hotel near Santa Ana.,"Clean room and washroom. The beds were good. This hotel included parking and breakfast. There is a Walmart, Costco and Costco Gas, Cinema, Whole Foods, and a lot of shops close to the hotel. The main reason we stayed at this hotel was that it was close to the Disney Resort in Santa Ana.",October 2017,none,none,"Dear Sahand_Mary, Thank you for taking the time to send us your thoughts on your recent stay. We are pleased you found your accommodations both convenient and clean, and hope to be your hotel of choice on your next visit to Disneyland or the OC area. Thank you again for your time.  Warm regards,  Scott Young General Manager",none,none,none,none,none,none,77,143
none,2 contributions,4.0 of 5 bubbles,A just fine place to stay,"This is a clean friendly place and it is REALLY close to John Wayne Airport without ever hearing an airplane.  Easy to get to. Near Whole Food, the beach (really) and easy place to eat with the family. We were in for a wedding Friday, Sat and Sunday and the traffic was easy.",June 2018,none,none,"Dear Areppun, Thank you for choosing to stay at the Clarion Inn & Suites. We are pleased you found your accommodations convenient and quiet, and we hope to be of service to you and your acquaintances in the near future. Please do not hesitate to contact us for any assistance. Have a blessed day.  Warm regards,  Scott Young General Manager",none,none,none,none,none,none,78,143
none,1 contribution,5.0 of 5 bubbles,P,"First thing... What a beautiful place to relax. Plenty of shade trees and splendid views. It was a stroke of genius pulling that off. I'm amazed every direction!. The lobby was as cool and inviting as it looked driving up. Great parking BTY. And I have traveled often many different cultures and I am proudnto say I have never had such incredible check in. Gabriella, thank you, felt like coming to visit a friend. This young lady made sure that I knew the near by atractions, had every thing I needed. Knowledgeable, great attitude. This is a real treat. My go to place in Santa Ana.",June 2018,none,none,"Dear 41345loco, Thank you so much for taking the time to send us your delightful feedback from your stay. Both my staff and I (especially Gabriella) were very appreciative of your kind words, and we hope to have you back sometime soon with us. Thank you again for your time, we hope to see you soon. Have a blessed day!  Warm regards,  Scott Young General Manager",none,none,none,none,none,none,79,143
2 helpful votes,5 contributions,5.0 of 5 bubbles,"Great value, great location, clean and nice rooms","This is my go to, always reliable quality hotel when I’m in the Orange County area on business. Friendly and caring staff, nice rooms, clean, comfortable, parking and a great value. Easy freeway access just up the street and short drives to all things of interest in OC, beaches, amusement parks, airports, malls and restaurants. Customer Service Manager Adilene is just a call away, but never necessary to contact, things are tight and dialed in here.",June 2018,none,none,"Dear Clayton, Thank you so much for your continued business with us. We are truly blessed to be of continued service to you and your traveling needs, and look forward to many more opportunities to come. Both my staff and Adilene were pleased to read your kind words, and appreciate your time in sending us them. Have a blessed day.  Warm regards,  Scott Young General Manager",none,none,none,none,none,none,80,143
none,2 contributions,5.0 of 5 bubbles,Great Service!,"The employees here were super amazing! They were quick to take care of me when I asked for towels and toiletries. I stayed for two nights and when I asked my room to be serviced, the house keepers were super sweet too! I will definitely come back and recommend.",June 2018,none,none,"Dear Sabrinve, Thank you so much for taking the time to send us your thoughts from your stay. My staff was so pleased to read your wonderful feedback, and we look forward to many more opportunities to serve you in the near future! Have a blessed day.  Warm regards,  Scott Young General Manager",none,none,none,none,none,none,81,143
none,1 contribution,4.0 of 5 bubbles,"Comfortable hotel, great service","I stayed in the king suite on the third floor with my wife and kids. The boys were able to sleep in the sofabed. The staff was very helpful, and the breakfast service was the best I've had at a hotel, with made to order breakfast sandwiches that were delicious. The fire pit in the courtyard is really cool too. The only reason I didn't do five stars was that the room was a little smoky, but upon alerting the desk they brought some strong air purifying spray that worked well enough(we didn't ask to be moved, as it was the only room of its kind available). I would stay at this hotel again.",June 2018,none,none,"Dear JMJ R, Thank you so much for taking the time to send us your thoughts. We appreciate your time and business, and are pleased you found your accommodations and its amenities accommodating. I apologize for the smokey scent you had found in your room, and have had my housekeeping team complete a deep clean to rid of the smell. I appreciate you bringing this to our attention. We look forward to another opportunity to serve you in the near future, have a blessed day!  Warm regards,  Scott Young General Manager",none,none,none,none,none,none,82,143
none,1 contribution,4.0 of 5 bubbles,Great service and attitude!,"Always feel welcome when I come in and most of the time get the room I want, Jessica welcomes​ me with a smile and happy greeting! Been staying here for years and I'm​ sure plenty more ahead!  Thanks again  Jason",June 2018,none,none,"Dear Jason,  Thank you for taking the time to share your thoughts from your recent visit.   We appreciate your business and your continued loyalty with us. I am delighted to hear that Jessica was able to provide you with a pleasant welcome and accommodate your needs, as we are always looking to exceed your expectations.   We are excited for your return in the near future, please do not hesitate to contact us for any assistance. Have a blessed day.",none,none,none,none,none,none,83,143
89 helpful votes,198 contributions,5.0 of 5 bubbles,Comfortable Stay,Spent 3 nights in this hotel recently. It was a comfortable experience. The hotel appears to have recently got an upgrade. Check in staff was very friendly and helpful. The room was clean and comfortable. Bad was very good for sleeping. Bathroom was very clean. Pool area looked enjoyable but was not able to find time to utilize it. Breakfast was interesting but good. You ordered what you wanted but it cut down on you choices. Still it was tasty. Would stay here again.,May 2018,none,none,"Dear Valued Guest,  Thank you for choosing to stay at the Clarion Inn & Suites on your recent visit to Santa Ana. I am pleased to hear our facility provided you with a clean and comfortable stay and that my staff was able to accommodate your needs. It is always a pleasure to receive positive feedback. We look forward to another opportunity to serve you in the near future. Have a blessed day.",none,none,none,none,none,none,84,143
247 helpful votes,2760 contributions,3.0 of 5 bubbles,Minor complaints - won't likely stay here again,"My spouse and I are Choice Hotel members and frequent travelers.  We recently spent three nights at the Santa Ana Clarion Inn which we chose for its convenient proximity to the John Wayne airport.  We did not utilize the shuttle service as we had rented a car.  Upon arrival, Gabrielle (sp?) was working at the front desk.  She was friendly but somewhat difficult to understand at times.  The room was fine, basically clean and comfortable.  However, the bed was so soft that it felt like a bowl of jello every time either one of us shifted positions in the night, making it difficult to get a good night's sleep.  We found the WiFi to be extremely unstable so we gave up and didn't use it after the first couple of hours.  The first morning we found a notice on our car windshield",April 2018,none,none,"Dear Valued Guest,  Thank you for taking the time out of your day to share your thoughts and concerns on your recent stay at the Clarion Inn & Suites.   On behalf of our entire team, I would like to apologize for failing to exceed your expectations regarding your experience at our facility. Your satisfaction is very important to us, and your feedback will be used to make necessary improvements. Your feedback serves as an encouragement to my team as we strive to continuously improve the quality of our services.We appreciate your patience with our temporary breakfast accommodation while we work to complete construction on our soon to come breakfast room. Once again, I am truly sorry we were not able to provide you with a pleasant experience. We do hope you will provide us with another opportunity to prove to you our superior services. Have a blessed day!",none,none,none,none,none,none,85,143
