Helpful Vote,Contributions,Overall Rating,Summary Heading,Summary,Date of Stay,Room tip,Trip Type,Manager Response,Location Rating,Cleanliness Rating,Service Rating,Value Rating,Rooms Rating,Sleep Quality Rating,Review Number,Index
2 helpful votes,2 contributions,5.0 of 5 bubbles,Great costumer service,Nigel L was a great help to me today! I’m doing this so he gets the recognition he deserves because this was top tier and I enjoyed my stay because of him. I pray this review gets the viewer ship it deserves.,March 2022,none,none,"Isaiah, your feedback back is awesome and appreciated. Thank you for staying with us and recognizing Nigel and the team and it's our pleasure to provide great costumer service.",none,none,none,none,none,none,36,156
1 helpful vote,2 contributions,5.0 of 5 bubbles,Definitely recommended,All I can say is that this place is a five star and has great customer service the rooms are nice the breakfast is good you should definitely book your stay here if you ever come to Lake Forest even if you stay around the neighboring cities it should be the place you should say highly recommend it.,March 2022,none,none,"Nestor, I wanted to say thanks for your recent stay here at our hotel! Thank you for your feedback and the recommendation, our team appreciates you entirely.",none,none,none,none,none,none,37,156
2 helpful votes,2 contributions,5.0 of 5 bubbles,Hampton inn,"This is a home away from home for me. That staff here is amazing. From the bar , Tawny is a blast. Nigel the GM makes our team feel comfortable and puts us at ease . Eric from sales is a riot during social hours on Wednesdays. I have not one complaint about this hotel. 10/10.",February 2022,none,none,"Jesse, thank you for recognizing Tawny and Nigel. I'm sure they appreciates you and enjoys the time you spend at the bar.  Thank you so much.",none,none,none,none,none,none,38,156
none,1 contribution,5.0 of 5 bubbles,Good stay very clean and modern,Very good stay with a very clean room and everything was close by including Irvine spectrum the service was good and the room was very quiet the pool was cool and so was the 24hr gym. The breakfast was good,February 2022,none,none,"Thank you for the Amazing feedback.  I am glad that he was able to provide you amazing service, a clean stay with a modern feel.  This is what we are all about and so very proud of our team.  We look forward to your next visit.",none,none,none,none,none,none,39,156
21 helpful votes,103 contributions,5.0 of 5 bubbles,Not in a glamorous location but very clean and comfortable.,"Looks very unassuming from the outside, but inside it is new and updated. The bed is comfortable and shower is simple and clean. Room is a bit small and not much space for work area, however Wi-Fi is great and plenty of regular and USB outlets. The hotel serves breakfast as well, which is minimal but actually rather tasty. Free coffee and tea throughout the day. There is a gym, a pool and a business center, they are all quiet small but serviceable. btw- the staff is excellent, helpful and friendly, this is what ultimately gave this facility the 5th star; very much worth the visit.",January 2022,none,none,"ngap_82, what a great review. Pretty awesome and I thank you so much.  Love the feedback concerning every aspect of your stay especially the team.  We do home to see you again soon. Thank you.",none,none,none,none,none,none,40,156
122 helpful votes,164 contributions,4.0 of 5 bubbles,Looks clean and new.,"The hotel is new and well kempt, although the bed sheets had long hair on. We asked for new clean sheets, other than that it seemed hospitable and quite clean throughout.  One other down side is breakfast, which very poor. Basic, limited and almost like baby food.Glad I had alternative food, but the coffee is good.",December 2021,none,none,"True_innsight, thanks for the feedback, it's unfortunate that we did not meet your breakfast standards and I am extremely happy that our team were quick to remedy the bed sheets situation, my sincerest apologies for that and the inconvenience.  We do look forward to your next visit and hopefully we can make it right and better.",none,none,none,none,none,none,41,156
11 helpful votes,56 contributions,4.0 of 5 bubbles,Great access to Irvine and south LA,Great location for business trips to Irvine. The bar had a great selection of drinks and cool staff. The rooms are clean and the complimentary breakfast is really varied and good. I would stay here again.,December 2021,none,none,"Nicklasson, thank you for your feedback. We appreciated you chose to stay with us over the holiday season. It seems you  had a great time and I'm hoping and wishing only the best for you and your family this new year.",none,none,none,none,none,none,42,156
1 helpful vote,6 contributions,5.0 of 5 bubbles,Highly recommended,Highly recommended. Extremely clean! Excellent receptionists. Easy parking. Good location. Very good breakfast. Definitely will go back. 5 stars review from me! This review coming from a person who stays at a hotel at least once every months.,December 2021,none,none,"Aousa698, thank you so much for the recommendation to others as well as the 5 star review and feedback. We are all happy that we were a small part of your experience and was able to meet your expectations. Thank you and Happy Holidays.  Best of 2022 to you and your family.",none,none,none,none,none,none,43,156
none,1 contribution,5.0 of 5 bubbles,Great Hotel,In town for volleyball tournament at Laguna Volleyball Club.  Hotel was very nice and in a good location close to route about 15 minutes from club and close to several food choices including The Hat and Starbucks.,December 2021,none,none,"Kjarper32, we appreciate your kind words and your time to give us your feedback. It seems we met your expectations and are happy to have been part of your experience.  We are to welcome you back when you are in the area. Happy Holidays.",none,none,none,none,none,none,44,156
4 helpful votes,7 contributions,5.0 of 5 bubbles,Perfect Hospitality!,"We are thankful to Evan and his team at Hampton!!  We had to be in town for a few days for my husband's surgery.  The property is beautifully maintained, and  the staff is incredibly accommodating.  They made a very stressful few days much easier!",December 2021,none,none,"Danettep537, it was our pleasure to have to stay at our property. I'm happy to know that we were a home away from home was was able to accommodate you and your husband during his surgery.  I'm glad it all worked out and went well.  Anytime you are in town, we will be happy to have to here and I know our team is looking forward to your next visit.  Happy Holidays to you and your family.",none,none,none,none,none,none,45,156
none,1 contribution,5.0 of 5 bubbles,Nice hotel,This hotel is extremely nice and very clean. The staff are extremely nice and I love how they have complimentary coffee and hot chocolate throughout the day. It’s in a perfect location and very safe area as well. Will stay here again.,December 2021,none,none,"Anieseparker, thank you for choosing to stay with us. We appreciate the feedback and we are so happy to accommodate your needs, even if it's just to have coffee and hot chocolate available all day.  We look forward to your next stay.",none,none,none,none,none,none,46,156
none,1 contribution,4.0 of 5 bubbles,Clean Hotel,"We enjoyed our stay..but there were a couple of things that could’ve been better.  The bathrooms really need exhaust fans….strange that they didn’t…and a few more towels upon arrival r appreciated…so we don’t have to call housekeeping…Finalky, there was a great deal of noise from some adjacent rooms…we believe there was a soccer and or cheerleading team staying there…let’s just say they must’ve been practicing!  😆",November 2021,none,none,"Antarescampbell, thank you for the review and your rating, much appreciated by our team. We do apologize about the noise from the soccer team, it is not always like this. We appreciate your feedback concerning the exhaust fans. We do hope that you will come back to visit us again and give us another opportunity.",none,none,none,none,none,none,47,156
none,1 contribution,5.0 of 5 bubbles,Great Hotel,"Great Hotel, very convenient to outside accommodations and freeways. The hotel is very well designed and well maintained. Hotel staff is very courteous and helpful with outside site information. Best hotel we stayed at in our month long trip",November 2021,none,none,"rfinke918, thanks for the feedback. Our team was honored to be part of the experience and are just grateful that your stay was a great one. Thank you.",none,none,none,none,none,none,48,156
2 helpful votes,2 contributions,5.0 of 5 bubbles,"Very Clean, large meeting room","We had our tram meeting here and it was excellent!!!  First of all, it was extremely easy to coordinate with Marlo and Aloha. They made sure everything was as expected at every turn. The meeting space was clean and very spacious for our 20 attendees. We were assigned someone to assist us with every question through the day. He stayed on the schedule we gave regarding air wall closure/open, lunch, etc.  We were all extremely satisfied with all the staff as well as the meeting room!!",November 2021,none,none,This is truly an amazing review and we appreciate that you think time to share your experience with the world. I'm happy that our team met your expectations and went above and beyond in the delivery of our service to you and your team. Thank you for allowing us to be part of it and we look forward to the next event.,none,none,none,none,none,none,49,156
none,1 contribution,5.0 of 5 bubbles,Quite fun,Nice place to stay very quiet and lots of places near by where you  can find good food to eat. I like that there was many places to walk to and around the facility. The place there is very clean I would definitely go there again.,October 2021,none,none,"myfantaz2001, this is so true. Our property is a nice place and as noted lots of places near by.  I am that your had an outstanding experience with us and that you took the time to share it. We so much appreciate it and our team would love to have you stay with us again, Thank you for your kind words.",none,none,none,none,none,none,50,156
none,1 contribution,5.0 of 5 bubbles,Fabulous Hotel!,"Stayed 2 separate nights over a long weekend. Hotel is located on a block of several new hotels. This is the one to select! It's new so you'd expect it to be clean but constant cleaning is very visible & is keeping it that way (floors & room cleaning). Staff throughout the hotel (housekeepers & cafe folks) greet you with a sincere ""Good morning!""  On both stays, our pre-selected rooms were ready (at 3:00 & 4:00), front desk staff at check in & out was friendly & receptive to a suggested room tweak (loose toilet paper holder), and best of all-- the Breakfast buffet to open to SELF-selection & is well stocked with Hot food (including egg, bacon, sausage, potatoes). Book this hotel before price escalates!!",October 2021,none,none,Thanks for your recent review and recommendations. We are all so happy that you found our hotel to be fabulous. Happy everything was to your satisfaction.,none,none,none,none,none,none,51,156
none,1 contribution,5.0 of 5 bubbles,"New, super clean, nice neighbourhood, would stay there again and again","Great hotel, super clean, great for a family trip, convenient location, very close to Laguna beach at a much more reasonable prices, 2nd time staying there and never to disappoint, good complimentary breakfast, coffee and tea available all day free of charge",September 2021,none,none,"Monterlea13, thank you so much. Was happy to read you recent comments. Our team does an excellent job in keeping our entire hotel super clean. We hope to see you again and again.",none,none,none,none,none,none,52,156
none,1 contribution,5.0 of 5 bubbles,Quality and Comfort. Stay here!,I have never felt more comfortable at a hotel! I’m so glad we stayed here. Great location and very quiet. I am a clean freak and our room passed the test. Front desk was very welcoming. Our experience was awesome and we will definitely stay here again!,September 2021,none,none,"fmg519, I want to thank you for your recent stay with us. I'm happy to hear that your entire stay was comfortable and having a clean hotel and room created an awesome experience.  I do hope that you will visit us again when you are in the area.  Again, thank you for sharing your experience.",none,none,none,none,none,none,53,156
none,1 contribution,1.0 of 5 bubbles,They won’t let your  charge your EV here,"Nice place, clean and good breakfast.  If you bring your EV car, don’t plan on charging.  You plug it and, go to bed to only find they unplugged it.  So, your departure is delayed while you find another charger.",August 2021,none,none,"AZsoccertraveler, Thank you for taking the time to share your experience about your recent stay at our hotel. We sincerely appreciate your feedback and we’re very sorry you were unhappy with your stay. We will take your comments under consideration as we continually work to improve our guest experience. We hope you will consider staying with us in the future.",none,none,none,none,none,none,54,156
none,1 contribution,5.0 of 5 bubbles,District Convention,"A fabulous place to hold our Convention of 60 people. The meeting room was always clean, the A/V worked, the coffee bar tended, the sleeping quarters disinfected, the parking at no additional cost. For the needs of our group, we were extremely pleased with the outcome of our convention. Thank you!",August 2021,none,none,"JohnofHuntingtonBch, I wanted to say thanks for your recent stay and attending your district convention here at our hotel! I hope you felt at home. I am also happy that our team extend such a warm welcome which reflected in the details during your convention. We are so glad that it all work out and we met your expectations.   We can’t  wait to welcome you home again!",none,none,none,none,none,none,55,156
none,1 contribution,5.0 of 5 bubbles,Daughters Birthday,"We had our daughter's 21st birthday party in the ballroom at the Hampton Suites on Lake Forest in Irvine and needless to say I was overwhelmed and nervous. We had never thrown a party of that size before and had no idea how to. Luckily for us the Hampton has a party planning angel on their staff. Thanks to Aloha Gonzalez, the Hamptons event consultant, our party was a complete success! She walked us through every step with planning the food menu and letting us know if we needed to add more or decrease certain food items, she was in contact with all of our outside vendors and made sure they were all on the same page and that things would be dropped off and set up in time for the party and she did it all with such patience and care. The day of the party she was there helping set",August 2021,none,none,"Jennifersandersm, I wanted to say thanks for having your recent event here at our hotel! We are so happy that everything went according to plan and thanks to our great team for the entire execution from the beginning to end to make sure that you and your guests were extremely satisfied. Thank you for allowing us to share in joy and excitement of celebrating your daughter's birthday.",none,none,none,none,none,none,56,156
none,1 contribution,5.0 of 5 bubbles,SuperClean hotel and room. Great staff.,Very Clean hotel. Hand sanitizer and surface wipes provided throughout hotel. Felt very comfortable staying here. Room was super clean. The hotel staff was extremely helpful. The complimentary breakfast is always delicious.,August 2021,none,none,"cggzman, I wanted to say thanks for your recent stay here at our hotel! I agree staying in a hotel that is super clean with great and amazing staff says a lot about the property.  I hope you felt at home and we certainly can’t  wait to welcome you home again soon!  Thank you!!!",none,none,none,none,none,none,57,156
6 helpful votes,3 contributions,5.0 of 5 bubbles,Great hotel,Great stay at the hotel.  Staff was very pleasant.  The young lady in the breakfast area took great pride in her job.  She asked if there was anything I needed and was friendly and very clean.  Well after breakfast she was mopping the floor and wished me a good day.  Just great,August 2021,none,none,"I wanted to say thanks for your recent stay here at our hotel! I hope you felt at home. I am also happy that our team extend such a warm welcome which reflected in her job, thank you for acknowledging her.  We can’t  wait to welcome you home again soon!",none,none,none,none,none,none,58,156
none,1 contribution,4.0 of 5 bubbles,Can’t beat this place.,"The place is conveniently located next to the freeway but you don’t hear it. Rooms are large and clean and NEW! Overall good place, just try to stay on the 5th floor so you don’t have someone above you.",August 2021,none,none,I wanted to say thanks for your recent stay here at our hotel! I hope you felt at home.  We can’t  wait to welcome you home again soon!,none,none,none,none,none,none,59,156
none,1 contribution,5.0 of 5 bubbles,Modern hotel + impeccably clean + friendly team,"The hotel is new, beautifully decorated and incredibly clean. Another perk is the beds are comfortable and sheets smell fresh. We couldn’t be more pleased with our stay and love the hospitality Lauren and Rose have showed us at breakfast each morning!",August 2021,none,none,"Ali B, such a wonderful review.  Thank you for taking the time to share such amazing comments about your experience. To hear you say that you love the hospitality if Lauren and Rose brings joy to my heart.  Simply AMAZING.  Thank you.",none,none,none,none,none,none,60,156
none,3 contributions,5.0 of 5 bubbles,"Wow! Positive, attentive and helpful staff!","In a time where the hospitality industry has been stressed and stretched, I wanted to call out that this Hampton Inn had several staff that really shined! I don’t know any of these people, and have never stayed at this location before (but am a frequent traveler in general).   Shout outs to: Michael at the bar, mentioned he was new, who went out of his way to be friendly and responsive. Then in the morning, Lauren and Rose at the breakfast room - Lauren could not have been any more positive,  helpful, and attentive. Even the gentleman cleaning the public restroom, kind and courteous!   All of their positivity was refreshing and contagious! Seemingly rare in these times, keep it up! The facility was new, clean, well kept!",August 2021,none,none,"WOW, that says it all. Totally agree with your assessment and appreciate your feedback about your recent experience.  Thank you so much for sharing it with the world.  We do hope you come back and visit us.",none,none,none,none,none,none,61,156
none,1 contribution,3.0 of 5 bubbles,Decent Stay,Stayed 3 nights from July 30 to August 2 and it was a decent place to stay. Place looked clean; room and beds were very spacious and clean. The door for the bathroom was broken though and kept getting stuck which was annoying. The comforter was a bit scratchy and itchy on one side but overall the beds were comfortable.   Information on their website/app is not up to date so you should call or ask the front desk ahead of time if needed. The lady that checked us in was friendly but the others I interacted with had a bit of an attitude like I was annoying them. Parking required a small fee of $7/night  but the place has lots of parking so it's nice if you have a car with you.,August 2021,none,none,Thank you for taking the time to share your experience about your recent stay at our hotel.  We sincerely appreciate your feedback and we're very sorry you were not able to meet all your expectations. We will take your comments under consideration as we continually work to improve our guest experience. We hope you will consider staying with us in the future.,none,none,none,none,none,none,62,156
7 helpful votes,12 contributions,4.0 of 5 bubbles,Clean and quiet room,We stayed at the Hampton Inn Irvine Spectrum for a family event.  The room was good size and comfortable for the four of us.  Conveniently located and surrounded by other similar hotels.  I would stay here again if the price was similar to the other hotels in the area.,July 2021,none,none,Thank you for choosing to stay with us and we very much appreciate your feedback.  Our team are extremely to in providing excellent service which entails having clean room and top of the line service.  We look forward to your next visit.,none,none,none,none,none,none,63,156
18 helpful votes,8 contributions,1.0 of 5 bubbles,"Hotel is clean, centrally located but front desk staff get an ""F"".","Clean, buffet breakfast with hot and cold, busy location but front desk staff could not get two rooms assigned correctly or understand the duration so my brother, who needed a handicap room, was locked out a day prior to his leaving.  They also mischarged his parking to me.  And, their handicap rooms have step over tubs???   Can't imagine that is ADA compliant.  Won't stay here again.",July 2021,none,none,Thank you for taking the time to share your experience about your recent stay at our hotel. We sincerely appreciate your feedback and we’re very sorry you were unhappy with your stay. We will take your comments under consideration as we continually work to improve our guest experience. We hope you will consider staying with us in the future.,none,none,none,none,none,none,64,156
1 helpful vote,1 contribution,5.0 of 5 bubbles,THE BEST HOTEL,"Really friendly staff, clean rooms and really great for families and being by yourself. Definitely will stay here again! The breakfast was good and filling as well but you do have to get up early as 6 am in order to beat everyone else until 9 am.",July 2021,none,none,"Lilbabe2021, thanks for the ""The Best Hotel"" review.  I'm sure like myself all other travelers appreciates it.  Thank you so much!",none,none,none,none,none,none,65,156
1 helpful vote,1 contribution,5.0 of 5 bubbles,Ms.,Superb. Immaculately clean. Friendly staff. Delicious hot breakfast. The pool was very clean and relaxing. Decor is modern and new. Beds were deliciously comfortable as is always expected from the Hilton brand.,July 2021,none,none,"Dear KarisU5630G, thank you for your 5 star rating and sharing your recent experience while staying with us.  Having a comfortable bed is so important and necessary to be able to have a relaxed and comfortable sleep.  We hope to see you again the next time you are in the area.",none,none,none,none,none,none,66,156
1 helpful vote,1 contribution,5.0 of 5 bubbles,Wonderful experience,It was a wonderful experience. From politeness of the staff to cleanliness of the hotel. The hot open buffet breakfast was also notable. You should definitely give this one a chance. You could easily say that the staff loves what they are doing and it is reflected in their performance for sure.,June 2021,none,none,"Serdarozen, this is breathtaking to read.  I share this knowing that not only myself but my entire team do love what we are doing and it's our utmost pleasure to serve our guests.  You all makes us happy and gives us a reason to come to work.  We are all happy that you had a wonderful experience and took the time to share it with others. Thank you.",none,none,none,none,none,none,67,156
1 helpful vote,1 contribution,5.0 of 5 bubbles,Staycation,"Just needed to get away for a night and found the Hampton inn by Hilton in Lake Forest. I was amazed at how easy it was to book a room! The hotel is very modern and sleek as well as incredibly clean! For just having a night out, and for any other future reasons, I will definitely be staying here again. Staff was so friendly and helpful and the rooms were so nice! 10/10 would recommend 😊",July 2021,none,none,"Dear Elodubz, sometimes that's all we need is a staycation. I glad you were able to find us and our team was able to create the environment for you to have an amazing experience.  We hope to see you again on your next staycation.",none,none,none,none,none,none,68,156
2 helpful votes,2 contributions,5.0 of 5 bubbles,Perfect Location,"Right off the 5 freeway, close to the John Wayne airport, shipping, beaches. Very gorgeous hotel, friendly staff, great customer service. Over all, the best hotel in the area and also very clean. The breakfast is amazing, has something for every one.",July 2021,none,none,Thank you so much for sharing your thoughts and experience.  I'm glad that were in the perfection location and that we were able to accommodate you.  Do come back and visit us. Thank you.,none,none,none,none,none,none,69,156
5 helpful votes,3 contributions,5.0 of 5 bubbles,Angel1,"We enjoyed our stay, the room was clean and the hotel staff were professional, friendly and accommodating.  We will plan to stay again on our next trip. Great location, highly recommend, quiet and peaceful",May 2021,none,none,"Frequestflier552188, thank you for your recent stay.  Thanks for sharing your experience and the great review, much appreciated by our team.",none,none,none,none,none,none,70,156
