Helpful Vote,Contributions,Overall Rating,Summary Heading,Summary,Date of Stay,Room tip,Trip Type,Manager Response,Location Rating,Cleanliness Rating,Service Rating,Value Rating,Rooms Rating,Sleep Quality Rating,Review Number,Index
none,1 contribution,5.0 of 5 bubbles,"Hampton Inn, Irvine, CA",This is my go-to hotel with every business or leisure trip I take to the Orange County area.  The staff is extremely friendly and helpful.  The rooms are always completely clean and the breakfast is great!,February 2023,none,Traveled on business,none,5.0 of 5 bubbles,none,none,none,none,none,1,156
95 helpful votes,360 contributions,5.0 of 5 bubbles,Basketball Tournament,"We arrived in this hotel Friday night April around 8 pm. The hotel was absolutely sparkling clean . 24 hours coffee, tea, and chocolate milk in front of the Hotel Registration . The staff are so friendly and very approachable . Our room was very clean , a lot of plugs for cellphone or any other device . We called for towels and in less than 5 minutes , someone was knocking in our door . We absolutely love every details of the hotel . There are certainly rules to follow like curfew but will not  change the fact that this hotel has great value for money , cleanliness and staff are very efficient . I will definitely be back if I am in the area.",April 2021,none,Traveled with family,"Hello Elisaadens, we are happy to hear your stay with us was amazing and the staff went above and beyond on delivery of you requests . We hope to see you in the near future.",none,none,none,none,none,none,2,156
1 helpful vote,10 contributions,5.0 of 5 bubbles,Nice staff and great rooms!,"We arrived on Super Bowl afternoon. The man who checked us in was great, he was funny and friendly. It was nice to be treated so well. The hotel had a fun set up for the game. The room was clean and very quiet. We will be coming back next time in the area.",February 2023,none,none,It was our utmost pleasure to serve you and our team was excited preparing for Super Bowl weekend.  Thank you for your review and glad you enjoyed your stay.,5.0 of 5 bubbles,none,none,none,none,none,3,156
46 helpful votes,385 contributions,5.0 of 5 bubbles,Pet Friendly,The reason we stayed here is because it’s pet friendly. It’s close off the freeway and we traveled for soccer so close to the soccer park as well. Hilton never disappoints. The breakfast never disappoints as well. Everyone was friendly and it’s a Hilton… always great service,February 2023,none,Traveled with family,Thank you for your recent stay and 5 star review.  It's greatly appreciated. We are so happy you chose us for your stay and we look forward to your next visit.,none,none,none,none,none,none,4,156
none,10 contributions,1.0 of 5 bubbles,Do not go here,"Tried to check in yesterday this place is absolutely filthy. Hair balls on the floor, dirty stained carpet. Bad smell. No other words. Tried 2 rooms, checked the filthy pool and brown water hot tub. Run far away from this disgusting place. Really upsetting",January 2023,none,Traveled as a couple,Thank you for taking the time to share your recent experience at Hampton Inn Irvine Spectrum Lake Forest.  We sincerely appreciate your feedback and we're very sorry you were unhappy. Your feedback is important as our goal is to ensure every guest feels at home while staying with us and that our hotel is always 100% clean.  Please feel free to reach out to me at the hotel to share your concerns.  We hope you will consider staying with us in the future.,none,none,none,none,none,none,5,156
none,4 contributions,5.0 of 5 bubbles,Good location - Friendly Staff - Clean,Hotel has it all for the passing through traveler.  Location right off the 405/5.  Cleanliness.  Good breakfast.  Easy parking.  Reasonable price. Friendly staff.  Quiet. We had a room right off the elevator and didn't hear a thing all night.,December 2022,none,none,Thank you so much for a wonderful review and feedback.  Wishing you a wonderful holiday season and a fantastic new year.,5.0 of 5 bubbles,none,none,none,none,none,6,156
1 helpful vote,1 contribution,5.0 of 5 bubbles,Good to be back.,Arrived back at my favorite hotel.  I must say that it feels like home away from home. I was greated by Lisa and Loyd by name and a warm smile. Julian was extremely helpful with questions we had and notified me once he found the answer. Claire was behind the bar and friendly as ever as she made the perfect  Old Fashion. As always exceptional customer service from an exceptional staff.,December 2022,none,Traveled on business,"Tim, welcome back home! We all are so happy to have you here. Thank you for always choosing to stay with us and recognizing Lisa, Lloyd, Julian and of course Claire. Happy Holidays.",5.0 of 5 bubbles,none,none,none,none,none,7,156
7 helpful votes,14 contributions,5.0 of 5 bubbles,Must stay if you want to enjoy a place,"First of all I never walked in a hotel and be met with a  very  pleasant smell that was awesome.second I was greeted by Lloyd, next I had pleasant conversation with Nour  next day and she helped me reserve next stay. The room  was very clean and pleasant colors. Antony and the breakfast team were great too. And of course Lisa the Am was very nice and Elisha wow great team you guys having fyi. So please for all of you thank you for making me believe that we can find good place to stay.  Anyone in the hotel business go and learn from them how to be pleasant. They were amazing",November 2022,Enjoy the team kindness and willing to help with a smile,Traveled on business,"Thank you, what an amazing review and feedback. I certainly appreciate that our team went above and beyond to meet your expectations. Thank you for recognizing the team, all those who were mentioned that brought such delight in making your stay pleasant.  Do come back to visit us again soon.",5.0 of 5 bubbles,none,none,none,none,none,8,156
none,1 contribution,5.0 of 5 bubbles,Great location,The staff was very accommodating for our large group.  They attended to all our needs.  The facilities were very clean.  The rooms comfortable and all the staff were friendly.  The kitchen staff prepared our group with a Thanksgiving meal that was excellent!  The breakfast choices were excellent and changed each day.  No hesitation to stay here again!,November 2022,none,none,Thank you for choosing us over others.  We are happy that you and your team enjoyed your stay and that we were able to provide a Thanksgiving meal to your liking. We hope to see you and your team again.,5.0 of 5 bubbles,none,none,none,none,none,9,156
1 helpful vote,2 contributions,5.0 of 5 bubbles,A+ service and facility,"Great 6 day stay! Very clean rooms and comfortable bed, pillows and duvet. 24 hr coffee/tea service. Excellent conference room and fitness room (2 peletons, large weight rack etc…), convenient access to freeway. A+ service from front desk, housekeeping, and restaurant",November 2022,none,none,"Great feedback, thank you so much. I am happy that our team was able to provide A+ service that went above and beyond your expectation.  Thank you.",5.0 of 5 bubbles,none,none,none,none,none,10,156
none,none,5.0 of 5 bubbles,Best Experience Staying at a Hotel,The general manager Nigel was very accommodating. He made our stay a great experience. His staff were all super professional and nice. The entire hotel was clean. We would recommend this hotel to anyone. We are so excited for our next visit!,November 2022,none,none,Thank you so much for not only recognizing Nigel but the entire team.  We were so happy to have you and your family staying with us and I hope that you do come back to visit us again. Thank you for sharing your experience.,none,none,none,none,none,none,11,156
none,none,5.0 of 5 bubbles,Great service and amenities,Great staff and amenities. Beds are fantastic. Good location. This hotel is new and very clean. The staff is excellent and provides great service. The hotel bar is welcoming and the food is good. Rooms are a good size and the beds are fantastic.,November 2022,none,none,"Awesome review if I must say. Our team was happy to accommodate your hockey team travelling from Canada.  It was certainly a great opportunity and experience, thank you.",none,none,none,none,none,none,12,156
none,none,4.0 of 5 bubbles,Great experience for our hockey team,We had a positive experience as we came from Canada for a hockey tournament. The hotel was great to deal with and there were many thoughtful/convenient aspects including a coffee and tea bar that operated 24 hours. The staff were helpful and the kitchen was great too. Recommended.,November 2022,none,none,"Thanks you for rating us and your feedback, our team truly appreciates it. We are all extremely happy that you had a great experience and that we made your stay extra special.  Thank you for vising us all the way from Canada.",none,none,none,none,none,none,13,156
none,none,5.0 of 5 bubbles,Great Hotel,I really enjoyed my stay at the hotel. The food at the restaurant was very tasty and the live music was such a happy surprise. My friends and I loved listening to the live music by Alex! They also had a great selection of drinks at the bar,October 2022,none,none,Thank you so much. Alex has certainly added to the overall experience of our guests. So much great feedback about the live music and appreciate it so much. Thank you.,none,none,none,none,none,none,14,156
68 helpful votes,667 contributions,5.0 of 5 bubbles,Newer brighter better Hampton property,"This is a newer model Hampton with the more square shaped rooms. Bright and cheerful decor, tall ceilings, way better than old Hampton's.   I drove in late. i wasn't told about pay parking. pay parking at Hampton is rare. Make a bigger deal of this even in Orange County because your visitors are not used to this at Hampton.",November 2022,none,none,"Thank you so much for the 5 star review and feedback, much appreciated.  WE look forward to your next visit.",none,none,none,none,none,none,15,156
none,1 contribution,3.0 of 5 bubbles,Hampton spectrum,"I can rate it good only because for me front desk folks are very important but since they are not as friendly and accommodating as i expect in every hotel i go to so i can only give you 3stars. The management really need to improve their trainings to their front dest people. Be very friendly, energetic and accommodating and helpful. Some of them are really not nice!!! I even encounter rude one short lady i think shes african american. On duty in the morning.",September 2022,none,none,"Thank you so much for your review and feedback, it is appreciated and will assist with further training.",none,none,none,none,none,none,16,156
none,none,5.0 of 5 bubbles,Overall a wonderful experience and the cleanliness of the hotel was insanely impressive. We will be back in the future,"As someone who has not normally stayed at Hampton Inn by Hilton, my family and I were throughly impressed by the quality of the room. It was extremely clean and the worries I have had previously about a dirty hotel room left me instantly. Additionally, as this is a new location that sprung up a couple of years ago, my family and I appreciated how quiet and calm the location was despite being close to the freeway, especially in comparison to the rest of Los Ángeles. We truly appreciate the services Hampton Inn provided and will be sure to recommend it to friends and family members.",October 2022,none,none,"Thank you for such a positive feedback and review. We are so happy that you had a wonderful experience . Also, thank you for sharing your experience with family and friends.  Please do come back and visit us again soon.",none,none,none,none,none,none,17,156
none,none,5.0 of 5 bubbles,Hotel stay,Nigel and Claire are the best! Had a great experience! Hotel was so clean and staff was amazing !would definitely recommend this hotel to our friends! Thanks you for a fun wonderful stay!hopefully we will be back soon!,October 2022,none,none,"Thank you for your feedback and amazing review. We appreciate recognizing our team, especially Nigel and Claire.  Our team looks forward to your next visit.",none,none,none,none,none,none,18,156
none,none,5.0 of 5 bubbles,Claire and Nigel are THE BEST!!!,Nigel and Clare were awesome.   Their customer service was the best. We spent the weekend with our softball team and they were so accommodating. We’ll be back for sure thanks to the warm welcome. Thank you.,October 2022,none,none,Claire and Nigel are the BEST.  Thank you for recognizing them.  I'm happy that they both were able to create such a positive experience for that you were able to share it with others. We look forward to your next visit.,none,none,none,none,none,none,19,156
1 helpful vote,2 contributions,5.0 of 5 bubbles,Home away from home,"My company has had an extended stay for the past few months and while the time away from home comes with its own set of challenges, since I’ve been here at the Homewood suites, I can honestly say that this place has become my home away from home. The polite and attentive staff like manager, Nigel and front desk, Lloyd have ensured that my stay is as comfortable and hassle free as can be. Additionally the cleaning staff has worked to keep the place clean, inviting, and safe in a post COVID world. Finally, bartenders like, Tawny and Claire offer service that goes above and beyond creating a warm and truly homey space where me and my coworkers can unwind and enjoy all that the kitchen staff has too offer. In truth EVERYONE at Hilton has helped make work feel more like a vacation",September 2022,none,none,Our hotel is definitely a home away from home and we certainly appreciate you saying so. I am extremely prod of my team and it gives me great joy that the go above and beyond to serve our guests.  Thank you for recognizing all of them.,none,none,none,none,none,none,20,156
1 helpful vote,2 contributions,5.0 of 5 bubbles,Best value for business Trip,"Had a wonderful stay while on business and had a quick and easy check in with minimal delay! Staff was attentive and made sure my stay was as pleasant and without much stress to worry about. Definitely staying here next time, and if you do as well, ask for Alex at the front desk 👌",September 2022,none,none,Thank you for such a wonderful review and feedback as well as recognizing our team especially Alex.  We are all happy that you had a wonderful stay and we look forward to your next visit.  Thank you.,none,none,none,none,none,none,21,156
2 helpful votes,6 contributions,5.0 of 5 bubbles,GREAT PLACE!!,"Clean place & room, plenty of parking, & great staff! I’d have to say, Julian is just wonderful! He’s sincere, accommodating, he’s fast, he’s very helpful - you got a great person on your team, Hilton!! Hope he gets recognized!!! You guys are doing an awesome job.",May 2022,none,none,"Thank you for your recent stay at our hotel! I hope you felt at home.  We appreciate the staff recognition as we do as well, thank you. We can’t wait to welcome you home again soon!",none,none,none,none,none,none,22,156
none,1 contribution,1.0 of 5 bubbles,Staff needs some serious improvement.,"Being a Hilton Diamond member you stay and come across all types of properties. You choose Hilton for their hospitality.  Their front desk employee here named Floyd needs some serious lessons in the hospitality field.  We check in the early evening for one night, and were asked by the young lady if we would be parking, we replied yes. She has us sign something saying the charge is $12.00 for overnight parking. Well we check out of the hotel only a few hours later so we never stayed overnight. Somehow we were still charged for 2 cars for overnight parking.  Also we received a change of $12.00 on top of that for a gift shop purchase. I’m the only one with my name on the reservation and room. And I did not make that purchase.  No worries, a simple call to the front desk this should",August 2022,none,none,Thank you for taking the time to share your experience about your recent stay at our hotel. We sincerely appreciate your feedback and we're very sorry you were unhappy. We will take your comments under consideration as we continually work to improve our guest experience. We hope you will consider staying with us in the future.,none,none,none,none,none,none,23,156
none,1 contribution,5.0 of 5 bubbles,Wonderful Hotel,"This wonderful hotel is extremely accommodating, I arrived earlier than expected and Gracie was able to check me in with no problems whatsoever.  Later on my AC was giving me issues, I called the front desk and a gentleman by the name of Julian was very helpful and walked me through it and we tried fixing it over the phone. We unfortunately couldn't get it to work and he send engineering right away. Exceptional staff . Will be recommending to my family and friends.",August 2022,none,none,Thank you for our kind words and recognizing Gracie and Julian. We appreciate the 5 star rating and such a wonderful review; amazing feed back. Our team looks forward to welcoming you back.,none,none,none,none,none,none,24,156
none,1 contribution,4.0 of 5 bubbles,DO NOT BOOK DIRECT,"Hotel is reasonable value for price, clean, comfortable, and well appointed. DO NOT book direct through Hilton or with the hotel itself - inventory and pricing is significantly more favorable via third party sites (specifically, agoda) and the hotel DOES NOT price match with third party sites.",July 2022,none,none,"Thank you for your feedback, we appreciate you choosing to stay with us.",none,none,none,none,none,none,25,156
none,1 contribution,5.0 of 5 bubbles,Absolutely wonderful service and staff,Hotel is very clean! A very pleasant experience! I highly recommend staying here if ever finding yourself in lake forest. The staff was very friendly to me and my family and breakfast was pretty good. Thank you to Gracie and Tawny for greeting us with a smile and helping make our stay both seem less and welcoming. I would most definitely book here again anytime we’re in town!,July 2022,none,none,"Thank you for such a wonderful review and feedback. Our team was excited to have you stay with us and looks forward to your next visit.  Gracie and Tawny appreciates your kind words, thank you for recognizing them.",none,none,none,none,none,none,26,156
none,1 contribution,4.0 of 5 bubbles,Overall very good.,"The place is clean and accessible to freeway and food. We stayed here with my family and upon arrival, the host greeted us. She seemed tired and was polite but the next morning she was there still, apparently 24 hour shift. She was then a bit short with me when I asked for ketchup. At the end, she got me the ketchup we asked for, but was very dismissive and seemed annoyed.",June 2022,none,none,Thank you for choosing to stay with us recently and taking the time to post a review. We appreciate your feedback and apologize on behalf of the team as it seems we fell short your expectations. We hope you will give us another try and the opportunity to make your next stay an amazing and 5 star experience.,none,none,none,none,none,none,27,156
2 helpful votes,1 contribution,5.0 of 5 bubbles,Amazing Property and Wonderful Stay,"This staff was so kind and attentive. We hosted a meeting in one of the conference rooms for about 60 people and throughout the entirety of it all, the staff was just so accommodating and professional.  Also, shoutout to Aloha for helping organize our event! She's absolutely such a pleasure! The property itself is so clean, modern and well kept. Several of our guests stayed overnight and were absolutely enthralled by how wonderful their stay was.   10/10",May 2022,none,none,"Thank you so much for choosing to stay with us and hosting your meeting here at the Hampton. It was our team's pleasure to serve you and your guests. Aloha, always does a tremendous job and goes the extra mile above and beyond in creating the utmost experience for her clients; so thank you for recognizing her. I sure she is thrilled that it was a perfect and amazing event. We look forward to hosting your next event in the near future hopefully.",none,none,none,none,none,none,28,156
23 helpful votes,71 contributions,5.0 of 5 bubbles,Friendly staff,My main man Lloyd at the front desk was always cheery and helpful.   Stayed Here before but this time was better than ever.   Thank you Lloyd for making me feel better when I'm not doing so well.   Will continue to stay at this property   Much appreciated,April 2022,none,none,"Thank you so much for your kind words and feedback, we certainly appreciate it.  Thanks for recognizing Lloyd as well as the rest of the team. Thank you for choosing us. Looking forward to your next stay.",none,none,none,none,none,none,29,156
2 helpful votes,6 contributions,5.0 of 5 bubbles,"""Mini-Me"" Vacay! ! Yayyy!!","Fresh, modern hotel, crisp air throughout the hotel & room..my stay was peaceful, other guests mind their own business..front-desk team is courteous, efficient, helpful, professional, mild-mannered - they're great. The service crew, just as wonderful - like Esmeralda, she's friendly, approachable, hospitable - THANK YOU; the sincerity and consistency from this crew at Hampton is very much appreciated! ! !",April 2022,none,none,Thank you for your for such and amazing review.  We are all happy that you had a great and enjoyable time while staying with us. Thanks for recognizing the team especially Esmeralda. It was our pleasure to be of service to you. We all look forward to your next vacay.,none,none,none,none,none,none,30,156
none,1 contribution,5.0 of 5 bubbles,I almost died,"That was an exaggeration just to capture some attention, but WOW these workers you got here are insanely kind and very friendly and the fact they are such a great team together makes it all better. Had laughs while checking in and definitely made me want to check in next week since I know I can enjoy my stay and feel confident I’m covered incase anything, julian and Leo and Omg we can’t forget about Mary were absolutely amazing. I can’t say it enough when I say they were such a great help. The manager who’s name is Nigel Louis; was such a great person to the point I feel like I can say he is a friend of mine At this point. Please check these people out and have them here more often",April 2022,none,none,"This review definitely caught all our attention, had to stop what I was doing to read.  Truly amazing and thank you so much. We appreciate you and the team have enjoyed having their names mention. We are happy to share in your experience and look forward to having you with us always. This is your home away from your, thank you.",none,none,none,none,none,none,31,156
none,2 contributions,5.0 of 5 bubbles,No cap! Best hotel ever!,"The bed was comfy, breakfast could’ve been better better but Yasmin recommended me to go to a little place about 10 minutes away and it was worth the drive. The front desk service overall was just spectacular and Takuya and Julian went above and beyond for me! Couldn’t ask for a better stay!",March 2022,none,none,"WOW!!! Great review and feedback. I am glad that Yasmin, Takuya and Julian went above and beyond to create at wonderful stay and experience. Thank you for your kind words.",none,none,none,none,none,none,32,156
none,2 contributions,5.0 of 5 bubbles,Great hospitality!,"Perfect place to stay! The staff here takes a lot pride what they do, whether is keeping the facilities clean to perfection or answering any questions. The front desk person, Julian, went above and beyond by showing me where the best places to eat and when I lost my room key. I will continue coming here whenever I’m town! Great job!",March 2022,none,none,"Manny, thank you for the 5 star rating and your amazing feedback.   I truly happy that our team was able to provide great hospitality and service.  Thank you for recognizing Julian, he certainly appreciates it.  The team looks forward to your next visit.",none,none,none,none,none,none,33,156
none,1 contribution,5.0 of 5 bubbles,Great,Amazing stay !! And I would definitely look at staying again and I would be happy to stay again. And the location was nice and the restrooms were very clean so that was nice. Overall stay was great. Friendly staff.,March 2022,none,none,"Thank you for a great review, excellent feedback. Just happy that you had a great experience while staying with us and we look forward to your next visit.",none,none,none,none,none,none,34,156
4 helpful votes,20 contributions,5.0 of 5 bubbles,"Omg, how did I not know about this hotel?!?","Fabulous new huge clean rooms, with plenty of plug ins, great lighting, and quiet comfortable bed. The kitchen is amply supplied, new and very clean. We stayed in room 525, facing the freeway, it was quiet and the sunsets were spectacular.  This hotel has the usual amenities,  plus a great on site laundry.  This hotel has a separate breakfast area from the adjoining hotel with fresh hot coffee all day, The location is ideal and  within easy walking distance to lots of restaurants, and right off the freeway. Also, if you’re too lazy to walk to s restaurant, the food at the hotel is remarkably good. Lots of fresh sandwich’s, and soups. The front desk personnel is attentive, responsive, and professional. Thank you",March 2022,none,none,"Yes, OMG. This is an amazing review and an acknowledgment of our team and what they offer. You said it all in your review, touch on everything and we appreciate you so much.  Thank you for choosing to stay with us, we look forward to your next visit.",none,none,none,none,none,none,35,156
