Helpful Vote,Contributions,Overall Rating,Summary Heading,Summary,Date of Stay,Room tip,Trip Type,Manager Response,Location Rating,Cleanliness Rating,Service Rating,Value Rating,Rooms Rating,Sleep Quality Rating,Review Number,Index
none,1 contribution,1.0 of 5 bubbles,"Avoid!! Hotel is under major construction and should not be being used in current condition - no food, elevators not","Hotel is unsafe in current condition - no elevators, only packaged food and plastic sheeting on all surfaces - when I complained, they said it was a ""Management issue"".  We are Hilton Diamond Members and this is unacceptable - filthy room and dust everywhere -I carried my luggage to the 3rd floor",February 2023,none,none,none,4.0 of 5 bubbles,none,none,none,none,none,1,175
13 helpful votes,15 contributions,5.0 of 5 bubbles,First Rate Airport hotel,"Southwest Airlines cancelled by flight and I had already checked out of my room at another hotel.  Wanted to stay near airport so I could get to the airport without using Uber or Lyft. This is one of the nicest and best run Hampton In. Locations in the country. The staff checking in were friendly, helpful and just pleasant. The hotel was clean and air was already on in the room. Everything was just right. In the morning they had a decent breakfast and we’re keeping everything cleaned up. Shuttle to airport was timely and driver was friendly. great people, excellent location and hotel.  Will stay here again",June 2021,none,Traveled on business,none,none,none,none,none,none,none,2,175
5 helpful votes,26 contributions,2.0 of 5 bubbles,Elevator out of service,"Made a reservation at this hotel for two adults and two teens.  When my husband arrived, he was informed that the hotel was under renovation and the elevators were not operational.  He would have to haul our luggage to the 3rd or 4th floor.  Not acceptable!  Why was this not communicated in ANY of the many ""welcome"" emails we received prior to arrival or in the confirmation.",February 2023,none,none,none,3.0 of 5 bubbles,none,none,none,none,none,3,175
none,3 contributions,1.0 of 5 bubbles,Find another site -- there are plenty in this area,"Been here many times and it was great.  Returned last week (Jan 2023) and what a disaster...  1.  Site says under construction -- ok -- but tell me you've canceled/postponed breakfast.  Had to juggle morning transportation to get a little something to eat. 2.  Water -- no hot water, any time of day 3.  Stained carpets, walls -- looks like a murder scene 4.  Bathroom mold on sink and tub 5.  Toilet constantly running 6.  Noise -- although they can't control other guests, for the week I was there a group in the parking lot every night having a little fun.  But their smoking weed and yelling at each other was too much.  There are other hotels just there on the street -- easy to get another booking at another site....",January 2023,none,Traveled on business,none,5.0 of 5 bubbles,none,none,none,none,none,4,175
none,1 contribution,1.0 of 5 bubbles,Don't be fooled by the Hampton name,"The name implies it is near the airport - but is about a good 10 minute drive versus the Hampton Inn in Irvine which is walking distance to the airport.  Both say Orange County Airport in the title - very deceptive.  If you are wanting to be near the airport, stay at the Irvine location. Since I arrived shortly after 6PM, they would not transfer the reservation to the Irvine location and I was forced to keep my rental car another night and pay an $18 fee to park in a mostly empty lot. The furnishings were old and the bathtub was very dirty - would not even use it to shower. I have never seen such a dirty tub in a hotel.  An obvious ring of dirt on the sides and bottom of the tub. I have stayed in many Hampton Inn locations.  This one does not deserve the name.",November 2022,none,none,none,1.0 of 5 bubbles,none,none,none,none,none,5,175
none,1 contribution,1.0 of 5 bubbles,Construction on every floor including breakfast area and constant loud noises,Horrible stay for 6 days. Loud construction on every single floor with parking area full of old furniture and garbage. And no area to eat complementary breakfast. I ask the staff about condition of the rooms and was told that is was not really their problem,November 2022,none,none,none,2.0 of 5 bubbles,none,none,none,none,none,6,175
none,none,5.0 of 5 bubbles,Best Bartender,Go see Austin at the hotel bar. His old fashioned is beyond compare. His attention to detail goes unmatched with the best bartenders in the area. He also sprinkles it with just a little crave to keep you ordering more.,November 2022,none,Traveled on business,none,none,none,none,none,none,none,7,175
none,4 contributions,1.0 of 5 bubbles,"This hotel is currently under remodel, which it definitely needs, but should be avoided at all costs.","My room had not been remodeled, extremely worn out.  This hotel charges $18 for parking, but the parking lot is full of construction trucks and containers.  NO HOT WATER in the morning.  The hotel representative stated that the boiler was out, and she was wafting for a plumber to repair.  I will never return to this hotel.   There was no breakfast room, which I guess was going through remodel.",October 2022,Do NOT use this hotel,Traveled on business,none,none,none,none,none,none,none,8,175
none,2 contributions,1.0 of 5 bubbles,Worst Hampton Inn in US,"I’m writing this after spending less than 30 minutes in this hotel… 1- lobby/check-in area under construction, big trucks armed in various places making tight lot even tighter 2- they wanted to charge $18 for parking…I said no, not doing it - at least they waived it  3- I walk into room and A/C not on…it’s smoldering, thermostat says 77; I turn it up full blast at 65 (lowest it goes) and it’s barely sputtering 4- the bed feels like it’s from 1970, sheets/blanket feel like sandpaper  DO NOT STAY HERE!!! I’m a HHonors member using points to stay here…if it wasn’t 9 PM I’d cancel and leave. There are other options nearby - pay the extra and be comfortable!",October 2022,none,Traveled solo,none,none,none,none,none,none,none,9,175
4 helpful votes,2 contributions,1.0 of 5 bubbles,Worst Hampton Inn I ever stayed at! AVOID!,"On August 17th, 2022, my family and I had the misfortune of staying at the Hampton Inn located at 2720 Hotel Terrace, Santa Ana, CA 92705.  We had made reservations months in advance at this Hampton Inn to attend our son's master's degree graduation ceremony. Two rooms were reserved. One of the room requests reserved was for a two queen size bed and sleeper sofa accommodation. The second room, which was ours, was supposed to be a room with two queen sized beds. We travelled from South Carolina to California and expected the kind of excellent service from Hampton Inns that we are accustomed to receiving.  The first thing we noticed when we arrived was the old and musty smell of the hotel. At check in, we were informed that the room for our son did not have a sleeper sofa. The",August 2022,The parking area is very small and cars have to be double-parked; a guard was there to move cars...,none,none,3.0 of 5 bubbles,none,none,none,none,none,10,175
3 helpful votes,4 contributions,3.0 of 5 bubbles,Close enough to Disneyland,"This property is currently under remodeling so there is potential, however, Im not sure when it will be completed. We stayed here because it was close enough to Disneyland, and decently priced without having to stay at a motel. You get what you pay for with this property. We came in pretty late (1am) and apparently we were put in the last room they had available. Very spacious room but someone may have had the room before us and switched out because the toilet was used. Luckily I had some Lysol cleaning wipes and we just dealt with it on our own because it was so late and we had to wake up early to go to Disneyland the next day. Bed was comfortable and sheets were cleaned. You can hear the sounds of running pipes all night. We also had very noisey upstairs neighbors who were",October 2022,none,none,none,none,none,none,none,none,none,11,175
3 helpful votes,2 contributions,1.0 of 5 bubbles,Deplorable Room Conditions,Bathtub enamel is eroded horribly.  Caulking line has mold.  Air conditioners are antiquated and ineffective. Cutbacks in service abound:  no daily room service. You have to hunt down a maid when towels are needed. No soft drink for Diamond Members at chedkin anymore. Ice machines are almost always inoperative.,October 2022,none,none,none,none,none,none,none,none,none,12,175
43 helpful votes,57 contributions,1.0 of 5 bubbles,Dump..!,OMG..the pictures that were on this site were so misleading.  This place is nothing like the pictures at all.  By far the worse looking Hampron Inn I've been to..!  The rooms are way too small to call it a suite.  The plumbing is horrible..!  When some one flushes the toilet from the floor above you can hear the water rushing down from the pipes in my restroom..!  Parking is so small that they have to double stack card using a valet.  A valet at the Hamptons .. really??,October 2022,none,none,none,none,none,none,none,none,none,13,175
none,1 contribution,1.0 of 5 bubbles,Zero stars,"If I could leave a zero I would… This place was under renovation, it wasn’t what we expected from a Hilton hotel whatsoever. No ironing board (we had to ask like three times), they ran out of towels and gave us pool towels to use. They don’t clean rooms every day, so we had towels piling up in our room the entire stay. I left my AirPods there on accident when we were checking out and called them back about an hour after we left to ask them to look, they didn’t get back to me. I called again, I was put on hold twice and both times they said it wasn’t there. I tracked them and they were at the hotel last, so that’s weird… so don’t leave anything behind, but I guess an apology will make it better if you do.",September 2022,none,none,none,none,none,none,none,none,none,14,175
none,1 contribution,1.0 of 5 bubbles,Stay away from this hotel! Your health is at risk!,"Stayed there between August 14 to August 19, 2022. There is no room service! If you require room service you must request it the morning of & it depends on whether there is staff available. We had to request toilet paper 3 times before it was delivered & that was only after physically speaking to the front desk (phone & nothing happens). When they did deliver the toilet paper it was 1 roll, for a family of 3 staying 6 days this is unacceptable. The electrical outlets at the bed did not work. I was unable to plug my CPAP unit in the first night & my family & myself were all kept awake and had a restless night when we had a full day of events planned the next day at a theme park. Outrageous! The furniture is old and creaky, possibly hazardous if it falls apart while sitting on it.",August 2022,none,none,none,none,none,none,none,none,none,15,175
none,1 contribution,4.0 of 5 bubbles,Great hotel with great customer service,"I can not say enough about the staff at this hotel. Everyone that we spoke to was polite and friendly.  They did an amazing job!  The hotel was clean, but could use a few updates.  We would stay there again.",August 2022,none,none,"Dear DebBob13,  Thank you for your feedback. We greatly appreciate all the kind comments regarding our staff! We recently started our renovations and hope to be done before the end of the year. We hope to see you again, next time you visit the Santa Ana area!  Kind Regards, Robert Flores",none,none,none,none,none,none,16,175
none,1 contribution,1.0 of 5 bubbles,Really run down hotel,"Aging property that needs a complete overhaul. Multiple things in room broken: desk chair, hooks by door, towel rack and hook… and there is mold in the bathtub. I agree with other posters that parking is a disaster. Staff have been friendly for the most part but that is the only upside to this place. With so many options nearby, opt for something else. I’m Hilton Diamond and wish I had stayed at the similarly-priced Doubletree or the other airport Hampton Inn.",July 2022,none,none,"Dear ugaindc,  Our sincere apologies about the inconvenience you may have faced during your stay. We can assure you that we take pride in ensuring our guest all rooms are cleaned thoroughly. We will be going through two renovations this year to address the wear and tear you may have come across. Thank you for bearing with us during this transition phase and we hope to see you again after our renovations.  Kind Regards, Robert Flores",none,none,none,none,none,none,17,175
none,1 contribution,5.0 of 5 bubbles,"Clean, convenient, and affordable!","Hampton Inn by John Wayne airport is very convenient, clean and affordable. Erick, at the front desk, is helpful and friendly. My highlights include the on site snack bar. You buy ice cream to cool down! Guests can enjoy complimentary  breakfast. The Hall, a food court, is within a walkable distance. I would recommend staying here!",July 2022,none,none,"Dear tamtams77,  Thank you for your feedback. We greatly appreciate all the kind comments regarding your recent stay. We hope to see you next time you are in the Santa Ana area.  Kind Regards, Robert Flores",none,none,none,none,none,none,18,175
5 helpful votes,2 contributions,1.0 of 5 bubbles,Rude Staff and Dump of a hotel.,"The lady at the front desk is rude (Aileen). The hotel is dirty and run down, The parking  is a mess. Your car will get blocked in from cars parking along the red curbs, I'm a Hilton Honors member and expected better standards. Usually the Hiltons are nice but this place is a rat hole. They offer breakfast but you would have to be nuts to eat anything from here. The room was gross. I left because I couldn't have my family sleep  here. The ""excellent"" reviews have to be bots or former inmates. Avoid this nasty hotel. Sleeping in your car is a better option.",July 2022,none,none,"Dear mikecarrillow14333,  We deeply apologize about the inconvenience you may have faced during your stay. We can assure you that we take pride in ensuring our guest all rooms are cleaned thoroughly. We will be going through two renovations this year to address some of the wear and tear you may have come across. Thank you for bearing with us during this transition phase and we hope to see you again after our renovations.  Kind Regards, Robert Flores",none,none,none,none,none,none,19,175
none,1 contribution,5.0 of 5 bubbles,Location and staff excellent,"We stayed here for our grandson's hockey tournament. The staff, especially Dylan, was friendly, accommodating, and efficient. Rooms were clean and well maintained. The location was excellent as there are a number of hotels nearby along with easy access to restaurants and expressways. Breakfast was good and well maintained. Pool is a little small but certainly sufficient for kids and as a nice place outside to ""hang"". There is a charge for parking, however.",July 2022,none,none,"Dear CorinnebE7832CJ,  Thank you for your feedback. Great to hear that Dylan was friendly and accommodating throughout your stay. We hope you will visit us next time you are in the area.  Kind Regards, Robert Flores",none,none,none,none,none,none,20,175
none,2 contributions,5.0 of 5 bubbles,Super friendly staff and service excellence,"I am a Hilton Diamond member and I stay in a lot of Hilton properties.  I always make it a point to call-out above and beyond service.  It's been a while since I have been moved to write a review to recognize someone, let alone a team of people.  However, the staff at Hampton Inn Santa Ana has made such an impression in such a short time that I am compelled to compliment and thank the front desk staff.  I have had interactions with Dylan, Erin, and Vincent and have been impressed by Dylan's unmatched service-with-a smile, team spirit and truly friendly demeanor, Erin's ability to deal with challenging guests and remain a model Hilton team member during the interaction with grace and professionalism, and Vincent personally ensuring our stay was comfortable and delivering some",July 2022,none,none,"Dear Texastone62,  Thank you for your feedback! We are thrilled to hear that Dylan, Erin & Vincent went above and beyond during your stay! We are grateful to have them with us. We hope to see you again, next time you visit the Santa Ana area.  Kind Regards, Robert Flores",none,none,none,none,none,none,21,175
none,1 contribution,1.0 of 5 bubbles,This place is a nightmare. If you value your health.  Go elsewhere.,"This place is very dirty. The bathroom has mold issues and there are leaks behind the toilet. The tub has trouble draining.  The toilet doesn't flush well.  It is really old and poorly maintained.  The front desk staff is rude. You see a bunch of them there and they aren't doing anything but socializing with each other.  This place is under staff during the night (after 10 pm)  to early morning hours.  The staff that serviced the breakfast room was nice.  Come to think of it, I shouldn't have eaten their breakfast since the kitchen may be poorly maintained too???? I just hope I didn't catch anything from my stay at this place.",May 2022,none,none,"Dear janemF379BK,  Thank you for taking time write a review,  I would like to apologize that our services fell short of your expectation. We will be going through two renovations this year to address a lot of the issues you may have come across throughout your stay. We hope you will consider us next time you visit the Santa Ana area.  Once again, I would like to thank you for your review.  Kind Regards, Robert Flores",none,none,none,none,none,none,22,175
none,1 contribution,5.0 of 5 bubbles,"Friendly, helpful staff","Checked in for the night and had an issue with the heater in my room. Erin and Rina tried to get the heater working but to no avail. So Erin arranged to  change rooms, made sure the heater was working and checked in with me to make sure everything was fine after changing rooms.  I appreciate their help and assistance in trying to make everything as easy And comfortable as possible.   Erin has a kind demeanor and went above and beyond to make sure I taken care of.  Having wonderful, friendly customer service is the difference between a good stay and a great stay.",June 2022,none,none,"Dear Umatissa,  Thank you for your feedback. We greatly appreciate all the kind comments regarding your recent stay. Great to hear ""Erin & Rina"" were trying their best in addressing the issues you may have had. We hope to see you again, next time you visit the Santa Ana area.  Kind Regards, Robert Flores",none,none,none,none,none,none,23,175
10 helpful votes,99 contributions,4.0 of 5 bubbles,Good location and good price,"The hotel is in a great location, and they serve breakfast. And the price is good for families. We have stayed at this location before.  It’s close to beaches and good restaurants.  We will be returning in the future.",June 2022,none,none,"Dear monav331,  Thank you for your feedback. We greatly appreciate all the kind comments regarding your recent stay with us. We look forward to seeing you next time you visit the Santa Ana area!  Kind Regards, Robert Flores",none,none,none,none,none,none,24,175
36 helpful votes,31 contributions,1.0 of 5 bubbles,Dangerous mold and leaks,"I felt an obligation to post: this place is dangerous. Our room was dirty, toilet leaking and to top it off leaking shower wall resulting in mold and mildew. Scary part: reception was aware of it (obviously) and put us there because there are no other rooms. Are you crazy?!? Then don’t sell rooms like that. This is not one day or one week of mold. We ran out of there as soon as we could.",June 2022,none,none,"Dear tsgreattrip,  We deeply apologize about the inconvenience you may have faced during your stay. We can assure you that we take pride in ensuring our guest all rooms are cleaned thoroughly. We will be going through two renovations this year to address some of the wear and tear you may have come across. Thank you for bearing with us during this transition phase and we hope to see you again after our renovations.  Kind Regards, Robert Flores",none,none,none,none,none,none,25,175
none,1 contribution,4.0 of 5 bubbles,Great staff,The staff was wonderful and really personable and accommodating. Specifically the staff member Ailene was so fun and so helpful! She was attentive and speedy in getting us extra towels and blankets to make our stay more comfortable.,June 2022,none,none,"Dear malorys201,  Thank you for your feedback! We are thrilled to hear that ""Ailene"" was very attentive and quick about providing you extra towels and blankets. She is truly a treasure to have with our team! We hope to see you again, next time you visit the Santa Ana area.  Kind Regards, Robert Flores",none,none,none,none,none,none,26,175
none,1 contribution,4.0 of 5 bubbles,Good workers,"I am writing this review because of how nice,caring and friendly the workers were one that stood out was Dylan me and my friends and my family had just came back from a soccer tournament it was late and we just wanted to relax in the hot tub so we whent. Later on we realized that the people befor us took the last towels and with out even asking Dylan came out brought us all towels. We thanked.him and he told us to have fun and be done before 10:00 so we did.we had fun but before we knew.it it was 10:20 we had lost track of time. So Dylan came out and told us the time so we left and thanked him again.",May 2022,none,none,"Dear matteodW1398DE,  Thank you for your feedback! We are thrilled to hear how great Dylan was with assisting you! He is certainly a treasure to have with us. We hope to see you again, next time you visit the Santa Ana area.  Kind Regards,  Robert Flores Front Office Manager Robert.Flores@Hilton.com Hampton Inn & Suites Santa Ana/Orange County Airport 2720 Hotel Terrace Drive, Santa Ana, CA 92705 Phone: 714-556-3838 Fax: 714-241-1008",none,none,none,none,none,none,27,175
none,1 contribution,1.0 of 5 bubbles,Horrible experience,"We purchased a jacuzzi room suite and when we checked into our room we discovered it didn't work! The staff said there was nothing they could do for us! We ended up leaving right away! I do not recommend this hotel! Go to mainstay across the street, much better",May 2022,none,none,"Dear knbourque80,  Thank you for your feedback. We deeply apologize about the inconvenience you may have experienced. Our team is looking into this issue to ensure you it is addressed. We will be going through renovations this year for our bathrooms to enhance our guest experience. We hope you will consider us next time you visit the Santa Ana area.  Kind Regards, Robert Flores",none,none,none,none,none,none,28,175
21 helpful votes,73 contributions,2.0 of 5 bubbles,Wish I had read the reviews before booking here,"This has to be one of, if not the worst Hampton I have ever been in.  I was able to check in early which was great. I asked for 2 waters instead of 1 water/1 snack (Lifetime Diamond status) and was told that the choice is for 1 of each, but was given 2 waters. (That is always my choice at Hamptons and I have never been refused.  The extra room in the suite was great, however it was the darkest 2 rooms I have ever been in. Other than the 2 wall lamps on each side of the bed, there were no other lights in the bedroom. Working at the desk with the bed lights on after dark was very difficult. There was 1 floor lamp in the living room, too big to move near the desk. from the power strips (one in living room for coffee pot, one near bed on bathroom side and one on desk, only 1",May 2022,none,none,"Dear califcajin,  Thank you for your feedback. We will be going through two renovations this year to enhance our guest experience and address a lot of the issues you have mentioned. We thank you for bearing with us during this transition phase and hope you will consider us next time you visit the Santa Ana area.  Kind Regards, Robert Flores",none,none,none,none,none,none,29,175
2 helpful votes,8 contributions,1.0 of 5 bubbles,DO NOT STAY HERE IF YOU VALUE THE HILTON BRAND !,"This is by far the sorriest excuse for a Hilton sponsored property I have ever experienced! No fresh towels until you bring your dirty ones back to front desk. Hidden charges applied at check out for parking. I rode with colleagues and had no car but was still charged with $15 parking fee per day. I was specifically asked my car tag at check in and informed them then i had no car! It took me me several phone calls, leaving messages for manager, to finally get that refunded. Staff are rude and unhelpful if you can find one and / or get them off thier phone. Furthermore, there is no coffee until 6:30 when breakfast opens. Needless to say, this was a horrible experience for myself and colleagues!",April 2022,none,none,"Dear Sherry R,  Thank you for your feedback. We have gone ahead and refunded the parking charges several days ago. We deeply apologize about the inconveniences you may have faced during your stay. Unfortunately, we have been a bit short staff lately and thank you for bearing with us. Our breakfast staff makes a fresh batch of coffee early morning and might've been within the 15 minutes when you might have missed it, we thank you for your patience again. Our team will go over your feedback to try and make the necessary adjustments to enhance our guest experience.   Kind Regards, Robert Flores",none,none,none,none,none,none,30,175
