Helpful Vote,Contributions,Overall Rating,Summary Heading,Summary,Date of Stay,Room tip,Trip Type,Manager Response,Location Rating,Cleanliness Rating,Service Rating,Value Rating,Rooms Rating,Sleep Quality Rating,Review Number,Index
none,1 contribution,5.0 of 5 bubbles,Great stay,"Great service, clean room and comfortable bed. The gym and pool were pleasant as well. The quality of this hotel to the ones around it was outstanding. I had reservations somewhere else but the room was terrible and I didn't stay. They got me right in and took great care of us quickly. No comparison to the others in area this was take the lead by far.",November 2014,none,none,"Thank you for taking the time to provide feedback about your recent stay at the hotel.  I was very pleased to read ""Great service, clean room and comfortable bed"" .  I will let the staff know about your experience.  We look forward to your return.  John McIff",none,none,none,none,none,none,799,175
none,1 contribution,5.0 of 5 bubbles,Completely satisfied!!!,"The staff at this hotel was courteous and accommodating. The hotel was spotless, as was my room. Breakfast included a wide array of options that were always fresh &/or hot. It is conveniently located for the Santa Ana/Irvine area. I would recommend to anyone!!!",November 2014,none,none,"Thank you for taking the time to provide feedback about your recent stay at the Hampton Inn & Suites.  I am very pleased to know that you found the hotel to be spotless, the breakfast to be hot, and the staff to be courteous.  We look forward to your return.  John McIff",none,none,none,none,none,none,800,175
44 helpful votes,30 contributions,5.0 of 5 bubbles,Can't fault it,I recently stayed at this hotel with my two daughters for three nights. We were very comfortable with a separate bedroom/living area.  The breakfast area was beautiful and the pool area was lovely.  Everything is excellent.  The sofa bed was the best we've had and we've travelled extensively.  It wasn't springy and uncomfortable like we've come to expect.  The hotel has close freeway access and easy access to the beaches.  I highly recommend it.,November 2014,none,none,"Thank you for taking the time to provide feedback about your recent stay at the Hampton Inn & Suites Santa Ana/Orange County Airport.  I was very happy to read ""Everything is excellent"".  I am glad you found the newly remodeled rooms with brand new pull out sofas to be very comfortable.  I hope you and your family have an opportunity to return and be a guest in our home again.  Thank You, John McIff",none,none,none,none,none,none,801,175
57 helpful votes,31 contributions,5.0 of 5 bubbles,Inexpensive but comfortable in Santa Ana,"This hotel provided clean rooms, a pleasant physical plant (including outdoor pool and hot tub), and hot breakfast daily 6-10 am.  It was near a concert venue we were attending, and even though we did not fly there, we selected this airport location which was very convenient and we had a great stay.",November 2014,none,none,"Thank you for taking the time to provide feedback and rate your recent stay at the hotel.  I am glad you found the location convenient, the breakfast met your needs, and the room to be clean and comfortable.   The staff works very hard to ensure a 5 star experience for each guest.  We look forward to your return.  Thank You, John McIff",none,none,none,none,none,none,802,175
78 helpful votes,209 contributions,5.0 of 5 bubbles,**VERY NICE ROOMS**,"This is a great hotel very close to John Wayne Airport.    The rooms are like a small apartment.   You have an office space, a bathroom, a bedroom, and a living room all separated.    It doesn't feel like you are staying in an apartment.    Free parking is great too.     It is only a 15 minute drive to Corona Del Mar beach.     And, believe me, you will want to take that drive.   it is also 15 minutes to Orange Outlets.    There is a gas station around the corner.    The only thing I would say would make the hotel better is if there were more options to eat close by.   Del Taco is within walking distance but everything else is a mile or more drive.     Great hotel.",November 2014,none,none,"Thank you for taking the time to provide feedback about your recent stay at the hotel.  I was very pleased to read ""The rooms are like a small apartment. You have an office space, a bathroom, a bedroom, and a living room all separated.""  I am glad the location met your needs as well,  we are centrally located to many attractions, beaches, and the airport as well.  The staff and I hope you have an opportunity to return soon.  Thank You, John McIff",none,none,none,none,none,none,803,175
88 helpful votes,102 contributions,4.0 of 5 bubbles,"Friendly Staff, Good Location","My group stayed at this hotel while visiting Disney Land.  The location is good, a short drive from JWA, and Walmart and Target are less than a mile away.  Not the best place to stay if you're going to Disney (a 20 minute drive).    The hotel is a typical Hampton: good breakfast, clean rooms, and fresh duvet cover. The beds were hard but not back-breaking hard.  The decor was a little worn.  It had a decent fitness room, pool, and free parking.  Basic WiFi was also free but it was unreliable. I also found the WiFi in the lobby to be spotty. The staff was friendly and helpful.   Overall, it was a good hotel and I'd recommend it if you need a hotel close to the airport.",October 2014,none,none,"Thank you for taking the time to provide feedback about your recent stay at the hotel.  I am pleased to know that you found the location to be convenient just a short distance to attractions, beaches, and the airport.  I was also please to read "" good breakfast, clean rooms, and fresh duvet cover"" and that you found the staff to be friendly and helpful.  the staff and I hope you have an opportunity to return and be a guest in our home again soon.  Thank You, John McIff",none,none,none,none,none,none,804,175
none,1 contribution,4.0 of 5 bubbles,Nice hotel,"I only stayed here for one night for a business trip but I was overall pleased with my choice.  I don't travel often so my ability to compare is limited but I felt this was a good value for the money.  In that area there were a few less expensive hotels and a couple more expensive so I split the difference.  I actually had a room with two beds and it was more than enough room (even if I had my wife and two small kids it would have been fine).  There were two TV's in the room and there was a good amount of seating to accommodate up to four people.  The bed I slept in was a bit firm for my preference but that's just me.  The bathroom was a good size, and there was plenty of hot water.  I was only in the hotel for one night and didn't use the amenities but I walked by the fitness",October 2014,none,none,"Thank you for taking the time to provide feedback about your stay at the hotel.  I am pleased to know that the hotel met all of your needs.  We look forward to your return.  Thank You, John McIff",none,none,none,none,none,none,805,175
none,1 contribution,5.0 of 5 bubbles,Excellent,"I'm an airline pilot who stays in a LOT of hotels.  This was one of the all time top regular hotels I've seen.  Looks, cleanliness, staff, bed, quiet, location...... everything was excellent. Stay here if you've a chance.",October 2014,none,none,"WOW!  Thank you for taking the time to provide feedback about your recent stay at the hotel.  I will pass your comments on to every member of the staff who w=each work so hard to ensure a pleasant stay for every guest.  I was so pleased to read ""airline pilot who stays in a LOT of hotels. This was one of the all time top regular hotels I've seen. Looks, cleanliness, staff, bed, quiet, location...... everything was excellent. Stay here if you've a chance""  We look forward to having you as a guest in our home again soon.  Thank You, John McIff",none,none,none,none,none,none,806,175
none,1 contribution,5.0 of 5 bubbles,SoCal visit,"I enjoyed staying at this Santa Ana Hampton Inn, as I do most Hamptons. I like that the duvet cover is washed for every new occupant. A microwave, refrigerator, and safe were supplied. Wifi and parking were free. Good oatmeal for breakfast! Staff was friendly and helpful.",October 2014,none,none,"Thank you for taking the time to provide feedback and rate your recent stay at the hotel.  I am very proud of the hotel and each staff member each time we earn a 5 star rating.  I was very pleased to read "" I like that the duvet cover is washed for every new occupant. A microwave, refrigerator, and safe were supplied. Wi-Fi and parking were free. Good oatmeal for breakfast! Staff was friendly and helpful.""  I hope you have an opportunity to return soon.  Thank You, John McIff",none,none,none,none,none,none,807,175
1 helpful vote,4 contributions,4.0 of 5 bubbles,Nice recent renovation!,"This property was just redone from top to bottom.  Hotel exterior, common areas, rooms and furniture just totally redone.  The property really needed this revamp and it was well done.  About the only negative I can think of is that the AC units were not replaced during the renovation and I have had two rooms now where the AC unit is a bit noisy.",October 2014,none,none,"Thank you for taking the time to provide feedback about your recent stay at the hotel.  We are very proud of the complete hotel renovation that was just completed at the property.  I hope you have an opportunity ti return and be our guest again soon.  Thank You, John McIff",none,none,none,none,none,none,808,175
1 helpful vote,2 contributions,4.0 of 5 bubbles,Great experience,"This hotel is great, nice clean and comfortable rooms. Stayed here for 3 nights with my family on a recent visit to southern California. I will stay here again on future visits. Easy access to freeway and close to food and shopping.",October 2014,none,none,"Thank you for taking to time to provide feedback about your recent stay at the hotel.  I am so pleased to read that you had a ""Great Experience""  while you were a guest at the Hampton Inn & Suites Santa Ana/Orange County Airport.  I will let the staff know that you found our rooms clean and comfortable as well.  I hope you have an opportunity to return soon.   Thank You, John McIff",none,none,none,none,none,none,809,175
none,1 contribution,4.0 of 5 bubbles,Business,"Hotel was convenient to Anaheim Convention Ctr (business convention) and ""The District"" mall.  Very friendly courteous staff.  Breakfast was very good. Price was extremely reasonable for the quality.  Only complaint was a noisy fan somewhere in the duct work that was distracting at night.",October 2014,none,none,"Thank you for taking the time to provide feedback about your recent stay at the hotel.  I was very pleased to read "" Very friendly courteous staff. Breakfast was very good. Price was extremely reasonable for the quality"".  I know every member of the staff wants to exceed every guests service and cleanliness expectations.  We hope you have an opportunity to return soon.   Thank You, John McIff",none,none,none,none,none,none,810,175
4 helpful votes,4 contributions,4.0 of 5 bubbles,Comfortable Stay,"We stayed 8 nights in April 2014.  Room was a bit dated but clean.  Check in was quick and easy as was check out.  Breakfast was more than adequate for continental breakfast!  Pool area nice....we used the hot tub but not the pool, as the water in the pool was too cold for our liking.  Not crazy about the round about way of getting to the pool.  We didn't have an issue with parking any of the 8 nights we were there.  All in all we enjoyed our stay and would stay there again when visiting So. CA.",April 2014,none,none,"Thank you for taking the time to provide feedback about your recent stay at the hotel.  I am pleased to know your stay was pleasant and you enjoyed the pool as well as the complimentary breakfast.  I did notice your feedback about the room being a little dated.  Since your visit we have completed a renovation on the rooms.  The staff and I hope you have an opportunity to return and see the remodeled rooms and beautiful new lobby.  Thank You, John McIff",none,none,none,none,none,none,811,175
none,2 contributions,5.0 of 5 bubbles,Hampton repeat customer,"If you are looking for comfort at a reasonable price, this is the place. I have stayed here many many times with only good experiences. The rooms are very clean and recently upgraded. The employees are the best!",October 2014,none,none,"Thank you for taking the time to provide feedback about your recent stay at the hotel.  I was very happy to read "" I have stayed here many many times with only good experiences. The rooms are very clean and recently upgraded. The employees are the best!""  I will be sure and make the staff aware of your good experiences!  We look forward to your return.  Thank You, John McIff",none,none,none,none,none,none,812,175
9 helpful votes,27 contributions,5.0 of 5 bubbles,"Comfortable, spacious room","My daughter, infant granddaughter, and I were in the area for a combined business/pleasure trip. We spent one night in a suite furnished with two queen beds. We were pleasantly surprised by the amount of space, which was helpful for our needs. The breakfast has something to satisfy everybody's likes. The room was very clean and the beds were quite comfortable. The complimentary internet service worked very well. We appreciated the free parking. We did not have time to explore the pool area. We would consider staying here again.",October 2014,none,none,"Thank you for taking the time to provide feedback about your stay at the hotel.  I am very pleased to know that each feature of the hotel was able to meet your needs from the spaious suites to the complimentary breakfast, free parking, and of course the free internet.  We look forward to your return.  Thank You, John McIff",none,none,none,none,none,none,813,175
97 helpful votes,105 contributions,5.0 of 5 bubbles,Excellent all the way around,"I have the need to stay near Tustin several times a month during the school year.  I have been recently staying at the newer Marriott properties in Tustin, but my preferred one is just a bit more than I want to pay.  I have been wanting to try the Hampton, but sometimes it also a bit on the high side compared to many of the other properties right in that location.  This week, it was not.  The price was reasonable so I gave it a try.  We were greeted by a very friendly person at the front desk.  The entire stay, I noticed staff around doing things to make sure the property was clean and appealing.  Our room was great.  It was a double queen and very large, with a nice workspace.  The bathroom was adequate.  The fridge was larger than at some hotels.  The internet was fast enough",October 2014,none,none,"thank you for taking the time to provide feedback about your recent stay at the hotel.  I was very pleased to read you found the complimentary breakfast to exceed your expectations and you found the staff to be friendly.  I hope you have an opportunity to return soon.    Thank You, John McIff",none,none,none,none,none,none,814,175
17 helpful votes,82 contributions,3.0 of 5 bubbles,"Bad start, but fine in the end.","We checked into the hotel around 8pm with a reservation for a one bedroom king suite with separating door (the reservation clearly stated the door). When we got there, my son was with me and I joked that his energy was the reason we needed the two rooms. She told me the room was ready with two queens, but assured me there was a door. I got to the room, only to find a standard room, not a suite. When I returned to the front desk, I was given many excuses for why my room wasn't available (priority to Hilton Honors people - I am one; third party website glitch - I made it through the hotel site) then I was told that the only room left was a corner suite with no separating door. Turns out, it was exactly what I reserved, with the door, and was on the corner (apparently, the corner",October 2014,none,none,none,none,none,none,none,none,none,815,175
35 helpful votes,86 contributions,4.0 of 5 bubbles,great value for hotel district,We were wanting to hang out in Downtown Santa Ana.  These are the closest hotels to the area worth staying in.  20 minutes away.  We are fans of Hampton Inns for cost and services.  This one fits right  in.  Not fancy but nice and efficent.  Comfortable beds. Clean.  Comes with breakfast.  And you can grab one to go also.,September 2014,none,none,"Thank you for taking the time to provide feedback about your experience while at the hotel recently.  I am pleased to know that Hampton Inn's have provided the comfort , consistency, and service that you are looking for.  I am also glad to know you have found the same comfort, amenities, and service while staying at our hotel.  We look forward to having you as a guest in our home again.    Thank You, John McIff",none,none,none,none,none,none,816,175
5 helpful votes,4 contributions,5.0 of 5 bubbles,ExcellentHotel,"I highly recommend this hotel.  The rooms were  excellent, the staff was excellent, the location is great, and the price is reasonable.  The pool and hot tub were in excellent shape; eating establishments were a short drive away.",September 2014,none,none,"Thank you for taking the time to rate and review your recent stay at the Hampton Inn & Suites Santa Ana/Orange County Airport.  Wow, I was very happy to read that your stay exceeded your expectations for service and amenities you were able to use while a guest in the hotel.  I was also very pleased to read ""I highly recommend this hotel. The rooms were excellent, the staff excellent, the location is great, and the price is reasonable. The pool and hot tub were in excellent shape.  We hope you have an opportunity to return son. Thank You, John McIff",none,none,none,none,none,none,817,175
none,1 contribution,5.0 of 5 bubbles,"Great Value, nice place!","We stayed here one night for the Sand Sports Super Show. Our teenager wanted to hang out in the room and play on his XBox, set him up with snacks, got him settled into the pullout sofa and hooked up to the TV, he was very happy and comfy! Husband and I did not hear him at all with our bedroom door shut! Very clean, comfy, comp shuttle was the selling point to/from the SSSS for us.",September 2014,none,none,"Thank you taking the time to review your recent stay at the hotel.  I am very pleased to know that you found the hotel to be "" Very clean, comfy"".  I am glad the staff and amenities of the hotel met your family's needs.  See you for next year's Sand Sports Super Show.  Thank You, John McIff",none,none,none,none,none,none,818,175
none,2 contributions,4.0 of 5 bubbles,Good choice,"You generally won't go wrong staying in a Hampton Inn wherever you go. Rooms are consistent and clean, staff is courteous, breakfast is good. This particular one is about 8 minutes from John Wayne airport, amongst many other choices. Shuttle to take you anywhere close.",September 2014,none,none,"Thank you for taking the time to provide feedback about your recent stay at the Hampton Inn & Suites.  I am glad you have found a home with Hampton Inn.  The staff and I strive to make every guest feel at home.  We look forward to yur return. Thank You, John McIff",none,none,none,none,none,none,819,175
none,1 contribution,5.0 of 5 bubbles,Great hotel,"This is an overall great hotel and I was pleased with my stay. The room was quiet, spacious and clean. The housekeeping staff were so hardworking and kind. Breakfast selection was great, they have an outdoor pool and fitness center as well. It is close to the airport and they also provide a shuttle to take you places nearby. They offer complimentary valet as optional parking. I would recommend this hotel to both families and corporate travelers.",September 2014,none,none,"Thank you for taking the time to comment on your recent stay at the hotel.  the staff wil be pleased to know that you found "" The room was quiet, spacious and clean. The housekeeping staff were so hardworking and kind. Breakfast selection was great""  I will pass your comments along to the staff and we hope you have an opportunity to return soon. Thank You, John McIff",none,none,none,none,none,none,820,175
none,6 contributions,4.0 of 5 bubbles,Our goto hotel,May family and I (independently at times) have stayed here many times going to Southern California to visit family members (Qrtrly+ per year).  We will be back this fall 2014. The service is excellent and I love the suite offerings.,September 2014,none,none,"Thank you for taking the time to review your recent stay at the hotel.  I am very pleased to know that you have experienced excellent service while at the property.  The staff and I look forward to your next visit. Thank You, John McIff",none,none,none,none,none,none,821,175
45 helpful votes,98 contributions,5.0 of 5 bubbles,I'd stay again,"5 star, with 1 star internet service. Easy to get to, top quality hotel with super friendly and helpful staff. Excellent free breakfast. Almost impossible internet access, though, as it seemed the router was insufficient strength to reach the room with it's signal.",September 2014,none,none,"Thank you for taking the time to provide feedback about your recent stay.  I was very pleased to read that you found the staff to be""super friendly and helpful"" and the breakfast to be execellent"".  We are making upgrades to the internet service.  We look forward to your return.    Thank You, John McIff",none,none,none,none,none,none,822,175
68 helpful votes,67 contributions,3.0 of 5 bubbles,"Seemed old and tired, but they are trying","The place is getting redone, but we were in a new room, and it wasn't really finished... Of all the Hampton Inn's I have stayed in, this was one most disjointed..  Lots of other choices right around the area you may want to look at....",June 2014,none,none,"Thank you for taking the time to provide feedback about your stay in June.  The hotel has completed a renovation since your last visit to the property, I hope you have an opportunity to return and see the finished product.    Thank You, John McIff",none,none,none,none,none,none,823,175
1 helpful vote,1 contribution,5.0 of 5 bubbles,A+ from our family,"I commend the hotel staff and management, especially General Manager John Mciff. They all do a terrific job and were very professional and accommodating throughout our 8 day stay. It was great to see management greeting guests each morning during breakfast and helping to address any needs. Breakfast consisted of a nice selection of hot, cold and healthy choices to start each day and the main hot courses changed day to day. Our room was updated, clean and quiet. The pool and hot tub were refreshing and well maintained amenities. To top that, free parking, a short drive to the Districts for some great food and 15 minutes to the beach.  This hotel certainly deserves some excellent online reviews.",August 2014,none,none,"Thank you for taking the time to review your recent stay at the Hampton Inn & Suites.  I was very pleased to read the level of service you received from each memeber of the staff.  I know each member of our team wants to exceed every guests expectations when to service or the cleanliness of the hotel.  I am also very pleased to know that you found the breakfast, pool, and location to meet and even exceed your expectations.  We hope you have an opportunity to return soon.  Thank You, John McIff",none,none,none,none,none,none,824,175
none,2 contributions,5.0 of 5 bubbles,Newly Refurbished,We've stayed at this hotel 5-6 times and really like the location.  It is far enough away from the airport and beach to be affordable yet close enough to the beach to get there in under 30 minutes.  They are just finish up refurbishing the hotel and it is nice.,August 2014,none,none,"Thank you for taking the time to review your recent stay at the Hampton Inn & Suites.  I am glad the hotel's location met al of your needs.  We are very centrally located to the airport, beaches, and seeveral attractions her in southerm california.  The hotel is completeing  renovations and we look forward to your return.  Thank You, John McIff",none,none,none,none,none,none,825,175
none,4 contributions,5.0 of 5 bubbles,Great business hotel,I recently stayed at this hotel for business.  Great location in Orange County and close to John Wayne Airport. Excellent experience down the line. I recommend this Hotel to any business traveler working in the Irvine area.,August 2014,none,none,"Thank you for taking the time to comment on your stay at the Hampton Inn & Suites.  I was very pleased to read that your experience was positive all the way down the line.  We value our business travelers and to ensure they feel at home while at the hotel.    Thank You, John McIff",none,none,none,none,none,none,826,175
