Helpful Vote,Contributions,Overall Rating,Summary Heading,Summary,Date of Stay,Room tip,Trip Type,Manager Response,Location Rating,Cleanliness Rating,Service Rating,Value Rating,Rooms Rating,Sleep Quality Rating,Review Number,Index
1 helpful vote,1 contribution,5.0 of 5 bubbles,Very Nice,Everything at this hotel was very nice.  Close to the beach and Disneyland.  We had a good trip and the staff was all very friendly.  I would stay here again if ever in the area.  The only issue was parking but the valet took care of it.,June 2016,none,none,"Very pleased to read you were able to use our central location to visit several attractions in the area.  The staff and I await your return.  Thank You, John M",none,none,none,none,none,none,547,175
6 helpful votes,28 contributions,5.0 of 5 bubbles,"Clean room, good customer service, delicious free breakfast, free wifi",Why go to 5 stars when you can get everything you want to stay at this hotel. There is free hot breakfast and pantry. I love everything about this hotel. The room is big and clean. The hotel cleans my room everyday I stay. I am here 5 nights. Only complaint is parking fee $8 lol,June 2016,none,none,"Wow,  great to know you found everything at his hotel that would normally find at a 5 star hotel.  I will pass your comments on to the staff.  We look forward to your next visit.    Thank You, John M",none,none,none,none,none,none,548,175
none,1 contribution,5.0 of 5 bubbles,Quick business trip,"Excellent, low key, beautifully decorated, fantastic staff. I will only be staying here when I'm in town. There are a ton of hotels in the area but none that could possibly have been as outstanding in all areas as the Hampton. There is no restaurant onsite and I personally liked this as room service was still available, but you didn't have to deal with the noise of having a bar/restaurant in the lobby. Great for work. You can go across the street to one of the lesser hotels and have a drink if you need one. Then return to your nicer, quieter, more pleasant room.",June 2016,none,none,Thank you for taking the time to review your recent stay.  The staff and I are always very pleased to know the hotel has delivered an overall experience that earns a 5 star rating.  I hope you have an oppoetunity to return and be a guest in our home again soon.,none,none,none,none,none,none,549,175
264 helpful votes,720 contributions,5.0 of 5 bubbles,Very nice hotel!,This was my first stay at this property...and I was very impressed! My room was spacious and well appointed. The bed was very comfortable. Staff was friendly and the free breakfast was hot and fresh. I will definitely stay at this property again when in this area.,June 2016,none,none,Thank you for taking the time to rate your recent stay at the hotel. The staff and I hope you have an opportunity to return soon!,none,none,none,none,none,none,550,175
16 helpful votes,33 contributions,5.0 of 5 bubbles,Wonderful place to stay!,"Staying here was a wonderful, relaxing experience. It is less than ten minutes from the Orange County Airport. Our room was spacious, quiet, and well equipped with refrigerator, microwave, coffee maker, and wifi. The staff went out of their way to be welcoming, friendly, and helpful. Breakfast was one of the best I have ever had in a hotel - a variety of delicious, fresh food. I commend the staff for their excellence and friendliness, in particular Marisol in the dining room. During our stay there were ample parking spaces available, although I understand that at times there are not. The only negative I can think of is the $8 daily charge for parking. Parking charge or not, I will definitely stay here the next time I am in the area.",May 2016,none,none,Thank you for taking the time to provide feedback about your recent stay at the hotel. I am very pleased to know you were able to enjoy many of the amenities of the hotel such as the wifi as well as the friendly staff. I hope you have an opportunity to return and be a guest in our home again soon!,none,none,none,none,none,none,551,175
none,6 contributions,5.0 of 5 bubbles,Excellent Hotel,The hotel location was so convenient.  Close to the Orange County Airport and walking distance to a variety of places to eat.  The hotel is in great shape and extremely clean.  I really liked the layout of my room.  Closing the door to the bedroom resulted in near silence.  I would definitely stay here again!,June 2016,none,none,Thank you for taking the time to rate your recent stay at the hotel. The staff and I hope you have an opportunity to return soon!,none,none,none,none,none,none,552,175
none,1 contribution,5.0 of 5 bubbles,Totally worth the price,"From the moment we stepped into the lobby to the moment we departed, the staff at the Hampton Inn & Suites - OC Airport made us feel as if we were their only guests!!!  Even when there was a problem with our room and I was expecting to have to get nasty with the check-in person in order to be switched to another room during a busy weekend, I was surprisingly shocked that I didn't have to.  The ENTIRE staff provided service with a smile...not like at some hotels where the staff is irritated cause they have to work there.    I will DEFINITELY stay at this hotel again without hesitation.",June 2016,none,none,Thank you for taking the time to rate your recent stay at the hotel. The staff and I hope you have an opportunity to return soon!,none,none,none,none,none,none,553,175
none,1 contribution,5.0 of 5 bubbles,Great Stay,"As always with Hampton, upgraded furnishings, clean rooms, quiet hotel, and a decent breakfast. Parking was tight, but they accommodate with valet parking if lot is full. I have never had a bad experience at the Hamptons.",June 2016,none,none,Thank you for taking the time to rate your recent stay at the hotel. The staff and I hope you have an opportunity to return soon!,none,none,none,none,none,none,554,175
none,2 contributions,5.0 of 5 bubbles,BEST HOTEL hands down,This is the friendliest and cleanest hotel.  AND THE ROOMS... OMG simply GORGEOUS and large.  It's quiet and decorated perfectly. I will make this my hotel next time I'm in the area. Very worth every penny.,June 2016,none,none,Thank you for taking the time to rate your recent stay at the hotel. The staff and I hope you have an opportunity to return soon!,none,none,none,none,none,none,555,175
58 helpful votes,38 contributions,5.0 of 5 bubbles,Spot on through and through,"ALL positive  * The staff were simply superb  * The room was spacious, clean and classic Hampton * Proximity to where I was working was great * Restaurant recommendations a plenty from the front desk  * Quaint albeit small pool",March 2016,none,none,Thank you for taking the time to provide feedback about your recent stay at the hotel. I am very pleased to know you were able to enjoy many of the amenities of the hotel such as the wifi as well as the friendly staff. I hope you have an opportunity to return and be a guest in our home again soon!,none,none,none,none,none,none,556,175
none,5 contributions,5.0 of 5 bubbles,Excellent Suites,"Very satisfied and room was very spacious. Clean and organized. Pool was in a weird location but very refreshing. The front office staff was very helpful and friendly. Booked a room with 2 queen beds and a pull out, was very surprised how big it was!",June 2016,none,none,Thank you for taking the time to provide feedback about your recent stay at the hotel. I am very pleased to know you were able to enjoy many of the amenities of the hotel like the pool and the friendly staff. I hope you have an opportunity to return and be a guest in our home again soon!,none,none,none,none,none,none,557,175
none,1 contribution,4.0 of 5 bubbles,Parking should have been Free!,"The staff at this location are pleasant and accommodating, the hotel overall is nice and clean, breakfast is good a little warm in the room its severed, but good. The hotel charges $8.00 for parking, but its an open lot.",June 2016,none,none,Thank you for taking the time to rate your recent stay at the hotel. The staff and I hope you have an opportunity to return soon!,none,none,none,none,none,none,558,175
none,1 contribution,5.0 of 5 bubbles,Top notch,"Visited for a 3 night stay on a trip to Disneyland with family. Room was spacious, modern, well decorates, and clean. Everything from the lobby to the carpets, to the luggage carts was a cut above your average hotel. Hot breakfast was great, and service was genuinely  friendly and accommodating to our every need. Next time I'm in the Santa Ana area I'll definitely consider another stay",June 2016,none,none,Thank you for taking the time to provide feedback about your recent stay at the hotel. I am very pleased to know you were able to enjoyed the hospitable customer service and complimentary breakfast. I hope you have an opportunity to return and be a guest in our home again soon!,none,none,none,none,none,none,559,175
none,1 contribution,4.0 of 5 bubbles,Clean Hotel,"Hotel is clean and nice inside and outside.  Outside traffic can be noisy but after we changed room it was nice.  Rooms are big and spacious. Location of Hotel is excellent, close to shopping and restaurants.",May 2016,none,none,Thank you for taking the time to rate your recent stay at the hotel. The staff and I hope you have an opportunity to return soon!,none,none,none,none,none,none,560,175
1 helpful vote,4 contributions,5.0 of 5 bubbles,"Hampton Inn Hotel Terrace, Santa Ana May16","As always, the Desk Staff were remarkable in accommodating my every need. I especially appreciate Room 100, adjacent to the main desk, and have it for the second time. Staff are over the top cheerful and always make me feel at home. I especially enjoy Rachel, who is an absolute professional in all that she does, every day.",May 2016,none,none,Thank you for taking the time to provide feedback about your recent stay at the hotel. I am very pleased to know you were able to enjoy a specific room location and the front desk staff including Rachel. I hope you have an opportunity to return and be a guest in our home again soon!,none,none,none,none,none,none,561,175
10 helpful votes,24 contributions,5.0 of 5 bubbles,Great Stay for a large group,"As a Hilton diamond, I spend a lot of time in Hilton properties and I have to say that this property is an outstanding Hampton Inn.  Nice, clean rooms, and most importantly, a GREAT staff.  Brian at the front desk should have a name tag that reads ""future general manager"" - he is is truly exemplary.  So is the young blonde woman with shorter hair (so sorry I am having a brain freeze on her name) who worked the evening shift.  Thanks for making this stay nice for my family and my extended family while we were here for a wedding.  Looking forward to another stay one day.  Thanks again!!!",May 2016,none,none,Thank you for taking the time to provide feedback about your recent stay at the hotel. I am very pleased to know you were able to enjoy  the hotel and the customer service you experienced. It was truly my pleasure! I hope you have an opportunity to return and be a guest in our home again soon!,none,none,none,none,none,none,562,175
none,1 contribution,5.0 of 5 bubbles,Excellent customer service!,Rooms were very clean. Beds were queen size and very comfortable! The staff was very polite and gave us excellent customer service. Only bad review I would give is for the extra charge for parking. I don't think we should be paying for parking if you are giving them ypur buisiness. We had four rooms and four cars. It adds up.,May 2016,none,none,Thank you for taking the time to rate your recent stay at the hotel. The staff and I hope you have an opportunity to return soon!,none,none,none,none,none,none,563,175
none,1 contribution,4.0 of 5 bubbles,"Family - 9,4,2 yr boys","I had a pleasure staying here with my boys. Ages from 9,4, and 2. The staff was caring and there was plenty of activities like a a BBQ Social and we had cookies each evening. I also felt like the room we were in had enough space to  accommodate our area needs.",May 2016,none,none,Thank you for taking the time to rate your recent stay at the hotel. The staff and I hope you have an opportunity to return soon!,none,none,none,none,none,none,564,175
4 helpful votes,4 contributions,5.0 of 5 bubbles,Great Hotel!!,"Great stay. Very pleasant and helpful staff took care of our every need. Made us feel at home. Rooms spacious, clean and comfortable. Complimentary shuttle service made traveling to nearby places so very convenient.",May 2016,none,none,Thank you for taking the time to rate your recent stay at the hotel. The staff and I hope you have an opportunity to return soon!,none,none,none,none,none,none,565,175
none,1 contribution,5.0 of 5 bubbles,Great last minute stay,"Last minute another hotel overbooked and Hampton Inn came to the rescue with a better rate and tremendous service. Clean rooms, good variety for breakfast, staff was friendly and accommodating. Will definitely return if we travel through the area again.",May 2016,none,none,Thank you for taking the time to rate your recent stay at the hotel. The staff and I hope you have an opportunity to return soon!,none,none,none,none,none,none,566,175
none,1 contribution,2.0 of 5 bubbles,Horribly loud a/c outside my room & didn't get 2 queens I was confirmed into!,Noisy a/c outside my room kept me awake all night & I was put in a room with only my a king bed when my confirmation clearly stated 2 queens. I discovered this when we walked into our room. Didn't have the courtesy tell us & apologize up front.,May 2016,none,none,Thank you for taking the time to provide feedback about your recent stay at the hotel.. I apologize for the errors that were made on your room type. If you would like to contact me I would be happy to resolve the matter to your satisfaction. Your comments will be used to improve the overall experience for all future guests. Thanks you again!,none,none,none,none,none,none,567,175
1 helpful vote,1 contribution,5.0 of 5 bubbles,Excellent Hotel,"This hotel was wonderful.  They have friendly staff, clean rooms and an awesome complimentary breakfast. The temperature in the rooms were easy to operate and very spacious.  The breakfast provided had a huge variety to suit any individual's needs from healthy to delicious.",May 2016,none,none,Thank you for taking the time to rate your recent stay at the hotel. The staff and I hope you have an opportunity to return soon!,none,none,none,none,none,none,568,175
1 helpful vote,1 contribution,5.0 of 5 bubbles,A great hotel experience,"This hotel experience was ""top notch"" from check-in to check-out. Hotel staff was extremely friendly and helpful. The complimentary daily hot breakfast and wireless internet service was awesome. The fitness room was not huge but it was clean, it had everything you need and the equipment was in excellent condition. I did not use the pool or spa although it looked great and several of my business associates, who did use them, gave them high praise. Free shuttle service within 5 mile radius was a BIG PLUS since I did not have a rental car at my disposal! I would give this Hotel a 5-Star rating!",May 2016,none,none,"Thank you for taking the time to provide feedback about your recent stay at the hotel. I am very pleased to know you were able to enjoy many of the amenities of the hotel like the complimentary breakfast, fitness center, and wifi. I hope you have an opportunity to return and be a guest in our home again soon!",none,none,none,none,none,none,569,175
none,1 contribution,1.0 of 5 bubbles,"Spacious rooms, clean, great breakfast","The rooms were modern, spacious and very clean. The staff was great! Breakfast offered many choices and was well stocked. Something for everyone. We had no problems during our stay. Great room for the price. And easy access to highways.",May 2016,none,none,Thank you for taking the time to rate your recent stay at the hotel. The staff and I hope you have an opportunity to return soon!,none,none,none,none,none,none,570,175
4 helpful votes,2 contributions,5.0 of 5 bubbles,"Hampton Inn, Santa Ana, CA","Very pleasant check in.  Room very comfortable with nice selection of personal items and a complimentary bottle of water. Parking would be difficult without the  service provided, but  very convenient and prompt service.  Selection of breakfast items excellent and constant renewing of items.  Very pleasant experience.",May 2016,none,none,Thank you for taking the time to rate your recent stay at the hotel. The staff and I hope you have an opportunity to return soon!,none,none,none,none,none,none,571,175
1 helpful vote,1 contribution,5.0 of 5 bubbles,Business Travel but will now also use for Personal Travel with my family,"I had to use this hotel for business travel because it was the only option my company offered, but my stay was so enjoyable. The hotel was clean, modern, and comfortable. The services and amenities were fare greater!! I will make Hampton Inn & Suites my first accommodations option for my personal travel. This hotel would be the perfect place to stay with a small family; I traveled alone on this occasion, but there would have been room for 6 adults comfortably in their double queen suites. Thank you for the amazing experience and opening me up to Hampton Inn & Suites!",May 2016,none,none,Thank you for taking the time to rate your recent stay at the hotel. The staff and I hope you have an opportunity to return soon!,none,none,none,none,none,none,572,175
9 helpful votes,26 contributions,5.0 of 5 bubbles,"Great Food, Service and Clean","Staff went out of their way to welcome us.  Brian Wallace checked us in and made sure we had everything we needed.   The hotel pool is clean and a very pretty setting.  To our surprise, we discovered on Wednesday evenings they serve Hot dogs, hamburgers, chips, other accessories, and drinks.    They also serve breakfast.  This is a great Hampton Inn.  Look forward to coming a back to this area.",May 2016,none,none,Thank you for taking the time to provide feedback about your recent stay at the hotel. I am very pleased to know you were able to enjoy many of the amenities of the hotel like the pool and complimentary Manager's Reception on Wednesdays. I hope you have an opportunity to return and be a guest in our home again soon!,none,none,none,none,none,none,573,175
1 helpful vote,1 contribution,5.0 of 5 bubbles,Friendliest Staff,"The Hampton Inn Santa Ana/Orange County Airport had the most excellent staff. They were extremely friendly and accommodating throughout my entire stay. I felt so welcomed as a guest, that I even felt sad to have to check out early when my work assignment had ended ahead of schedule. This Hampton Inn location is only 4 minutes from my company's work site in Santa Ana. I will definitely refer more of my colleagues to stay there if they need a place to stay in the area.",May 2016,none,none,Thank you for taking the time to rate your recent stay at the hotel. The staff and I hope you have an opportunity to return soon!,none,none,none,none,none,none,574,175
23 helpful votes,11 contributions,5.0 of 5 bubbles,Really Great Stay,This is a very comfortable hotel.  The rooms are really large.  The 2nd television is a definite plus.  The staff provided a level of service best described as excellent.  I would highly recommend.  I learned they have a shuttle to train.  Now I can  return even when working a little further away.,May 2016,none,none,Thank you for taking the time to rate your recent stay at the hotel. The staff and I hope you have an opportunity to return soon!,none,none,none,none,none,none,575,175
2 helpful votes,5 contributions,5.0 of 5 bubbles,Great Value Awesome Staff,"Heavy Business Traveler.  Checked in kind of late and the staff was more than accommodating.  Got to my room and the WIFI was weak, so they walked me to a few different rooms until I had successful signal.  I would upgrade the WIFI here a bit, but a great stay in a very clean hotel. Again, the welcoming staff was AWESOME!  Good cookies too.",May 2016,none,none,Thank you for taking the time to provide feedback about your recent stay at the hotel.. I apologize for the WiFi issues you experienced. If you would like to contact me I would be happy to resolve the matter to your satisfaction. Your comments will be used to improve the overall experience for all future guests. Thank you again!  -Brian Wallace,none,none,none,none,none,none,576,175
1 helpful vote,11 contributions,5.0 of 5 bubbles,A gem of a hotel including the friendly staff!!,"Very clean, sparkling hotel with easy access to major interstates! Staff is very friendly and go out of their way to make you feel welcome. We will stay here again if in the area!! Work out area and pool were very nice.  Breakfast had many selections and was very tasty.",May 2016,none,none,Thank you for taking the time to provide feedback about your recent stay at the hotel. I am very pleased to know you were able to enjoy many of the amenities of the hotel like the pool and complimentary breakfast. I hope you have an opportunity to return and be a guest in our home again soon!,none,none,none,none,none,none,577,175
none,2 contributions,4.0 of 5 bubbles,Southern California visit to the doctor,"We had to visit this area because of seeing a doctor. It was close by and the Hampton Inns are great places to stay. Like the beds, breakfast and staff. We would stay there again, so we look forward to the next stay.",May 2016,none,none,Thank you for taking the time to rate your recent stay at the hotel. The staff and I hope you have an opportunity to return soon!,none,none,none,none,none,none,578,175
1 helpful vote,2 contributions,5.0 of 5 bubbles,Great place to stay,From the moment we were picked up in the shuttle at the OC airport to the check-in we felt like we were invited into your family home. The staff were very friendly and went out of their way to see that all was taken care of and we were satisfied. We were there 4 nights and 5 days. The morning breakfast was very good. The main dishes varied from day to day and was fresh and very delectable. The staff was awesome. Great job to all at this warm a comfortable Inn.,May 2016,none,none,none,none,none,none,none,none,none,579,175
1 helpful vote,1 contribution,5.0 of 5 bubbles,Best Hampton Inn ever!,"Suite was perfect, staff was absolutely suburb! Every staff member from the front office to the front desk to house keeping to the kitchen went above and beyond all expectations to accommodate every need or request. They deserve 5 stars+",April 2016,none,none,none,none,none,none,none,none,none,580,175
19 helpful votes,64 contributions,4.0 of 5 bubbles,"Great location, very nice hotel","This hotel has a great central location between the beach and Anaheim. It was perfect for us as we wanted to spend time at Newport Beach & Balboa, but also went to Disney and an Angels game. Very close to the airport as well, just a bit north.  I had 2 billing issues, first there is a charge for parking (not unlike any of the other hotels in the area) but the Hilton Honors website at the time of my booking noted ""free parking"". Also, I was charged for internet 3 times when we only used the complementary internet. (they did credit me after we checked out, although I did have to call and request it be removed)  Other than those 2 things, our stay was great. The room was spacious (2 room suite) and the bed was very comfortable. We had a fridge and microwave as well.  The breakfast",April 2016,none,none,"Thank you for taking the time to provide feedback about your recent stay at the hotel.. I apologize for the errors that were made on your bill.  I am pleased to know they adjusted those charges off.  If you would like to contact me I would be happy to resolve the matter to your satisfaction.  Your comments will be used to improve the overall experience for all future guests.    Thank,  John",none,none,none,none,none,none,581,175
10 helpful votes,14 contributions,5.0 of 5 bubbles,Best Hampton Inn Stay Ever,"We loved the Hampton Inn chain anyway -it's a great option for international travelers, but this Hampton Inn was FANTASTIC. The staff were super friendly, the hotel was immaculate and quiet, and had everything we needed after a long day in the car. Because we stayed on a Wednesday night we enjoyed a free poolside dinner which was incredibly generous (and YUM) and we can't wait to come back.",April 2016,none,none,"WOW ""Best Hampton Inn Stay Ever"".  I am very pleased to know the service you received was super friendly and the hotel was immaculate.  The staff and I await your return.",none,none,none,none,none,none,582,175
17 helpful votes,36 contributions,4.0 of 5 bubbles,Excellent Services,"When we arrived 9:00am from early flight. I was planning to ask if we can leave our travel bags until check in hours which is @3:00pm.   Not only was our room was ready but we were allowed to enjoy complimentary breakfast.   Boy! That was great as we didn’t had a time to eat our breakfast since we had to take very early flight. Every times we encounter hotel staff, they always greet us with smile and “Good morning”. We stayed for 5 days and 4 nights, everyone was so friendly and helpful.   We were there for family wedding and had great time while staying there.   I will stay there when I have travel again in Santa Ana area.   Thank you all for your kindness and helpful travel and activities tips. All hotel staff were great.  They all greet us with smile and greet us with Good",April 2016,none,none,Thank you for taking the time to rate and review your recent stay at the hotel.  I was very pleased to read that your encounters with the staff were always friendly and helpful.  I will pass your comments on to Lacey and the ladies in the breakfast.  I hope you have an opportunity to return soon.,none,none,none,none,none,none,583,175
