Helpful Vote,Contributions,Overall Rating,Summary Heading,Summary,Date of Stay,Room tip,Trip Type,Manager Response,Location Rating,Cleanliness Rating,Service Rating,Value Rating,Rooms Rating,Sleep Quality Rating,Review Number,Index
none,1 contribution,5.0 of 5 bubbles,Family and I enjoyed our stay!,"This was a pleasant surprise! Family and I were driving back home but felt that we needed the rest.   Decided to get a room here and it seemed really packed for parking but Felix was able to help us with our vehicle and our bags! He was like a gentle giant.  Front desk staff seemed tired but they still had that energy to them, sadly we didn’t have the energy. Vanessa was very pleasant and had a smile throughout the whole check in.  Rooms were spacious, but all we did was just flopped into the beds and knocked out.  If we do come back to California, I would happily stay here again and take full advantage of the sorrounding area.",October 2018,none,none,"Thank you for taking the time to rate and review your recent stay. It is always a pleasure ensuring that our guests have a fantastic stay with us.  We are glad to hear that our staff provided great customer and took care of you and your family.  We look forward to seeing you again if you are ever in the area again, thank you!",none,none,none,none,none,none,227,175
1 helpful vote,2 contributions,2.0 of 5 bubbles,The room was not cleaned thoroughly,"The bathroom had not been cleaned completely. There was a used wet washcloth in the tub still, and trash on the desk that had not been taken care of. The breakfast area is also too small. We had to wait every morning for a place to sit. Tons of families stay here because of its close proximity to Disneyland, so i'd have thought the dining area would have been twice as big as it was. Other Hamptons I've been to were twice as big with half of the traffic. I don't plan on staying here again.",November 2018,none,none,"We regret that we were not able to provide you with the quality of service you deserve during your recent stay. We strive for flawless service delivery at our hotel, and we are always looking for ways to ensure that each guest experiences the very best we have to offer. Your feedback will help us to continue to improve our training processes, and we hope you will return to stay with us to experience the results of that work for yourself.",none,none,none,none,none,none,228,175
2 helpful votes,2 contributions,1.0 of 5 bubbles,Disappointed,"Dirty room, broken AC and heater, fell through pullout bed in first night. When issues brought to staff I was not offered a different room. Cleanliness issues were not addressed even after speaking to front desk and management three times. Terrible experience, I will never stay here again.",November 2018,none,none,"We are very sorry we were not able to provide you with the quality of services and amenities you deserved during your recent stay. Please know that the problems encountered are not typical of our hotel and staff and will be addressed accordingly to avoid recurrence for future guests. We are always looking for ways to improve our guest experience, as your satisfaction is very important to us. Thank you again for your feedback. We hope you will consider staying with us again soon so we may have the opportunity to make it right.",none,none,none,none,none,none,229,175
12 helpful votes,101 contributions,5.0 of 5 bubbles,"Fine hotel, outstanding value!","I stayed at this hotel last weekend - it was fantastic. Hampton inns are typically ""average or better"" but this one is special - friendly, attentive staff, enormous standard room, terrific bed, wonderful free breakfast buffet. I am sorry I could not stay longer!!!",October 2018,none,none,Thank you for taking the time to rate and review your recent stay. It is great to know you found the staff provided great service and location met your needs. We look forward to having as a guest in our home again soon.,none,none,none,none,none,none,230,175
none,2 contributions,4.0 of 5 bubbles,Quick work trip,"Work trip in Costa Mesa the hotel is about 15min away from 17th St during normal rush hour traffic.  I managed to get the oddball room with an 8 seat conference table... I guess this would be good if I needed to meet with people but I was kind of confused when I opened the door.  There is no TV in the main conference room - but you do get a white board.  I would stay here again, but I might ask for a different room unless I needed a giant table.",November 2018,none,none,"Thank you for taking the time to rate and review your recent stay. We are glad that we could be here to help during your quick work trip and we look forward to having you as a guest in our home again soon and once again, thank you for leaving us a review.",none,none,none,none,none,none,231,175
none,1 contribution,5.0 of 5 bubbles,Small business owner,"I have to say that my stay at Hampton inn &suites Orange County Airport- has been the best stay ever Everyone was very polite and helpful  Expecially Kayla at the front desk She was outstanding, you could tell as soon as she  Greeted you that she was raised the correct way With lots of manners  She takes pride in her work, and I believe she will go along way with Hampton, Or where ever she chooses to work You have a excellent employee there",October 2018,none,none,Thank you for taking the time to rate and review your recent stay. It is great to know you found the staff provided great service and location met your needs. We look forward to having as a guest in our home again soon.,none,none,none,none,none,none,232,175
2 helpful votes,4 contributions,1.0 of 5 bubbles,Stay Somewhere Else,No early check-in before 3. Front desk won’t even look to see if a room is available if you arrive early. Not helpful at all. Basically a low end property. Needs updating as the bathrooms only have a tub with an added shower head and is small and hard to move around in as the toilet blocks half of the space to enter the tub. Badly needs a modern touch. Worn out carpet just adds to the the dumpy look of the hotel. Check-in staff unhelpful in knowing anything than check-in and out and how to charge for parking. Watch out they charge by the day not the night so you pay the day you check-in and the day you check out which is an added day to the number of nights you stay. This is just bad as the extra money is obviously not being spent making the hotel better for the guests and is,October 2018,none,none,"Dear Jeff H,  We are very sorry we were not able to provide you with the quality of services and amenities you deserved during your recent stay. Please know that the problems encountered are not typical of our hotel and staff and will be addressed accordingly to avoid recurrence for future guests. We are always looking for ways to improve our guest experience, as your satisfaction is very important to us. Thank you again for your feedback. We hope you will consider staying with us again soon so we may have the opportunity to make it right.",none,none,none,none,none,none,233,175
none,1 contribution,1.0 of 5 bubbles,Poor customer service,I booked this hotel using Hilton.com advance purchase. I paid for the room in full. A few days after my stay I was billed again for the rooms. I gave the hotel the benefit of the doubt but on the first call the manger does not call me back. On the second call I am told they are needed to have the manager review the account. Still no call back and on the third call I am told to email the manager but never receive their email address.,October 2018,none,none,"We regret that we were not able to provide you with the quality of service you deserve during your recent stay. We strive for flawless service delivery at our hotel, and we are always looking for ways to ensure that each guest experiences the very best we have to offer. Your feedback will help us to continue to improve our training processes, and we hope you will return to stay with us to experience the results of that work for yourself.",none,none,none,none,none,none,234,175
50 helpful votes,46 contributions,4.0 of 5 bubbles,Enjoyed our multi-night stay,"Two senior couples stayed 3 nights each in different rooms while attending a local wedding. Location: easy drive to Newport Beach, not far from Costco & other shopping/dining options.  Walking distance to a grill/cantina (happy hour menu perfect for our evening meal). Rooms & bathrooms were a nice size (one had a separate bedroom and one was a large open space w 2 queen beds); both had sofas and refrigerators. Breakfast a little different each day with hot & cold options; last day included scrambled eggs-yummy! Employees are courteous & helpful; check-in & check-out easy. Ample parking. Would stay again!",September 2018,none,none,Thank you for taking the time to rate and review your recent stay. It is great to know you found the staff provided great service and location met your needs. We look forward to having as a guest in our home again soon.,none,none,none,none,none,none,235,175
2 helpful votes,15 contributions,4.0 of 5 bubbles,Great hotel for family,"My family of 4 stayed here when we went to Disneyland. We were 20 mins from the park. It was more affordable to stay away from the park and we got more space. The hotel is very up to date. We got the suite with king bed and sleeper sofa in the living area for our kids. Both beds were very comfortable and the bathroom had a lot of space. Nice to have a fridge, microwave and 2 separate living areas for our family. Free breakfast was nice with hot food. My son loved the pool too. I’d stay here again. We were also only 20 mins away from Newport Beach which was really nice to visit.",October 2018,none,none,"Thank you for taking the time to rate and review your recent stay. We are glad the hotel and staff met your needs. We look forward to being your hotel of choice during your next Disneyland outing, thank you!",none,none,none,none,none,none,236,175
8 helpful votes,8 contributions,5.0 of 5 bubbles,Amazing stay!!,The entire staff was very pleasant and helpful from the moment we go there. I had an issue with the air conditioner and without hesitation I was moved to a new one which we loved. Recommend this place!,September 2018,none,none,Thank you for leaving us some feedback. We greatly appreciate what our guests think of us!  We are glad that your issue was resolved quickly and look forward to seeing you again! Thank you!,none,none,none,none,none,none,237,175
1 helpful vote,2 contributions,5.0 of 5 bubbles,Great stay,"My room was nice and well serviced, and the complementary breakfast was solid.  The staff throughout the hotel were cordial and interested in making sure I had a good stay.   I particularly want to compliment Juan. When I entered the elevator he was cleaning, he stopped to greet me pleasantly and then commenced cleaning again. It was evident from the detailed way he cleaned around the floor buttons that he took great pride in his work -- no going through the motions!",September 2018,none,none,Thank you for taking the time to rate and review your recent stay. It is great to know you found the staff provided great service and location met your needs.   We will make sure to let Juan know about his service and helpfulness.  We look forward to seeing you again.,none,none,none,none,none,none,238,175
none,1 contribution,5.0 of 5 bubbles,My first trip to California,I enjoyed my stay at the Hampton Inn. I was in town for a 4 day training boot camp. I arrived because I was flying in from the east coast. I booked my reservation online with ease. I arrived early Friday and had no where to go so i called and voiced my concern with someone at the front desk and a room was made ready for me to accommodate my early arrival! I was also shuttled from Santa Ana to the inn within minutes!,September 2018,none,none,Thank you for taking the time to rate and review your recent stay. It is great to know you found the staff provided great service and location met your needs. We look forward to having you as a guest in our home again soon.,none,none,none,none,none,none,239,175
none,1 contribution,5.0 of 5 bubbles,My go-to spot in OC!!,"I wanted to get away for an overnight.  Check in was effortless, staff friendly and the room size is great. Common areas and room were very clean and the breakfast wonderful.  This was a great find.  I will be back!! Thanks!",September 2018,none,none,Thank you for taking the time to rate and review your recent stay. It is great to know you found the staff provided great service and location met your needs. We look forward to having you as a guest in our home again soon.,none,none,none,none,none,none,240,175
1 helpful vote,5 contributions,1.0 of 5 bubbles,Stay away from this hotel,"If I could give this hotel a negative rating I would do that but it doesn't allow me to. My room had mold, the bed was broken, my headboard had grease stains on it. It's supposed to be a non-smoking Hotel someone was smoking marijuana. The pool was filthy the jacuzzi was not working. Don't waste your time and money going to this hotel.",September 2018,none,none,"Dear Cheri H,  Thank you for taking the time to write a review about your stay with us. We truly appreciate your feedback and are very sorry for the conditions encountered in your room and at our pool. We will address your comments with our team as we work to improve our guest experience. Your input is genuinely helpful, as it is the first step in identifying areas where we can better our guest services. We hope you will come visit us in the future.",none,none,none,none,none,none,241,175
none,2 contributions,4.0 of 5 bubbles,Comfy Beds!!-😴,"Overall it is a nice establishment i personally like the layout and how the bedroom is separate from the sitting area, also the very large bathroom! I would recommend this place and I will definatly return in the future!",September 2018,none,none,"Thank you for leaving us some feedback! We always appreciate when our guests let us know about their experiences.  We are glad you enjoyed the layout of our rooms as well as the property. We look forward to seeing you again, thank you!",none,none,none,none,none,none,242,175
167 helpful votes,383 contributions,2.0 of 5 bubbles,This hotel needs some serious renovation,"I am getting a bit lost with the reviews. But let me first point out the good. The people and service are great. They are trying to help you and especially the staff during breakfast is super friendly and helpful. However this is where it stops. The hotel is falling apart. It needs some serious renovation. The sofa in our room was so old that the fabric was so thin that it broke when you touched it. There was rust and mold everywhere. When you take the stairs, don't be surprised to see actual the AC pipe without any cover. The pool needs some massive overhaul and cleaning. I wouldn't stay there again until something is being done.",August 2018,none,none,Thank you for taking the time to write a review about your recent stay with us at our hotel. We really appreciate your feedback and are very sorry for the condition of your guest room. We will take your comments under consideration as we work to improve our guest experience. We hope you will come visit us in the future.,none,none,none,none,none,none,243,175
none,1 contribution,5.0 of 5 bubbles,Love this hotel,I love everything about this hotel the staff in the front desk are really friendly and the rooms are very clean. I highly recommend this hotel. Everytime i come back for business or leisure i will be staying in this hotel i loved it,September 2018,none,none,"Thank you for the feedback!   We are glad that the property suited your needs as well as our front desk staff!  We look forwards to seeing you again, thank you!",none,none,none,none,none,none,244,175
none,2 contributions,5.0 of 5 bubbles,Vacation with a baby,I loved my experience at this location. From the second we walked in we were greeted by the front desk staff. They also acknowledge my 8 month old who was crabby due to the long car ride. They offered us a crib but we had our own pack and play. They put us on the top floor so nobody would wake my son which I really appreciate. The next day we hung out by the pool with such beautiful weather. We will definitely make this our go to hotel during our next vacation.,August 2018,none,none,"Thank you for leaving us some feedback!  We are glad that our staff provided great service. Some of us being parents, we can understand how our children can be during long and stressful car rides. It makes us happy that you were able to enjoy your time here with us with the beautiful California weather and look forward to seeing you and your family here again! Thank you!",none,none,none,none,none,none,245,175
none,1 contribution,2.0 of 5 bubbles,No Hot Water??,"First morning there was no hot water to shower in. When notified staff was told it was probably because ""everyone was showering at the same time"". On our 3rd morning there was only mildly warm water. Have never experiences this type of issue in any other hotel I've ever stayed at. Also, none of the outlets on the lamps work to charge electrical devices.",August 2018,none,none,"Dear theoford  Thank you for your feedback in regards to the water not working in your room. I've worked with our maintenance team to fix the issue, however I apologize that it wasn't resolved sooner. Thank you again for your review and I invite you to stay with us again the next time you return to the area.		  Thank you, Miri L.",none,none,none,none,none,none,246,175
23 helpful votes,21 contributions,1.0 of 5 bubbles,Poor service and issues with room 417,"Numerous issues with room 417. Billed as a suite but very awkward layout made this room feel more like a long hallway. Issues with deadbolt, lights, and bathroom door. Upon reporting issues to front desk staff, was accused of causing the door issues. Very unprofessional!  This property does not look like the typical Hampton brand. Would not recommend this location.",August 2018,none,none,none,none,none,none,none,none,none,247,175
none,1 contribution,5.0 of 5 bubbles,Employee Uses Sign Language,"I was traveling with my sister and her step-daughter, both of whom are deaf.  It was so nice to find that one of the employees uses sign language, so he was able to communicate directly with my sister.  He decided to learn sign language thinking it might come in handy some day.  Well, we are thrilled that he did and that he works at this hotel. The room was very nice.  The three of us never bumped into each other.  Big bathroom.  And of course the beds were comfortable.  I only stay at Hampton Inn now because of the Hampton Bed.  The sleeper sofa was comfortable also.",July 2018,none,none,none,none,none,none,none,none,none,248,175
152 helpful votes,122 contributions,3.0 of 5 bubbles,It's all the little problems,"Have not stayed here for years but it used to be one of the best in the area.  Now it has a lot of little problems.  First the good.  The rooms are quiet.  If it says ""suite"" you actually get a separate bedroom unlike most ""suites"" in this area.  Comfortable bedding and nice towels.  Microwave and mini-fridge work well.  Breakfast area is exceptional, as is the selections.  They only offer 3 hot items but it is not the same thing every day.  $8 a night to park.  Many in the area charge more but there are some nearby, like La Quinta, that are still free.  Like most Hampton Inns they are not dog friendly.  Parking can get scarce at times.  Now the bad.  The carpet is showing its age in the hallways and rooms.  One elevator was broken my entire stay.  The room furniture has a lot",August 2018,none,none,"Dear swtraveler2,  Thank you for your review. We’re sorry we didn’t provide the quality of amenities and service you deserved during your recent stay at our hotel. We apologize for the many housekeeping and maintenance issues encountered, as well as the lack of assistance from our staff. We are working to correct the problems and avoid recurrence going forward. Your feedback is genuinely helpful, as it is the first step in identifying areas where we can better our guest services. If you return to our area, we hope you’ll stay with us again.",none,none,none,none,none,none,249,175
none,3 contributions,1.0 of 5 bubbles,Horrible hotel! Staff are rude and they don't care about loyal customers.,Might as well not even use Hilton honors because they give no accommodations for being a member. In fact they gave worse treatment then if I wasn't a member.          I wouldn't recommend this hotel to anyone.,July 2018,none,none,"Dear 719473uu2u78,  Thank you for staying with us. We appreciate your honesty as we look for reviews to provide insight and constructive feedback regarding our hotel’s service and amenities to better our guest experience. We welcome any specific comments or suggestions you would like to share. If you return to our area, we hope you’ll stay with us again.",none,none,none,none,none,none,250,175
31 helpful votes,709 contributions,1.0 of 5 bubbles,Worst Hilton ever.,Room 418 AC is so loud. I could not sleep. I didn’t complain since it’s only for a night. And why charged a guest for parking? Freakin’ $8 really? I’ve stayed in many Hilton hotels (Hilton Honors member here) and I was never charged for a parking. What about start charging for breakfast and make parking free?,August 2018,none,none,"Dear Gesjn M,  Thank you for staying with us. We appreciate your honesty and apologize for the noise disturbance encountered. We look for reviews to provide insight and constructive feedback regarding our hotel’s service and amenities to better our guest experience. We welcome any additional comments or suggestions you would like to share. If you return to our area, we hope you’ll stay with us again.",none,none,none,none,none,none,251,175
47 helpful votes,37 contributions,2.0 of 5 bubbles,Won't stay here again,"I selected this hotel as part of a sports team event. This was listed as a hosting hotel and after reading reviews, we decided this appeared to be a good value. The rooms were very worn. The bathroom tub was moldy as the facet drip continuously. The furniture and doors had very visible dirty hand/finger prints that were not wiped. The bathroom wall and doors paint was peeling. The edge of the carpet was thick with a line of dirt and grime that wasn't vacuumed. There were several questionable people throughout the lobby throughout the night. Mostly women who appeared to be ""meeting up"" with men. At one point I witnessed a male speaking to law enforcement officers who were called as he reported his wallet and money missing. The explanation was extremely shady and appeared to have",July 2018,none,none,none,none,none,none,none,none,none,252,175
none,4 contributions,5.0 of 5 bubbles,Quick getaway,"Such a clean, friendly, comfortable place to stay. Was a last minute decision to stay away for the night and really happy we stayed there. Its a busy area..lots of hotels in the area but a nice safe location. Breakfast was really good, pools were nice too",August 2018,none,none,none,none,none,none,none,none,none,253,175
3 helpful votes,3 contributions,4.0 of 5 bubbles,Nice place to stay,This was a pretty good place to stay. The staff was very friendly and helpful. The rooms were very clean. Breakfast was awesome. I only have a couple of complaints. 1. Severe mold problem in the showers. (We had 2 rooms and it was this way in both rooms) 2. The pool area and hot tub needs some minor repairs.  I would probably stay here again. Definitely would if these issues were fixed.,August 2018,none,none,none,none,none,none,none,none,none,254,175
1 helpful vote,3 contributions,1.0 of 5 bubbles,Don't feel safe and supported,"It looks like a gang crime. It was around 8:30am on Friday, August 2018. There were many people in the dining room for breakfast. The dining room is in the hotel aisle, not very close to the lobby or other entrances. The lady's purse was on an empty chair by a small table for two where her friend sit in the other side of the table and ate. It was almost the innermost table in the room. There were 3 credit cards, $600+ cash, an iPhone, a driver’s license inside that purse. Suddenly, someone touch her friend from her back. Right when her friend turned the head subconsciously, the purse was stolen. At the moment that they realized the crime, several people were walking out of the room at the same time. It’s hard to catch the thief from a group of people, especially without the",May 2018,none,none,none,none,none,none,none,none,none,255,175
14 helpful votes,7 contributions,5.0 of 5 bubbles,Extremely Nice!,Very clean hotel. Wonderful staff. And many breakfast choices .  Very pleasant stay. I highly recommend this Hampton Inn and Suites . I plan to stay at this Hampton Inn and Suites in the future . Very comfortable bed. Very clean hotel.,August 2018,none,none,none,none,none,none,none,none,none,256,175
none,1 contribution,1.0 of 5 bubbles,Worst Hilton hotel,"Don’t stay here, even if it’s free. I typically stay at the Double Tree when in the area and thought I would try the Hampton. Bad mistake the quality of service and honesty of staff is non existent at this Hampton.",August 2018,none,none,"Dear Greg P,  We appreciate the review of your recent stay at our hotel, and apologize that you received a poor level of service; this is not the Hampton norm, as our goal is Satisfaction Guaranteed. We have addressed these issues with our staff. The next time you are in the area we would love to have you come back and experience an improved level of customer service. Safe Travels.",none,none,none,none,none,none,257,175
