Helpful Vote,Contributions,Overall Rating,Summary Heading,Summary,Date of Stay,Room tip,Trip Type,Manager Response,Location Rating,Cleanliness Rating,Service Rating,Value Rating,Rooms Rating,Sleep Quality Rating,Review Number,Index
none,1 contribution,5.0 of 5 bubbles,Beautiful hotel,We enjoyed our stay and had a wonderful time. Hotel was clean and staff was friendly. Just fyi it’s a 20 minute walk to Disneyland. Can’t cut through any buildings and take a shortcut you have to follow the pathway,December 2021,none,none,none,none,none,none,none,none,none,32,230
none,1 contribution,5.0 of 5 bubbles,Great stay,"From the minute we walked into the lobby we felt welcomed. Nice clean, quiet room. Just a 5 minute walk to Disneyland. Front counter personnel were knowledgeable regarding the park and they had great personalities.",December 2021,none,none,none,none,none,none,none,none,none,33,230
none,2 contributions,5.0 of 5 bubbles,Fantastic hotel,"The place is amazing. Amazing staff, clean facility, like new, quiet and very close walk to Disneyland. Our room was great for the stay and we really appreciated the place. It had a great laundry room and valet parking that made everything easy. We will gladly stay here again.",December 2021,none,none,none,none,none,none,none,none,none,34,230
none,1 contribution,5.0 of 5 bubbles,Great Hotel to stay at when going to Disneyland,This was the perfect hotel to stay when you have a big family. My three kids had room and space to use. The beds were nice and lovely to go to after walking around Disneyland all day. Staff is outstanding,December 2021,none,none,none,none,none,none,none,none,none,35,230
none,2 contributions,4.0 of 5 bubbles,Pretty good,"All good aside from the lackluster “welcoming” our first day from the front desk clerk (Sarah?); maybe she was having a bad day.  Clean room, nice lobby, good distance from Disneyland. Valet crew were great and welcoming.",December 2021,none,none,none,none,none,none,none,none,none,36,230
none,1 contribution,1.0 of 5 bubbles,Horrible customer service. Not very clean,"There was a dirty sock in the room when we checked in on the floor and one of the queen beds had dirty sheets. They do not service the room unless you stay more than four days which was not told to us when we checked in. Do not stay at this hotel, stay at any other hotel then the Hilton Garden Inn",December 2021,none,none,"Thank you for your review and we are sorry for the challenges that you experienced.  We strive to ensure perfection, but it seems like we let you down.  We will be sure to review your feedback with our team to improve our service and hope that we can make it up to you on a future visit.  Best regards!",none,none,none,none,none,none,37,230
1 helpful vote,2 contributions,3.0 of 5 bubbles,Overall nice hotel,"Overall, the hotel was good. Clean and linens were comfortable. On-site restaurant is only open certain days and the cafe didn’t have many options for a late dinner. The hotel is right off freeway so you will hear traffic noise. The hot water in our room did not get very hot. Location was good being about a 15 min walk to Disneyland.",November 2021,none,none,none,none,none,none,none,none,none,38,230
1 helpful vote,1 contribution,5.0 of 5 bubbles,Walking Distance,I picked this hotel because it was so close to Disneyland we could walk there and back. I was delighted with how comfortable the beds were and the rooms were very spacious. There was a nice coffee/snack shop in the lobby too!,November 2021,none,none,none,none,none,none,none,none,none,39,230
30 helpful votes,46 contributions,1.0 of 5 bubbles,Falsely advertise Breakfast,"There is no breakfast. Despite them advertising as such on Google. It is false advertising. Which is a first for us at a Hilton garden inn. When you're excited to do Disneyland, and have to feed a family of 6 with kids, stopping for breakfast on the way to Disneyland is a grade A can of suck. Your day basically just lost an hour of premier park time. TERRIBLE!!! The front desk is like ""we have no clue why it says that"".......well its because your manager put it on there and its called SCAMMING FOR BUSINESS.",November 2021,none,none,none,none,none,none,none,none,none,40,230
1 helpful vote,5 contributions,5.0 of 5 bubbles,Had a great stay!,"Hotel was very clean as well as the room. Beds were comfortable and even though we faced the freeway, we didn’t hear too much noise. Staff was very friendly no matter who we encountered. Short walk to Disney and convenient walk to a few fast food restaurants. Great hotel and only feedback I have is better coffee at coffee stand.",November 2021,none,none,none,none,none,none,none,none,none,41,230
1 helpful vote,1 contribution,5.0 of 5 bubbles,Perfect Disneyland Hotel,Nice new hotel perfect for our mini vacation . Walk to Disneyland was short and easy. Very comfortable beds and room was very clean. All hotel personnel was super nice. Would definitely go back and excited to see finished restaurant.,November 2021,none,none,none,none,none,none,none,none,none,42,230
none,1 contribution,5.0 of 5 bubbles,Very nice comfortable rooms,The staff was so nice and helpful. The rooms are pretty much brand new. Very comfortable beds and very clean. It's walking distance to Disneyland so we were able to just park the car and walk all weekend,November 2021,none,none,none,none,none,none,none,none,none,43,230
1 helpful vote,14 contributions,4.0 of 5 bubbles,Good family Trip,"I went to this hotel, it was good experience but check in process need some simplifications. Guests shouldn’t have to wait if there is any problem with their booking websites. But overall, room was good, free wifi etc.",November 2021,none,none,none,none,none,none,none,none,none,44,230
1 helpful vote,2 contributions,4.0 of 5 bubbles,Brand New,This hotel is only 5 months old and is right next to Disney Land. It was fun staying in a brand new place! I felt like I was staying in a very upscale and modern hotel! Very green efficient too! Unfortunately free   breakfast is not offered here. The restaurant was still under construction during my stay.,October 2021,none,none,none,none,none,none,none,none,none,45,230
none,1 contribution,4.0 of 5 bubbles,Super close to Disney!,"This place is a 7 minute walk to Disney. Nice location. Only down side , room walls are to thin you can hear next door neighbor. Bathtub can be cleaned out better. But overall the stay here was pleasant",October 2021,none,none,none,none,none,none,none,none,none,46,230
none,9 contributions,1.0 of 5 bubbles,"The ""2 Queen Beds 1bd Suite"" is not a separate bedroom","I cancelled my reservation after confirming with Hilton who confirmed with the hotel that the ""2 Queen Beds 1bd Suite"" is not a separate bedroom. They also said that it should be advertised as a junior suite, but it is not. They knew about this problem since July, but did not update their website.",October 2021,none,none,none,none,none,none,none,none,none,47,230
none,1 contribution,5.0 of 5 bubbles,Great Hotel if you visit Disneyland/Anaheim,Good if you’re going to DL. Short walking distance. Super clean/new everything. Friendly staff. No bar/ restaurant open during my time of travel - maybe on the next trip. This will definitely be a go-to hotel for me In the future. Hopefully it won’t change much.,October 2021,none,none,none,none,none,none,none,none,none,48,230
none,1 contribution,1.0 of 5 bubbles,Do not bring your family here,Website description was false marketing. The room was missing half the furniture. The restaurant wasn’t completed. If Disneyland wasn’t open nor would this hotel. A brand new hotel which makes it worse.,October 2021,none,none,none,none,none,none,none,none,none,49,230
none,1 contribution,5.0 of 5 bubbles,Great hotel close to Disneyland,"Hotel was beautiful and within walking distance of Disneyland. Staff was great and accommodating , valet parking was very quick and professional as well. Would return and stay again at this hotel next time we come to Disney .",October 2021,none,none,none,none,none,none,none,none,none,50,230
166 helpful votes,215 contributions,5.0 of 5 bubbles,New Disney-area favorite,"Had a really good experience here. All the staff were welcoming and efficient. Our room was available when we arrived, a couple hours before 3pm. It was very clean and sufficiently spacious. We heard very little noise while we were there (aside from the white noise of freeway traffic). It's nice to have a fridge and microwave. We didn't ask for our room to be cleaned for the 3 nights we were there. Beds were comfy. Bathroom has a barn door, which I don't like--they don't block sounds very well. Valet parking was friendly and fast. Easy 10 minute walk to the gates at Disneyland. I've stayed at several other hotels in the vicinity, and this is my new favorite.",October 2021,none,none,none,none,none,none,none,none,none,51,230
2 helpful votes,3 contributions,2.0 of 5 bubbles,"Great location, bad service, good breakfast","Great location and very close to Disney. Easy walk. Good Continental breakfast. Got back from a day at Disney and rom wasn’t even touched. Dirty Towels on floor where we left them,  trash not emptied, coffee not restocked… beds not made. Fridge didn’t work so nothing could be kept cold. Called next day to have someone turn down the room. Went to Disney and came back later… still the room wasn’t touched. Had to call again for someone to bring fresh towels and take the trash. Hilton Diamond status gets you warm mini bottles of water and that’s it…",October 2021,none,none,none,none,none,none,none,none,none,52,230
none,1 contribution,5.0 of 5 bubbles,Beautiful Hotel across from Disneyland,"So happy we decided to stay at this beautiful Hilton Garden Inn, a 10 minute walk to the entrance of Disneyland. Hotel was immaculate and the staff outstanding, very accommodating and friendly. Highly recommend for anyone traveling to this area.",October 2021,none,none,none,none,none,none,none,none,none,53,230
none,1 contribution,5.0 of 5 bubbles,Great stay!,Super nice and walking distant to Disneyland and California adventures. We could even see the fireworks from our room. My family and I would stay again!! Easy to get to off the I-5 and feels very safe. CLEAN and very friendly staff!,October 2021,none,none,none,none,none,none,none,none,none,54,230
none,1 contribution,5.0 of 5 bubbles,Loved our stay,"The staff was great very helpful and friendly. They answered all our needs during our stay. Rooms were clean and well appointed. Our room was large enough for a comfortable stay for our family of five. There was coffee, tea and cocoa available in the room. Hilton hit it out of the park.",October 2021,none,none,none,none,none,none,none,none,none,55,230
1 helpful vote,1 contribution,1.0 of 5 bubbles,Racially Profiled by Security Personnel,"While waiting 10 minutes in the lobby for an Uber, hotel security approached me to ask if I was “lost.”  I wasn’t asked if I was a guest at the hotel, or if they could be of assistance.  They were clearly uncomfortable with a Black man walking around the lobby not realized I was merely passing time awaiting my Uber.  If I wasn’t with my children I would have called out the security personnel on this nonsense and probably made a scene.  But I chose to let it go so as to not embarrass him, or myself, and avoid a situation that clearly would have escalated quickly.",October 2021,none,none,none,none,none,none,none,none,none,56,230
1 helpful vote,1 contribution,4.0 of 5 bubbles,Short walk to Disneyland,"We stayed 3 nights and visited Disneyland and Knotts Berry Farm while there. Disney is an easy walk and Knotts is an easy drive. The valets were nice and quick and the only employees we ever interacted with the entire time. You check in online and download your room key to your phone, so we spoke to absolutely no one else. The rooms are very modern and clean. The TV has Directv and the bathroom is equipped with good quality toilet paper!  If you’re on the freeway side of the property be prepared for loud traffic noise all night long. Which is really the biggest downfall for this property.",September 2021,none,none,none,none,none,none,none,none,none,57,230
none,1 contribution,5.0 of 5 bubbles,Beautiful Hotel,"Everything was fine. Walking distance to a lot of restaurants and Disney. We loved it. Not happy about paying to park my car, but everything else was lovely. Valet and front desk amazing. Everyone greeted you daily.",September 2021,none,none,none,none,none,none,none,none,none,58,230
none,2 contributions,5.0 of 5 bubbles,Stay at Hilton Garden Inn-Only Good Surprises Await,"We booked at a hotel nearest to Disneyland as was available.  After staying there, this will be the hotel we choose from now on.  The hotel is up to Hilton standards!  Pleasant surprise and all staff were so helpful and friendly!!",September 2021,none,none,none,none,none,none,none,none,none,59,230
1 helpful vote,2 contributions,5.0 of 5 bubbles,Excellent Hotel Stay.,"Using the Hilton Honors App was so easy, and it allowed us for a hassle-free reservation along with a hassle-free check-in and check-out. The hotel rooms and the beds were clean, very minimal noise, and easy access to the Disneyland Park.",September 2021,none,none,none,none,none,none,none,none,none,60,230
none,1 contribution,5.0 of 5 bubbles,Outstanding Service,Outstanding customer service! Everyone in this hotel was very nice and helpful.  I will definitely stay here again and refer this hotel to others.  The valet service was very convenient.  They were very nice and helpful with my family’s luggage.  My entire stay was great.  All the staff at the hotel are very nice and i was greeted by all staff and felt sincere like it should.,September 2021,none,none,none,none,none,none,none,none,none,61,230
none,1 contribution,4.0 of 5 bubbles,Disney trip,Overall great property location for Disney trip.  It’s close enough to walk.  And rooms face the Disney fireworks if you don’t stay to see them in the park.  No restaurant.  One elevator working made it inconvenient   No shuttle service either but rooms were clean and comfy,September 2021,none,none,none,none,none,none,none,none,none,62,230
none,3 contributions,5.0 of 5 bubbles,Hospitality at its best!,The minute we drove in and walked into the hotel lobby and until our departure day. We were welcomed with a warm and inviting environment. The hotel is beautifully and comfortably designed from the lobby to your rooms. The beds are very comfortable and the rooms pristine shape. I could not ask for a better place to stay while in Anaheim visiting Disneyland.,September 2021,none,none,none,none,none,none,none,none,none,63,230
none,1 contribution,5.0 of 5 bubbles,My top choice when visiting Disneyland!,Short walk to Disney. Multiple food options on the way to the park. Clean. Comfortable. If you’re on the fence….STAY HERE! Didn’t use work out room but did visit it. Great condition and clean. Water fill station inside was perfect!,August 2021,none,none,none,none,none,none,none,none,none,64,230
none,1 contribution,5.0 of 5 bubbles,Great Hotel Near Disney!,"Not sure why this hotel doesn’t have more stars. It is new and a hidden gem! Close to Disney and the staff is amazing. Especially Jules! Beautiful new hotel. No pool yet, but that wasn’t a big deal for us.",August 2021,none,none,none,none,none,none,none,none,none,65,230
none,1 contribution,2.0 of 5 bubbles,Bad experience,In three nights staying they only clean the rooms at once… nor recommend this place at all and I’ll never stay there again…the communication between a valet ticket girl at the hotel’s driveway the valet parking and the front desk was terrible I had to wait 30 min before I get my room keys,July 2021,none,none,none,none,none,none,none,none,none,66,230
none,1 contribution,5.0 of 5 bubbles,"It was a good hotel, welcoming people !",It was a nice experience for my family and I! We enjoyed our stay in the room since the beds were comfortable and the bathroom was clean. The only thing we wished for the trip to be better was being able to access the pool in the actual hotel instead of the other hotel’s pool.,August 2021,none,none,none,none,none,none,none,none,none,67,230
none,3 contributions,5.0 of 5 bubbles,Great Hotel,New hotel- easy walking distance to Disneyland- rooms are on the larger size and very comfortable.  Dropped car off at valet and hotel held our luggage until check-in time.  Very friendly snd helpful staff,July 2021,none,none,none,none,none,none,none,none,none,68,230
95 helpful votes,115 contributions,3.0 of 5 bubbles,New but needs improvement,"Facility is beautiful and the room was excellent for a Garden Inn.  Front desk are still learning and were a bit tense to work with as they were not following Hilton Honors procedure and this interaction (with one agent) was unnecessarily tense.  Still working out my billing as I was over charged.  Pool is not open, but more frustrating, the restaurant is closed too and there is no indication of that on the website which is why I picked the Garden Inn as I like their breakfast buffet.  Cafe is open but is double what a Starbucks would cost with no prices listed on the menu.",July 2021,none,none,none,none,none,none,none,none,none,69,230
1 helpful vote,1 contribution,2.0 of 5 bubbles,Unfinished facility/poor service,The facility was under construction. The pool was not completed and the rooms were bare and unfinished. The valet lost my car for period of time and were generally hostile. The staff was sometimes polite but more often aggressively rude. The staff appeared untrained and overwhelmed and ever detail of my stay was affected by this.,July 2021,none,none,none,none,none,none,none,none,none,70,230
1 helpful vote,1 contribution,3.0 of 5 bubbles,Great place to stay and close to Disneyland to walk. Bar and restaurant was not open yet. Parking was a nightmare,Overall the hotel is clean and the staff was friendly. We paid extra money for a corner room but was not aware that it was going to be right against the five freeway and was super loud all night long. The parking was a nightmare. The valley system did not work. We waited up to 45 minutes at a time to get our car either park or to pick it up to leave. We would not come back unless the parking was fixed.,July 2021,none,none,none,none,none,none,none,none,none,71,230
1 helpful vote,1 contribution,1.0 of 5 bubbles,"No pool, room smelled","The hotel is really nice but was very disappointed when they said they did not have a pool. Got to the room, had a powerful awful smell, kind of like a wet dog. Walked back down and checked right out.",July 2021,none,none,none,none,none,none,none,none,none,72,230
4 helpful votes,4 contributions,1.0 of 5 bubbles,All good until you need your car,The hotel is nice and new. It’s easy to walk to Disneyland down South Harbor. The staff is helpful and friendly. That’s all that’s good about this place.  The hotel valet service is HORRIBLE. Dropping off a car is a easy. Picking up your car is a nightmare. The valet ticket states “text this number to get your car.” That’s what I did and a while later received a text to try again because no one was available. Meanwhile my family and I are waiting in the lobby seeing other families get their cars. My husband walked up to the valet person with our ticket. Apparently the text service isn’t being utilized right now. (that info would have been helpful earlier) I went up to talk to the very overwhelmed valet person who said that they’d be retrieving our car. After explaining that we,July 2021,none,none,none,none,none,none,none,none,none,73,230
6 helpful votes,3 contributions,2.0 of 5 bubbles,Beware when booking - there are no 1 bedroom suites!,"Hilton Garden Inn Anaheim Resort is selling rooms that they do not have.  I booked the following on their website: "" 2 QUEEN BEDS 1BD SUITE - SEPARATE LIVING AREA-COMP WIFI- HDTV REFRIGERATOR-MICROWAVE- KEURIG COFFEEMAKER"".  This Hilton does not have this room type.  Front desk staff confirmed when I checked in that they do not have one bedroom suites with separate living areas.  They said this is a problem with the website.  Fortunately, they allowed me to cancel the reservation.  However, I had to scramble to find another similar option at a different hotel for the night.  After driving all day with family waiting this was not ideal.  I just checked this morning and they are still offering this room type on their website.  They are also charging more for this room.  You will",July 2021,none,none,none,none,none,none,none,none,none,74,230
1 helpful vote,1 contribution,1.0 of 5 bubbles,Dishonest valet,Take your valuables from your car or the valet staff will steal them. Nothing done when this was brought to the attention of the valet manager. Also housecleaning did not clean until very late in the afternoon,July 2021,none,none,none,none,none,none,none,none,none,75,230
1 helpful vote,1 contribution,5.0 of 5 bubbles,Great stay,"Brand new hotel, within walking distance of Disneyland, great place for staying with family, I would stay they’re again! The service and attention that was given to us was great, they did not have the coffee bar opened yet the pool or restaurant but we did not need one.",July 2021,none,none,none,none,none,none,none,none,none,76,230
