Helpful Vote,Contributions,Overall Rating,Summary Heading,Summary,Date of Stay,Room tip,Trip Type,Manager Response,Location Rating,Cleanliness Rating,Service Rating,Value Rating,Rooms Rating,Sleep Quality Rating,Review Number,Index
9 helpful votes,12 contributions,4.0 of 5 bubbles,Pleasant Stay for Disneyland,Overall we enjoyed our stay here. Check in/out staff were friendly. Room looked like they have been recently renovated. Bed was comfy. Hotel provides a nice simple continental  breakfast. Also it's about a 20 minute walk to Disneyland and within walking distance of a Target and various restaurants.  Some downsides were the bedsheets are a little rough. Even though the breakfast hit the spot it would be nice if they would provide some fresh fruit. Overall we would stay here again.,July 2019,none,none,"Dear Guest,  We appreciate your feedback and we thank you for giving prospective guests who may be reading the comments relevant information about our location and proximity to Disneyland. It's nice to hear that our staff was able to provide you with good service during your stay. Your feedback about breakfast is duly noted and we will consider adding some more options in the future. Thanks for choosing to stay with us and we hope to see you again soon.  Best Regards,  Magnolia Tree Hotel Customer Care Team",none,none,none,none,none,none,52,259
2 helpful votes,1 contribution,5.0 of 5 bubbles,Great Place you stay,"The staff was friendly.  Room was clean, fresh and nicely furnished. Accommodated our large family comfortably. We Will stay again when visiting California. We didn’t realize check it was at 11:00 and front desk called to remind us and they were very nice about it",July 2019,none,none,"Hi Sheyeurs,  Our hearts are filled with joy because of the wonderful feedback that you provided. It's nice that you found the rooms clean and we hope you and your family had a comfortable stay. Our staff also thanks you for the nice commendation you left about the service. Thanks for choosing to stay with us and we look forward to your next visit.  Best Regards,  Magnolia Tree Hotel Customer Care Team",none,none,none,none,none,none,53,259
2 helpful votes,3 contributions,4.0 of 5 bubbles,Nice rooms!!!,"The room was great! Very nice layout, easy to get to. Included breakfast. Great WiFi. Very friendly staff. Very affordable. Big bathroom! Perfect for the short stay we came for! Convenient for the convention center. Easy walking distance.",July 2019,none,none,"Dear Guest,  We appreciate your feedback and we thank you for giving prospective guests who may be reading the comments relevant information about our location and proximity to the convention center. We are glad you liked the room and found the prices to be affordable. Our staff also thanks you for the nice comment you left about the service. Thanks for choosing to stay with us and we hope to see you again soon.  Best Regards,  Magnolia Tree Hotel Customer Care Team",none,none,none,none,none,none,54,259
8 helpful votes,3 contributions,5.0 of 5 bubbles,Efficient and clean,Very clean and safe and accessible. Close enough to Disney to walk for all but the smallest children. The beds were comfortable and the a/c was good.   For the money this was a five star hotel.   It has a big walk in closet - shockingly big.   Downsides are no real counter space at all in the bathroom and the breakfast is cereal heavy. But for the money this was an excellent choice for us.,July 2019,none,none,"Hi Matthew,  We appreciate your feedback and we thank you for giving prospective guests who may be reading the comments relevant information about our location and proximity to Disney. We are glad you found the place clean and safe - we hope you had a comfortable stay. We will see what we can do about having some additional updates soon. We are glad you found good value for the money you spent and we look forward to your next visit.  Best Regards,  Magnolia Tree Hotel Customer Care Team",none,none,none,none,none,none,55,259
6 helpful votes,8 contributions,2.0 of 5 bubbles,Surprisingly underwhelmed,"Stayed here for 2 weekday nights with my son. While the website and many pictures online were hopeful, the experience left me a little exasperated.   It’s a motel style accommodation with very  and limited parking. SUVs and trucks be warned; do NOT park towards the rear because there is a perpendicular parking row that will likely trap you in your spot. Location is great though if you’re going to the park or the convention center. There’s plenty of restaurants and a Target a half block down.   Check in was very pleasant with a bubbly receptionist. Check out, I had to look around and call the desk while standing there waiting for someone to show up. It wasn’t too long but long enough that I walked around the property looking for help.   The rooms were updated but there was what",July 2019,none,none,"Dear Guest,  Thanks for your review and we appreciate you giving prospective guests relevant information about our location and proximity to the convention center/restaurants. Your comment about maintenance is noted and we will see to it that our team does a better job preparing the area moving forward. We will also see what we can do about having some updates soon. Your feedback about breakfast is also duly noted and we will consider adding some more options in the future. We hope you consider staying with us again soon.  Best Regards,  Magnolia Tree Hotel Customer Care Team",none,none,none,none,none,none,56,259
95 helpful votes,80 contributions,4.0 of 5 bubbles,"A good 2 night stay for a good price, close to Disneyland","Stayed 2 nights in the middle of June. They were running a great promotion.  I already knew from reviews, that this was a good choice. Front desk staff was friendly. Room was nice, clean, and everything working. I was surprised they still have carpet. It was the type that turns your feet black. Too hard to keep clean. The bathroom ceiling was really low. It took some getting used to. Bed was nice and comfortable, sleep great. Some other guest noise, but not the hotel's fault. Parking was a bit more tight then I am used to. Could be an issue. But parking is still free, included in the price. Over all a nice stay.",June 2019,none,none,"Dear Guest,  It is great to hear feedback from you regarding your recent stay with us - we are glad to hear that you had a good overall impression of your stay. It's good to hear that you were able to avail of a good promotion and that you found the place generally clean. We are also glad to hear that our staff was able to provide you with good service. Your feedback about the carpet is noted and we will see what we can do about it We will also see what we can do about having an update soon. We hope to see you again the next time you are in the area.  Best Regards,  Magnolia Tree Hotel Customer Care Team",none,none,none,none,none,none,57,259
2 helpful votes,1 contribution,3.0 of 5 bubbles,Don't Judge A Book By Its Cover,"Upon arriving at the hotel, we were highly skeptical about our booking decision. The exterior of the small grey building was underwhelming and in need of fresh paint or a face lift to reflect its name, Magnolia Tree.  When we arrived at our room, we were pleasantly surprised to find the interior was newly renovated and clean.  The sleeping area, although small, included a new king size bed and mattress, new side tables, carpeting, and paint. It also included a small refrigerator and widescreen television. The room had a walk-in closet to accommodate our bags.  The bathroom donned all new cabinetry, sinks, shower/tub, and tile floor.  The hotel breakfast was very limited, and the breakfast area could use improvements.  In comparison to other hotels in the area it was a value if",June 2019,none,none,"Dear Guest,  We love hearing back from you about your recent stay with us. We always look forward to feedback about how we can make things better for our guests and how we can improve. We are glad to hear that we were able to surprise you with the quality of our rooms - we hope you had a comfortable stay. Your feedback about the exterior is noted and we will see what we can do about having additional updates to the property. Your feedback about breakfast is also duly noted and we will consider adding some more options in the future. We hope to see you again soon.  Best Regards,  Magnolia Tree Hotel Customer Care Team",none,none,none,none,none,none,58,259
2 helpful votes,5 contributions,1.0 of 5 bubbles,Worst hotel and Service I've ever seen!,"We booked this hotel on Hoteltonight. The price fit our budget and we have been trying different hotels in the Anaheim area. When we checked in we were charged a very large for the price of the room deposit. The room was $90 the deposit was $100.My boyfriend is a smoker and the staff let us know where the designated smoking section is (bottom of the stairs under some rooms in the corner, not bad). When we got in the room we were smacked in the face by an overpowering bleach smell that gave me a headache and turned my stomach. This place is trying very hard to appear clean. We took off our shoes and from walk the bed to the bathroom my feet were turned black, the carpets were greasy and sticky. So gross. We brought the concernes about the smell and carpet to the attention of",June 2019,none,none,"Dear guest, We want all our guests to have a great stay with us and the vast majority of all our guests do have a wonderful stay with us. We are always disappointed when a guest leaves with less than the first-rate experience. As you know the parking is very tough in the area, but we do provide a convenient option for our guests. However, options being limited, we want to make sure everyone is able to park well, that is the reason we left a kind note requesting if you could re-park just so we can accommodate fellow guests. Our housekeeping usually does a great job preparing the room for all upcoming guests and stocks the room with all items, including towels which are kept in the drawer. If there is anything you need, just give us a call, we'd be happy to bring it right over. Our housekeeping staff generally checks on every room to ensure our guests receive the room service, we are sorry if our housekeeping team was not aware that you were checking out the same day. Our entire team does work hard to provide a pleasant and comfortable stay for all our guests, so we are very sorry to see that we did not achieve that goal on your visit. This is very unusual and rare. We sincerely hope that you will give us another chance to restore your faith in our hotel and hospitality. Thanks again.    Best Regards,  Magnolia Tree Hotel Customer Care Team",none,none,none,none,none,none,59,259
2 helpful votes,1 contribution,4.0 of 5 bubbles,Tree review,"For the price the hotel is good. It has more of a motel/inn feeling but overall good. Breakfast is only a few items: bagels, toast, cereal, yogurt, oatmeal. The room is very nice however it gets very humid and makes the bed sheets damp and my clothes smell. Other than that the hotel is good.",June 2019,none,none,"Dear Guest,  It's nice to hear back from you - we are glad that you found our rates to be reasonable and competitive. We are glad you had a good overall impression of your stay. Your feedback about the humidity is noted and we will see what we can do about it. Your feedback about breakfast is duly noted and we will consider adding some more options in the future. We hope to see you again the next time you are in the area.  Best Regards,  Magnolia Tree Hotel Customer Care Team",none,none,none,none,none,none,60,259
14 helpful votes,6 contributions,3.0 of 5 bubbles,Clean and comfortable budget accommodation,"The rooms were well kept and clean, bed was comfortable. Motel-style with doors open to the car park on ground level or upper balcony/walkway. As a seasoned traveller this didn't bother me too much but others, especially single travellers, may not like this.",June 2019,none,none,"Dear Guest,  It is great to hear feedback from you regarding your recent stay with us. We are glad you found the rooms clean and that you had a comfortable stay. We also thank you for the tips you left about our location and appearance. We hope to see you again the next time you are in the area.  Best Regards,  Magnolia Tree Hotel Customer Care Team",none,none,none,none,none,none,61,259
1 helpful vote,1 contribution,5.0 of 5 bubbles,Clean Rooms!,The room was very clean. The bedding and the tub were very clean which made out stay very pleasant. The room was pretty small but I will take small and clean over big and dirty any day. The gentleman that checked us in was very nice and informative.,May 2019,none,none,"Dear Guest,  It is great to hear feedback from you regarding your recent stay with us - we are glad to hear that you had a good overall impression of your stay. it's nice to hear that you found the rooms clean and we hope you had a comfortable stay. We are also happy to hear that our staff was able to take good care of your needs during your stay. We look forward to having you back soon.  Best Regards,  Magnolia Tree Hotel Customer Care Team",none,none,none,none,none,none,62,259
33 helpful votes,58 contributions,4.0 of 5 bubbles,"Great location, comfy bed and plenty of hot water!!","Stayed 4 nights recently and was really pleased by the friendly staff, the super comfy bed and the smokin' hot water - when you need a bath at the end of the day, that hot water is sooo welcome!! Is a budget hotel, but I would stay there again in a heartbeat. The location is close to Target, restaurants and an easy Disney shuttle. Great little gem in Anaheim for a good nights sleep. Was nice to have a fridge and a basic breakfast.",May 2019,none,none,"Dear Guest,  We appreciate your feedback and we thank you for giving prospective guests who may be reading the comments relevant information about our location and proximity to Disney/Target/local restaurants. We are glad you had a comfortable stay and that our staff was able to provide you with awesome service. It's nice that you found good value for the money you spent and we look forward to your next visit.  Best Regards,  Magnolia Tree Hotel Customer Care Team",none,none,none,none,none,none,63,259
76 helpful votes,77 contributions,3.0 of 5 bubbles,I'd give it 3.5 if I could,"We stayed in a family room with bunk beds. On the surface, it was a great room. They have tapped into the fresh, modern vibe for bedding which was great to see. Forest green and red are tired! Considering it was spring break, the price was amazing. We were on the bottom floor, but always able to park in front of our room every time. We bring white noise machines but could hear the people above us all night long, so I'd request a second-floor room. Personally, we don't think it's close enough to Disney to walk. Not a knock on the hotel, but I'd drive to the park or the bus lot (Woody & Friends, I think) closer to the hotel. We chose to drive to the park. Definitely needs some additional work, though. We're at Disneyland - the average family has at least 3 kids so two towel bars",March 2019,none,none,"Dear Guest,  It's nice to hear back from you - we are glad that you found our rates to be reasonable and competitive. It's good to hear you liked the overall look of the hotel as well as the bedding style. Your comment about cleanliness is noted and we will see to it that our staff does a better job preparing the rooms moving forward. We will also see what we can do about having some updates to the property soon. Your feedback about breakfast is duly noted and we will consider adding some more options in the future. We will also see what we can do about providing more channel options in the future. We hope you consider staying with us again in the near future.  Best Regards,  Magnolia Tree Hotel Customer Care Team",none,none,none,none,none,none,64,259
1 helpful vote,1 contribution,4.0 of 5 bubbles,Clean & comfortable for the price!,"Nice! Clean & quiet! Price was fair for the location & condition. Breakfast was good, better than basic continental. The gentleman gave us an early checking & a free upgrade from a Queen room to King!",April 2019,none,none,"Dear Guest,  It's great to hear back from you and we are glad that you found good value for the money you spent. It's great that you found our place to be clean and we hope you had a comfortable stay. We are also happy to hear that you were quite satisfied with the service that you received. Thanks for choosing to stay with us and we hope to see you again soon.  Best Regards,  Magnolia Tree Hotel Customer Care Team",none,none,none,none,none,none,65,259
1 helpful vote,1 contribution,4.0 of 5 bubbles,Nice cute hotel,"It's  a bit far to walk to Disney, but we did Lyft which was good. They have complimentary bagels, toast, cereal, juice, and coffee for breakfast which was nice. Parking was minimal since the lot was not very big. Overall nice stay.",April 2019,none,none,"Dear Guest,  It is great to hear feedback from you regarding your recent stay with us - we are glad to hear that you had a good overall impression of your stay. We are glad to hear that you enjoyed your breakfast and we hope that you had a great time at Disney. We hope that you had a comfortable stay and that everything was in order. Thanks for choosing to stay with us and we hope to see you again soon.  Best Regards,  Magnolia Tree Hotel Customer Care Team",none,none,none,none,none,none,66,259
2 helpful votes,3 contributions,5.0 of 5 bubbles,Great service and location,"The best of this hotel is its location and service. We walk to the Convention Center, Disneyland and many shops and restaurants are nearby. It is also close to The Outlets at Orange. The staff were always helpful and let me receive an Amazon shipping. Breakfast is not spectacular but enough. The room was clean. I would absolutely recommend it for couples.",March 2019,none,none,"Dear Guest,  Thanks for your review and we appreciate you giving prospective guests relevant information about our location and proximity to Disneyland / Convention Center. We are also glad you found shops and restaurants easily accessible. Our staff thanks you for the nice commendation you left about the service you received. Thanks for your recommendation and we look forward to your next visit.  Best Regards,  Magnolia Tree Hotel Customer Care Team",none,none,none,none,none,none,67,259
none,5 contributions,5.0 of 5 bubbles,Magnolia Tree Hotel,"Everything was excellent, rooms clean, beds comfortable, customer service and breakfast. It was a 15 minute walk to the convention center and convenient to bus transportation. Lots of fast food and restaurants within walking distance.",March 2019,none,none,"Dear Guest,  Thanks for your review and we appreciate you giving prospective guests relevant information about our location and proximity to the convention center. We are glad you found the rooms clean and the beds comfy. We hope you had a great time and we look forward to your next visit.  Best Regards,  Magnolia Tree Hotel Customer Care Team",none,none,none,none,none,none,68,259
6 helpful votes,31 contributions,3.0 of 5 bubbles,Needs a few tweaks,"This could be a great little place with a little tweaking but the management has no clue what travelers really want.  As much as I like the ""Pros"", the ""Cons"" are too numerous to give the Magnolia Tree more than 3 stars. Anaheim offers too much hotel competition in this price range for me to choose to stay here again.  Pros:  Clean & spacious rooms Very Nice Furniture A/C &heat Mini Fridge Free WiFi (if it doesn't kick you off the network) Downtown & close to Everything, (restaurants, pubs, Disney, Convention Center  Quiet Large Screen TV Free Parking *  Cons:   No Lamps on desk or nightstand -have to get out of bed to turn off lights via wall switches-not good for reading in bed  No Charging Station in room No Microwave Not enough & inaccessible outlets-had to move the desk to",February 2019,none,none,"Dear Guest,  Thanks for your review and we appreciate you giving prospective guests relevant information about our location and proximity to the downtown area. It's nice to hear that you found the rooms spacious and that you found the place to be clean. Your feedback about the additional amenities is noted and we will see what we can do about having some updates soon. We are also sorry to hear that your requested room was released to somebody else - we will look into our processes and see how we can avoid similar concerns in the future. Thanks for choosing to stay with us and we hope you consider staying with us again.  Best Regards,  Magnolia Tree Hotel Customer Care Team",none,none,none,none,none,none,69,259
2 helpful votes,21 contributions,4.0 of 5 bubbles,"good value, very low price","The Magnolia is .7 miles (15 minute walk) from the Anaheim Convention Center.  I didn't have car but they have free parking.  I arrived in the morning and the hotel staff stored my luggage while I went to the convention center for the day.  I checked in late afternoon and retrieved my luggage.  Again when I checked out they stored my luggage for the day while I was away.  This was a big convenience for me.  The hotel is old but the bathroom was nicely updated.  A power box on the nightstand had multiple USB outlets for charging devices - very convenient.  The sink was stylish but not so practical - it was all basin with only a narrow lip around it so there was no place to put my toiletries.  A large decent quality flat screen tv with a lot of broadcast channels, with multiple",February 2019,none,none,"Dear Guest, Thank you for your detailed and complimentary feedback; we very much appreciate the time that you spent sharing your experience with us. It is always wonderful to hear positive feedback in relation to our staff, thank you for those comments. We are pleased that the cleanliness of your room was satisfactory and that you had a comfortable stay. It sounds as if our hotel was very suitable for your accommodation needs in terms of the facilities that we offer. We hope to remain your hotel of choice in the Anaheim area.   Best Regards, Magnolia Tree Hotel  Customer Experience Team",none,none,none,none,none,none,70,259
none,4 contributions,3.0 of 5 bubbles,First time to California,"This hotel was much better than we expected! The rooms were VERY clean and updated ... just like the photos! It is close to all of the attractions, restaurants, shopping... Overall it is a good value hotel for the price.",January 2019,none,none,"Dear Guest,  It is wonderful hearing back from our satisfied guests and we are glad to hear that you had an awesome stay with us. We are glad that we were able to exceed your expectations and that you liked the room and the hotel. We hope you were comfortable and had easy access to everything you needed. It's also great that you liked our location and proximity to local establishments. We are glad you found good value for the money you spent and we look forward to seeing you again soon.  Best Regards,  Magnolia Tree Hotel Customer Care Team",none,none,none,none,none,none,71,259
none,1 contribution,5.0 of 5 bubbles,Weekend Getaway 🤗,"VERY clean. Friendly staff. Fast a d easy check in process. Please consider disposable cups in the room for tooth brushing/rinsing purposes. Other than that, it's perfect for the price! Thank you very much.",January 2019,none,none,"Dear Guest,  Our hearts are filled with joy because of the wonderful feedback that you provided. We are glad to hear that you had an awesome weekend getaway and that you found everything to be clean. Our staff will be delighted to hear that you left a nice commendation about the service you received. Your feedback about disposable cups is noted and we will see what we can do about it. Thanks for choosing to stay with us and we look forward to your next visit.  Best Regards,  Magnolia Tree Hotel Customer Care Team",none,none,none,none,none,none,72,259
none,1 contribution,5.0 of 5 bubbles,Repeat customers!,"We have stayed here twice and both times were excellent.  Clean, quiet rooms, parking has been fine. Helpful, speedy front desk. Accommodated our needs and took care of a slight misunderstanding with no extra charges. Will stay here again.",January 2019,none,none,"Dear Guest,  We are beaming with pride because of your amazing feedback. It's always great to hear back from returning guests and we are happy that we have consistently provided you with great service. We are glad you liked the clean rooms and it's nice to hear that you only have good words for our staff. Thanks for choosing to stay with us and we look forward to having you back soon.  Best Regards,  Magnolia Tree Hotel Customer Care Team",none,none,none,none,none,none,73,259
