Helpful Vote,Contributions,Overall Rating,Summary Heading,Summary,Date of Stay,Room tip,Trip Type,Manager Response,Location Rating,Cleanliness Rating,Service Rating,Value Rating,Rooms Rating,Sleep Quality Rating,Review Number,Index
12 helpful votes,46 contributions,4.0 of 5 bubbles,Good enough,"Pretty close to Disney. Uber was $8 morning, $16 evening. Limited breakfast (Eggos. toast, cereal). No hot foods. Clean, very large room - three beds. Good for the money. Bunk beds are cool and would be good for families with kids.",September 2022,none,Traveled with friends,"Hi khinds,   Thank you so much for your kind words. I’m so pleased that you found us a clean and pleasant place to stay and that our location and breakfast were to your liking. We take real pride in this hotel and in serving guests like you, and I’m extremely happy that you had such a pleasant stay. We look forward to having you with us again soon.",none,none,none,none,none,none,1,259
1 helpful vote,3 contributions,5.0 of 5 bubbles,"Clean, modern retro and convenient!","I loved the King/Twin bunk beds - very nice use of space! Comfy beds/pillows, window in bath room for fresh air, easy parking. We walked to Downtown Disney - that was long but doable. It's pretty quiet there, besides hearing other room doors slam - so if you are reading this, be a nice neighbor and remember to gently shut your doors anywhere you go, not just here. Be nice.",July 2022,none,none,"Hi Daydreem50166412490,   Thank you for giving us the opportunity to recognize our staff for their exemplary work in providing a clean and comfortable experience for our valued guests. Our ultimate ambition is to provide a five-star experience, and we are thrilled to learn that we have succeeded. I am glad that we were able to meet your expectations of service and accommodations and we're all looking forward to your next visit!",none,none,none,none,none,none,2,259
2 helpful votes,3 contributions,1.0 of 5 bubbles,Nightmare experience,The beds were horrible I could not sleep I came here to relax because I’m having surgery in a week they gave me a room with a horrible broken bed it had a big giant dip in it I could not sleep when I told the manager about it he didn’t care and didn’t wanna do anything about it not even change my room walking on the floor from the bed to the toilet twice at night my feet were totally black I had just had a pedicure that day now my feet are black on the bottom very unclean not friendly and I wouldn’t advise anyone to stay here,July 2022,none,Traveled as a couple,"Dear Sonia,  We are sorry to hear that several things during your stay did not meet your expectations. Please accept my sincere apologies for the state of your guest room and overall experience. This is a very uncommon scenario, and we again apologize for any inconvenience it caused you. I will be sure to investigate the matter and make sure it does not happen again.  Again, please accept my sincere apologies for your difficulties during your stay with us.  Regards, Magnolia Tree Hotel Management",none,none,none,none,none,none,3,259
47 helpful votes,60 contributions,5.0 of 5 bubbles,Clean and functional. Perfect for practical people.,"Family suite room layout wasn't as separated as shown in the photos but the beds were the same: 1 king, and a queen/twin bunk. More than enough space for 2 adults and 3 kids.  When I say practical, here's what I mean: 1) large bottles of shampoo/soap - I don't like small Hilton/Marriott bottles that are just littering the planet with plastic waste  2) breakfast was just bagels/oatmeal/cereal with milk/coffee/OJ - it's no 5* hotel buffet, but let's be honest, this is all I need and I am happy not to pay twice the price for the fancier food 3) room was clean, neighborhood was safe, and front desk people were easy to work with. That's all I need.  Minor annoyance: the pre-check-in forms which they said is handled by Booking.com and doesn't get relayed to them.  Word of advice for",July 2022,none,none,"Dear Slipaway,  We are always pleased to receive feedback from our guests about their stays with us, and we are delighted with your PERFECT score. It makes us so happy to know that you loved our well-maintained and clean hotel during your stay. We are happy to see that you appreciated our complimentary breakfast and friendly staff.  We look forward to hosting you again soon for another enriching stay on your next trip to Anaheim.  Thank you, Magnolia Tree Hotel Management  P.S. For amazing offers and the best prices on our accommodations, book directly on our website: magnoliatreehotel.com.",none,none,none,none,none,none,4,259
none,2 contributions,4.0 of 5 bubbles,Great service,"I had a very nice stay of 5 days at the Magnolia Tree in Anaheim.  When I arrived around midnight on the first night I found my reservation had been canceled by Booking dot com without my knowledge. The hotel was gracious to give me a larger room for the mistake even though it was not their fault.  Comfortable room, not fancy but great for the price and location",June 2022,none,Traveled on business,"Dear Kccrum,  Thank you so much for giving us a valuable rating for your stay with us in Anaheim. It’s fantastic to learn that you had an easy check-in process and found our room to be clean and spacious. Thank you for recognizing our affordable rates and the value our hotel provides. We are happy you enjoyed our convenient location.  We always want our guests to have a memorable stay with us, so we hope to see you again soon and earn a perfect score.  Thank You, Magnolia Tree Hotel Management  P.S. Be sure to book directly at magnoliatreehotel.com to find the lowest available rates for our property.",none,none,none,none,none,none,5,259
none,1 contribution,5.0 of 5 bubbles,"Great Little Hotel, Fantastic Location!","The staff was incredibly friendly. The room was clean and comfortable. Breakfast was simple, but good. While it may not have all of the amenities of the larger hotels, the location can’t be beat! I would stay here again anytime!",June 2022,none,Traveled on business,"Dear Lianna,  Thank you so much for leaving a Perfect Score review for your stay at Magnolia Tree Hotel. Our friendly and supportive staff works hard to keep the guest rooms clean, convenient, and comfortable. We are happy you enjoyed our convenient location and spotless rooms. We are happy to see that you appreciated our complimentary breakfast.  We can't wait to have you back for another pleasant stay with us on your next visit to Anaheim.  Thank You, Magnolia Tree Hotel Management  P.S. For amazing offers and the best prices on our accommodations, book directly on our website: magnoliatreehotel.com.",none,none,none,none,none,none,6,259
none,1 contribution,5.0 of 5 bubbles,Exceeds Expectations,"I’m used to hotels not living up to what the Internet says, but this place did not disappoint. Staff was pleasant. Everything was clean and fresh. The towels weren’t “oh so fluffy,” but they got the job done. The bedding WAS nice. I would stay here again whether for an event at the convention center (like this time; very walkable) or for Disney, etc.",June 2022,none,Traveled on business,"Dear Paul,  Thank you so much for leaving a Perfect Score review for your stay at Magnolia Tree Hotel.  We are so honored by the praise you provided for our hospitality, service, and maintenance. Thank you so much for appreciating our hardworking staff and convenient location. Our staff takes full responsibility to provide guests with a clean and comfortable stay. It's also an honor for us to learn that you had a good night's sleep on our comfortable beds.  We can't wait to have you back for another pleasant stay with us on your next visit to our area. Until then, take care!  Thank You, Magnolia Tree Hotel Management  P.S. Don't forget to book directly on magnoliatreehotel.com to get the best deals and discounts.",none,none,none,none,none,none,7,259
none,1 contribution,4.0 of 5 bubbles,Disney trip 👍🏼,"Our experience here was good!  Best part was the sleeping arrangement—bunk bed for kid. Fairly clean. Lots of USB’s, app tv, which was convenient for entertaining kid. Nights were quiet and bed was comfortable.  Cons: no counter space in bathroom. Bathroom is an odd layout. Not many convenient racks for towels either. Bathroom could’ve been cleaner.  If you don’t mind walking 1.5 miles after a long day at Disney, location is fine. We decided to drive.",June 2022,none,Traveled with family,"Dear Tina,  YOU MADE OUR DAY! Thank you so much for taking the time to leave us a PERFECT 5-STAR REVIEW of your recent stay at Magnolia Tree Hotel.  Comfort and convenience are our best attributes.  Glad to see that your experience highlighted this. It's great to hear that you found our place quiet and peaceful during your stay. It is awesome to learn that you loved our comfortable beds and the convenient location.  We look forward to hosting you again soon for another enriching stay on your next trip to Anaheim.  Thank You, Magnolia Tree Hotel Management  P.S. Always remember to book your stay directly at magnoliatreehotel.com where you will find the lowest rates anywhere online.",none,none,none,none,none,none,8,259
2 helpful votes,5 contributions,5.0 of 5 bubbles,Great visit,"A nice ideal, no frills base for my holiday.  The room was good, beds very comfy after a long day of activities, and the breakfast was a nice extra.  I wasn’t looking for more, so more than happy and would come back.",May 2022,none,none,"Dear Wendy,  Thank you so much for leaving a Perfect Score review for your stay at Magnolia Tree Hotel.  We are so glad you enjoyed our delicious complimentary breakfast, clean rooms, and comfortable beds. Our staff takes pride in working hard to provide clean rooms, greet guests, and ensure a fantastic stay, and your review speaks for itself--we are honored.  Thank you for choosing to stay with us, we are eagerly waiting to welcome you back soon.  Best Regards, Magnolia Tree Hotel Management  P.S. Book your stay directly on MagnoliaTreeHotel.com, where you will get exciting offers and great discounts!",none,none,none,none,none,none,9,259
30 helpful votes,62 contributions,5.0 of 5 bubbles,Better than expected,This hotel was much better than I had expected. The room was clean and large. I was alone but it could easily accommodate multiple people with its king sized bed and a bunk bed above. There are a lot of restaurants around and it is not too far to walk to Disneyland. I would stay here again if I had the opportunity.,March 2022,"This hotel is on a busy street I’m a city, so you will most likely hear traffic noises. I was in...",Traveled solo,"Dear Guest,  Thank you for staying with us and for taking the time to provide us with your valuable feedback. It is honorable to learn how you are impressed by our housekeeping staff and their dedicated service. Thanks for noting our great location--it is definitely something that sets our hotel apart from the competition.   Once again, we genuinely appreciate your feedback, and we hope to host you again very soon!  Best Regards, Magnolia Tree Hotel Management  P.S. Always remember to book your stay directly on our official website Magnoliatreehotel.com, you will get the lowest possible rates anywhere online!",none,none,none,none,none,none,10,259
none,2 contributions,5.0 of 5 bubbles,Disneyland with Kids,"We stayed one night in a family suite. It was perfect for sleep after a full day at the park.  It was close, the beds were comfy, plenty of room for a 16  and 8 year old and for two adults and it was really clean.  Thank you!",February 2022,none,none,"Hi Dickson,  WOW! Thank you for giving us a PERFECT RATING! It feels great to know that you enjoyed our modern and comfy hotel. I am so happy you liked the clean room and good vibes. Our staff works tirelessly to keep our hotel neat and clean. Thanks for the appreciation.  We would love to welcome you and your family back at the Magnolia Tree Hotel!  Best Regards, Magnolia Tree Hotel Management  P.S. Book your stay directly on our official website: MagnoliaTreeHotel.com and get excellent deals and discounts!",none,none,none,none,none,none,11,259
none,1 contribution,5.0 of 5 bubbles,Disneyland trip,"Everything was great very clean rooms, SUPER comfortable beds and cozy hotel room. Spacious and enough space for our family of 5. Good hotel parking very close to your room. Hotel is located within 25 mins walking distance to Disney. We will definitely stay here again no complaints at all!!",February 2022,none,none,"Dear Jessica,  Thank you for the PERFECT SCORE RATING of your stay with us during your trip to Disneyland. We are glad that you had a great time staying here at our spotless, comfortable, and welcoming hotel. We are pleased to learn that you loved our hotel rooms and other amenities we offer.  Thanks so much for your stellar recommendation! We look forward to hosting you again soon for another enriching stay on your next trip to Anaheim.  Best Regards, Magnolia Tree Hotel Management  P.S. Book your stay directly on our official website: MagnoliaTreeHotel.com and get excellent deals and discounts!",none,none,none,none,none,none,12,259
none,2 contributions,5.0 of 5 bubbles,I choose magnolia tree hotel over any of the near by choices when in Anaheim.,"The staff is always really nice, and the rooms are spacious and very clean with a nice modern feel. I definitely always choose the magnolia tree hotel. Its a great value for the price. Thanks again for the stay! Will be back and will recommend. Oh and the beds are very comfy!!!!",October 2021,none,none,"Dear Paige,  WOW! We are so excited to hear from you and to receive a coveted 5-star review! It made my day to hear that you had a fantastic experience with us and that you loved our comfortable beds, and super location. We love our guests enjoying our provided amenities to the fullest. And we would love to host you again for your next trip to Anaheim.  Thanks for your continued patronage.   Best Regards,  Magnolia Tree Hotel Management  P.S. Book your stay directly on MagnoliaTreeHotel.com instead of Online Travel Agents, where you will get exciting offers and great discounts!",none,none,none,none,none,none,13,259
1 helpful vote,1 contribution,1.0 of 5 bubbles,Disgusting,"If you like floors that leave dirt on your feet, rank unwashed sheets, lots of noise, and a front desk person who hates other people including you and isn’t on site for all issues, then this place is for you!",January 2021,none,none,"Dear Johnny:  It is apparent from your review that you did not really enjoy your experience at The Magnolia Tree Hotel. It is disappointing to read that we failed to meet your desired expectations. I will certainly place this feedback in front of the respective team managers and make sure this never repeats again. We are sorry for all our shortcomings.  Thank you for staying with us!  Sincerely, The Magnolia Tree Hotel Management",none,none,none,none,none,none,14,259
2 helpful votes,1 contribution,5.0 of 5 bubbles,Great,"Hotel room is great, the beds are wide so sharing isn’t no issue. You have a walk in hallway closet so you are able to storage your bags as well as hanging up clothes. Hotel is close to the park so you can either walk 30mins to the park or 10min drive to the park. Highly recommend staying here!",February 2020,none,none,"Hi SJA701,  Thank you for your spectacular response. We are glad that you liked the room and in-room amenities. Again, we are pleased to know that you found the location convenient. We will be happy to host you once more. We hope that your next trip is just around the corner!  Best Regards,  Magnolia Tree Hotel Customer Care Team",none,none,none,none,none,none,15,259
3 helpful votes,1 contribution,4.0 of 5 bubbles,Disneyland stay,I stayed at magnolia tree for a Disney trip this will be my 3rd stay here. It's decent. It's quite aways from the park. Breakfast is nothing special. It would be nice if they had curtains instead of shutters the rooms are really light. Also parking is free but we like to go to the park on our last day and they do not allow you to stay parked past check out.,February 2020,none,none,"Hi Journey687657,  Thank you so much for taking the time to review us. We are glad that you had a pleasant stay, We are offering a 'Lite Breakfast' for now but the plan is to expand and improve it. We have also noted your feedback regarding the curtains and will see what can be done about that. Depending on the vacancy, we are quite flexible with regards to parking past check-out. But we are sorry that we could not accommodate your request this time to make space for the upcoming visitors' vehicles. We hope that you will continue to visit us!  Best Regards,  Magnolia Tree Hotel Customer Care Team",none,none,none,none,none,none,16,259
3 helpful votes,1 contribution,5.0 of 5 bubbles,Couples trip to Disneyland,"CLEAN ROOMS... FRIENDLY SERVICE. Convenient location... close to restaurants,  Target,  $7 lyft from DISNEYLAND. Decent breakfast but super clean eating area.  Only downfall to the room was no coffee pots in room.",February 2020,none,none,"Hi Geo408,  Thank you for your review. We are glad that you found the room immaculate and service amicable. Thank you for appreciating our location and cleanliness too. Also, we have noted your feedback regarding the coffee pots and will surely pass it to the management. We hope that you will continue to visit us!  Best Regards,  Magnolia Tree Hotel Customer Care Team",none,none,none,none,none,none,17,259
33 helpful votes,28 contributions,4.0 of 5 bubbles,Nicely renovated and renewed,They've done a good job of renovating this property. New fixtures in the bathroom. Comfortable bed. Wooden shutters on the windows. Good value for the money. Included breakfast is simple but filling. Service staff is very good,February 2020,none,none,"Hi efassett,  Thank you for your stellar rating and response. We are glad that you liked the recent renovations and amenities. Thank you for appreciating the overall value, staff service, and breakfast. We look forward to your next visit!  Best Regards,  Magnolia Tree Hotel Customer Care Team",none,none,none,none,none,none,18,259
2 helpful votes,1 contribution,5.0 of 5 bubbles,Best bang for your buck!,"Stayed here for our most recent Disney trip. We go to Disney a few times a year and have tried a lot of the area hotels/motels. Magnolia Tree is great for what it is. For a low price, you’ll get free parking, breakfast & WiFi, a clean (fairly) recently upgraded room, and convenient location on Harbor Blvd.",February 2020,none,none,"Hi  kk1232020,  Thank you for your stellar rating and response. We are glad that you loved the service rendered by us and liked the overall value. Thank you for your positive comments about the amenities too. We are pleased to know that you liked the location too. Certainly, it will be a pleasure to host you again in the future!  Best Regards,  Magnolia Tree Hotel Customer Care Team",none,none,none,none,none,none,19,259
14 helpful votes,8 contributions,4.0 of 5 bubbles,Why pay more???,"Stayed at the Magnolia Tree in May/19. Needed a decent room for a decent price in my favorite area of Anaheim - this little hotel was perfect. Super clean room, comfy bed, really nice staff and near the Target, various restaurants and a good shuttle to Disney. Love this place and would recommend to anyone needing a great place to sleep between Disney days",May 2019,none,none,"Hi pattiOlantern,  Thank you for your feedback. We are glad that you liked the room and found good value for money. Thank you for appreciating our cleanliness, amenities, location, and staff service. Nothing makes us happier than a guest leaving us with a first-rate experience. We thank you for your lovely recommendations and we hope that your next trip is just around the corner!  Best Regards,  Magnolia Tree Hotel Customer Care Team",none,none,none,none,none,none,20,259
13 helpful votes,7 contributions,4.0 of 5 bubbles,Great Night's Sleep,"Overall we really enjoyed our stay. The beds are amazingly comfortable! The bathroom was nice and clean. A couple of minor negatives: the breakfast is very basic, the tub has glass doors which makes it difficult to bathe small children, the bright lights outside shine through the slats in the windows all night, and the parking was very very tight. There's an ART bus stop across the street if you're going to Disney, and it's a short walk to the Toy Story parking lot to catch the bus there. The staff was very friendly. The breakfast room has a few choices for cereal and bagels or toast, some packages of instant oatmeal, milk and Juice in the fridge, as well as yogurt. We were surprised that the bunk beds were as comfortable as the regular queen size beds. The kids really enjoyed",December 2019,none,none,"Hi rondah702,  Thank you for sharing your detailed experience with us. We are happy that you had a highly enjoyable stay coupled with comfortable beds, a clean bathroom, and friendly staff service. However, we are sorry about the minor inconveniences that you had to deal with. We have noted your suggestion regarding both the breakfast and glass doors and will definitely pass it to the management. But all in all, we are pleased that you were satisfied with the experience provided by us. We hope to see you again soon!  Best Regards,  Magnolia Tree Hotel Customer Care Team",none,none,none,none,none,none,21,259
12 helpful votes,5 contributions,5.0 of 5 bubbles,"Amazing holiday, a very helpful staff, very clean","I have stayed for 5 days there, and it was amazing, very clean, the room was spacious and the food is so good  i would like to specially thank Ammar the manager of this place and his wife, they have been of great help, whenever i faced any problem they were eager to help.",January 2019,none,none,"Hi maggiegendy,  Thank you for your amazing response. We are glad that you had a wonderful and immaculate stay coupled with good food and impressive service. On behalf of our team, we thank you for choosing us and we do hope to see you again in the future!  Best Regards,  Magnolia Tree Hotel Customer Care Team",none,none,none,none,none,none,22,259
20 helpful votes,14 contributions,5.0 of 5 bubbles,Repeat stay,"The Magnolia Tree Hotel in Anaheim is just down the street at the entrance to Disneyland.  The room was huge and the bed was one of the best in my many years of traveling.  We were happy to come back and got the same wonderful room The breakfast was skimpy, but fke the economical price,  any breakfast was not expected.",December 2019,none,none,"Hi Marcia,  Thank you for your spectacular response. We are glad that you found the room spacious and bed ideal for your needs. It is always a pleasure to hear from our regular customers. We have also noted your suggestion regarding breakfast and will try to improve that. We are eagerly looking forward to your next visit!  Best Regards,  Magnolia Tree Hotel Customer Care Team",none,none,none,none,none,none,23,259
2 helpful votes,1 contribution,4.0 of 5 bubbles,My Stay,"Our stay was okay. Our room was nice, but I didn’t like that I was up stairs with no elevator and my two kids were asleep in the stroller after a long day at Disneyland. I had to wake them up and carry my double stroller up the stairs. The walk was kinda long from Disneyland but not terrible.",November 2019,none,none,"Dear Nicolelee86,  Thank you for your valuable feedback. However, we are sorry for the room allocation. We apologize for the inconvenience you and your children had to face but we were unable to accommodate your request as we were running full. We will definitely keep in mind your convenience the next time and will strive hard to make your stay more successful. We hope to see you again soon!  Best Regards,  Magnolia Tree Hotel Customer Care Team",none,none,none,none,none,none,24,259
2 helpful votes,1 contribution,5.0 of 5 bubbles,Great Place to Stay!,Very clean room for an amazing price! Their king bed is very comfy and they have FREE parking! They also have free breakfast in the morning which was very nice. We will definitely be staying here again when we come back to Disney Land!,December 2019,none,none,"Dear kyleigh2019,  Thank you for your wonderful response. We are glad that you found good value for money and room immaculate. Again, we are happy to learn that you had a comfortable stay and loved the free parking and free breakfast facility. It was a pleasure hosting you! We are eagerly waiting to host you again in the future!  Best Regards,  Magnolia Tree Hotel Customer Care Team",none,none,none,none,none,none,25,259
3 helpful votes,2 contributions,3.0 of 5 bubbles,Renovated but still odd,"The room was nice, recently redone it seemed, bed and pillows were very comfy, but the tv didn’t have great channels and the mirror in the bathroom was super low and only showed the chest down and I’m not even tall. But overall great for what you’re paying and close to the park and convention center",November 2019,none,none,"Hi Heytheresierra,  Thank you so much for your honest review. We are glad that you liked the recently redone rooms and had a comfortable stay. However, we are sorry about the inconvenience you faced as a result of the tv channels and the bathroom mirror. We will surely pass your feedback regarding the channels to the management so that you can have better options the next time you want to entertain and relax. Again, we will also brood over your comment regarding the mirror height and see what can be done about that. But we are relieved to hear that you had a great stay overall and enjoyed the location and convenience. We look forward to the pleasure of serving you once more!  Best Regards,  Magnolia Tree Hotel Customer Care Team",none,none,none,none,none,none,26,259
