Helpful Vote,Contributions,Overall Rating,Summary Heading,Summary,Date of Stay,Room tip,Trip Type,Manager Response,Location Rating,Cleanliness Rating,Service Rating,Value Rating,Rooms Rating,Sleep Quality Rating,Review Number,Index
2 helpful votes,1 contribution,5.0 of 5 bubbles,Good nights rest,Beds are comfortable and I was able to sleep through the night. No charge for parking is always great. There’s free breakfast in the mornings. The staff is friendly and helpful. It’s the perfect stay for a night!,November 2019,none,none,"Hi there, It sounds as if our hotel was perfect for your needs, and we are delighted that you enjoyed your time with us so much. Thank you for your positive rating; we hope that you will have an opportunity to make a return visit very soon.    Best Regards,  Magnolia Tree Hotel Customer Care Team",none,none,none,none,none,none,27,259
2 helpful votes,1 contribution,5.0 of 5 bubbles,Great stay,"The room was clean and spacious, and the bathroom was remodeled. The hotel had free parking but might had been overbooked because when we got back from Disneyland around 2am there was no parking. The staff was really friendly, however the other guests were not very considerate. I saw two vehicles parked in the middle of two parking spots. The other guests were extremely loud and was having an argument in the parking lot around 9pm. It was four groups in the family since they were yelling at each other across the parking lot and up and down the balcony. Then around 8am they were extremely loud and kids screaming. But overall the hotel was great.",November 2019,none,none,"Dear guest, It sounds as if our hotel was perfect for your needs, and we are delighted that you enjoyed your time with us so much. Thank you for your positive rating; we hope that you will have an opportunity to make a return visit very soon.    Best Regards,  Magnolia Tree Hotel Customer Care Team",none,none,none,none,none,none,28,259
2 helpful votes,1 contribution,5.0 of 5 bubbles,More than your money’s worth,"My first impression of this hotel was when I called to let them know we’d be checking in late, they answered on the second ring. That already made me happy, I hate going through twenty different things just to talk to someone.   Check in was easy. The girl at the front desk was extremely nice and helpful. She was who I mainly dealt with. When I checked out there was a guy, he was also nice but I didn’t have any real interaction with him. The rooms were well kept and homey. The bathroom looked newly remodeled and was very clean. This was a relief to my boyfriend and I because we hate old/gross bathrooms at hotels, as I’m sure most people do ha.   The price you are paying for the location and the room, I think is well below what it’s actually worth. I was happy with my stay and",November 2019,none,none,"We are delighted to have provided you with suitable accommodation for your trip here. We appreciate your kind rating, and we hope to welcome you back again before long.  Best Regards,  Magnolia Tree Hotel Customer Care Team",none,none,none,none,none,none,29,259
15 helpful votes,14 contributions,5.0 of 5 bubbles,"Excellent Price, Nice Room, Close to Everything, I Slept Like a Baby","It was a last minute booking over Booking.com. At first I was not sure if I should book it because I’m looking for Hilton branded places to earn HH points but I’m glad I did. The room was clean. It’s surprisingly quiet although I’m at the 1st Level and across the main, busy street. Check in was prompt. I was given a parking pass. It’s walking distance to a lot of restaurants. The A/C worked great. I had a very good night’s sleep.",November 2019,none,none,"Dear mitcardinal,  Thank you so much for your thoughtful feedback! We are glad that you took the decision of staying with us and had a clean and peaceful stay. Again, we are pleased to know that you had a quick check-in and found the location and amenities just great. We look forward to welcoming you again!  Best Regards,  Magnolia Tree Hotel Customer Care Team",none,none,none,none,none,none,30,259
104 helpful votes,151 contributions,2.0 of 5 bubbles,A place to sleep for a few hours and nothing more,"We visited the Magnolia Tree Hotel as part of a visit to Disneyland, like most do.  This should be the only reason whatsoever to stay here, and even then, you should only do so if you plan on staying all day from open to close and use the room as a place to sleep.    We checked in and found our room to be in a pretty poor state.  For starters, the carpets were so dirty we had to keep socks on that would quickly turn black from the carpets.  We all threw them away when we got home.  Of the two bedside lights, one was burned out and not working.  The bulbs in the bathroom were a rainbow of light colors from bright white to soft yellow in no particular order.  The walls were clearly very dirty and had not been washed in some time.  There was no cable TV, something I have never",October 2019,none,none,"Hi Nevergo33,  Thank you for sharing a review of your recent stay with us! On behalf of our entire team, we apologize for not being able to exceed your expectations. We are extremely sorry that you were not satisfied with our service and did not find the room to your liking. We will definitely ask our housekeeping crew to be more particular about ensuring cleanliness. Also, we have noted your feedback regarding the bedside lights and bulbs and will try our best to fix them! Again, we are sorry about the cable TV. We will see what can be done about that. However, we are glad that we could provide you with a good location, fast Wi-Fi and free parking. Your satisfaction is important to us and we will be using this review to ensure that we offer a better experience to our guests in the future. We would really appreciate a second chance to earn back your trust!  Best Regards,  Magnolia Tree Hotel Customer Care Team",none,none,none,none,none,none,31,259
2 helpful votes,1 contribution,3.0 of 5 bubbles,Ok,"Free parking was nice. Before heading to Disneyland, they allowed us to park our car before check-in. Staff was friendly. Rooms were nothing special, but they were clean. Parking was tight. Breakfast only includes cereal and bagels. Price was reasonable. Denny’s next door, which was nice.  However, we won’t stay again as it is too far of a walk to Disneyland for us.",October 2019,none,none,"Dear mit591,  We thank you for your valuable feedback! We are extremely delighted to hear that you liked the free parking and staff service. Again, we appreciate your comment regarding the cleanliness and value offered. We specialise in providing our guests with a Lite Breakfast. However, the plan is to expand the selection and provide our guests with more varieties. We hope to make your next stay better!  Best Regards,  Magnolia Tree Hotel Customer Care Team",none,none,none,none,none,none,32,259
2 helpful votes,1 contribution,5.0 of 5 bubbles,Excellent Stay!!!,"I cannot say enough good things about this place. Clean rooms, kind and helpful staff, and very affordable. I will want to stay again and would recommend Magnolia Tree to others. I have stayed multiple places near a Disneyland, and, while this hotel is a little further away, it is a good one.",October 2019,none,none,"Dear Foxdoc,  We thank you for sparing a moment to write to us! We are glad that you just loved your stay and enjoyed every bit of it, right from the clean rooms to the amicable staff. We are sorry that the location proved to be a little far away but then we are still preferred for our location by the guests. We cannot thank you enough for your kind words and positivity. We would love to have you here with us once more!  Best Regards,  Magnolia Tree Hotel Customer Care Team",none,none,none,none,none,none,33,259
5 helpful votes,3 contributions,4.0 of 5 bubbles,Getaway,Price was right for time at Disneyland with courteous staff and clean room. Just older hotel so nothing extra. It was also noisy with other customers coming thru. I felt safe by myself. I recommend for short stay,October 2019,none,none,"Dear bdunkin3,  Thank you for your amazing response! We are glad that you liked the value offered and found the staff service amicable. Again, we apologize for the inconvenience you faced as a result of the noise. We are sorry for that. We will see what can be done about that. We hope our next experience will be better! Hoping to see you here again and again!  Best Regards,  Magnolia Tree Hotel Customer Care Team",none,none,none,none,none,none,34,259
2 helpful votes,1 contribution,5.0 of 5 bubbles,Great stay for a quick trip,Quick trip to Disney for a day. Can’t beat the price for two night and two queen beds. I would say the only downside was for our room with 4 girls total there was only a single mirror in the bathroom. This made for a difficult morning getting ready as there was one to share in the whole room. If they were able to add another in the room it would be perfect other than that it is perfect!,October 2019,none,none,"Dear 1995tara,  Thank you for your amazing response! We are glad that you loved your stay and enjoyed the location and value offered. However, we are sorry for the inconvenience you all had to face as a result of the mirror. We have noted your suggestion and will pass it to the management to do the needful. We hope you will keep coming to us! See you soon!  Best Regards,  Magnolia Tree Hotel Customer Care Team",none,none,none,none,none,none,35,259
2 helpful votes,1 contribution,5.0 of 5 bubbles,A Diamond in the Rough,"Freshly decorated, clean & modern. Comfortable bed. Updated bathroom and shower. Priced right. Friendly staff. Breakfast included. Great value and centrally close to everything. Will definitely stay again!",October 2019,none,none,"Dear Sheki09,  Thank you for your wonderful response! We are glad that you liked the place and the ambiance. Again, we are delighted to learn that the beds were comfortable and that you enjoyed the recent updates. It is true that we are considered as one of the most reasonably priced hotels in the area. We thank you on behalf of our entire team for choosing and appreciating us. We are looking forward to your next visit!  Best Regards,  Magnolia Tree Hotel Customer Care Team",none,none,none,none,none,none,36,259
71 helpful votes,126 contributions,5.0 of 5 bubbles,Best kept secret for large families,"We were looking for a hotel that sleeps 7 and has breakfast and found the Magnolia Tree Hotel!  Plenty of parking, about 1.5 miles from Disneyland entrance, breakfast includes cereal, bagels and juice/milk.  Room slept 7 and we really enjoyed staying there!  We will definitely come back when we are back on another Disneyland trip!",September 2019,none,none,"Dear Kepi,  Thank you for taking out the time to write to us! We are glad that you had a great experience staying here and enjoyed every bit of it, right from the parking to the breakfast. We are eagerly looking forward to your next trip!  Best Regards,  Magnolia Tree Hotel Customer Care Team",none,none,none,none,none,none,37,259
2 helpful votes,1 contribution,5.0 of 5 bubbles,A super nice surprise,"As this was an impromptu trip, we were looking for a room under $100... we found Magnolia Tree in booking.com....  when I drove up, I’m not gonna lie... I got scared when I saw a retro motel from back in the day. These now a days usually mean dirty or hourly!!! BUT NOT MAGNOLIA!!! MAGNOLIA WAS AWESOME!!!... it was clean, updated, and comfortable... I also felt very safe. Parking was tight but my car was safe. I would definitely stay again.",October 2019,none,none,"Dear Lisa,  Thank you for making us glow with your review! We are glad that you found us exceeding your expectations! Thank you for appreciating us as clean, comfortable and updated. We are glad that we could make you feel safe within our premises.  We are waiting impatiently for your next visit!  Best Regards,  Magnolia Tree Hotel Customer Care Team",none,none,none,none,none,none,38,259
48 helpful votes,11 contributions,4.0 of 5 bubbles,Overall Good Stay,"Stayed here 2 days. Hotel was clean which is most important. Bed was  fine, free parking amd free wifi. Anout  15 min walk from Disney. Or there is a bus ""43"" that goes right accross disney amd back to hotel. The fare is 2 bucks per person. No change given so have 2 bucks or no change. Plenty of restaurants around. Overall all good.",October 2019,none,none,"Dear Killerbee2009,  Thank you for describing our location so well in your review! We are glad that you found the property clean and enjoyed the amenities, free parking and Wi-Fi. We are happy to have got this opportunity to host you. We don't really hesitate to ask you for many more of these opportunities! Please visit us again!  Best Regards,  Magnolia Tree Hotel Customer Care Team",none,none,none,none,none,none,39,259
2 helpful votes,1 contribution,4.0 of 5 bubbles,Big Room,"Our room was really big. We had two queen beds and there was still room to spare. Everything seemed very clean and new. I do wish the bathroom had counter space, because of the farmhouse style sink there was no place to put our toiletries. The beds were comfy, I just would have liked more pillows but I know I could've called and asked for some more. It was pretty noisy, we could hear the room above us and the parking lot is right outside of the rooms so it was pretty noisy at times. Continental breakfast was to be expected, and left us full. Overall we would stay again. It was only a few miles away from Disneyland.",October 2019,none,none,"Dear TeamGibson09,  Thank you for your amazing response! We are glad that you found the room big and the property immaculate! Also, we have noted your suggestion regarding the counter space and will pass it to the management for future improvisations. We also regret the inconvenience caused to you as a result of the noise. However, we are glad that you liked the overall stay and enjoyed the breakfast. We hope that your next trip is just around the corner!  Best Regards,  Magnolia Tree Hotel Customer Care Team",none,none,none,none,none,none,40,259
2 helpful votes,1 contribution,5.0 of 5 bubbles,Amazing,"My stay there was really good. I would just say to have more of a variety on breakfast but other than that everything was perfect! I would also say the rooms are a little too small for two beds, we kept hitting our ankles on the edge of the bed.",September 2019,none,none,"Dear Giselle,  We thank you for sparing a moment to review your recent stay with us. Although we offer a lite breakfast, we have taken note of your feedback for future improvements in this area. Also, we are sorry for the inconvenience caused to you due to the less space in the room and though we have recently only renovated the property, we will continue to make further improvements. We hope you will visit us again soon!  Best Regards,  Magnolia Tree Hotel Customer Care Team",none,none,none,none,none,none,41,259
2 helpful votes,1 contribution,4.0 of 5 bubbles,Anaheim weekend,"Clean, convenient to Convention Center, where I was headed, with personable, and friendly help.  The rate was reasonable and worth what was charged.  If I had a negative reaction, it was regarding parking sites: a little narrow for a pickup.",September 2019,none,none,"Dear rlepcrn,  Thank you for choosing to stay with us! We are glad that you found the location convenient and service helpful. However. we are sorry about the inconvenience caused due to parking, We have noted your feedback regarding this and we will see what we can do about it. We hope to serve you again in the future!  Best Regards,  Magnolia Tree Hotel Customer Care Team",none,none,none,none,none,none,42,259
2 helpful votes,1 contribution,5.0 of 5 bubbles,Very nice stay!,"The room was very nice, clean, and comfortable. The staff was very kind and the location was great! Just a short drive to the Disneyland parking structure. We would for sure stay here again on our next visit!",September 2019,none,none,"Dear Maria,  Thank you for leaving us such a lovely review. We are glad that you had a great time with us. We take immense pride in our location as it's close to Disneyland and convention center. Again, we are sure that our staff would be equally happy to read what you have written. So thank you again and we look forward to hosting you once more!  Best Regards,  Magnolia Tree Hotel Customer Care Team",none,none,none,none,none,none,43,259
2 helpful votes,1 contribution,4.0 of 5 bubbles,"Clean, comfortable, affordable alternative to the Mega-hotels","I was here for a conference and didn’t want to spend $250/night plus another $30 to park my car. What a ripoff!  This was a pleasant 8 minute walk to the mega-hotel hosting my conference, and parking was free!  My room was spotlessly clean, the bed was comfortable, and it was surprisingly quiet considering the hotel is on a busy street. The staff was most helpful and accommodating. If you like a huge breakfast with waffles, etc., you might be disappointed. But the bagels, toast, fruit, oatmeal, yogurt and coffee was fine by me.  There’s a refrigerator in the room but no microwave or coffee pot. However, you can always access the breakfast room for hot water for tea and to use the microwave. All in all, I was very satisfied and will definitely one again if I’m in the area.",September 2019,none,none,"Dear docmcr2019,  Thank you for choosing to stay with us and reviewing that stay. We are thrilled to know that you really enjoyed your time here and found us a better option compared to the Mega-hotels. We aim to provide top-notch service to our guests at affordable rates. Your review surely affirms the hard work we put in every day. Highly elated to learn that you loved the location and found the rooms squeaky clean. If you are ever in this area, please feel free to book your stay with us. See you soon!  Best Regards,  Magnolia Tree Hotel Customer Care Team",none,none,none,none,none,none,44,259
2 helpful votes,1 contribution,5.0 of 5 bubbles,great room,"everything about room was great, good location, great price, cleanliness.  Breakfast was good, Room was cleaned everyday. Lots of restaurants, with in a block from room.  Secure parking lot, and quiet slept really well",September 2019,none,none,"Dear Guest,  Thank you for your feedback on your recent stay with us. We are glad to hear that you had a good overall impression of your stay and we hope you were comfortable. It's nice that you liked our location and proximity to restaurants. We are also glad you found the place clean and we hope you were comfortable. Thank you for choosing to stay with us and we look forward to seeing you again soon.  Best Regards,  Magnolia Tree Hotel Customer Care Team",none,none,none,none,none,none,45,259
2 helpful votes,1 contribution,1.0 of 5 bubbles,HORRIBLE. AVOID THIS HOTEL!,"Let me start with saying the room was decent. When we requested room service the sheets we had used weren’t changed to clean ones, they just made the bed and threw on the ones we had used. The towels they provide are old, rough and raggedy. The room has no cable, there were bugs in the restroom, and in the bathtub. The sink and shower water is dirty. We had more issues with the staff and how we were treated. As soon as we were about to check in I asked about the parking policy because my boyfriend and I drove separately to meet here. The woman working the front desk named Namrata rudely cuts me off and tells me to read the sign by the computer. The sign says one parking per guest is permitted. I said ok and if I could get the second parking pass and she says ok that it’s going",August 2019,none,none,"Hello Cristian,  We appreciate your comments - thank you for taking the time to leave us with feedback about your recent visit. It's unfortunate that you did not experience the usual level of satisfaction that other guests have but we love that you have pointed out the things that we can improve on. Your concern about cleanliness is noted and we will see to it that our team does a better job preparing the rooms. We will also see what we can do about having some updates soon. We are disappointed about the feedback on our unfriendly staff; we aim for awesome customer service and we do not tolerate rudeness from our team. We will look into the matter and have corrective measures in place. We are sorry for the inconvenience caused and we hope you consider staying with us again.   Best Regards,  Magnolia Tree Hotel Customer Care Team",none,none,none,none,none,none,46,259
259 helpful votes,585 contributions,3.0 of 5 bubbles,Convenient location but noisy,"This is an affordable hotel within walking distance of Disneyland and the Convention Center. There are also a lot of restaurants and shops within walking distance so there really was no need for a car.   Reception staff were friendly and the housekeeping staff did a good job. That said, the carpet in our room was filthy and had a stale odour. The AC worked well and thank goodness because we had it running pretty much 24/7.   A simple breakfast is included. Bagels, cereal and yogurt. Nothing fancy but worked fine for us.   My biggest complaint is the noise. Kids stomping around, people slamming doors, car alarms going off, etc. We were constantly woken up in the night. Next time we’ll stay at a quieter hotel.",August 2019,none,none,"Dear Guest,  Thanks for your review and we appreciate you giving prospective guests relevant information about our location and proximity to Disneyland and the Convention Center. It's great that our staff was able to provide you with good service and we hope you had a comfortable stay. Your feedback about the carpet/cleanliness is noted and we will see to it that our staff does a better job preparing the rooms moving forward. We will also see what we can do about having some updates to the property soon. We hope to see you again the next time you are in the area.  Best Regards,  Magnolia Tree Hotel Customer Care Team",none,none,none,none,none,none,47,259
2 helpful votes,1 contribution,3.0 of 5 bubbles,Expectations were met for thos hotel!,"I booked this hotel because of location and price, and I did not expect it to be a full service luxury hotel. What I got was a clean, small, convenient room at a reasonable price. I was completely satisfied with my experience, again, matching my expectations.",August 2019,none,none,"Dear Guest,  Thank you for your feedback on your recent stay with us. We are glad to hear that you had a good overall impression of your stay and we hope you were comfortable. It's nice that you found good value for the money you spent and that you were completely satisfied with your stay. Thanks for choosing to stay with us and we hope to see you again soon.  Best Regards,  Magnolia Tree Hotel Customer Care Team",none,none,none,none,none,none,48,259
2 helpful votes,1 contribution,5.0 of 5 bubbles,I would go again if i have a chance,"first, I got 20% discount from their website. great price even without discount. room is very clean. breakfast is not bad. i don't think you can find a better place with this price. convenient place.  recommended!!",August 2019,none,none,"Dear Guest,  It's great to hear back from you and we are glad that you found good value for the money you spent. It's nice that you found the place clean and we hope you were comfortable. Thank you for your recommendation and we hope to see you again soon.  Best Regards,  Magnolia Tree Hotel Customer Care Team",none,none,none,none,none,none,49,259
2 helpful votes,1 contribution,4.0 of 5 bubbles,Business stay,I have been in magnolia hotel for one week and I had a great stay! Cleaning was very good. The bed was really confortable. Air conditioner worked fine. Breakfast was also fine and always available from 6.30 am. I would for sure  recommend it.,August 2019,none,none,"Hello Anaitasalinas,  It is a delight to hear back from you regarding your recent stay with us - it's nice that you had a good overall impression of your visit. We are glad you found the place clean and that you had a comfortable stay. We hope that everything was in order and we look forward to having you back soon.  Best Regards,  Magnolia Tree Hotel Customer Care Team",none,none,none,none,none,none,50,259
7 helpful votes,12 contributions,4.0 of 5 bubbles,Friendly and satisfying stay,"Stayed here with my 2 daughters  just two weeks ago, booked a family room. It was quite a satisfying stay. There were 2 large bed and the room was big enough to accomoadate us. Room was cleaned everyday although they don't change the sheet daily :D Hotel provided breakfast, which is a very plus point because we don't have to hassle in the morning just to get something to eat.  Location is also a huge advantage. There were numerous restaurants around eg. denny's, tacobel, Jack in the box, del taco, Carl's Jr etc; Target supermarket within 10 minutes walk, a coin laundry, convenience store just right around the corner. Bus stops also within 1-5 minutes walk, going to Disneyland was such a breeze.  Hotel staffs and managers were friendly. All in all, I will recommend this hotel to",July 2019,none,none,"Dear Guest,  It is a delight to hear back from you regarding your recent stay with us - it's nice that you had a good overall impression of your visit. We are glad you found the rooms spacious and clean - we hope you had a comfortable stay. It's also nice that you liked our location and proximity to restaurants. Thanks for choosing to stay with us and we hope to see you again soon.  Best Regards,  Magnolia Tree Hotel Customer Care Team",none,none,none,none,none,none,51,259
