Helpful Vote,Contributions,Overall Rating,Summary Heading,Summary,Date of Stay,Room tip,Trip Type,Manager Response,Location Rating,Cleanliness Rating,Service Rating,Value Rating,Rooms Rating,Sleep Quality Rating,Review Number,Index
1 helpful vote,9 contributions,1.0 of 5 bubbles,Horrible Hotel! Not Smoke Free!,"The room was fairly clean. The breakfast was awful; very little choices & eggs tasted like water (not real). This is a smoke free hotel and yet there are cigarette butts all around the property.  When I checked in at 3 it smelled like smoke around my room. Went to a party and came back at 11pm and the smoke smell was horrible.  I told the front desk but these ""kids"" didn't seem to care. This is supposedly a smoke free hotel. My stomach is still upset from having to sleep with the wreaking smell in my lungs. I took pictures that I will share with the manager tomorrow. Yuck!  Here are some pictures right outside my room.",September 2022,none,Traveled with family,none,none,none,none,none,none,none,1,262
2 helpful votes,4 contributions,5.0 of 5 bubbles,Best Hotel in Califirnia,"We traveled from El Paso, Texas to California before checking the prices on hotels first. There were several big events happening in the area the week of September 10th through 20th 2022 so prices were high. Thank God for Martin at Quality Inn. He was kind, knowledgeable and made us feel right at home. The room was clean, refreshing and very comfortable. Breakfast was superb. They even have staff prepare waffles during the week. We camped out two nights just to be able to come here again. Clean towels and cold air conditioning.. This time our room was in the back and again amazing. The best place to stay in California for sure. Safe, clean and welcoming!!!!",September 2022,Parking is spacious and safe. I would book through an app to save money. The Choice app is higher...,Traveled as a couple,none,none,none,none,none,none,none,2,262
none,4 contributions,1.0 of 5 bubbles,Discrimination against Service Dogs.,"I was approached and questioned about my service dog when we were doing nothing but minding our own business, packing up our things in the parking lot atleast 40 feet from the hotel after what was seemingly a decent stay.  I then recieved rude comments when I stated one of the many tasks my service dog performs to get him out of our business and my personal space quickly. I told him it was pretty rude to ask when we are obviously going about our business and not causing any sort of disturbance. He then said ""It looks like a pet, but I'll let it slide.""  When I asked him who is manager was he turned his back on me and walked away with no response to my repeated questioning for his name and his managers name.  I called the front desk phone and he refused to give me his managers",May 2022,none,Traveled on business,none,none,none,none,none,none,none,3,262
1 helpful vote,2 contributions,1.0 of 5 bubbles,Horrible service and disrespectful staff.,"You could not pay me to stay here again.  I urge you to look for another place to stay and avoid a horrible place that will rip you off. I took my family on a trip to see friends and figured for the price, that this would be a good place to stay.  Says breakfast will be included, however they ""run out"" of food and do zero to take care of issue. We saw drug use on the stairwell near elevator and management did nothing. BEWARE",May 2022,none,Traveled with family,none,none,none,none,none,none,none,4,262
15 helpful votes,16 contributions,3.0 of 5 bubbles,Good hotel but one member of the staff was terrible.,"Nice hotel and good cleaning rooms. Comfortable bed and a decent breakfast service.  I only give them 3 stars because one of the employers call Ariel has this strange passive aggressive attitude with us. When we ask for a package he wasn’t polite at all so we ask for his name to make a complain and he say “Ariel and I’m also going to be here at the morning” like making us a warn, then he pass us the package and by the moment we receive it he just keep holding the box with this threatening attitude like waiting for so kind of reaction of us.",March 2022,none,Traveled with family,"Hi Anfemo3, I thank you very much for staying with us recently and I apologize for any misunderstanding on our employees behalf, for any package pick up we do require a photo ID and the name on the package has to match the ID. I hope that you can give us another opportunity to make your stay great on your next trip to the area.",none,none,none,none,none,none,5,262
176 helpful votes,482 contributions,4.0 of 5 bubbles,Great!!!!,"Very nice place to stay. Beds are wide and comfortable... place is clean and have all we needed travelling with two little boys. Had to mention the shower, since was suuuuuper good!!! Hot water and perfect pressure.",May 2021,none,Traveled with family,"Hi Sandra,  We are pleased to hear that your stay was great and we met your expectations, we sure hope that you can visit us again soon.",none,none,none,none,none,none,6,262
18 helpful votes,4 contributions,4.0 of 5 bubbles,A great stay with a great price,"Needed an affordable one night stay as a friend and I were visiting the CSU Fullerton campus which was only a 5 minute drive from the inn. At check-in, we were informed that our room was upgraded from a King to 2 queens which was perfect (at no additional cost). For COVID reasons they took our temperatures and had us sign paperwork in regards to their policies and procedures regarding the virus. In no time, we were in our rooms on the 2nd floor facing the parking lot. The room was spacious and very clean. The AC was tricky at first since we wanted to keep it running the whole stay but it turned off after a certain time. In the middle of the night it started warming up in the room and I was having troubles turning it back on...it wasn't a dealbreaker for me, but I could see",August 2020,none,none,"Dear JerryC362,  Thank you for taking the time to tell us about your recent stay at our hotel.  We are very happy to hear that you enjoyed your stay at our hotel.  We are taking any precaution necessary to prevent the virus and yes we are taking temperatures at check in, have hand sanitizer stations on all floors and sanitizing all points of touch in the public areas as well as in the rooms.  We thank you for giving as an informational review and we hope to see you soon.  Sincerely, Management",none,none,none,none,none,none,7,262
45 helpful votes,26 contributions,5.0 of 5 bubbles,Celebrating our 10th anniversary,This has become our favorite place to stay when going to Disneyland Resort! The staff has been absolutely amazing each time we've stayed. They have newly remodeled the rooms and they're beautiful. We'll definitely be going back as often as we can.,March 2020,"The area the hotel is in is industrial so nights are incredibly quiet, no matter what floor we...",none,"Hello Disneygurusmith,  We are very happy to hear that you have enjoyed your stay at our hotel. Our hotel strives to provide a clean and comfortable rooms for every single guest that visits us.  Thank you for your kind review and we hope to see you soon.  Sincerely, Management",5.0 of 5 bubbles,none,none,none,none,none,8,262
127 helpful votes,164 contributions,4.0 of 5 bubbles,Pleasantly Surprised,"I had a very good experience at my stay at this Quality Inn.  The facilities were in the process of being renovated, so it made for a nice and comfortable stay.  The wifi was good as well as the morning breakfast.  The only problem was the parking.  Not enough parking spaces for all the guests, so people made their own spaces along the sides of the lot.  The location was convenient along the 57 freeway and just north of the 91 freeway.  Though it seems to be a bit isolated, a short drive away are a lot of places to shop and eat.  Just a block away is a Sam's Club and a little over a mile is a Costco, so it's a great place to pick up supplies or gas up.",February 2020,none,none,"Dear Guest,  Thank you for letting us know about your recent stay at our hotel. We are very please to know that our hotel was of good value to you. Our hotel was undergoing renovations but we are all set and the parking issues are not a problem any more.  Thank you again for your review and we hope to see you soon.  Management,",4.0 of 5 bubbles,none,none,none,none,none,9,262
197 helpful votes,927 contributions,4.0 of 5 bubbles,Good Location,Very efficient and friendly staff at check in. Room was not overly large but was satisfactory. Clean and comfortable. Breakfast had both hot and cold options. Fairly easy access to main roads with plenty of restaurants nearby.,January 2020,none,Traveled as a couple,"Dear Valued Guest, Thank you for letting us know about your recent stay at our hotel. On behalf of our entire staff we would like to thank you for acknowledging that our rooms were clean and comfortable.  We are also happy to hear that you enjoyed your breakfast the the customer service. We hope to see you again.  Management",none,none,none,none,none,none,10,262
46 helpful votes,47 contributions,4.0 of 5 bubbles,Very good hotel with breakfast,"My wife and I enjoyed our stay in this hotel. Simple but good. Breakfast is very good as well. Room is comfortable, simple and clean. Location is also pretty good. This is an affordable, simple hotel. Not great... I would stay there again.",January 2020,none,none,"Dear Guest,  We are very happy to hear that you enjoyed your stay at our hotel.  Glad that you found your room comfortable and that you felt that our breakfast was of good value to you. Thank you for your comment and we hope to see you soon again.  Sincerely, Management",none,none,none,none,none,none,11,262
119 helpful votes,180 contributions,5.0 of 5 bubbles,"Great location, great value","I have stayed at this hotel many times before and I'm still hooked on the server, breakfast, and rooms. I booked a room with a king bed. While the is a bit smaller than other hotels that I have stayed at, it's just right for my stay in the North OC. Close to Cal State Fullerton, local businesses, freeways, and Disneyland. The service from the staff is still very friendly. The breakfast is among the better ones for it's class of hotels. Some of the breakfast items include waffles, scrambled eggs, potatoes, and cereals.   A tip for this hotel would be to get your breakfast before the rush of people, I try to be there within the first 90 minutes of service time.",November 2019,none,none,"Hello Mou2,  Thank you for taking the time to tell us about your stay at our hotel. We are very exited to hear that your enjoy the value received at this our hotel and that you are like our service. Yes we are centrally located to many Southern California attractions including Disneyland, California Adventure, Universal Studios, and Knotts Berry Farm to name a few.  On behalf of our team we want to thank you for your review and we hope to see you again soon.  Sincerely,  Management",none,none,none,none,none,none,12,262
51 helpful votes,21 contributions,4.0 of 5 bubbles,Great stay for the price,"My husband and I stayed here for four nights in November as a base for our Disney vacation. I booked based on ratings and price, and while it’s not as close to Disneyland as other hotels, I’m glad we stayed here. It was an easy 15 minute drive (we used Lyft mostly) and an even shorter one to the Honda Center where we went to a hockey game.  The hotel is tucked in a commercial and industrial area, and while it was a little strange, we didn’t find any issue with that at all. And yes, as other reviews say, it is an older building with some older decor, but that hardly affected our stay.  The room itself was very comfortable! The bed was comfortable, and everything was very clean. Cleanliness, especially in the bathroom, is the most important factor for me. Housekeeping should",November 2019,none,none,"Hello Kara,  We would like to thank you for a very informative review on our Hotel.  We are very happy to hear that you enjoyed your stay and that our hotel was clean and comfortable for your vacation needs.  Our hotel is in the process of a soft renovation and we will be changing the noisy ac units.  Thank you for your time to tell us about your stay and we hope that you stay with us soon.  Sincerely,  Management",none,none,none,none,none,none,13,262
43 helpful votes,31 contributions,4.0 of 5 bubbles,Cheaper option in Anaheim,"We really enjoyed it, it was so much cheaper than right out side disney but driving to disney was easy. The breakfast was good and filling and the room itself was nice and clean. I will point out that there was a lot of smokers, it didn't bother us but it definitely might deter other non smokers.",October 2019,none,none,"Dear Guest,  Thank you for taking the time to let us know about your recent stay at our hotel.  We take pride in providing clean comfortable rooms and great customer service.  Our hotel also provides a buffet style breakfast for all our guests and we are glad that you enjoyed it.  We are a non smoking property and guests are allowed to smoke outside in designated areas or 8 feet away from the building.  Never the less if smoke bothers our guest we will address the issue.  Thank you again for your review and we hope to see you soon.  Sincerely, Management",none,none,none,none,none,none,14,262
8 helpful votes,4 contributions,1.0 of 5 bubbles,Quality is not the true description,"Lets start by saying this place has all the charm and cozy ambiance of a minimum security federal prison.  It starts with a sign at the door advising if you or somebody you know is being forced to work in a job against their will, to call the number provided.  I have never seen such a sign at any other hotel or motel ever.  This motel is in an industrial area and makes you wonder who their clients are.  The reception area is spartan and reminiscent of a very low level government office.  The tile floor is in serious need of cleaning.  The grout, which was once a light color, is now seriously dark brown.  The tile in the elevator is gross with gunk piled up all around the edges.  The parking lot is in serious need of resurfacing and the trees on the West side are so overgrown in",July 2019,none,none,"Dear George J,  On behalf of our entire staff we would like to apologize for a less than pleasant stay at our hotel.  Thank you for pointing out the areas of opportunity for our hotel, our staff will focus on making sure that we take care of the issues that you have mentioned.  Unfortunately the sign that you mentioned is a mandate by the state that all business with the same nature as our business have to post in a conspicuous place.  We are very sorry if the sign made you feel uncomfortable. Thank you taking the time to write about our hotel and it is our hope that you give us another opportunity to serve you better.  Sincerely, Management",none,none,none,none,none,none,15,262
19 helpful votes,17 contributions,5.0 of 5 bubbles,Perfect quality and great value.,"I’ve grown to really love the level of service, accommodation and comfort you get from a Quality Inn. This one was no exception. A perfect location for Disney, the Angels baseball and also shopping at Orange Outlet. We’ll definitely look at Quality Inns first in future.",July 2019,none,none,"Dear Guest,  Thank you for taking the time to tell us about your recent stay at our hotel.  We are happy to hear that you enjoyed the level of service of our team at the Quality Inn Placentia.   We are definitely centrally located to most of the attractions in Southern California and our team takes pride in delivering a higher level of service.  We hope to see you soon.  Sincerely, Management",none,none,none,none,none,none,16,262
81 helpful votes,122 contributions,3.0 of 5 bubbles,Basic but might be ok for a short stay...,"Stayed at this Inn for 8 nights, probably too long for this place.    First, continental breakfast. Enough food to get your day started; egg patty(?), sausage patty, make your own waffles, cereal, toast, oatmeal and a few other things I can’t remember. However, breakfast during the week was only served until 9am(10am weekends). Great if you’re a business traveler but we found it ended too early for leisure travelers like ourselves.   Plenty free parking. Neighborhood was quiet and industrial. Felt pretty safe. 7-11 close by.   The room. Tiny. Difficult for two people with two suitcases to find space, ended up using the chair from the desk as an end table. Some mold on the bathroom walls, no fan so not much ventilation in there.  Small pest problem. Little flies were coming out",June 2019,none,none,"Dear Guest,  On behalf of our entire team I would like to apologize for a less than pleasant stay at our hotel.  We have shared your review with our team and will be working towards making our guests stays more comfortable.  We will discuss having the breakfast open later than 9 am on weekdays and will also mention the pest issue to our pest control company.  It is our hope that you give us another opportunity to serve you better.  Sincerely, Management",none,none,none,none,none,none,17,262
155 helpful votes,252 contributions,4.0 of 5 bubbles,Good motel,"We stayed in this motel for 5 nights. One of the nights we had very loud neighbors all night and the staff were not helpful enough despite 2 calls to the front desk. We also stayed in 2 different rooms. One was great and the other could have smelled much better. The staff were mixed. Female staff were great, male not so much. The breakfast was just so so- could have been much better. We liked the location and neighborhood. Liked the beds and bed linens. Nice pool with ducks in it while we were there. The neighborhood is mostly industrial.",March 2019,none,none,none,none,none,none,none,none,none,18,262
25 helpful votes,155 contributions,5.0 of 5 bubbles,Great place,Me and my mom stayed here for four nights for our Disney trip! Everything was clean and very nice! The beds were comfy. Had a good breakfast and always had cookies at night! Definitely would recommend this place!,February 2019,none,none,"Hello Nicolelynette,   On behalf of our entire staff we would like to thank you for your review.  Your feedback is very important to us and we can assure you that we will use this information to do everything possible to create an enjoyable experience for each of our guests.   We are happy to hear that you enjoy the rooms and the facilities at our hotel.  We hope to see you again soon!  Sincerely,  Management,",none,none,none,none,none,none,19,262
20 helpful votes,39 contributions,1.0 of 5 bubbles,Very bad experience!!,"I stayed there this past Sunday, Jan 20, 2019.   I checked in around 4pm. Around 5:30pm, I just finished taking a shower and was drying myself off. There was a knock on the door. Before I could answer, the door began to open. This was quite disturbing because I was butt naked. I was quite alarmed. Luckily, I had the bolt lock on and whoever opened the door couldn't open it.   I heard a female voice but I couldn't make out what she was saying. She was asking me something. I asked her what is it that she was looking for? She said are you ok? I said, ok about what? She said, ok, if you're ok, then it's ok.   This was quite alarming to me. I didn't know what that meant. She closed the door and left. So I called downstairs to ask what was going on. I told the front desk that someone",January 2019,none,none,"Hello traveling90808,  Thank you for taking the time to tell us about your recent stay at our hotel.  On behalf of our entire staff, we would like to apologize for a less than pleasant stay at our hotel.  I have investigated your concerns, our housekeeping staff had forgotten to place a decorative sheet on your bed and they wanted to comeback to the rooms to placed it but the rooms was already occupied.  Allow us to apologize for this miscommunication among our staff.  We thank you for your review and we hope that you give us another opportunity to serve you better.  Sincerely,  Management",none,none,none,none,none,none,20,262
none,8 contributions,5.0 of 5 bubbles,"Nice staff, highly recommend!","We are a group of families with kids to Fullerton for science tournament. We had to leave early the next morning for the event. Breakfast on regular weekend starts from 7pm, which was too late for us. Ms. Florencia of Quality Inn Placentia was very nice to prepare the breakfast earlier for us, and offered her help to see whether we needed anything. We really appreciate her kindness and warm words. Big thanks!",December 2018,none,none,"Hello,  Thank you for taking the time to tell us about your recent stay at our hotel.   We very much appreciate and value your feedback and will share it with our team and Florencia.  Your survey responses will serve as encouragement to all of our staff as we strive to continuously improve the quality of our services to provide an exceptional experience for our guests.  It is always a pleasure to receive positive feedback.  Thank you again for sharing your experience, and we hope your next visit will be even more pleasant than the previous one.  Sincerely,  Management",none,none,none,none,none,none,21,262
90 helpful votes,379 contributions,4.0 of 5 bubbles,4 Stars for sure!,"We were very pleased with Quality Inn Placentia. Good location, close to everything. The management was courteous, the room was clean and decidedly comfortable. The breakfast was better than most, although our only complaint was that the eating accommodations were a bit cramped. But we would definitely stay here again!",December 2018,none,none,"Hello Sonova_Beach,  We are very happy to hear that you enjoyed your stay at our hotel. On behalf of our entire staff we want to thank you for your positive review, we love to hear that our guests are enjoying our clean and comfortable rooms and our great customer service.  Thank you for letting us know that the breakfast was better than most.  Again thank you for your review and we hope to see you again soon.  Sincerely,  Management",none,none,none,none,none,none,22,262
none,3 contributions,3.0 of 5 bubbles,Decent price,No hot tube. Room was decent and clean. Would have liked more towels. Breakfast was average and same thing daily. After being there 3 nights I wanted something different. Quiet place but a little bit away from places to eat.,December 2018,none,none,none,none,none,none,none,none,none,23,262
9 helpful votes,10 contributions,5.0 of 5 bubbles,I stay here every other month for work!,"Every time I have to come into Fullerton for work, as a Choice Diamond Member I always stay with Choice, and this is the best Choice Hotel in the Anaheim area! They always have a water waiting for me at the desk, and there's plenty to UberEats or Postmates from, and it's 3 miles from my LA office. The staff is always friendly, and I'm happy to call myself a regular guest at this hotel! Plus free cookies on check in! Like a Double Tree for half the cost! Everyone knows you only stay at a Double Tree because of the free cookies... Haha",October 2018,none,none,none,none,none,none,none,none,none,24,262
223 helpful votes,85 contributions,5.0 of 5 bubbles,Great value excellent service from front desk,"Much better option than the high priced options near Disneyland. The rooms are well equipped with refrigerator, microwave, work desk with a good quality chair, many electrical outlets, new type shower head with good water pressure and good quality mattress on the bed. Breakfast had several hot food options and a big variety. Front desk staff went out of their way to accommodate my needs and made my stay perfect. Parking is free so overall a great value and highly recommended.",October 2018,none,none,"Dear Guest,  On behalf of our entire staff I would like to thank you for your review.  We are very happy to hear that you enjoyed your stay at our hotel and that you felt that our hotel was of great value to you.  Our team strives to deliver clean and comfortable rooms every day and we are glad that you enjoyed your room. Your review will help us as encouragement to our team. Thank you again for your review and we hope to see you again soon.  Sincerely,  Management",none,none,none,none,none,none,25,262
none,1 contribution,2.0 of 5 bubbles,Off putting oder,"Off putting, Bad smell in the air, also the bedding seems damp. It smells like mold or something they tried to cover up with some sort of air freshener. I will not be back. The room is nice though ....",September 2018,none,none,"Hello Brian,  Thank you for taking the time to tell us about your recent stay at our hotel.  We are very disappointed to hear that your stay was not up to standard.  On behalf our entire staff please accept our sincere apology, we have shared your review with our cleaning staff and the room has been inspected to make sure that there is no smell in the future.  Again, thank you for your review and we hope that you give us another opportunity to serve you better.  Sincerely, Management",none,none,none,none,none,none,26,262
