Helpful Vote,Contributions,Overall Rating,Summary Heading,Summary,Date of Stay,Room tip,Trip Type,Manager Response,Location Rating,Cleanliness Rating,Service Rating,Value Rating,Rooms Rating,Sleep Quality Rating,Review Number,Index
3 helpful votes,3 contributions,3.0 of 5 bubbles,Acceptable Room; Very Thin Walls!,"My husband and I decided to stay somewhere near Disneyland for a night, after we went to Knott's Berry Farm after his work one day. This hotel was a good location for both. The room was decent (we weren't expecting much, but thought it was pleasant enough).  At 3:30 am though, I was awoken by the voices of the room next door. I don't think they were talking overly loud, but they could clearly be heard. Shortly after, somebody knocked on our door, and quickly went away (I'm guessing somebody in a drunken stupor knocked nad realized quickly that they had gone to the wrong room). As the doors are all facing outward, I think it's very easy for anybody to come and disturb. The talking next door continued on until 5:30 am. While I thought about calling the front desk to ask them to",October 2016,none,none,none,none,none,none,none,none,none,63,262
6 helpful votes,14 contributions,5.0 of 5 bubbles,Reunion trip,"This is the best place to stay if you are traveling to Orange County. We booked several rooms for our reunion and everyone said the same thing, it was great. The breakfast is wonderful, the rooms were nice and clean. The maid service was great. Everyone on staff was so helpful, even when I needed a safety pin. When I come back to CA this is where I will be staying, This trip made my second visit, Thank you Quality Inn.",October 2016,none,none,none,none,none,none,none,none,none,64,262
14 helpful votes,126 contributions,3.0 of 5 bubbles,No room to eat,"On the plus side, the beds were comfy, and we had a room for handicap that was comfortable for my husband to get around in his walker. Also there was plenty of parking for our SUV with trailer. On the negative side, the blankets were too thin - no comforters like we ususlly find at hotels. Also, we always enjoy a breakfast before we start out on the road in the morning, but there was a tour group that took up all available space.",October 2016,none,none,none,none,none,none,none,none,none,65,262
101 helpful votes,530 contributions,4.0 of 5 bubbles,Great for a conference,"We needed a reasonable priced hotel for a couple of nights at a conference in Placentia. Most hotels nearby were quite pricey and the Quality Inn was under a $100 per night, with breakfast, free wifi and close to freeways, but not too close.",October 2016,none,none,none,none,none,none,none,none,none,66,262
15 helpful votes,45 contributions,5.0 of 5 bubbles,Great hotel great staff.,From the moment we got to the front desk we were made to feel welcome.  The room and bed were both spotless and comfortable.  I did have a small problem with the chair in the room but the staff sorted it out in short order :)  Breakfast was basic but there were plenty of choices and as it was a buffet style you could eat all you wanted.  All in all I can heartily recommend this hotel to anyone visiting LA for Universal or Disney as it's close by but without the outrageous prices.,October 2016,none,none,none,none,none,none,none,none,none,67,262
none,none,2.0 of 5 bubbles,"Very rude manager Roberto,","Manager Roberto  was the rudest hotel manager.  .Just warning if you have a problem with your room, oh well Roberto won't even help you out.   WILL NEVER GO BACK!!!!   Don't waste your money, wish I would have done more research before booking this Hotel.",October 2016,none,none,"Hello Stephanie Dwelle,  Please allow me to apologize if I seemed rude over the phone.  Please know that your reservations booked by your travel agent were sent to us only for two rooms with one king size bed only for double occupancy.  During our conversation I explained to you that my front desk agents were able to accommodate your request for two beds in one room and another room with a king bed and a sofa sleeper.  These upgrades do require an upgrade fee but I waived it to accommodate your stay.  I was just simply not allowing more discounts to you because we did accommodate your needs and my team did everything possible to give you the beds you needed.  I am sorry if I seem rude when I said there would not be an additional discount.  I hope that you understand that our hotel staff tried our best to accommodate you and your family.  Thank you for your review.  Roberto Vasquez General Manager",none,none,none,none,none,none,68,262
3 helpful votes,24 contributions,5.0 of 5 bubbles,Great place for families,"Stayed for 2 nights with kids. Clean rooms, have microwave and refrigerator im rooms. Pool is heated and clean, no hot tub. Breakfast is good selection and therebwas a very happy and friendly keeping everything full! We ubered to Disney, 10 minute ride and about $10 fare.",October 2016,none,none,none,none,none,none,none,none,none,69,262
9 helpful votes,37 contributions,4.0 of 5 bubbles,sports team bus trip,"This is a slightly out of the way motel although it did a fine job looking after 80 young people and their coaches on this trip. Staff was, of course, quite busy but they carried out their business with a smile and were quite helpful. The rooms were mid size with a comfortable enough bed and a fridge and microwave. The bathroom is a little small but was kept clean. The included breakfast had the usual continental ingredients plus the waffle maker and sausages. Disneyland was a 10 minute drive away and shopping opportunities a little closer. This stay was generally a good experience.",August 2016,none,none,"Hello John M,  Thank you so much for your review of our hotel the Quality Inn Placentia.  We are happy to hear that you were satisfied with our service.  I am specially glad that our staff were able to carry business with a smile and that they did a great job with providing clean and comfortable rooms.  Our hotel does have an extended breakfast with waffles, sausage patties and egg patties and of course we have the plenty of more items for a full continental breakfast.  I will be sharing your review with our staff so they know that they are doing a great job and that our guest are having a good experience at our hotel. Again thank you for your review and we hope to see you again soon.  Best Regards, Roberto Vasquez General Manager",none,none,none,none,none,none,70,262
1 helpful vote,4 contributions,2.0 of 5 bubbles,Eh.,"Stayed here for 3 nights at the end of a trip to CA. On the first night, founds stains (might have been wine?) all over the comforter. I called down to the desk and was advised I could be switched to another room. I asked to see the room first and upon inspection found that the comforter in the new room was also dirty. That said, the stains were more concerning than what I think was wine on the first room. I ended up staying in the first room and did receive a clean comforter the following day. Otherwise, room is pretty much what you would expect for the price. Treadmill in the ""gym"" (converted motel room) was broken. Hallway smelled of marijuana the first night. The best part of this place is that it's relatively close to Disney and right next to this awesome little place",September 2016,none,none,"Hello kalaughlin,  I want to thank you for taking the time and review our hotel.  I would like to apologize for giving you a room that was not up to standard your review has been shared with our housekeeping staff to prevent this from happening in the future.  Thank you for bringing up to our attention the elevator permit, the department of industrial relations has been notified since 5 months ago and we are schedule for an inspections soon. I am glad that you found us convenience for Disneyland and the Bruery, two places that you definitely do not want to miss when visiting this area.    Thank you again for your review and we hope that you consider us for your future stays.  Best Regards, Roberto Vasquez General Manager",none,none,none,none,none,none,71,262
184 helpful votes,559 contributions,4.0 of 5 bubbles,Comfortable Stay,"Other than the fact that they didn't fulfill my request for a ground floor room and there was no sofa as had been depicted when I booked, there was really nothing 'wrong' with our accommodations.  Luckily they had an elevator.  The room was small, but we merely slept there after checking in and going to a dinner show.  The bed was comfortable, the room clean and overall maintenance was somewhat above average.  While the standard fare for Choice properties, the breakfast and dining area were both above average.  The lady taking care of replenishing the food, although by herself (and the place was packed when we were there), did an excellent job.  Check in and out were a breeze as we are Choice Privileges members and were using points for a free night.",August 2016,none,none,"Hello Ron P,  First of all I would like to thank you for taking the time and letting us know about your recent stay at our hotel.  I am glad that you enjoyed the breakfast and the service provided, even when the hotel was completely full and most guests were enjoying breakfast.  I will make sure to pass on your compliment to our break fast attendant.   I would like to apologize for not meeting your request for a first floor room, I will make sure that we do everything possible for our future guests to meet their requests.  I would also like to say thank you for being a Choice Privileges member and happy to hear that my team recognized your loyalty to our brand.  Thank you for choosing our brand and we hope to see you soon.  Best Regards, Roberto Vasquez General Manager",none,none,none,none,none,none,72,262
246 helpful votes,4500 contributions,3.0 of 5 bubbles,"Decent hotel, close to a great brewery","Booked via Choice with Points.  The check in was OK, the room was cleanif a bit dated, with cheaper furniture, not to Fairfield Inn level (but it is now a Quality Inn). King bed which was a bit lumpy, lumpy pillows, decent TV, microwave and fridge, free wifi.   Plenty of parking, decent pool, little gym with old equipment, OK breakfast. In walking distance to the Bruery.  Overall, OK if at the right price.",July 2016,none,none,"Hello Lubiere,  I want to thank you for being a Choice Privileges member and thank you for your review.  Please accept my sincere apology if the hotel was of less value than what you expected.  We do offer complimentary breakfast, complimentary parking and wifi.  We are close to the Bruery and to Disneyland and centrally located for other Southern California attractions.    I hope that you found our hotel of good value for the price paid and it is our desire that you choose our hotel for your future stays.  Sincerely, Roberto Vasquez General Manager",none,none,none,none,none,none,73,262
80 helpful votes,192 contributions,3.0 of 5 bubbles,Adaquate,"Stayed here for one night while attending commencement at CSUF..  It's reasonably clean and in good condition for the price.  Location is in an industrial area but pretty quiet since it was a Saturday night.  The staff was ok.  Check-in was impersonal.  The highlight on the staff was a elderly woman (I think Filipino) who was quite delightful.   Breakfast was average to fair, they were running out of the sausage constantly.",May 2016,none,none,"Dear RedwoodShores305,  Thank you for taking the time to tell us about your recent stay at our hotel.  I am glad to hear that you found our hotel adequate for your visit and your needs.  We are very close to CSUF, thank you for letting us know that the hotel was quiet even on a Saturday night when we are typically sold out.  I will make sure to share your comment with my staff so we improve out service when our guests are checking in.  I will let our breakfast attendant know about your positive comment about her and we will make sure that food is promptly replenish.    Again thank you for your comment and we hope to see you again soon.  Sincerely, Roberto Vasquez General Manager",none,none,none,none,none,none,74,262
none,6 contributions,3.0 of 5 bubbles,Ok for sleeping,Clean but small room. Fridge and microwave are a nice touch. Breakfast just ok - crowded and not much fresh stuff. Location was good for my meetings but I wouldn't want to spend much time in the room other than sleeping.,August 2016,none,none,"Dear Magique1960,  I would like to thank you for taking the time to review our hotel the Quality Inn Placentia.  I am glad to hear that the hotel was close to your meeting and that you enjoyed our amenities.  Our rooms are equiped with a microwave, refrigerator, coffee maker, hair dryer and an iron with an ironing board for your convenience.  I apologize if the room was smaller than your expectations.  I will make sure to talk to upper management about including more fresh options for breakfast.    Again thank you for your review and it is our hope that you consider our hotel for your next visit to the area.   Sincerely, Roberto Vasquez General Manager",none,none,none,none,none,none,75,262
52 helpful votes,55 contributions,3.0 of 5 bubbles,Comfortable,"Free WIFI, free parking, free breakfast. We were there for a family vacation and the hotel is about 15 minutes from Disneyland. The rooms were small but sufficient. The bed and linenes were clean and comfortable. Our room had a strong unidentified smell, if we hadn't been so tired upon check in we would have asked for a different room. We propped the door open for a while. There was a fridge, microwave and the room seemed recently updated. There was black mold in the bathtub. If not for the mold and funky smelling room I'd have rated this 4 stars, as I was otherwise impressed. Good job Quality Inn, I may stay here again.",June 2016,none,none,"Dear Guest,  We are happy to hear you enjoyed your stay and will consider staying with us again. Please do let us know if there is anything else we can do to improve, we apologize for the issues you faced. Thank you for candid comments and your business.",none,none,none,none,none,none,76,262
7 helpful votes,41 contributions,1.0 of 5 bubbles,Rudeness,"This is my second time staying at the Quailty Inn in Placentia and will be my last. Their rudeness is a turnoff. No greeting no thank you or any appreciation for your business.... I their is a lack of training in customer service or a basic understanding of the hospitality business...   The meaning of Hospitality...   noun 1. the friendly and generous reception and entertainment of guests, visitors, or strangers.  It's very simple...",July 2016,none,none,"Hello Guest,  We do sincerely apologize for the service you had received. Please do allow us to serve you again and we will rectify these issues. Thank you for your candid comments and your business.",none,none,none,none,none,none,77,262
19 helpful votes,113 contributions,3.0 of 5 bubbles,"Not bad, serves it's purpose.",This hotel serves it's purpose especially if you're just look for a place to sleep. The room wasn't big at all and it was also outdated. The bed was comfortable though and the staff was nice and welcoming. Breakfast was included which was nice as well.   Definitely a good place if you're looking to save a dollar and just want somewhere to sleep.,July 2016,none,none,"Hello Guest,  We are glad to hear that you found your stay satisfactory. Please do come again soon. Please if you have any other suggestions, let us know and we will try our best to incorporate them. Thank you for your comments and business.",none,none,none,none,none,none,78,262
35 helpful votes,114 contributions,5.0 of 5 bubbles,THIS IS A GREAT PLACE,"Our 2 day stay was A1 +.  If any one writes a bad review about this motel, the are sabotaging to review process.  This place is in our top 10 and we stayed at more than 100 motels the past 3 years. ENJOY THE AREA",July 2016,none,none,none,none,none,none,none,none,none,79,262
83 helpful votes,175 contributions,3.0 of 5 bubbles,Not bad,"Not the worse I've stayed, clearly not the best either. Carpet is very dated. The front desk when I checked in late was not very friendly. I guess that's the thanks for being a diamond member. If I wasn't using points would I pay for this one, no. I'd have spent just a little bit more for a little bit better hotel",July 2016,none,none,none,none,none,none,none,none,none,80,262
10 helpful votes,53 contributions,4.0 of 5 bubbles,"Safe, clean comfortable","I agree with other reviewers,  this is a motel and rooms are tiny but the price was great and since we were just sleeping there,  it was fine.  Comfortable beds,  a/c worked great.  If your planning to stay multiple nights,  this may not be the best  choice. But if you just need a bed,  it's just fine.",June 2016,none,none,none,none,none,none,none,none,none,81,262
63 helpful votes,59 contributions,3.0 of 5 bubbles,Meh,"I stayed for 2 nights at this place, which definitely feels like a budget motel.  To be fair, the price is quite reasonable.  My room was small, and the bathroom door clunked loudly against the counter every time it was left open.  The bathroom area was cramped.  There was a fridge and microwave, but they took up a lot of room in an already small space.  The walls were thin and other guests were loud until quite late.  The place feels quite dated and a bit shabby.  But generally functional, easy to find, good service, and reasonably priced.",June 2016,none,none,"Meh,  Thank you for taking the time to let us know about your recent stay at our hotel.  Your feedback is greatly appreciated and we are glad that you found the room to be of good value and reasonably priced.  We apologize that the room was not of your liking and are glad that you found value in our service.  If you are ever not completely satisfied with your room please feel free to contact our front desk agent so we can accommodate you in a room that is functional for you.   Again we thank you for your review and we hope that you give us another opportunity to serve you better.  Roberto Vasquez General Manager",none,none,none,none,none,none,82,262
1 helpful vote,1 contribution,1.0 of 5 bubbles,"Deceptive! This should be called a ""Motel"", not ""Hotel"".","Tiny room crammed with cheap looking furnishing. Sagging beds. Odorous, moldy smelling room, dirty carpet. People's smoke outside the balcony would seep into your ""non-smoking"", so if you're intolerant of smoke smell, don't stay here.  Place has a funky smell overall.  Wouldn't recommend at all.",May 2016,none,none,"Greatlife99, I would like to sincerely apologized for a less than pleasant stay at our hotel.  On behalf of our entire team please accept our apology for not providing you with the accommodations, facility and service that you deserve.   It is our hope that you five us another opportunity to better serve you in the future.  Sincerely, Roberto Vasquez",none,none,none,none,none,none,83,262
2 helpful votes,9 contributions,1.0 of 5 bubbles,"Dirty hotel room. Rude, nasty, unprofessional manager.","Upon checking in and unpacking after a long day, we were getting ready for bed around 10 PM.  We found out the bed linens were not changed from the previous guest check out, had many hairs on sheets (head hairs, body hairs, pubic hairs).  I called front desk and was told there was no other staff at the hotel to bring new sheets and change them.  Hotel sold out with a high school softball team so no feasibly available room for us to switch to. We didn't mind to go down to front desk to pickup the new bed linens to change the sheets ourselves.  Upon taking down the bed sheets, we were horrified to see how dirty the blanket was! We brought it to the front desk to exchange for a new one and also to pick up new sheets one more time, as the new sheets given to us the first time was of",June 2016,none,none,"LovetoTravelSage,  On behalf of our entire team at the Quality Inn Placentia I would like to sincerely apologize for your recent stay at our hotel.  I am very concerned about the level of service that you received at our hotel, our team is always ready to accommodate our guests in every possible way.  I have noted all the deficiencies that you mentioned in your review and will make sure that none of our guests experience a less than pleasant stay.  While looking at the notes on your reservation we noticed that you were fully compensated and another room was offered to you, again I am sorry that we were not able to provide you the level of service that you deserve.   Sincerely, Roberto Vasquez",none,none,none,none,none,none,84,262
8 helpful votes,42 contributions,3.0 of 5 bubbles,"Great Pros, Terrible Cons = Extremely Alright","Quick checklist: PROS - Clean Room - Comfortable Beds - Microwave, mini-fridge, and television in-room - plenty of hot water for showers - Simple but effective breakfast  CONS - leaky faucet from outside soaked through into our carpet - some guest issues (loud outside after midnight & minor pot use)  Booked this room through Hotwire for a three-night stay, after having just had a terrible experience booking through them previously and getting a rat-hole of a hotel. Luckily, this one was initially great, as we had come in to find a room furnished with a comfortable bed, clean sheets, neat and tidy room, refrigerator, and microwave.  We got the room because of a competitive rate near Disneyland, which was the focus of our trip, as we were using the final days of our premium Annual",June 2016,none,none,"Rafael M,  Please accept my sincere apology for failing exceed your expectations.  I am very sorry for the inconvenience that you experienced with the wet carpet, this was an issue that we did not have an explanation about.  We are glad that our amenities worked out for you and that the room overall was comfortable except for the incident.  Please know that our team is always ready to take care of noise issues in a very gentle way.  I am glad that you enjoyed the breakfast.    Please feel free to contact me for any of your future hotel needs and I will personally make sure that your room is comfortable.    Sincerely, Roberto Vasquez",none,none,none,none,none,none,85,262
7 helpful votes,19 contributions,5.0 of 5 bubbles,Very nice,This was my first trip driving solo to the LA area! My sister and I traveled to Anaheim to see a baseball game. I wanted a Choice Motel as close to Angel Stadium as possible. This location was perfect. Easy travel to the stadium and back.,June 2016,none,none,"Lorane, Thank you for your review, it is always great to receive positive feedback from our guests.  We are glad that you enjoyed your stay and that you found our hotel to be in close proximity to the Angel Stadium.  We are centrally located to many attractions including Disneyland and Knotts to mention some.  Thank you for visiting our hotel and we look forward to your next visit to the area.  Sincerely, Roberto Vasquez",none,none,none,none,none,none,86,262
16 helpful votes,17 contributions,4.0 of 5 bubbles,Quality Because It Used to be a Fairfield Inn,"I've never been a fan of the Quality Inn chain of hotels.  Any name with the word ""QUALITY"" to try to describe how great it is usually falls flat as far as I'm concerned.  In fact I booked this hotel through the ""Express Deals"" option on Priceline.com and thought that I was going to get a Fairfield Inn (Marriot Brand) but was disappointed when I got this chain.  After the stay, I must admit that it was rather pleasant, but mainly attributed to the fact that it used to be a Fairfield Inn up until about a year ago.  Please note that if this wasn't the case, the hotel stay would have been less pleasant, and I say with experience having lived out of hotels for over 6 months back in 2012-2013 and after moving out of SoCal, I visited this part of LA County quite often.",April 2016,none,none,"Hello Ming W,  I want to thank you for giving as an extensive view of our hotel.  Yes we used to be a Fairfield Inn Marriott two years ago but we have maintained our hotel in top performance, thank you for noticing.  We do have some work to do in some areas of the hotel and I am glad that you mentioned them so we can improve.  Your review is very informative as we are always looking for ways to improve our services and we are glad that you took the time to write such details.   We hope to see you again on your next visit to the area.  Sincerely, Roberto Vasquez",none,none,none,none,none,none,87,262
15 helpful votes,32 contributions,3.0 of 5 bubbles,"NOT GREAT, NOT BAD OK","I was there last march to visit Disney with my family.  we had 2 rooms.  For the cost, for the location ( 15-20 minutes driving from Disney), for the breakfast included, it's a OK hotel.  The room are not big but there's enough space if you really use it to sleep and shower between visits to Disney.  The rooms were dark, and would need some renovation soon. On a next visit i would try to find something better for the same price, and if not i would go back because it's a OK hotel.",March 2016,none,none,none,none,none,none,none,none,none,88,262
177 helpful votes,784 contributions,4.0 of 5 bubbles,Hotel for our Disney visit,"My husband and I stayed here while in town to visit Disneyland. Check-in was easy and quick. When we walked into our room, the bathroom was noticeably dirty. The rest of the room was fine, but it looked like they forgot about the bathroom. My husband went downstairs to reception and they assigned us to a different room. This time everything was as it should be.   The room was comfortable and had everything we needed. The location was close enough, but not walking distance to Disney. You have to pay much more for that perk.   The hotel does offer free breakfast in the morning...pastries, cereal, waffles, egg, sausage and such.",March 2016,none,none,none,none,none,none,none,none,none,89,262
