Helpful Vote,Contributions,Overall Rating,Summary Heading,Summary,Date of Stay,Room tip,Trip Type,Manager Response,Location Rating,Cleanliness Rating,Service Rating,Value Rating,Rooms Rating,Sleep Quality Rating,Review Number,Index
80 helpful votes,63 contributions,1.0 of 5 bubbles,Not good.,"This was not a good stay - an unfortunate choice for a business trip to the Anaheim Convention Center.  There was nothing going for this hotel - from a tiny room to overcrowded breakfast area with no room to sit after 7:00am, to poor business facilities, to a tiny, dirty pool. In the room, there wasn't even a workdesk, so it was definitely a poor choice for business trip. Immediately outside the room, in the hallway, there were smokers at most hours of the day, and the entire floor reeked of smoke, despite being a ""non-smoking facility""!  Despite repeated complaints to front desk, nothing was done about it.  The surrounding area is an industrial zone that has absolutely nothing - no place to eat, no public transportation.  Without a car, you are stranded.  Getting from this",July 2012,none,none,"I apologize for your recent experience at our hotel. The lapse in service you experienced is certainly not in line with the great customer service our guests have come to expect. We are looking into the incidents you described and will take actions to make sure this will never happen again. Again, we are sorry that your recent stay was not in line with what you rightfully expected from our hotel, and we thank you for your feedback, it is greatly appreciated.",none,none,none,none,none,none,220,262
51 helpful votes,198 contributions,4.0 of 5 bubbles,What a deal!,We were scared to see what we were getting when we paid such a low rate. We were pleasantly surprised.  It was very clean and convenient from airport. If you are in the area this deal will be tough to beat.,July 2012,none,none,Thank you! Glad you had a pleasant stay.,none,none,none,none,none,none,221,262
none,1 contribution,5.0 of 5 bubbles,BEST PLACE,This place is wonderful. They serve you breakfast and on certain nights they serve dinner. They're pool is great. The rooms are nice and comfy. They have a computer you can use downstairs for free. The water works great. Their service is wonderful and helpful,August 2011,none,none,Thank you! Glad you enjoyed your stay.,none,none,none,none,none,none,222,262
40 helpful votes,75 contributions,5.0 of 5 bubbles,Pleasant stay-would go back!,"My husband and I came from Chicago to Southern California for my cousin's wedding.  My cousin and his bride made accommodations for their guests at this hotel. My hubs and I were very impressed with the warm welcome we received upon check in.    Our room was small and cozy with a king sized bed.  It was conveniently located on the first floor and we were able to park our rental car right in front of our room.   Our room was clean and did not smell (we've had bad experiences of smelly rooms before!).  Each day, house keeping came and freshened up our room and gave us clean towels.    The pool area was very clean and well maintained.    Each morning the hotel offered breakfast, which consisted of cereals, English muffins, toast, make-your-own waffles, and egg and sausage",July 2012,none,none,"Thank you for this great review! I'll forward your comment to Dolores, she'll love to read your shout-out. I apologize for the noise from the AC, we will look into the issue, it certainly shouldn't be waking you up at night. Again, thank you for your feedback, and we are looking forward to seeing you again next time you're in the area!",none,none,none,none,none,none,223,262
2 helpful votes,9 contributions,5.0 of 5 bubbles,Great stay!,"My family of 3 stayed here for a week at the end of June. Front desk and breakfast staff were friendly and helpful. Hotel room was comfortable and clean. With free breakfast, refrigerator, microwave, easy parking and free wifi, we felt this hotel was an excellent value.",June 2012,none,none,Thank you!,none,none,none,none,none,none,224,262
103 helpful votes,516 contributions,4.0 of 5 bubbles,"Great staff, quiet location","The clean, comfortable room with a refrigerator and free WiFi was perfect for our one-night stay. The breakfast at this Fairfield Inn was much better than the breakfast at a similar property in this area where we stayed a few weeks ago.   The staff at this location really shines. The women at the front desk were friendly and professional. One of them helped us to solve a problem that was not caused by the hotel. The breakfast buffet team was the best I have seen in a long time. They were moving all the time, refilling food and cleaning tables, while smiling and chatting with guests. I hope that Marriott appreciates these hard-working employees! I'm sure we'll stay here again.",July 2012,none,none,"Thank you for taking the time to share your experience! We'll be sure to recognize the staff for a job well done, they are truly the heart of our hotel.",none,none,none,none,none,none,225,262
21 helpful votes,78 contributions,5.0 of 5 bubbles,Great Stay!!!!,"Was very clean, the beds were comfortable.  The staff was great.  The ladies who take care of the breakfast in the morning were wonderful!!!!!   It was quiet. Close to Disneyland!  Loved the fact that they had a refrigerator.  We bought waters and sodas at the Walmart down the street and kept them in there during our week long stay.  Great area, lots of good places to eat!  In & Out burger is really close! Would stay there again :).",June 2012,none,none,"Thank you for this great review. And yes, gotta love that In-N-Out burger... . We hope to welcome you again the next time you're in the area.",none,none,none,none,none,none,226,262
98 helpful votes,234 contributions,4.0 of 5 bubbles,Clean Motel in Quiet Area,"Good motel, clean & in quiet area. Beds very comfortable & fridge + coffemaker in the room. We could park right outside. There are plenty of restaurants a short drive away. Swimming pool is small but has good chairs around it. Easy to find as just off the 57. Didn't have the breakfast other than fruit juice but there was plenty of it.  Very happy with our one night stay.",June 2012,none,none,Thank you for this great review!,none,none,none,none,none,none,227,262
12 helpful votes,21 contributions,3.0 of 5 bubbles,Parking Charge,"I used Hotwire and received a decent rate for the room. The room itself was clean (although the walls were a tad bit dirty). I was in a single King and it was by far the smallest hotel room I have ever stayed in. You could barely get around the bathroom door to access the sink. The staff up front was friendly, yet couldn't tell me where my room was. She didn't know! Really? She had to ask another staff member.  The pool are was nice, but I only stayed a few minutes because the surrounding bushes were swarming with bees and yellow jackets. Kind of ruined the relaxation having to swat stinging flying insects every few seconds.   I was very surprised to see that they charge $5 a night for parking. While $5 is not a lot of money, the thought of charging to park in their parking lot",June 2012,none,none,none,none,none,none,none,none,none,228,262
4 helpful votes,2 contributions,5.0 of 5 bubbles,A great stay!,"Our overnight stay was a pleasant one.  The rooms were clean and comfortable and the staff was super friendly.  One of the employees, Elva, was extra helpful with the continental breakfast, as she tended to everyone and their needs.  The breakfast here was actually worth getting up early for, as they offered much more than other hotels do with their continental breakfasts.  The location is great as it is right off the freeway, and I didn't notice much noise.  Will definitely stay here again the next time we are in the area!",May 2012,none,none,none,none,none,none,none,none,none,229,262
61 helpful votes,99 contributions,4.0 of 5 bubbles,Convenient but traffic/train noise,"Made an overnight trip to Disneyland.  Only 5-10 min from Disneyland and much cheaper than the Fairfield Disneyland Resort on Harbor Blvd.  Staff friendly, bed comfortable, and AAA price very reasonable.   Close to the freeway and somewhere near train tracks, so not the most quiet nights sleep, but not horrible.  Wouldn't keep me from staying here again.",April 2012,none,none,"Yes, the Fairfield Inn Placentia is definitely an affordable alternative to the Anaheim hotels for Disneyland visitors. Thank you for the review!",none,none,none,none,none,none,230,262
51 helpful votes,67 contributions,5.0 of 5 bubbles,"Comfortable, Clean and Friendly Emplyees","This is my first stay and I'll be here for 5 days. Have already signed up for my next visit to this area. A clean room, comfortable bed, nice flat screen TV and, their ""Continental Breakfast"" is better than most with a large selection.",April 2012,none,none,Thank you! We're looking forward to see you again!,none,none,none,none,none,none,231,262
3 helpful votes,15 contributions,5.0 of 5 bubbles,Great value!!,"I bought my room on Priceline for $45. I was thrilled because I had stayed here a long time ago. Checkout was easy and the girl was very nice. This place is still great.   The beds are firm, but comfortable enough. Linens are clean and pretty. The room was very clean and I like the design. The pool was beautiful and plenty of extra towels were available for swimmers.  The breakfast was good. I made my own waffle, which was fun. They also have fresh fruit, so that's easy for people on the go. I saw that they offered breakfast sandwiches, but they were gone by 9 am when I got there. Breakfast is open UNTIL 9 am.  We said ""Do Not Disturb"" because we were clean enough and didn't want people (maids) in our room. I've learned from traveling to just not have maids in your room. Then",April 2012,none,none,Thank you for this great review!,none,none,none,none,none,none,232,262
42 helpful votes,130 contributions,3.0 of 5 bubbles,Just OK,"We stayed for 3 nights (March 27, 28, 29).  It was just OK.  WiFi was horrible.  I could not get connected the entire time I was there.  Breakfast was your typical continental breakfast with muffins, donuts, bagels, etc, waffle maker and jimmy dean sandwiches in the fridge to warm in the microwave.  Staff worked really hard to keep everything stocked, but while we were there, there were a couple of very large groups and it was difficult to find a seat and move around in the breakfast area.  We had a room with a ""king"" bed, but my husband (6') thought it was a little shorter than our king at home.  I didn't care for the bathroom setup much.  The bathroom door had to be shut in order to use the sink and there was no fan in the bathroom, so after a shower, the room got quite",March 2012,none,none,none,none,none,none,none,none,none,233,262
24 helpful votes,54 contributions,5.0 of 5 bubbles,great stay,The complimentary breakfast is great really close to disneyland. our room was very clean houseekeping and front desk really friendley. i loved it. we loved our bed so confy.,January 2012,none,none,Thank you!,none,none,none,none,none,none,234,262
91 helpful votes,295 contributions,5.0 of 5 bubbles,Excellent Stay Again!,"This was my second stay here. I booked a package with fights through Travelocity. I booked and received a non-smoking King room on the third floor. Check-in was easy, fast and efficient. Customer service is excellent. Rooms are comfortable and clean. Grounds are clean and breakfast is stocked well. I would definatley stay here again for the quality, convenience to Disneyland for price.",October 2011,none,none,Thank you for this great review!,none,none,none,none,none,none,235,262
6 helpful votes,9 contributions,5.0 of 5 bubbles,Great Place to Stay,"We stayed here from 03/16/2012 - 03/24/2012.  Good price.  Discount for staying over 7 days if you plan ahead.  I was surprised to find that the room doors all faced outside.  That was not a problem.  The room were nice.  Had a desk, good internet service (no change), a desk and large chair, and nice size frig..  The hotel was well taken care of and they were updating the carpets while we were there.  I had read reviews about the train noise.  We didn't have any problems with that.  The breakfast was good for a continental breakfast.  Waffles, bagels, English muffins, cereals, fruit, yogurts, microwave biscuits with egg and cheese, and juice and coffee.  Staff was friendly and helpful.  The web said they changed $5 for parking.  No one said anything about that and we were not",March 2012,none,none,"Thank you! And yes, guest who book directly through us receive free parking with their reservation. We hope to welcome you back again soon!",none,none,none,none,none,none,236,262
6 helpful votes,11 contributions,3.0 of 5 bubbles,More often ahead... a few things behind. An overall solid value,"I have been staying here for 6 years for the NAMM Show each January.  It has improved a lot over that time. As mentioned by others, beds are now reasonable... I would not call them ""comfy' however..and the room decor is modern.  Housekeeping very attentive.  The front desk team seems responds well to inquries.  Breakfast is tended by two long-term employees who are very nice and do a great job for requests.  Broad range of b-fast items.. not eggs however.   Where I find the ""behinds"" though are in the common hallways, elevators and so on. I don't understand why they can't replace the third floor carpet and more thoroughly clean common areas. This needs to be done right away...  also fans in bathrooms seem to be commonly broken or not functioning... that needs to be fixed.",January 2012,none,none,none,none,none,none,none,none,none,237,262
416 helpful votes,943 contributions,4.0 of 5 bubbles,Great Value!,"Like what was said below, this property provides what we've come to expect from a Fairfield Inn.  It was clean, the beds were comfy, the staff was friendly, and the breakfast was adequate.  The breakfast on the weekdays included waffles, yogurt, assorted pastries, bagels and microwaveable breakfast sandwiches.  On the weekend we got all of the above, however the breakfast sandwiches were replaced with build it yourself breakfast sandwiches in a heated tray.  The breakfast attendant kept everything very well stocked.  We paid $67 a night on a deal where we stayed 5 nights for a reduced rate.  We were also not charged the $5 parking fee that it says they have on the website.  I think at the most we were 15 minutes away from Disneyland Parking, but probably a little closer than",February 2012,none,none,Thank you for this nice review! We hope to be able to welcome you back again soon.,none,none,none,none,none,none,238,262
13 helpful votes,29 contributions,4.0 of 5 bubbles,Fairfield Inn-West Kimberly-Placentia/Fullerton,"Exactly as would be expected from a FFLD Inn...clean, well kept, staff was VERY helpful with assisting with destinations (how long it would take, how bad the traffic would really be, etc).  The wifi was slow, but not unusable.  As with travel447's review, I agree-fine place for a good night's sleep..except never heard the trains(we were on the back side of the building).  Breakfast fare standard, but there was always coffee available...if we were to have to come back to the Fullerton/Placentia area, I would definitely consider this location again.",January 2012,none,none,Thank you for taking the time to share your experience - we are glad to hear that you had a pleasant stay.,none,none,none,none,none,none,239,262
35 helpful votes,43 contributions,4.0 of 5 bubbles,Nice Budget Hotel,"Stayed here for a night and found it to be a good place to rest.  Room was large enough to have closet. Wash area separate from shower. Mini fridge/Micowave in room.  Has free WIFI, our connection was slow on this occasion. Has nice work table in room along with side chair.  The lobby has a guest computer to print tickets, browse email, etc for those without their own laptop.  Room was clean.  Industurial area setting. Occasional train comes near hotel and can hear whistle, however, not too often.  Beds were comfortable.  Complimentary breakfast is of standard fare for continental type breakfast.  If you're looking for just a good night sleep at a reasonable price, then this hotel is worth consideration.  Charges $5/night for parking.",November 2011,none,none,"Thank you for being our guest, and taking the time to share your experience.",none,none,none,none,none,none,240,262
49 helpful votes,61 contributions,5.0 of 5 bubbles,the most value you can get,"for 69 dollars a night + $ 5 parking it cannot b beaten . the hotel is a motel with all ur needs big rooms and free internet and business center located 15 minutes from disney and had adequate breakfast although breakfast area is small relatively , plenty of parking and very clean , dont expect much but for a room of 4 and you pay 69 dollars it is a deal",December 2011,none,none,none,none,none,none,none,none,none,241,262
11 helpful votes,42 contributions,3.0 of 5 bubbles,Nothing really wrong with the Hotel,"We stayed here for 2 nights on a family vacation to Disney. It is a nice hotel, nothing really out of place. Except may be the noise of trains, which did not bother me as I slept like a log after walking the whole day at Disney :) The room and bathroom are clean, the beds nice, and it's fairly spacious too. The breakfast area is small, but the spread is decent. The drive to Disney is 15 minutes thru surface streets.   I would not mind staying here again. But, if I visit Disney, I would rather stay at a Hotel which is walking distance from the park.",December 2011,none,none,none,none,none,none,none,none,none,242,262
23 helpful votes,58 contributions,4.0 of 5 bubbles,Great hotel,"I stayed here for 2 nights while interviewing for a position for Disneyland (moving out there Monday), and enjoyed my stay very much. The bed is one of the best I've ever slept in at a hotel. The breakfast was nothing to write home about, but I didn't go hungry. The location is good as well, not far from either 91 or 57, and a lot of places to eat in the area as well. Would stay here again if I needed to.",December 2011,none,none,"Thank you for taking the time to share your experience at our hotel, and congratulations on the job for Disneyland!",none,none,none,none,none,none,243,262
34 helpful votes,22 contributions,2.0 of 5 bubbles,Go elsewhere if you want to actually sleep,"I'll start with the good--the front desk and housekeeping staff are great. Free breakfast was good and has mostly continental stuff and hot breakfast sandwiches. The room is a little dated and the carpet is stained, but overall it was fine because I wasn't expecting the Hyatt.   My biggest complaint and is the reason why I am only giving this hotel 2 stars is due to the fact that I couldn’t get a full night of sleep because of all the TRAINS GOING BY ALL NIGHT LONG. Very loud trains that are impossible to ignore. I am actually shocked I didn't see this in any other reviews, but feel that I must warn you about this if you plan to stay here. I’m not even sure that earplugs would help.  This hotel is a 15-20 minute drive to Disneyland on the side streets, which you will need to",December 2011,none,none,none,none,none,none,none,none,none,244,262
12 helpful votes,19 contributions,3.0 of 5 bubbles,"Ok for a overnight sleep, fitness center smells","My experience here was not bad though. There were some turnoffs for sure, checking out the fitness center is definitely not advised without covering your nose, gosh it smelled bad. If you don't use it often then the rest was not really bad. It was an average room, clean and can sleep beds. Some rooms have windows that directly face the lights outside which may bug you for a while when you sleep. Breakfast was just ok with no eggs. Bottom line, if its your stopover while you spend your complete day outside then its doable.",November 2011,none,none,none,none,none,none,none,none,none,245,262
3 helpful votes,1 contribution,1.0 of 5 bubbles,Beware of undisclosed charges,The hotel is fine in terms of location and amenities.  However the hotel charges for parking and doesn't tell you until you get your bill after your stay.  You never sign anything for it.  They just hand you a parking pass (without even asking you if you have a car) and then charge your credit card for all the days you stay there.  Their only defense is that their website says they charge for parking.  This is ridiculous as fees can change day to day and others on TripAdvisor have stated they had free parking.  They refused to refund the money and were incredibly rude.,November 2011,none,none,"We regret to hear about your recent experience at the Fairfield Inn Placentia. There is certainly no excuse for the unfortunate way the parking fee situation was handled; I want to apologize for that and let you know that we have taken notes so we can prevent this from ever happening again.  We do hope you will consider returning for an experience that reflects what many happy guests have come to expect of our hotel.  Sincerely,   Sandra Gilliom Fairfield Inn Anaheim Placentia/ Fullerton",none,none,none,none,none,none,246,262
3 helpful votes,1 contribution,1.0 of 5 bubbles,"If you value sleep, stay away","I was booked this hotel by marriot reservations and told it's a great hotel a couple miles from disneyland.  My husband and I booked there for our honeymoon, this was a mistake.  There is a flaw in the way the curtains are installed and the black out curtains don't close.  There is also a large security light by the windows so the room is completely bright with all the lights turned off, because of the curtain issue.  We tolerated the first night because we were so tired after the wedding then driving 4 hrs after.  The next night when we tried to get moved to another room, even another marriot we were checked out at 11pm and left to find another hotel.  This is not how I wanted to spend my honeymoon.  When I brought this to the attention of Marriot after our trip they didn't",November 2011,none,none,none,none,none,none,none,none,none,247,262
20 helpful votes,11 contributions,5.0 of 5 bubbles,Very clean,"We stayed here for 5 nites for a disneyland vacation. If you don't have a car I would not recommend it here because of the distance to Disneyland. But if you do have a car, it's about a 10 to 15 minute drive. The rooms were a little smaller than I was hoping for, and the hotel itself is a little dated, but they keep it very clean, parking is abundant, the staff is very friendly, and the free breakfast does the job.   Evelia is the person in charge of the breakfast, and she is always smiling and very helpful. Miguel is the front desk supervisor, and I think the entire front desk staff is a direct reflection of him in that friendliness and willingness to go the extra mile seems to be the standard here.  The Marriott corporation should use this hotel staff as a model for training",October 2011,none,none,"Thank you for your kind review! I might be a little biased here, but I have to agree with you - our staff is indeed a model for friendliness and great service, and we will be sure to recognize them for a job well done.",none,none,none,none,none,none,248,262
4 helpful votes,11 contributions,4.0 of 5 bubbles,Good hotel but watch out bidding on hotwire,"The hotel was a solid 2 star.  Clean rooms, free wi-fi.  Breakfast was good continental.  Hot items were microwavable breakfast sandwiches and waffles were good.  Toilets are not set right.  They flush but you have to get the hang of it.  The hotel really needs to make it more reliable so you don't have to flush 2-3 times.   Location about 15-20 minutes from Disneyland.  The problem I have is with hotwire.  They lamined this was a 3 star hotel.  I am sorry, but the beds and rooms did not have the luxury of what you would expect from a three star, especially a Marriott hotel.  This is last time I book using hotwire.  Staff was nice and rooms were great for a 2 star and a pretty goo value if you intend to stay at a 2 star.",October 2011,none,none,none,none,none,none,none,none,none,249,262
1 helpful vote,1 contribution,5.0 of 5 bubbles,Excellent ********,"Stayed here for two weeks while visiting LA.Close to Disney, Knotts,Angels stadium and getting to Hollywood and LA.We stayed here for 2 weeks,nice and clean very good free breakfast hot and cold.Nice shower, comfortable beds, A/C.Staff were very good and comfy beds.Nice pool,Very close to freeways 5 and 91 and the 57 could not say a bad word about this place.",September 2011,none,none,"Thank you for this great review! We are glad to hear you enjoyed your stay, and we hope to be able to welcome you again in the future.  Sincerely, your team from the Fairfield Inn Anaheim Placentia/ Fullerton",none,none,none,none,none,none,250,262
none,3 contributions,5.0 of 5 bubbles,Nice Stay,This hotel was very reasonably priced.  The Staff were friendly.  Free breakfast always a bonus.  We stayed here to go to a game at Angel Stadium. Close to everything.  Will stay again.  Great value.,September 2011,none,none,Thank you for this great review! We're looking forward to welcome you again soon!,none,none,none,none,none,none,251,262
