Helpful Vote,Contributions,Overall Rating,Summary Heading,Summary,Date of Stay,Room tip,Trip Type,Manager Response,Location Rating,Cleanliness Rating,Service Rating,Value Rating,Rooms Rating,Sleep Quality Rating,Review Number,Index
77 helpful votes,93 contributions,3.0 of 5 bubbles,Average quality inn,Not bad stay. Laundry room used to be 27/7. Now it's 8 to 10 pm. Really limities ones options with only one washer and one dryer. Copy of restaurant listing in area barely readable after countless  times of recopying.,April 2015,none,none,"Hello tonyvas328,  Thank you for taking the time to let us know about your recent stay at our hotel.  Please accept my sincere apology about the new laundry hours, the modification was due to guest having issues with the noise from the laundry room.  I will make sure that our new copies for the list of restaurant is nice and clear.    Your feedback is important to us and we hope to see you again soon.  Sincerely,  Roberto Vasquez",none,none,none,none,none,none,132,262
26 helpful votes,80 contributions,4.0 of 5 bubbles,Very Nice,"This hotel is not much to look at on the outside, but our room was very nice, was very clean, and our bed comfortable. Loved the big-screen TV and large shower. Breakfast was great, with lots of choices. I would definitely recommend this hotel to other travelers.",April 2015,none,none,"Dear Becky G,  We appreciate your great review and we are glad that you enjoyed the amenities of the hotel.  Our hotel does offer a complimentary continental breakfast that has a lot of items to choose from.  We hope that you make our hotel your hotel of choice when you come back to this area and thank you for recommending us to your friends and family.  Sincerely,  Roberto Vasquez",none,none,none,none,none,none,133,262
30 helpful votes,30 contributions,4.0 of 5 bubbles,"Good Quality, Nice Stay, Friendly Staff","We booked this hotel on short notice for a weekend getaway.  We've never stayed in Placentia before, so we didn't know what to expect.  We had two rooms and found both of them spotless.  The rooms seemed updated with flat screen TV's, microwaves, and a refridgerator.  The beds were comfortable, and the rooms were quiet.  We didn't hear a peep from anyone, and the hotel had a high occupancy rate.  Every member of the staff we encountered was very pleasant.  We had no issues with anything.  The morining breakfast was standard, but good, again, no complaints. Everything was stocked up and there was little wait time for anything. We were going to Knott's Berry Farm, it was about six miles, so it wasn't that far.  It took about 15 minutes to get to the park.  The pool was closed",March 2015,none,none,"Hello Jeffrey_03,  We are very pleased to hear that you had a good time while staying at our hotel.  Our staff always strives to provide clean and comfortable accommodations.  Unfortunately the pool was out of service but it will be back in service this weekend. We appreciate your feedback and we hope to see you soon.  Sincerely,  Roberto Vasquez General Manager",none,none,none,none,none,none,134,262
none,2 contributions,5.0 of 5 bubbles,Wonderful time with my group,"I brought my high school choir group here on tour, and was thoroughly impressed with Quality Inn Placentia.  Our experience was first-rate from start to finish.  Getting a quote, placing the reservation, checking in--all were as easy and pleasant as I could've wished for.  Our rooms were all together, and nice, clean, updated.  The Quality Inn staff were courteous and helpful, and just as anxious to look out for my teenagers as I was.  They went above and beyond in assisting me with one sick student, made a recommendation for a nearby urgent care, etc.  Breakfast was delicious and plentiful.  Walls and floors are thick enough that we didn't worry about noise (ours or anyone else's).  We will definitely keep this hotel in mind for our next SoCal trip!  Thanks, Quality Inn!",March 2015,none,none,"Hello Laura H,  Thank you for your positive feedback from your stay at our hotel.  We are pleased to hear that you enjoyed your stay and that our staff was helpful.  Our everyday goal at the Quality Inn Placentia is to provide great service and great accommodations.  We hope to see you soon in the near future.  Sincerely,  Roberto Vasquez General Manager",none,none,none,none,none,none,135,262
103 helpful votes,97 contributions,3.0 of 5 bubbles,Average to Below Average,For some reason this hotel has better reviews than it deserves.  This is a below average Quality Inn with smaller than average rooms.  The pool is small and poorly maintained; there is no hot tub.  The area is not bad but just alright. The staff borders on rude at times and frequently appears to be snickering at the customers. The breakfast attendant is pleasant and helpful. The breakfast food itself is average to poor.  The beds were pretty comfortable.,March 2015,none,none,"Dear ruinslover, Allow me to apologize for a less than pleasant stay at our hotel.  I will be sharing and discussing with our staff your comments and we will make sure that our future guest leave our hotel satisfied.  Thank you for your feedback and we hope that you give us another opportunity to serve you better on your future stays.  Sincerely, Roberto Vasquez General Manager",none,none,none,none,none,none,136,262
25 helpful votes,52 contributions,3.0 of 5 bubbles,Your average Quality Inn,"This is a typical Quality Inn hotel. The bed was comfortable, the shower had nice pressure, and the room was quiet other than the air conditioner rattling due to the front of it being loose. I just put my backpack against it, and that stopped it. You never know if the towels you get at a Quality Inn will be decent or not, but the towels were cheap and thin. The internet was very slow in the evenings, but was faster during the day.   The breakfast wasn't any special, and the food was just okay. Your usual Quality Inn. The room was more expensive than I would have liked, but it wasn't overpriced. The convenience is the reason I stayed there. I would stay here again if it was a little cheaper, otherwise I will look for a place in Anaheim.",March 2015,none,none,"Dear WindTraveler101,  Please accept my sincere apology for not providing exceptional service to you while staying at our hotel.  We have shared your comments in our staff meetings and we will make sure to improve in the areas that you have mentioned.  Again we apologized for a less than pleasant stay we hope that you give us another opportunity to serve you better.  Sincerely, Roberto Vasquez General Manager",none,none,none,none,none,none,137,262
none,1 contribution,4.0 of 5 bubbles,Awesome,"Okay so I stayed here two nights. The service at the front desk was pleasant I felt very comfortable. The room was nice and clean. It was just me so the bathroom being small didn't bother me. The first morning me being there, service was great at breakfast however the food wasn't stocked as needed, trash wasn't taken out and overflowing and tables weren't clean. However the next morning, it was much better! Housekeeping is amazing and kept my room stocked and cleaned! Overall it was a great experience!",March 2015,none,none,"Hello Thee_nefertiti,  Thank you for taking the time to tell us about your recent stay at our hotel.  We are glad that you found value while staying at our hotel.  Your feedback is very important to us we will be making sure that breakfast is well stock at all times during breakfast hours and that trash is being changed on a timely manner.  We appreciate your comments and we hope to see you soon,  Sincerely, Roberto Vasquez General Manager",none,none,none,none,none,none,138,262
59 helpful votes,127 contributions,4.0 of 5 bubbles,Small Rooms but Very Clean and Nice,"We stayed here back in 2011 when it was the Fairfield Inn.  The area isn't the best, but the hotel is very clean and well-kept up.  The bed was comfy, but the bathroom and room was small.  We were given this as part of a travel package, so we didn't mind too much.  If I was in the area and needed to stay somewhere for business, I may possibly stay here.  Next time though, we will probably just stay closer to Disney.  It definitely is a little bit of a hike to get there.",April 2014,none,none,"Hello Jess5K,  Thank you for your review on our hotel. We are glad that you found the hotel to be comfortable and well kept.  We are about a 10 minute drive to Disneyland but relatively close.  Our staff is dedicated in providing great accommodations to our guest and we are glad that you enjoyed our hotel.  Sorry about the disappointment with the size of our rooms.  Again thank you for your review and we hope that you give us another opportunity to serve you better.  Roberto Vasquez General Manager",none,none,none,none,none,none,139,262
4 helpful votes,7 contributions,5.0 of 5 bubbles,Great stay!!!!,"I came to Anaheim in January to attend the NAMM convention for the first time. I found the Quality Inn Placentia online and chose it because of the ratings. When I got there the hotel was everything it was stated to be online. For the first three of my scheduled four days I booked a single, but on the fourth day, I needed a room with double beds. Nancy at the front desk made the switch very easy for me and didn't charge me extra. The rooms were clean, the staff was attentive and helpful, the heated outdoor pool was nice as well. The  distance between the hotel and the Anaheim Convention was only a ten minute drive. I will be coming back for NAMM next year and provided I don't find a place closer to the convention ctr. I will be staying here again. Thanks for a great stay. Brian E",January 2015,none,none,"Hello Brian E,  Thank you for taking the time to let us know about your stay at our hotel.  I have shared your comments with my staff, and they join me in thanking you for your kind words.  We take pride in our hotel and the services we provide and we are so glad you enjoyed your stay.  Nancy thanks you for commenting about her customer service and high remarks about your accommodations.  We are looking forward to providing you the same pleasant accommodations and service the next time you are in town.  Hopefully you choose us for your next NAMM convention.  Kind Regards,  Roberto Vasquez General Manager Quality Inn Placentia-Anaheim",none,none,none,none,none,none,140,262
64 helpful votes,109 contributions,3.0 of 5 bubbles,Ok,We stayed here for a couple of nights at the end of our road trip and the hotel was ok for our purposes. It was clean which was great but in serious need of updating. It was fairly run down but on the upside had a fridge and microwave which was useful. The hotel is not within walking distance of any restaurants however it does offer breakfast which again is ok. I think there are better hotels to stay at if I was in this area again.,February 2015,none,none,"Hello Angela J.  I would like to thank you for taking the time to write a review on our hotel.  We appreciate your comment about our hotel been clean, our staff strives to provide a clean and comfortable room to each of our guest.  We apologize for failing below your expectations and we hope that you give us another opportunity to better serve you in the future.  Sincerely,  Roberto Vasquez General Manager",none,none,none,none,none,none,141,262
226 helpful votes,599 contributions,5.0 of 5 bubbles,Hidden gem,"Tucked away on a side street off an industrial road, this hotel exceeded all my expectations and is a great value.Presents well both outside and in.Terrific attitude and demeanor of front desk staff on check-in and out.Room itself is very tastefully decorated and spotlessly clean.Nice name-brand LCD TV with lots of channels.The shower was luxuriously hot with great pressure and a nice high showerhead.Even the bed was very comfortable, with adult-sized pillows, as opposed to most other Quality Inns that have child-sized pillows.Not much within walking distance, so have dinner prior to coming here.Overall, an A+, well-run, very nice hotel.",February 2015,none,none,"Hello William J,  Thank you so much for such high rating of our hotel.  Our everyday goal is to provide the best accommodations possible to our valued guests.  Our entire staff thanks you for appreciating our hard work.  Thank you for letting us know that our hotel was of great value to you.  We appreciate your comments and we hope that you choose our hotel on your next visit to the area.  Sincerely,  Roberto Vasquez General Manager",none,none,none,none,none,none,142,262
none,2 contributions,5.0 of 5 bubbles,Great Value for money friendly staff.,"Have stayed at the hotel a few times now, One of the best value for money hotels I have stayed in globally for the past few years. Since I spend about 140 days in hotels per year I have experienced all levels. With plenty of parking, good breakfast choices including the friendliest breakfast staff I have ever met. The rooms are kept clean and the entire ambience is good for a hotel with this price point. If there are any problems that are taken care of efficiently and in a friendly manner. Look forward to visiting again soon.",January 2015,none,none,"Hello John K,  Our team certainly appreciates your comments about our hotel.  We are happy to know that our hard work is paying off.  Our team thanks you for appreciating the customer service and the cleanliness of the rooms and we want to thank you for choosing our hotel when you visit this area.    On behalf of our entire team, thank you for choosing our hotel and we hope to serve you better on your next visit.  Sincerely,  Roberto Vasquez General Manager",none,none,none,none,none,none,143,262
11 helpful votes,17 contributions,5.0 of 5 bubbles,Good stay,We got the room on the first floor facing the parking lot. Modern spacious room Very clean and ac works great. They have Good breakfast n friendly front desk. About 7 miles from disneyland. Wi fi works great. The parking lot well lighted. Located in the good neighborhood.,January 2015,none,none,We are humbled to get your candid review! we would like to thank you so much for taking the time our of your schedule and to take the time to write our hotel a review!  We are very happy you enjoyed Placentia CA!  Happy 2015!,none,none,none,none,none,none,144,262
81 helpful votes,159 contributions,4.0 of 5 bubbles,"Nice stay, quiet on 3rd floor","Thanks to previous reviews, we got a 3rd floor room and had a decent stay. It was New Year's Eve so I expected worse noise...but none that I noticed. Breakfast was ok, hot options in addition to cereal, breads, etc. For this area, perhaps the price was average but I consider it on the high side. We would return though. Felt safe, lots of families staying here.",January 2015,none,none,We are so happy you enjoyed our Rooms and quiet interior corridor hotel ! we always try to exceed ourselves in service and quality and we are very happy you liked both!   Happy 2015!,none,none,none,none,none,none,145,262
6 helpful votes,6 contributions,4.0 of 5 bubbles,Great experience overall...,"Hubby and I visited in early November 2014, we drove down from the bay area for a business trip and arrived earlier than expected. I wasn't feeling well from the drive and we called and asked if we could check in early. Without any problems  we checked in around 1:30pm. First impressions where the room was a bit small, so probably not a good place for a large family in one room.  Pros~  Overall nice friendly staff. Clean room. Yummy make your own waffles and a hearty breakfast that helped us save money in the long run. Not too far to Disney. However you would have to drive there and leave early if you want to beat the rush. People complained about the noise, we where on the third floor but we didn't experience any noise problems and we both are very sensitive to noise.  Cons~",November 2014,none,none,We are so happy you enjoyed our complimentary hot breakfast ! we always try to exceed ourselves in service and quality and we are very happy you liked both!   Happy 2015!  Quality Inn Placentia,none,none,none,none,none,none,146,262
none,1 contribution,2.0 of 5 bubbles,Rundown,"Tried to check in early and there were no rooms available. That's ok. But check in is 3pm and when I returned at 4:30pm, they did not have a room ready. They explained they had been very busy. As the consumer, how is that my concern. When I complained, a room was ready.The mattress are over due for replacement. Both bed frames squeaked loudly when you turned in bed. The clock in the room didn't work. Cheaper than the Marriott Residence Inn next door but pay the extra $$ next time and stay there.",December 2014,none,none,"Hello Mmmmmmmmh,  On behalf of our entire team, I would like to apologize for failing to exceed your expectations.  We will make sure that our team understands the importance of having clean rooms by check in time.  Your satisfaction is important to us and we will be using the feedback you provided to make improvements to ensure we offer an exceptional experience for our guests in the future.  It is our hope that you give us the opportunity to better serve you in the future.  Sincerely,  Roberto Vasquez General Manager",none,none,none,none,none,none,147,262
44 helpful votes,89 contributions,2.0 of 5 bubbles,sleepless in Placentia,"I am rating 2 stars based on the quality of my sleep (which, clearly, I am not getting since I am writing this review at 1 am), most of which is out of the control of the hotel owners/staff (train nearby, freeway nearby, etc). This is part hotel, part motel, with a large percentage of the rooms opening to the outside walkways. I was in a 3rd floor, inside doorway.   Pros: The hotel is inexpensive. The staff is very friendly. The room was clean. Incredible water pressure in the shower.   Cons: My main issues are with the inadequate soundproofing. I could hear snoring, talking, TV, etc... from the rooms next door and above and below. There is not likely to be anything that the hotel company can do to correct this (or would be cost prohibitive). I also unplugged the refrigerator",December 2014,none,none,"Dear Businesspeep,  Thank you for taking the time to write a review about our hotel.    On behalf of our entire team, I would like to apologize for failing to exceed your expectations. Your satisfaction is important to us and we will be using the feedback you provided to make improvements to ensure we offer an exceptional experience for our guests in the future.  We are glad that you felt that our customer service was great and that our hotel was nice and clean.  If you are ever not satisfied with the room you are assigned to please let our attentive front desk staff know and they will make sure that you are place in a room to your satisfaction.  I hope that you will consider staying with us again so that we can have another chance to provide you with a superior experience.   Sincerely,  Roberto Vasquez General Manager",none,none,none,none,none,none,148,262
none,1 contribution,5.0 of 5 bubbles,Clean rooms & clean area,"First walking into the room it was very clean, nice sized & spotless. Good working microwave & refrigerator, theirs also a coffee/tea maker wich is nice. The bed is comfy & the  flat screen is a nice touch. The bathroom is bigger then most hotel bathrooms, wich I liked the big bathroom alot. The bathroom was also very clean & stocked with plenty of clean white towels. THUMBS UP!",November 2014,none,none,"Hello Cheyanne H,  Thank you for your great review about our hotel.  Our team takes pride in providing clean and comfortable rooms as well as great value for your hard earned money.  We are very glad that you enjoyed your stay at our hotel and we hope that you choose our hotel for your future stays in the area.    Thank you again for your great comments, we have shared them with our team as encouragement to keep on providing great customer service.  Sincerely,  Roberto Vasquez General Manager",none,none,none,none,none,none,149,262
14 helpful votes,10 contributions,5.0 of 5 bubbles,Great Value,"This motel was an excellent value in the Anaheim area. The room was spacious,well equipped,well maintained and very,very clean.Access to highways  was convenient and quick.The continental breakfast was excellent with plenty of room,hot items,well restocked and a good variety of choices.I would highly recommend this location for a stay. Anton at the main desk was very helpful and a nice young man.",November 2014,none,none,"Hello Maggellan,  We are delighted to hear that you highly recommend our hotel.  It gives our team great satisfaction to know that their hard work is paying off.  Your review will help as encouragement to our team to keep providing great customer service.  We will pass along your comment to Anton for providing exceptional service.  Thank you for your review and we hope that you choose our hotel for your next visit to the area.  Sincerely,  Roberto Vasquez",none,none,none,none,none,none,150,262
4 helpful votes,5 contributions,5.0 of 5 bubbles,Would stay here again,"Room was modern, comfortable, quiet, and reasonably priced. Staff was friendly and there was a very good hot breakfast with a good number of tables to use. I was even asked if I wanted a room on the first or second floor.",November 2014,none,none,"Hello M G,  On behalf of our entire team we would like to thank you for a great review on our hotel.  Our team is always working arduously to provide the best customer service possible and it gives us great satisfaction that our guests are recognizing the great work done at our hotel.  We are glad that you liked our breakfast and the plenty of options to choose from.    Thank you for your review and we hope to become your hotel of choice when you visit the area.  Sincerely,  Roberto Vasquez",none,none,none,none,none,none,151,262
119 helpful votes,180 contributions,5.0 of 5 bubbles,Peace and Quiet -- Nice!,"Because of the location, this hotel is quiet during the weekend. The rooms are very clean and up to date. The breakfast area can get a bit crowded but it works itself out.  If you are looking for a place close to Disneyland yet far off the beat path this place is for you. The restaurants in the area are must better than the high price ones near Disneyland.    I will be coming back to this location.",November 2014,none,none,"Hello mou2,  We are very happy to hear that our hotel will be your hotel of preference when you come to the area.  We are glad that hear that our hotel was of great value to you and your family.  We are in a commercial area of Placentia secluded from the busy street and that works out on our favor because the hotel stays mostly quiet.  Our breakfast can be a little crowded on the weekend because we cater to mostly families during the weekend that are here to visit Disneyland.  Our best comments come from our breakfast because we offer plenty of choices and our breakfast attendants are courteous and friendly.    We appreciate your comments and we hope to see you soon on your next visit to the area.  Sincerely,  Roberto Vasquez",none,none,none,none,none,none,152,262
6 helpful votes,11 contributions,4.0 of 5 bubbles,Quiet area,"Close to Anaheim.   Located in a business area but close to freeways.  We liked the breakfast,  fridge and microwave.   Staff were friendly and the grounds were clean.  Disneyland is not far but not busy with tourists.   We would return to the hotel when we're in the area.",October 2014,none,none,"Hello Trip Advisor Member,  Thank you for taking the time to write a review of our hotel the Quality Inn Placentia.    We are glad that you found value in our hotel.  Our team strives to provide great customer service and your review will serve as encouragement to all of our staff as we strive to continuously improve the quality of our services to provide an exceptional experience for our guests.  We will be delighted to serve your hospitality needs when you visit the area.  Sincerely,  Roberto Vasquez",none,none,none,none,none,none,153,262
2 helpful votes,1 contribution,1.0 of 5 bubbles,Air Quality- Unacceptable,"We stayed at this Quality Inn for one night and our lungs could not take any more of it.  We stayed in room 148.  And although the room had a slight stench, it seemed like a basic budget hotel room.   The beds were nice and we enjoyed the large refrigerator and microwave.   The bathroom was dirty and there was the odor of urine.   However, the reason for the one star is the terrible air quality.  We could smell mold coming from the air conditioner, but figured that maybe it hadn't been used for a while, so let it go.   We both woke up sore throats, coughing and headaches the next morning because of the air quality.   The windows don't open so there is no relief or fresh air.   Our symptoms were alleviated later that evening after we moved to another hotel.",October 2014,none,none,"Hello Kathleen G,  Thank you for taking the time to complete our online survey regarding your recent stay at our hotel.   I would like to apologize for not providing you a room that is not up to standards.  Our team strives to provide clean and comfortable accommodations for every guest in our hotel.  If you encounter the same situation in the future please advise one of our team members and they will make anything possible to provide you a room that accommodates to you and your family.  I hope that you will consider staying with us again so that we can have another chance to provide you with a superior experience.   Sincerely,  Roberto Vasquez General Manager",none,none,none,none,none,none,154,262
