Helpful Vote,Contributions,Overall Rating,Summary Heading,Summary,Date of Stay,Room tip,Trip Type,Manager Response,Location Rating,Cleanliness Rating,Service Rating,Value Rating,Rooms Rating,Sleep Quality Rating,Review Number,Index
1 helpful vote,5 contributions,4.0 of 5 bubbles,Great customer service,I have stayed at this particular La Quinta and I have found the staff to be very professional and always willing to accommodate a request. Good value for the hotel. The breakfast is helpful as well for a cup of coffee and a quick meal to start the day. I would recommend this hotel and it is very close to all freeways,October 2017,none,none,Thank you for letting us know about your stay with us Donna.  It is great to hear that my staff delivered great customer service and were attentive to your needs.  I was pleased to learn that our breakfast was to your liking.  It is always nice to hear positive things that a guest has experienced where we can pass on to our employees when we have out meetings.  Thanks so much for that and we hope you come back soon.,none,none,none,none,none,none,301,28
none,2 contributions,5.0 of 5 bubbles,Great pet friendly hotel.,This hotel is pet friendly with a dog area. The rooms were clean and the beds were very comfortable. Free breakfast in the morning with waffles and coffee and it was located to the freeway with easy access on and off.,October 2017,none,none,"It was great to read your positive review for our property.  I am glad that my staff provided great service and the hotel was clean.  Our breakfast has a nice selection: Waffles, Bread, muffins, bagels, cereals, eggs, milk, juice, yogurt, oatmeal, fruit and coffee.  We have a great location near shopping malls, movies theaters, beaches and not to mention the restaurants. It was great that you were able to take advantage and enjoy Orange County.  Thank you again and we hope to see you soon.",none,none,none,none,none,none,302,28
6 helpful votes,5 contributions,3.0 of 5 bubbles,Can't believe it was a La Quinta,I don't mind an old hotel but wow this one needs work! Obviously to old to properly clean and the room was infested with gnats. Time for an update or you need to take this name  off of it! Misleading g to people familiar with the chain.,September 2017,none,none,none,none,none,none,none,none,none,303,28
4 helpful votes,94 contributions,4.0 of 5 bubbles,Decent stay.,"Good size room, clean. Comfortable bed. Helpful friendly staff and service. Decent continental breakfast. Approx 20 minutes from Disney. In reality because of traffic volume it will take at least an hour. If you want a quick cheap meal to tide you over pop to Ikea across the road.  Stayed here 6 days as a Base. Would recommend.",September 2017,none,none,"Thank for the positive review bunkerbaby.  It was nice to hear that my staff was helpful and provided great customer service during your stay.  It is as you described although 20 minutes from Disney with traffic it can at times take almost an hour to get there.  But all the while great view and other venues in our area as restaurants, shopping mall, south coast plaza, movie theaters and beaches of course.  I can loose myself in Ikea for hours just walking through the displays for your home.  I have gotten many ideas from them that's for sure. Their cafeteria has nice specials.  Thank you again for sharing with us and letting us know we were here for you during you visit to our area.",none,none,none,none,none,none,304,28
none,1 contribution,1.0 of 5 bubbles,Don't Stay!,"Made a reservation through Expedia.  First time I have done this.  When traveling before I had stayed at  La Quinta and found the rooms clean and updated.  Price was fair. No problems.  I was comfortable when I made my reservation.  BUT, after arriving......I am in my 80th year and I was given a room facing the freeway.  I asked for another room and was given a room and the second floor.  This was ok with me as I considered stair climbing as an exercise. Dirty hand holds and rust.  The steps were poorly marked.  The room was smelling, stains on the bed duster.  Mirrors was old and the backing was coming off.  Towels were good.  Did not have in room coffee.  The painting on the outside of the building was just thrown up no prep  was done .  Did not have breakfast the next morning",September 2017,none,none,"Thank you for sharing your comments with us about your stay.  My apologies that you did not enjoy your stay as you usually do.  We are next to the 405 freeway which is a little noisy but the double pained windows do help minimize the noise.  We do have an on going project and taking care of the outside of the hotel painting the walls and rails. We power wash the area that is being done each week.  Then we paint the walls,  ceiling,  doors, rails and stairwells.  It has taken longer to finish the project as we have 3 floors and are an exterior property we do not want to disrupt our guests during their stay.  My apologies for the issues you experienced in your room.  we will make sure we replace the items you mentioned.  we have spoken to your team and shared your comments with them in order to ensure they are reporting items that are in need of replacing or need of fixing.  I wished you would have had breakfast as we do have a nice selection.  We offer Waffles, bagels, toast, orange and apple juice, tea, coffee, hot coco, eggs, milk, yogurt, oatmeal and fruit.  I do hope your long trip back home was a safe and one do hope you decide to stay with us again when in that area and give us another try.",none,none,none,none,none,none,305,28
1 helpful vote,7 contributions,2.0 of 5 bubbles,Thank goodness I didn't pay.,"Had to stay here because work booked it. There are a few things this place needs. Remodel, attention to detail and thicker walls near the 405. This Laquinta is not up to the standards of most I've stayed at. Put some money into it.",September 2017,none,none,Thank you for taking the time to share with us how we did when you were here with us.  We are right next to the 405 freeway which is great when needing to get to areas not too close but with easy access that helps get you there faster.  The noise is a problem and that will soon get addressed when the freeway expansion begins.  They should be putting up a wall that will help minimize the noise.  In the mean time we are placing door insulations around the frames to help too.  We are looking forward to a renovation ourselves early next year and do hope you will come again to see our new look.  Thank you again.,none,none,none,none,none,none,306,28
none,2 contributions,3.0 of 5 bubbles,La Quinta Stay,"I travel a lot for my job, and stay in hotels an average of 2-3 nights a week. What I look for is a friendly staff who makes the end of my day a little more enjoyable. I stay here because Alejandrea, Ashley and Matthew make me feel comfortable and provide that extra touch of kindness that makes me feel welcomed and appreciated. Great staff, Great location, and a place I consider my second home because of them. I can stay anywhere but because of them this is my second home.",August 2017,none,none,Wow! Thank you Louis for your comments and warm affection you have for La Quinta and our staff.  I have shared you review with my team and that just brightened up their day.  It was great to hear that you not only enjoyed your stay but that my team made it even more comfortable for you.  We look forward to your return.  Safe travels.,none,none,none,none,none,none,307,28
none,1 contribution,4.0 of 5 bubbles,Good Quality,This like many of the La Quinta's that I stay when i travel is a good quality accommodation for the cost.  I have used them for many years and always feel that you get more than what you paid for. La Quinta is the first place I look when I need to do a trip or business trip.,August 2017,none,none,"Thank you so much for your comments. In sharing your post with my team, your words gave them reason for being a part of our family.  Its guests such as yourself that makes it all worth it.  La Quinta is a great company to work for and have great hotels to stay at.  With the company renovating the Inns and Suites this year makes us Inns have something to look forward to next year.  If you like us now wait until renovations come, you will love it.  Thank you again for being a loyal guest.  We do hope you come again when visiting the area.  See you soon.",none,none,none,none,none,none,308,28
none,1 contribution,1.0 of 5 bubbles,Dirty condom no sympathy or apology from staff and manager,Found used condom between bed and wall and a condom wrapper in the drawer. Notified hotel staff but got no offer for another room or reinbursement only two hours into stay. Checked out and had no money to stay elsewhere. Following day called to speak to manager who was busy so asst. Manager was reluctant to appologize and made comment that the room had already been used though other guest were willing to tell how we were seen in pool for first two hours but mngr said someone showered and bed had been sat on claiming we were not able to complain about a dirty condom in the room where my two young children were to sleep. 130$ will get u this at la quinta in costa mesa,August 2017,none,none,"Dear Tammy,  Thank you for your review of your recent experience at our hotel. We’re so sorry that you encountered less than stellar service during your stay. This is definitely not the kind of experience we want our guests to have. We will make sure your comments are shared with our Management Team, so we can use them for further training purposes.  We do hope you choose us for your future travels.               Respectfully, Diana - LQ Customer Care",none,none,none,none,none,none,309,28
none,1 contribution,3.0 of 5 bubbles,Glad to get a room at a reasonable rate at the last minute.,"I was very happy that we could find a room late at night, with the friendly and helpful person at the front desk at 1:30 am. We needed a room that could accommodate 2 dogs, as a fire earlier that evening displaced us. The room was spacious and clean and cozy. The only issue I had was the external noise.. The last time we stayed here, our room faced the 5 freeway, and that noise kept me up at night. So I asked for a room on the other side. However, that wasn't much,if any, quieter.  At around 4:30am it sounded like there were gardeners outside using blowers and weed whackers. So I didn't get much rest, then when I went downstairs for breakfast at 9:10, it was closed and everything had been put away. I don't understand why La Quinta can't have the later breakfast time everyday, or",August 2017,none,none,Thank you for taking the time to let us know about your stay.  I was pleased to hear that my desk staff was helpful and accommodating to your needs.  1:30am is pretty late and I do hope the fire you experienced was made a little more at ease with my staffs help. I was also happy that the room was clean and spacious for you and your pets. My apologies for the noise you experiences last time with the freeway.  I am glad that we were able to put you in a room that was not by the freeway this time.  I will talk to my landscapers and see if they can start a little later in the morning.  Sorry about the Breakfast being closed when you came done.  The hours are from 6am to 9am on week days and on weekends it is a little later from 7am to 10am.  My apologies for the elevator being down when you stayed with us.  It was in need of a part that they did not have at the warehouse.  It was ordered which took a few days for the repairs to get back up and running.  I do hope it did not cause you too much of an inconvenience.  Thank you again for letting us know what we have done well and what we can improve on.,none,none,none,none,none,none,310,28
4 helpful votes,27 contributions,1.0 of 5 bubbles,Definitely NOT up to the usual standards of La Quinta!,"My wife and I and a friend wanted to stay at a hotel where we have always had great experiences and customer service.  We are used to staying at La Quinta and cancelled our reservation at a different hotel because we wanted to stay at a La Quinta property.  Unfortunately, this particular La Quinta did not deliver!  The room appeared clean, but on our second day my wife moved a chair to use it to blow dry her hair and put on her makeup and underneath the chair we found what appeared to be a piece of raw meat.  We were THOROUGHLY disgusted!  On our way out for the day, we stopped by the lobby and told the front desk clerk what we had found and asked that our room be cleaned and made up.  We were disappointed and angry when we came back to our room to find that, not only was the",August 2017,none,none,"Thanks for your comments regarding your stay. We’re sorry about the experiences you’ve mentioned, and your comments are concerning to us. We take service and cleanliness quite seriously, and we’d like to better understand what happened during your stay. Would you mind contacting us at lq0541gm@lqreviews.com so we may discuss with you personally? We appreciate your feedback and hope to hear from you soon!",none,none,none,none,none,none,311,28
3 helpful votes,19 contributions,2.0 of 5 bubbles,Only stay here if you have to......,"I am losing patience with the La Quinta Inns having stayed at four of them now....Each have various degrees of quirkiness, uncleanliness and problems.  I stay at La Quinta not just because of the rate, but because I travel with my dog and they do not require the guest to stay in the room with the dog at all times......almost all others do not allow the animal to be alone.   You pay a big price for this convenience and I don't mean in money, more like aggravation and annoyance.  This ""inn"" is right next to the freeway.....the pool looks out on the freeway, a very stressful way to enjoy the pool.  When I checked in they were courteous to let me come in 3 hours ahead, but only had a third floor room available, nor was I told it was facing the highway.  I was too anxious to get on",August 2017,none,none,"Thank you for the review, it's great to hear you were able to take advantage of our pet policy! To hear were not satisfied with the hotel in general is very disappointing. This is definitely not the kind of experience we want our guests to have.  We will make sure your comments are shared with our Management Team, so we can use them for further training purposes and hotel improvements.  We do hope you choose us for your future travels.       Respectfully,  Lacey",none,none,none,none,none,none,312,28
none,4 contributions,4.0 of 5 bubbles,Right on 405,"La Quinta Cosa Mesa is conveniently located on 405 right next to Hooters.  We always book LaQ because of free breakfast and points toward free stays.  Although this is an older hotel, it was very well kept.",August 2017,none,none,"Yes we are and have Freeway access!  Thank you for mentioning that.  We are off the 405 Freeway which makes it easy to get to locations that are not too far from us.  Places like the beaches, shopping centers, Disneyland, California Adventure, Knotts Berry Farm, Downtown Disney, etc.  Hooters is great next door but for other restaurants just passed the freeway a many more and if you go down our street just a few blocks you are at the South Coast Plaza Mall and many family restaurant's there too.  I am pleased you look forward to LQ breakfast and points are important.  You can accumulate  points quickly and use them for like you said stays at LQ hotels or even at retail stores and restaurants.  We are an older property and do our best to maintain the rooms and the building.  We will be getting renovated early next year which we are looking forward to so our guests and staff will see new look.  Thank you again for letting us know about your stay and we love the loyalty to our brand.",none,none,none,none,none,none,313,28
11 helpful votes,21 contributions,1.0 of 5 bubbles,Bug infested,"This motel is in an industrial area where there are a lot of homeless people. And right next to a freeway with a hooters in the same parking lot. The room I stayed in had blood spatter on the wall and cockroaches in the drawers. I have stayed at other La Quinta property's before and they were awesome. This place is a dump, you couldn't pay me to stay here agian!",July 2017,none,none,"Thanks for your comments regarding your stay. We’re sorry about the experiences you’ve mentioned, and your comments are concerning to us. We take service and cleanliness quite seriously, and we’d like to better understand what happened during your stay. Would you mind contacting us at lq0541gm@lqreviews.com so we may discuss with you personally? We appreciate your feedback and hope to hear from you soon!",none,none,none,none,none,none,314,28
none,1 contribution,3.0 of 5 bubbles,3 star inn,"Friendly staff, carpet is filthy. The amenities of having a micro-wave and a mini refrigerator, are great, but the extra linens are old, blanket had a hole in the corner, it's a good place to stay on a last minute booking.",July 2017,none,none,none,none,none,none,none,none,none,315,28
none,1 contribution,1.0 of 5 bubbles,Not up to La Quinta standards,"Perhaps La Quinta purchased this motel/hotel and has not had time to refurbish. It seemed old and unclean, plus there was a spider in the room. Dark and dreary inside of the room. Hoe er, the clerk who. Heckled us in was very nice and efficient.",July 2017,none,none,Thanks for your review. I’m sorry the hotel didn’t meet your expectations. We are currently in the process of painting our entire building as well as updating all the outdated parts in our rooms. We will take a look at our current lighting to see if there is a better/brighter bulb we can use in our guest rooms. I’m sorry to hear there was a spider in your room. Our pest control company treats our property once a month. I will let them know to treat our grounds for spiders the next time they’re out. Thanks again for your review. We hope to see you again!,none,none,none,none,none,none,316,28
none,1 contribution,4.0 of 5 bubbles,Simple,"Breakfast was serve yourself, they had make your own waffles which was nice! The young man at the desk was really nice and happy when we checked in, and the young lady at was so helpful, I asked for towels and batteries and she responded quickly and asked if she could do anything more for me and I really appreciated that. The front desk staff our really nice and the hotel is welcoming. The only thing I didn't like was the smell of smoke outside the room, but that was temporary from people outside.",July 2017,none,none,none,none,none,none,none,none,none,317,28
none,1 contribution,4.0 of 5 bubbles,Comfortable,"I like the beds for my back. The rooms are okay. Staff is nice, I've stayed here before usually last minute after work and the blonde girl is always happy to help me she always smiling. I will be back again when I'm to tired to drive it's a nice place to rest and relax.",July 2017,none,none,none,none,none,none,none,none,none,318,28
none,1 contribution,3.0 of 5 bubbles,La Quinta Costa Mesa,Staff was friendly but room reeked of smoke and shower didn't work.Room key did not work in the fitness center and the equipment in the room didn't work either. Internet was very slow and TV remote had dead batteries.,July 2017,none,none,none,none,none,none,none,none,none,319,28
none,2 contributions,4.0 of 5 bubbles,Solo trip to the beach,"The service was very good. The location was good since I had a car. I was visiting Huntington Beach. The room was nice and clean. But the bathroom area was old, dingy, showing cracks and rust. The breakfast options were nice. The parking was good and the stairways and elevators and ice machines were conveniently located.",July 2017,none,none,none,none,none,none,none,none,none,320,28
none,1 contribution,2.0 of 5 bubbles,Run down,"This location is run down.  Outside walk ways, paint, and rooms inside reflect much wear and tear.  Soiled carpets, sunken bed, chipped bathroom tile, & dirty doors.  Although non-smoking rooms, we could smell the smoke as we walked by certain rooms.  We also awoke in the middle of the night from incredibly strong second hand smoke seeping from another room into ours.",July 2017,none,none,I am very sorry that there were many smoking issues and odors with your room during your stay with us.  We do have non smoking rooms and do charge a penalty fee of $250 if guests smoke in non smoking rooms.  It is a shame that we still have guests that smoke in those rooms.  We also have designated smoking area as well for those that do not smoke in the rooms.  We are an older property however we are doing our best to get the property repainted.  There are some areas still needing to get done which we will make sure we finish. We are expecting to have a full renovation at the beginning of the year that we are looking forward to.  I do hope you will come back to see our changes soon.  Thank you again for your comments it will help us improve our property.,none,none,none,none,none,none,321,28
3 helpful votes,3 contributions,3.0 of 5 bubbles,Probably would not stay here again,"Family of 4 for Disneyland vacation. Beds hard, pillows lumpy. Floor felt dirty even tho looked clean. Got the room we requested. Staff very nice. Clean pool. Clean grounds. Building looked ""older"". Breakfast area needs to be bigger to accommodate the number of guests.",July 2017,none,none,none,none,none,none,none,none,none,322,28
14 helpful votes,7 contributions,4.0 of 5 bubbles,LaQuinta - Orange county,"Clean rooms, and facility. Very friendly and pleasant staff, nice free breakfast. Good place to walk pets, restaurant sharing parking lot, guest receive discount. 4th time I have stayed here, mostly do to location. Tried another hotel close by, because it was cheaper, and was not happy. Lost my room key, and desk clerk replaced it with out any issues. I attend an annual conference, and will continue to stay here, because of the ease of making the reservation, friendliness of the staff and the comfortable bed, and the price.",July 2017,none,none,It was a pleasure reading your response about your stay and your regular stays with us.  I was most content hearing that my staff continually provides great service with a smile. We are happy that you did return to us even after you decided to stay with another hotel.  That makes it much more satisfying when we hear that we won our guests back.  In sharing your comments with my team I saw their faces brighten which means you made their day and they know they can continue taking care of our guests as they do.  I welcome you back when your travels direct you our way again.  And thank you for sharing with us your stay.  See you soon.,none,none,none,none,none,none,323,28
none,1 contribution,1.0 of 5 bubbles,see previous,"many complaints. Dirth,mouse droppings, long hair in shower, supplies  short on shampoo, no wake up call as requested and froze my food.  Right next to Hooters.  However, the manager reimbursed me for a day.",July 2017,none,none,"Thanks for your comments regarding your stay. We’re sorry about the experiences you’ve mentioned, and your comments are concerning to us. We take service and cleanliness quite seriously, and we’d like to better understand what happened during your stay. Would you mind contacting us at lq0541gm@lqreviews.com so we may discuss with you personally? We appreciate your feedback and hope to hear from you soon!",none,none,none,none,none,none,324,28
107 helpful votes,128 contributions,2.0 of 5 bubbles,Poor place,"This is a very low end La Quinta and quite expensive.  Very bare rooms, no fridge or microwave, very soft beds.  It is also quite loud being right next to the 405.  Shower had good pressure and internet was fast.  Would not stay here again.",July 2017,none,none,Thank you for your comments. We appreciate you letting us know how your stay was and helping us focus on what we need to do to improve guest satisfaction.  Not all of our rooms come with the microwave and fridge.  Those rooms are limited and do sell out first before the others as well as are at a higher rate. My apologies for the noise from the freeway.  We are right next to the freeway but when the city expand the freeway a higher wall will be put up that will help minimize the noise.  We are also expecting a full renovation next year and do hope you will give us another try.  Thank you again for taking the time to share with us your comments.,none,none,none,none,none,none,325,28
none,1 contribution,5.0 of 5 bubbles,Aaron's stay,"We enjoyed our stay. However, I left my personal pillow behind. We called to say that we would go back and get it. It was either thrown away or stolen. Maybe you can have a lost and found and hold items for 2 days. Also, if breakfast ends at 9 don't put everything away at 8:45.",July 2017,none,none,Thanks Aaron for letting us know that you enjoyed your stay.  It great that our guests take the time to tell us what we did good and also where we can improve.  Thank you for your suggestion for our lost and found.  We will make sure we are holding guests items for those to be returned.  Normally we do keep them for 30 to 60 days depending on the items.  My apologies if your pillow was not recovered.  We will check to see if we still have it.  I was concerned to hear that out breakfast was closed before the scheduled time.  Breakfast hours are weekdays 6am to 9am and on the weekends 7am to 10am.  I have shared your comments with my staff and our breakfast attendants and they will make sure we honor the breakfast hours.  Thank you so much again for taking the time and sharing your comments.  Only through your eyes can we know how we are doing with our guests.  Thank you.,none,none,none,none,none,none,326,28
