Helpful Vote,Contributions,Overall Rating,Summary Heading,Summary,Date of Stay,Room tip,Trip Type,Manager Response,Location Rating,Cleanliness Rating,Service Rating,Value Rating,Rooms Rating,Sleep Quality Rating,Review Number,Index
3 helpful votes,2 contributions,1.0 of 5 bubbles,Most disgusting hotel room,"This location was under new management. I've stayed at this location at least 40 times in the last 16 years and never had a problem before. The list is extensive so if you don't have a lot of time... At check-in I was told there would be a $50.00 deposit that is refundable at check-out but a sign states if you don't specifically ask for it back you give up the right to get it refunded. I entered the room and it smelled musty. The bath tub was moldy, the caulk around the toilet was stained yellow, and the toilet paper was so low quality I could see through it. The towels were small, not absorbant, and stained. When I tried to call the front desk I found the phone did not work. I called from my cell and was told I had to come to the front desk to get clean ones. There was no",May 2021,none,none,"Dear guest, We are very sorry to hear that you were so disappointed with your stay at our hotel. Our aim is to provide a clean, comfortable and pleasant place to stay, and we sincerely apologize that our hospitality and attention to detail left something to be desired in this case - this is very unlike us. We take guest feedback very seriously, and we will conduct an investigation within our housekeeping department to correct any lapses in current cleaning standards. We will also ensure that our front desk personnel is aware of your impression and see to it that the concerned team member endeavors to make sure that each guest has the positive experience that we aim to provide. Furthermore, we will instruct our staff to ensure 100% compliance in their use of masks in the hotel's indoor public areas. Our maintenance team has also been alerted to your comments so that they can take immediate action to address the issue that you have highlighted with the TV. Kindly note that due to COVID restrictions, we have temporarily suspended daily housekeeping services for stay-over guests (i.e., not making beds or cleaning rooms unless specifically requested). However, upon request, a change of linens, towels, and toiletries will be made available at the front desk. We regret the inconvenience caused, but this is to help protect the safety and well-being of our guests and staff members. Thank you for considering our accommodation for your stay in Costa Mesa and for taking the time to post your review. We appreciate both.  Best Regards, Guest Experience Team",none,none,none,none,none,none,139,28
1 helpful vote,1 contribution,1.0 of 5 bubbles,Horrible experience,"As soon as I got there I realized it was a horrible idea. The staff gave weird creer vibes, the keys did not work at all! The rooms had a weird smell. Made me feel super uncomfortable. No breakfast was served as advertised.",April 2021,none,none,"Dear guest, We are very sorry to hear that you were so disappointed with your stay at our hotel. It certainly does not sound as if you had the experience that we strive to provide for our guests, and we sincerely apologize for any failure in delivering on our commitment to provide you with a clean, comfortable, and pleasant place to stay. We take guest feedback very seriously, and we will put all your comments to good use for the betterment of the guest experience. Our maintenance team has been alerted to your comments so that they can take immediate action to address the issue that you have highlighted with the keys. Additionally, we will ensure that our housekeeping team does a better job of airing out the rooms moving forward and see to it that all of our staff members endeavor to make sure that each guest has the positive experience that we aim to provide. We also want you to know that our breakfast service has been temporarily suspended due to COVID restrictions. We regret the inconvenience caused, but this is to help protect the safety and well-being of our guests and staff members. Thank you for considering our hotel for your stay in Costa Mesa and for taking the time to post your review. We regret that our accommodation was not suitable for your needs, but we appreciate you staying with us on this visit.  Best Regards, Guest Experience Team",none,none,none,none,none,none,140,28
1 helpful vote,1 contribution,1.0 of 5 bubbles,Worst motel ever,The room was dirty. Sheets were dirty. Towels looked like they were used by a mechanic. Sketchy and dangerous area. They didn’t refund my deposit for no reason. Stay away and don’t waste your money. Spend 30$ extra and go to a real hotel.,April 2021,none,none,"Dear guest, Thank you for your review. Your comfort and satisfaction are of the utmost importance to us, and we truly value your feedback. We are working hard to improve our quality, and we hope you'll give us another chance down the road so that we can delight you with a superior experience during your next trip to the area.  Best Regards, Guest Experience Team",none,none,none,none,none,none,141,28
1 helpful vote,1 contribution,3.0 of 5 bubbles,Transitional moving period,"This place was a welcomed over night stay. I enjoyed it so much that I stayed an extra night to take care of business affairs before moving forward to my next location. I am in the middle of looking for a new line of work as I attend school and look for a new home for my adult dependent son and I. The next few weeks are important and what I call ""our transitional period/time"" before settling in somewhere new and calling it home.",April 2021,none,none,"Dear guest, Thank you for taking the time to post your review. We are glad to hear that you enjoyed your time with us and extended your stay by an extra night and we hope everything was in order and you had easy access to your essentials. While it appears from your rating that your overall experience was satisfactory, we really would have wanted you to love your time with us. Please do let us know if there is anything that we can do to make the next visit even more memorable for you. We look forward to hosting you again and hope to delight you with a superior experience during your next trip to the area.  Best Regards, Guest Experience Team",none,none,none,none,none,none,142,28
1 helpful vote,1 contribution,1.0 of 5 bubbles,Gross,"Cig butts on ground, stairs, and doormat to our room. Hair in bathroom on floor and walls. Dirt on counter and floor of bathroom. It was not clean. This place smelled bad and was disgusting. We slept with our clothes on top of bed afraid to get in it. Never stay here! Most La Quintas are nice but this one missed the mark on all accounts.",April 2021,none,none,"Dear guest, We are very sorry to hear that you were so disappointed with your stay at our hotel. We take upkeep and cleanliness very seriously, and your room should always feel fresh and clean. Our staff generally does a great job when it comes to maintaining our property and preparing the rooms for upcoming guests, so it is strange that this happened. Furthermore, there should not be any smoking at all. We take guest feedback very seriously, and we will conduct an investigation within our housekeeping and maintenance departments to correct any lapses in current cleaning and upkeep standards. We will also see to it that our staff does a better job of airing out the rooms/common areas moving forward.  Thank you for considering our accommodation for your stay in Costa Mesa and for taking the time to post your review. We appreciate both.  Best Regards, Guest Experience Team",none,none,none,none,none,none,143,28
1 helpful vote,1 contribution,1.0 of 5 bubbles,Worse hotel ever,Well first I had reservations for 2 double beds in a non smoking room. When I arrived to the hotel at 5 pm I was told my room was not available. I was asked to wait for 20 minutes in the lobby while I watched them tend to all the other guest and give them the room they reserved. I started to file a complaint with Booking.com about my reservation and the hotel service when the employee called me to the counter. He stated my room was now available. He put my family and I in a smoking room that looked like it wasn’t even cleaned at all. I wanted to leave the hotel but was told I would be charged the full amount. I couldn’t breath in the room it was so stuffy and smelled strong of cigarette smoke. There was a large stain on the carpet which looked like it could of been blood. The,April 2021,none,none,"Dear guest, We are very disappointed to read your review of our hotel. It certainly does not sound as if you had the experience that we strive to provide for our guests, and we sincerely apologize for any failure in delivering on our commitment to provide you with a clean, comfortable, and pleasant place to stay. We are sorry to hear that your room was not ready upon arrival, and we deeply regret the issues you describe with cleanliness and the smell of smoke. We are a smoke-free property, but, unfortunately, not all of our guests abide by our rule, and occasionally, as seems to have happened on this occasion, a guest will smoke in a non-smoking room. We thank you for voicing your concerns to us, and we will conduct an investigation within our housekeeping department to correct any lapses in current cleaning standards. We will also ensure that our staff does a better job of airing out the rooms moving forward and see to it that our front desk staff provides better customer service in the future. Thank you for considering our hotel for your stay in Costa Mesa and for taking the time to post your review. We appreciate both.  Best Regards, Guest Experience Team",none,none,none,none,none,none,144,28
1 helpful vote,1 contribution,4.0 of 5 bubbles,Costa Mesa Trip,I had a bit of a personal problem on this trip but luckily it was all taken care of. My advice to anybody staying at this hotel is don't speak to the staff that is working outside or cleaning the rooms in anything but a positive tone or manner even if it's taken forever for them to get to your issue. The other thing is the Costa Mesa police department had been there 3 weeks before this day that I had and there is a cross with a memorial that is present on the other side of the parking structure which kind of freaked me out but I think they should maybe not have that there it's just kind of creepy. However when I did get back to the property to reclaim my items the staff was good. At least I got my items back however do not speak to the cleaning staff or gardeners in any tone,April 2021,none,none,"Dear guest, Thank you for the positive rating. Your comfort and satisfaction are of the utmost importance to us, and we truly value your feedback. By telling us what you liked about your stay and how we can improve, you are helping us deliver a superior experience for you and other guests in the future. We appreciate you taking the time to let us know how you perceived our accommodation and service, and we will review your comments in detail and make changes wherever possible in improving our property and training our staff to ensure a superior experience for future guests. We hope to earn your business on future travels so that we can delight you with our continuous improvement.  Best Regards, Guest Experience Team",none,none,none,none,none,none,145,28
1 helpful vote,2 contributions,2.0 of 5 bubbles,Shabby and unwelcoming,Shabby and unwelcoming but also outdated and dirty. The checkin process was the worst I have ever experienced and will not be back again or will not recommend either. The beat part was check out and the smart tv was cool and oh pet friendly too.,April 2021,none,none,"Dear guest, We are very sorry to hear that you did not have a wonderful stay with us. We apologize for the aspects of your visit that did not impress you, and we regret any failure in delivering on our commitment to provide you with a clean, comfortable, and pleasant place to stay. We take guest feedback very seriously, and we will conduct an investigation within our housekeeping and maintenance departments to correct any lapses in current cleaning and upkeep standards. We will also endeavor to find out what specifically arose at check-in and see to it that it doesn't happen again. Thank you for considering our hotel for your stay in Costa Mesa and for taking the time to post your review. We regret that our accommodation was not suitable for your needs, but we appreciate you staying with us on this visit.  Best Regards, Guest Experience Team",none,none,none,none,none,none,146,28
1 helpful vote,1 contribution,1.0 of 5 bubbles,Worst motel I've ever stayed at.,"Dreary,, filthy room.  Stained carpets.  Substandard cable channels.  I paid for a ""deluxe"" room and got a standard.  I had to call the front desk to have the matter straightened out.  Mediocre cable tv channels.  Lack of amenities in the bathroom.  Room didn't even have kleenex.",March 2021,none,none,"Dear guest, We are very sorry to hear that you were so disappointed with your stay at our hotel. Our aim is to provide a clean, comfortable and pleasant place to stay, and we sincerely apologize that our hospitality and attention to detail left something to be desired in this case - this is very unlike us. We take guest feedback very seriously, and we will put all your comments to good use for the betterment of the guest experience. We will also conduct an investigation within our housekeeping department to correct any lapses in current cleaning standards. Thank you for considering our property for your stay in Costa Mesa and for taking the time to post your review. We regret that our accommodation was not suitable for your needs, but we appreciate you staying with us on this visit.  Best Regards, Guest Experience Team",none,none,none,none,none,none,147,28
1 helpful vote,1 contribution,2.0 of 5 bubbles,Dirty Rooms,One of the dirtiest and smelliest rooms I’ve ever been in. The noise from the freeway is very loud. The door to the room does not have a full seal on it. You will hear the noise all day and night. The price was the only thing I was satisfied with.,March 2021,none,none,"Dear guest, Thank you for choosing to stay with us and letting us know that our price suited you. We appreciate it. We strive to deliver a great guest experience, but it sounds like we did not achieve our goal on this occasion. We apologize for the issues you experienced with the room, and we regret the inconvenience you describe with street noise. We take guest feedback very seriously, and we will conduct an investigation within our housekeeping department to correct any lapses in current cleaning standards. Furthermore, we will alert our maintenance team to your comments so that they can take immediate action to address the issue that you have highlighted with the door. Also, while we don't have much control over external noise, we can probably look at assigning a quieter room for you the next time, should you consider staying with us again. It is disappointing if a guest leaves with less than first-rate experience - this is very unlike us. We hope for a chance to redeem ourselves with you and restore your faith in our hotel and hospitality.  Best Regards, Guest Experience Team",none,none,none,none,none,none,148,28
1 helpful vote,1 contribution,1.0 of 5 bubbles,Absolutely Disgusting!,"Upon checking in we walked up to our room and opened the door. Before we even walked in the room we noticed the room was not clean, had a tote of electronics and bags of trash. On the dresser there was drug paraphernalia and it smelled awful. Needless to say we closed the door and checked out immediately. I can’t imagine what the rest of the room looked like because that is just what we saw standing outside the door looking in.",February 2021,none,none,"Hi Marilyn, We are very sorry to read your review of our property. Our housekeeping staff cleans, sanitizes, and inspects each room so that it is ready for incoming guests. A room with odors and in the condition that you are describing would not/should not have passed inspection. We appreciate you bringing this to our attention, and we will conduct an investigation within our housekeeping department to correct any lapses in current cleaning standards. Thank you for considering our accommodation for your stay in Costa Mesa and for taking the time to share your feedback. We appreciate both. We would love the opportunity to redeem ourselves with you, should you choose to revisit us.  Best Regards, Guest Experience Team",none,none,none,none,none,none,149,28
1 helpful vote,1 contribution,1.0 of 5 bubbles,Filthiest hotel in town,"We have never stayed at a La Quinta or Wyndham property that was as run down with dirty rooms until this experience.  Pet stained carpets, brown stains on bedding and dirty counter tops.  Changed rooms and the second was only marginally better.  Loud noisy environment all night",February 2021,none,none,"Dear guest, We are very sorry to hear that you were so disappointed with your stay at our hotel. It certainly does not sound as if you had the experience that we strive to provide for our guests, and we sincerely apologize for any failure in delivering on our commitment to provide you with a clean, comfortable, and pleasant place to stay. We take guest feedback very seriously, and we will conduct an investigation within our housekeeping department to correct any lapses in current cleaning standards. Furthermore, we will continue to do our best in informing our guests to observe silence, especially during quiet hours, to ensure a comfortable stay for all of our guests. Thank you for considering our accommodation for your stay in Costa Mesa and for taking the time to post your review. We appreciate both. We would love the opportunity to redeem ourselves with you, should you choose to stay with us again.  Best Regards, Guest Experience Team",none,none,none,none,none,none,150,28
1 helpful vote,1 contribution,4.0 of 5 bubbles,Great stay!,The beds are very nice and the staff was very helpful and nice too! I stayed 2 nights and I would recommend this place to anyone wanting to stay in CM or HB. I am traveling with pets and didn't have to pay a pet fee which was great!,January 2021,none,none,"Dear guest, We are always pleased to receive feedback from our visitors in relation to their stays with us, and we are delighted with your rating and comments - thank you very much. We are glad to hear that you had a great stay with us, and it's nice to read that you liked the beds and found our staff helpful. We are also happy to know that our policy of welcoming pets at no additional charge suited you. Please do let us know if there is anything that we can do to make the next experience even more enjoyable for you. We appreciate you recommending our property to prospective guests, and we look forward to having you back soon for another pleasant stay during your next trip to the area.  Best Regards, Guest Experience Team",none,none,none,none,none,none,151,28
1 helpful vote,1 contribution,1.0 of 5 bubbles,Dog friendly is worse than a pound,Our dog friendly room was heavily soiled with dog feces. I secured another dog friendly room at a nearby hotel which was very nice then we checked out at La Quinta. They did not offer to refund my deposit. They did offer a different room but by then I just wanted to get out.,January 2021,none,none,none,none,none,none,none,none,none,152,28
1 helpful vote,1 contribution,5.0 of 5 bubbles,Resort,Had a wonderful stay and the staff was very helpful. My family and I will definitely will be back! The property was very bright and I can see the ocean from the third floor.  My dog enjoyed the pet area as well.  Thank you,January 2021,none,none,none,none,none,none,none,none,none,153,28
1 helpful vote,1 contribution,4.0 of 5 bubbles,La quinta by hooters,I just want to say thank you to the front desk worker named Luci. He worked with me bc I was struggling to pay the full deposit fee after I was told the total amount for my room. He was very understanding and stayed completely professional about my situation the entire time. I really appreciate him and everyone else that works there. Thank you again and I'll be back soon!,January 2021,none,none,none,none,none,none,none,none,none,154,28
1 helpful vote,1 contribution,5.0 of 5 bubbles,Awesome Spot!! Will come back again,"Great room with pool view, microwave/fridge. And walking distance to Hooters.. Sanjay was very hospitable and gave us directions to local eatery around town.. The beach is minutes away too from the hotel.",January 2021,none,none,none,none,none,none,none,none,none,155,28
3 helpful votes,2 contributions,5.0 of 5 bubbles,La Quinta off the 405 in Costa Mesa,"I stay at this location quite frequently. The staff at the front desk are very friendly, Ken is often the one who checks me in and he is very accommodating. There have been plenty of times I called the front desk needing amenities that I had run out of and I took note of how quick they were to get my towels, sheets, etc to my room. I would recommend staying here, it's clean, there isn't riff raff hanging around outside which makes for a quiet atmosphere which I love!",January 2021,none,none,"Dear Guest,   Thank you for taking time tell us about your experience. We are happy to hear about your experience. We would like to share your experience to our team members to achieve success.   We are hopping to serve you better and better again.   Best Regards Ken",none,none,none,none,none,none,156,28
1 helpful vote,1 contribution,5.0 of 5 bubbles,Clean,Hotel is very clean.housekeeping helped me extra towels. Ken helped me accommodate with Accessible room. My wife and I liked this hotel. We will recommend this to our family members and friends. We will visit this place again.,January 2021,none,none,"Dear Guest,   Thank you for taking to tell us about your experience. We are happy to hear about your experience.  We are glad that our team member helped with accessible room.   We are looking forward to serve you better in future.   Best Regards Dan",none,none,none,none,none,none,157,28
1 helpful vote,1 contribution,5.0 of 5 bubbles,Amazing stay,"We went to New Year’s Eve and I must say everything was excellent.  The front lobby was well decorated. Very clean spacious and hygienic room. Beds were very comfortable. Also Very Grateful to Mr. Ken, who helped us upgrading our room into deluxe which was facing the pool area.   I will definitely recommend this hotel.",December 2020,none,none,"Dear Guest,   Thank you for taking the time to tell us about your experience at La Quinta Inn by Wyndham Costa Mesa Orange County. It is always a pleasure to receive positive feedback.  I am particularly pleased that you found our service good. I will share your comments with our team, who I am certain will be encouraged by your remarks. Here at La Quinta Inns & Suites, we continuously strive to exceed your expectations.  Thank you again for sharing your experience, and we look forward to serving you in the future.  Sincerely, Ken",none,none,none,none,none,none,158,28
1 helpful vote,1 contribution,5.0 of 5 bubbles,Amazing place,This is the second time in few years and this place is improved a lot compared to last time. New paint looks attractive. Stan the supervisor is very helpful. He helped me find a parking spot and help me with pool facing room. Mew rooms are nice and clean. Will recommend to this place to mu family and friends.,January 2021,none,none,"Dear Guest,   Thank you for taking the time to tell us about your experience. we are happy to hear that you liked the changes in our hotel. I am pleased to know that you are happy with our Team members and we will share this experience with our team members to achieve the best customer service experience.  Here at La Quinta Inns & Suites, we continuously strive to exceed your expectations.  Thank you again for sharing your experience, and we look forward to serving you in the future.  Sincerely,",none,none,none,none,none,none,159,28
2 helpful votes,1 contribution,5.0 of 5 bubbles,Can’t stop complimenting,Lucifer Morningstar you are the best person I met so far! You took good care of me and my family would be looking forward to stay with you again! The property was clean and they have 24 hrs security that makes this place so safe! I can sleep without any worries,January 2021,none,none,"Dear Guest,   Thank you for taking time to tell us about your experience . We are happy to hear that you are happy with our service and our team member are very helpful.  Your feedback is important to us and we will share your experience to our team member.  we are happy to assist you in future. Thank you for  staying at La Quinta Inn costs mesa.   Sincerely,",none,none,none,none,none,none,160,28
23 helpful votes,10 contributions,1.0 of 5 bubbles,This hotel has went down hill.,I have stayed here many times over the last 10 years. For the price it was decent. But this last time was horrible. The room had no heat the first night. The carpet was filthy. They put us in another room and told me they would discount the room. When I checked out there was no discount. Very disappointed in our stay. They don't keep it clean like they used to.,January 2021,none,none,"Dear Guest,    Thank you for taking the time to tell us about your experience at La Quinta Inn by Wyndham Costa Mesa Orange County. I am sorry that your experience did not meet your expectations; please allow me to express my sincerest apologies. we are sorry that you had to face the problem with heat in the first night and carpet was filthy . We are working on improving carpets. Here at La Quinta Inns & Suites, we continuously strive to meet your needs and expectations.  Sincerely,",none,none,none,none,none,none,161,28
