Helpful Vote,Contributions,Overall Rating,Summary Heading,Summary,Date of Stay,Room tip,Trip Type,Manager Response,Location Rating,Cleanliness Rating,Service Rating,Value Rating,Rooms Rating,Sleep Quality Rating,Review Number,Index
none,4 contributions,2.0 of 5 bubbles,noisi rooms,"i couldnt sleept becouse constanting hitting of  wall from the next door room. you casn hear all kind of noises.and staff hotel dont care about it.  if you make an special request they dont care, even if youre an elite level from la quinta.",May 2015,none,none,none,none,none,none,none,none,none,544,28
3 helpful votes,2 contributions,2.0 of 5 bubbles,Weekend visit,"I checked in on a Friday, April, 2015 . (One king bedroom)The room was clean til I walked into the bathroom. It was just old and run down. I ask for a new room.. Front desk quickly gave me another room. Room was clean but the tub was missing the wash mat that sticks inside the tub. The whole bottom tub had that ring from where the mat use to be and all the dark scratches from it use to being there. . Just looked dirty.. Next morning , we got up to get hot breakfast ( was a good selection and hot waffles) walked back to our room with both hands full , both our key cards did not work. Had to put my hot breakfast down to walk to the front desk to get my key cards working.....     Afternoon, decided to take the iron board out to iron my clothes... iron board legs were broken...",May 2015,none,none,none,none,none,none,none,none,none,545,28
14 helpful votes,38 contributions,3.0 of 5 bubbles,It was OK,We need pet friendly and close to John Wayne Airport to pick up our family the next day. It was perfect for that. But it needs a facelift. The beds were fairly comfortable but the other guests talked outside our room by the pool until pretty late. It was not a restful night. The staff was helpful and considerate.I didn't really want to touch anything.,April 2015,none,none,none,none,none,none,none,none,none,546,28
1 helpful vote,9 contributions,1.0 of 5 bubbles,Horrible,"I recently stayed at this hotel and the service was bad,room was not upkeept,found a drug baggie right next to where my kids slept, i had a begal toasted and ready to eat and just before i took a bite another guest stopped me and showed me that it had mold.......ive reported all this and the manager still did not do anything to take care of my issues....do not stay here",April 2015,none,none,none,none,none,none,none,none,none,547,28
none,1 contribution,3.0 of 5 bubbles,Ok stay,"The hotel was okay.  I've stayed at better LQs.  It's next to a Hooters which had some competition going on which I didn't want to see or hear.  They were very loud patrons/workers in the parking lot late into the evening which made trying to rest in our room difficult, and not great for my young kids to observe.  hotel staff would not move us. But, it was in a convenient location, the breakfast was average and the rooms were okay, even though the nonsmoking room smelled like smoke.",April 2015,none,none,none,none,none,none,none,none,none,548,28
1 helpful vote,2 contributions,1.0 of 5 bubbles,Do not stay here,"Saggy matresses, dirty corridors, semi permenant residents who all smoke nite and day. Dog area not maintained. Do not stay here. They areadvertise recently remodeled that is only the looby and breakfast, Which are nice.",April 2015,none,none,none,none,none,none,none,none,none,549,28
55 helpful votes,111 contributions,4.0 of 5 bubbles,Nice Stay in Southern California,"Hotel is nice, room were clean, and bathroom clean.  Good WiFi connection.  You can hear the freeway noise if you on the side of the hotel facing the freeway.  Rooms are large.  Breakfast wasn't bad as you could have waffles, cereal and yogurt.  Parking is limited if they are full.  There is airport pickup but only between 10 am and 6 pm.",April 2015,none,none,none,none,none,none,none,none,none,550,28
67 helpful votes,133 contributions,1.0 of 5 bubbles,"Dirty , Noisy, Trashy, but Good Service","I had thought I made a reservation at the Santa Ana LaQuinta but I had made a mistake. I have stayed at that La Quinta several times and it is just fine for a mid-range hotel. It turned out to be the biggest hotel reservation mistake I have ever made. If you have kids, especially little ones, DO NOT STAY HERE. Dirty, noisy, trashy. Carpets in rooms dirty. Rooms in bad condition, need a remodel. Outside needs a pressure washer and some paint and a garbage can. Change the filter on the AC.   Noisiest room I have ever stayed in in my 50 plus year old life. Freeway noise is terrible. Stayed on a Friday night - a big party on the fourth floor facing our room with people inside and outside on the balcony. LOUD. When some lady walked by our room at 2:30 am and yelled ""BAD#@@"" that was",March 2015,none,none,none,none,none,none,none,none,none,551,28
61 helpful votes,32 contributions,2.0 of 5 bubbles,Loud - keep driving!,"This motel is right next to a VERY noisy freeway AND.. a Hooter's.. so if you LIKE Hooters then by all means, come on in.  The motel is .. well, on the inside it's clean and tidy.. on the outside it looks like a dive and some of the walkways were sticky with soda...but for the rest, then again it's dark as I write this. When I got to my room my cards did not work. After returning to the desk TWICE I was more than a little angry. Even after the desk clerk (who is delightful by the way) came up here to check on the door, the door still only works about 50% of the time, sticking and not opening even with the green light. Unacceptable!!!!  The walls are paper thin, I heard someone talking outside my door and I thought the window was open - it's not. The bathroom tub has weird spots",March 2015,none,none,none,none,none,none,none,none,none,552,28
38 helpful votes,133 contributions,3.0 of 5 bubbles,Not as bad as the reviews would have you believe,"I read the bad reviews and expected the worst. What I found was a perfectly adequate La Quinta. Maybe on the more run down side of things, but my room was fine. No smells, no stains, no mildew, maid service every day.   Yeah the parking lot attracted a varied crowd, there were definitely people smoking pot out there and I think there are people that live in that hotel as their home but it wasn't a big deal.",March 2015,none,none,none,none,none,none,none,none,none,553,28
53 helpful votes,118 contributions,2.0 of 5 bubbles,In need of a makeover,Hotel really needs to be upgraded.  Bathrooms had mold in tub and did not appear to be cleaned.  The beds are very small - they seem to be smaller than a full size bed.  Room size was adequate to get an extra blow up on the floor.  Front desk staff checked us into a King bed room when there were 4 of us all standing in front of her.  Our reservation was for 2 beds.  Best part of the hotel is that there's a restaurant next door.  Would not recommend this hotel and it has made me not trust the La Quinta brand.,March 2015,none,none,none,none,none,none,none,none,none,554,28
none,2 contributions,1.0 of 5 bubbles,Horrible stay,Ice machines and elevators broken;  No crib for my grandson after promised there would be one.  Pool was freezing cold.  Staff sitting on stairs and smoking right outside of rooms.  No waffles or juice bbreakfast very limited and parking was limited.,March 2015,none,none,none,none,none,none,none,none,none,555,28
none,1 contribution,4.0 of 5 bubbles,"Clean Hotel, Close to Beaches",We stay here often when traveling to the Huntington/Newport beaches. It's close to a lot of grocery stores and a quick drive to the beaches/beach towns. Staff is friendly and rooms are clean. Great value!,March 2015,none,none,none,none,none,none,none,none,none,556,28
183 helpful votes,2011 contributions,1.0 of 5 bubbles,Believe the bad reviews,"I stayed here for a few nights as part of a large group. We had read the negative reviews here and were quite concerned prior to arrival. My room was ok, it smelled like old motel, which brought back memories of family trips when I was a kid. The bathroom in my room was pretty gross with mildew and long hairs on the floor that never got cleaned during my stay.   But let me tell you, among my colleagues in my group were there stories to tell! Several had to ask for a new room upon check in because they could not take the stench in the assigned room, which varied from old smoking room to moldy to just disgusting old room smell. Several people told of wierd stains on the carpets - blood? paint? something else? The pool was so dirty that you would never let your kids even near it,",March 2015,none,none,none,none,none,none,none,none,none,557,28
1 helpful vote,2 contributions,1.0 of 5 bubbles,Needs an overhaul!!!,Worst experience in a hotel.  the mold threw me overboard as our son has asthma!!!  They had no extra rollaway beds and the rooms stunk like sweat.  Would never stay at this La Quinta ever again.  It needs a sever overhaul.  They allow pets and rooms were plain and dirty feeling.,March 2015,none,none,none,none,none,none,none,none,none,558,28
8 helpful votes,28 contributions,5.0 of 5 bubbles,Even business is a pleasure,La Quinta is the place to stay when you're looking for comfort and affodability.  Their knowledgeable and friendly staff have always made our stays special.  This is why we look for the nearest La Quinta when travelling.  It truly is our home away from home.  All of this and breakfast included.,March 2015,none,none,none,none,none,none,none,none,none,559,28
none,1 contribution,3.0 of 5 bubbles,"inadequate,needs attention to details",I spent a cold night with a not properly  functioning heating unit which was partially remedied on the second night. The front desk staff did try to help as best she could. I paid for the first night and used points for the second. I should get a reinstatement of my points,February 2015,none,none,none,none,none,none,none,none,none,560,28
none,2 contributions,4.0 of 5 bubbles,Feb 28/March 1,"Arrived VERY late 2 AM, room was waiting, received an email letting me know my room would be ready, my preferred area was held for me. I was able to slrep in to 8:30 Am without interruption. Staff were polite, professional and caring",February 2015,none,none,none,none,none,none,none,none,none,561,28
1 helpful vote,2 contributions,1.0 of 5 bubbles,Don't stay here!!Gross!!,Walked into room and turned around and left. Stunk of cigarettes. Filthy floor. Dirty bed. Moldy bathroom. Freeway traffic was loud. Front desk staff was nice and umderstanding. Gave me full refund. That's the only thing nice I can say.,February 2015,none,none,none,none,none,none,none,none,none,562,28
66 helpful votes,155 contributions,3.0 of 5 bubbles,It's fine for a budget hotel close to airport ...,"It's clean ( mostly ) beds are comfortable  , close to the highway so can be a little noisy , cigarette butts outside ... They allow pets and have a lawn to poop them ... There is a Hooters next door if you like that sort of thing ... Room service comes from a local restaurant and is quite good and inexpensive !  So if you don't want to leave your pet alone just order in :)  Would I be back , sure ... it was fine ...",February 2015,none,none,none,none,none,none,none,none,none,563,28
none,3 contributions,2.0 of 5 bubbles,Poor quality,Not the standard I expect of a La Quinta.  More like a Motel 6.  Building is old and the rooms are not well kept or clean.  I should have know by the price.  You get what you pay for!  Just did not expect this from a La Quinta.,February 2015,none,none,none,none,none,none,none,none,none,564,28
9 helpful votes,41 contributions,5.0 of 5 bubbles,Great place to stay with pets,"This is a great hotel when traveling with pets. We did have a mishap with the maid taking some of our things from the room, thinking we had left she took my dogs shampoo & conditioner which was very important to us seeing how he has allergies but Maria (front office) went above & beyond ordering new ones online to be delivered next day (it's not sold in Ca.) but luckily Maria (the maid) found the ones we had. I like to think it was a simple mistake Maria (front office) was wonderful in taking care of the matter. I look forward to bringing my dogs back.",September 2014,none,none,none,none,none,none,none,none,none,565,28
106 helpful votes,95 contributions,1.0 of 5 bubbles,So old...so confuse....,"My 1st impression when I arrived at La Quinta Inn John Wayne Airport was the worst I ever had. the hotel is a creep area, with a decadent Hooters just beside it. I had an issue with my room and the keys. The front desk gave me the key and said my room was 235. I went there and tried to open it 4 times. It was not working and I was returning all the times to the reception to say the key didnt work and probably it was a problem with it. The front desk attendat keep saying I was not using the key in the right way and asked me 3 times to come back to the room 235 and try to open again. I was feeling like a dumb because i knew it was not working at all. After I insisting on the problem, finally he decided to come till the rooom (by the way, it was a long walk from front desk to the",February 2015,none,none,none,none,none,none,none,none,none,566,28
3 helpful votes,1 contribution,2.0 of 5 bubbles,Will not be coming back,"Even though I have stayed at this hotel over 100 days for business in the last year, I will not be back. 80-85 year old Security Guard 80-85  chain smoking with ""guests"" in front of their room. No housekeeping for 2 of my 5 night  stay. Managerment does not care.",February 2015,none,none,none,none,none,none,none,none,none,567,28
13 helpful votes,19 contributions,1.0 of 5 bubbles,a terrible hotel,"we like La Quinta, but this is a terrible representation of the chain.  Dirty room, carpet that was so disgusting I could not fathom putting my bare feet on it,  and the smell,  better yet stink in the room, one night, and we were out of there first thing in the morning.  I never felt safe with the sketchy clientele, and the workers could have cared less.  Added to that, they decided to hose down the grimy third floor walkways at 8:30 in the morning, the water, soap and scum, poured off the balcony, and we had to wait in our room for about 20 minutes in order to not get soaked.",February 2015,none,none,none,none,none,none,none,none,none,568,28
2 helpful votes,5 contributions,4.0 of 5 bubbles,Quite Pleasant Say,I booked this hotel through Expedia and t got a great rate. My room was on the 3rd floor close to an elevator. Thy include a continental breakfast. It was peaceful and quite. The rooms have flat screen HD televisions and there's also a desk in the room.,February 2015,none,none,none,none,none,none,none,none,none,569,28
38 helpful votes,53 contributions,1.0 of 5 bubbles,Worst experience at a L Q,"After three years decided to try this hotel after a bad experience of being in a non smoking room that smelled of smoke.  As a frequent L Q member, I could not get the room i asked for, staff was unknowledgable, did not answer the phone and the ice machines (2) did not work. Guest in room next door had frequent visitors knocking on door through the night. figure that one out.",January 2015,none,none,none,none,none,none,none,none,none,570,28
1 helpful vote,1 contribution,1.0 of 5 bubbles,Poor service and hotel conditions,"Poor service and hotel conditions: dog food on the floor from previous customer was never cleaned during all my 4-nights' stay, rude staff when asked repeatedly for thorough cleaning, poor food variety, etc.",January 2015,none,none,none,none,none,none,none,none,none,571,28
3 helpful votes,4 contributions,1.0 of 5 bubbles,CAR THEFT WARNING AT LA QUINTA,"My overall stay at La Quinta was satisfactory until my car was robbed on my last night there. I am sad to say that my car was violated and 2 of my luggages with my personal belongings have been removed from my car without my consent. When I approached the hotel staff, they were not understanding, helpful, or empathetic. If the parking lot is unsafe, I do not feel safe staying at the hotel. Please be aware of safety issue when staying at La Quinta in Costa Mesa.",January 2015,none,none,none,none,none,none,none,none,none,572,28
38 helpful votes,17 contributions,1.0 of 5 bubbles,Falling apart and rude staff,The website says that it is renovated.  That means that they painted the interiors (and did a lousy job too).  The clientele is sketchy.  You don't want to stay here with kids.  Maintenance is lacking.  Most of the ice machines were broken the night that we arrived.  The desk clerk is miserable.  Really.  Find another job that you don't hate dude.  This place is cheap for a reason.,January 2015,none,none,none,none,none,none,none,none,none,573,28
60 helpful votes,136 contributions,3.0 of 5 bubbles,Newer rooms / Older building,"I stayed here for 7 nights, I wanted a less expensive room as i only needed a place to sleep. At first glance, it's not what you would want on a trip to OC. But I surely got my money's worth, (saved about $ 300) the room was clean, the bed was fine, etc. I normally don't eat breakfast in these chain motels, but this wasn't bad at all. The coffee was much better than most places, and the other items were the kind no one could screw up. ie fresh fruit, toast, sealed yogurt , cream cheese, jelly and cereal.  The clientele isn't what you'd meet at the Waldorf, but they were pleasant families, couples, and lower level business people. (not on a plush expense account) BTY, the staff more than made up for the location and or any negative feelings about the place.   WiFi was spotty or",January 2015,none,none,none,none,none,none,none,none,none,574,28
none,2 contributions,5.0 of 5 bubbles,Stayed on 01/08/2015,"This hotel is good.  Needs to improve little things like making sure the electrical outlets work, and improving the Wi-Fi coverage.  It is a good hotel for business purposes.  The food is minimum continental breakfast.",January 2015,none,none,none,none,none,none,none,none,none,575,28
27 helpful votes,132 contributions,2.0 of 5 bubbles,There is nothing good to say about this property,"We booked two rooms at this hotel.  My sister in law requested a handicap room and she got a regular room with a bathtub that they claimed was a handicap room.  She also had to call housekeeping to return and clean out the refrigerator.  Our room had holes in the walls, the rugs were filthy. Horrible hotel.",January 2015,none,none,none,none,none,none,none,none,none,576,28
6 helpful votes,13 contributions,3.0 of 5 bubbles,A place for sleep in tight budget,"Room is old, bed & fruniture are old too. Carpet might need to change. One of my room light is not working. WiFi is working sometime but slow. We are at quiet room as our room on 2nd floor and facing swimming pool. This is what you pay and what you get.",January 2015,none,none,none,none,none,none,none,none,none,577,28
39 helpful votes,52 contributions,2.0 of 5 bubbles,"Disappointed in La Quinta. 2 star hotel, at most.","I've stayed at La Quinta before and found them to generally be clean and relatively nice. This hotel was not. The rooms were dirty and a little run down. Whole there appeared to have been some effort to renovate, it was superficial. The grounds were unkept, adjacent to Hooters, and there were unsavory characters hanging around the property. The breakfast was tasty, but the space crowded and cramped, made worse by a waffle iron that didn't function. Although I slept well in the bed, the primary redeeming quality of this hotel is its proximity to the airport.",December 2014,none,none,none,none,none,none,none,none,none,578,28
9 helpful votes,21 contributions,3.0 of 5 bubbles,Excellent Customer Service!,"By far the best customer service I have seen in a while.  The front desk staff were extremely friendly and helpful.  Hotel is older, but great value for the money.  Close to the beaches and attractions.  Carpet in the rooms need to be replaced, not sure a good cleaning would do the trick.  Room was clean, bed was comfy, breakfast was plentiful (more fruit would have been nice).  WiFi coverage needs to be much better!  Hotel definately needs to be updated, but again..great value for the money",December 2014,none,none,none,none,none,none,none,none,none,579,28
none,1 contribution,2.0 of 5 bubbles,holidays,hotel needs a lot of help.rooms not very clean a/c unit being held togeather with duck tape low water pressure.reservation person his name was Ervin was very rude on the phone and in person.we have stayed at this hotel very often in the past and it gets worse with each visit.when complaints are made the excuse given is we are understaffed.unacceptable.,December 2014,none,none,none,none,none,none,none,none,none,580,28
none,1 contribution,1.0 of 5 bubbles,Very Disappointed,"Rooms have gone from good to shaby conditions. Room was not cleaned by housekeeping, no clean linens supplied and staff was rude and did not seem concerned when I asked why our room was not cleaned and we needed towels. We've been going there for the last 6 years...never again",December 2014,none,none,none,none,none,none,none,none,none,581,28
40 helpful votes,37 contributions,2.0 of 5 bubbles,Poor Service and Moldy Shower tiles,"Check-in was not good, had requested a ground floor room and got stuck on the third floor 5 rooms from the elevator.  This is after staying at this property for years and a Elite Rewards member, was not offered an upgrade for a different type of room on the ground floor, I was not offered anything except a ""oh well"" attitude.  The wifi was so slow (staying for business)  I had to get up at 6:00 am and check out just to go to McDonald's to do business on my iPad (free wifi and fast).  When I walked into take a shower and saw black mold in the grout of the tile in the shower area, OMG.  Normally this is an OK place to stay, not real high end.",December 2014,none,none,none,none,none,none,none,none,none,582,28
1 helpful vote,1 contribution,3.0 of 5 bubbles,You get what you pay for,"Inexpensive in an expensive area, good deals with adjacent restaurant.  Helpful staff.  Really run down room with peeling enamel in bath, leaking faucets and very noisy guests in parking lot outside.  Right next to 405 Freeway but you get used to it.  You get what you pay for.",December 2014,none,none,none,none,none,none,none,none,none,583,28
4 helpful votes,1 contribution,1.0 of 5 bubbles,Worse than Motel Hell...,"Came here for a conference for the weekend and brought my family along.  I'm a frequent traveler and go to many different hotels a month on business for the last 9 years.  I can safely say that this is the WORST hotel I've ever been to.  NEVER, NEVER EVER go here!  I looked at all the reviews of this location and gritted my teeth since I was on a tight budget this month but I was praying that it wasn't as bad as the others wrote but they were very kind as to the review of this place!   I'm writing this at 5am in the morning after someone was yelling and screaming at the top of their lungs next door and woke me up.  As my wife always says, there would have to be a bomb to go off before waking me up which tells you how loud they truly were. First, the person at the desk was",December 2014,none,none,none,none,none,none,none,none,none,584,28
1 helpful vote,1 contribution,1.0 of 5 bubbles,Low quality,"Rooms had a bad odor. Dirty carpet. Wi/Fi very poor - did not work at all in the first two rooms I tried. Extremely noisy from 405 highway, even on the back side of the hotel. Unclean, old and a bad experience.",December 2014,none,none,none,none,none,none,none,none,none,585,28
1 helpful vote,2 contributions,1.0 of 5 bubbles,Not newly renovated,"After reading the negative reviews, I still decided to stay based on the fact that the website stated that the properly was newly renovated. In my opinion, the renovation occurred a number of years ago, the carpet and tile were badly stained, the air-conditioner did not work, the bathroom sink didn't drain properly, the beds was very soft and lumpy and the bathroom towels were very thin. Also the room lacked some of the standard amenities, a clock and literature describing the local restaurants and sites. Unfortunately, you are unable to look up anything on the website, due to the poor internet speed. This was my first time staying at a La Quinta and will probably be my last.",December 2014,none,none,none,none,none,none,none,none,none,586,28
9 helpful votes,31 contributions,3.0 of 5 bubbles,The room was fine ...,"The room was fine, no problems with that.  The only problem was that we requested a microwave and refrigerator for the room, as we were going to be staying three nights.  We requested these items two months in advance when we made the reservations, figuring that that would be plenty of lead time to ask.  In the details about the property it says that a microwave and refrigerator could be furnished on request.  Great, that's what we wanted.  At check in we find out that, no, there won't be any microwave or refrigerator in the room because they are all gone.  Two months lead time and staying for three nights and that wasn't enough time for them to make sure we had the items requested.  If they are not going to honor requests like this then maybe they should consider removing it",November 2014,none,none,none,none,none,none,none,none,none,587,28
