Helpful Vote,Contributions,Overall Rating,Summary Heading,Summary,Date of Stay,Room tip,Trip Type,Manager Response,Location Rating,Cleanliness Rating,Service Rating,Value Rating,Rooms Rating,Sleep Quality Rating,Review Number,Index
none,1 contribution,1.0 of 5 bubbles,Stay away. You've been warned.,"I am extremely saddened to be treated with such disrespect, even after I did my best to be reasonable. They gave me room 150 during my 16th to 20th of february stay. Both the bathroom and half the actual bedroom flooded with water from the shower plumbing and apparently even from water from the upper rooms. Large amounts of water seeped up from the laminated floor and walls. On the front desk they told me they would change the room on the next day, and they didnt. I had to place towels all over the floor endibg up with what I can just describe as a pool of wet towels for a floor all over the bathroom and part of the bedroom. I had to stay 3 nights tolerating being told that they simply couldnt give me another room and that ""they could just check me out"" if I wanted. They finally",February 2023,none,Traveled as a couple,none,1.0 of 5 bubbles,none,none,none,none,none,1,28
none,1 contribution,1.0 of 5 bubbles,STAY AWAY!!,"This is not what La Quinta typically provides. This is not a hotel, it’s a dirty motel with understaffed front desk, stains in blankets, marks in the bathtub, doorknobs falling out of doors and bathroom doors that barely shut. I booked 5 nights and only stayed 1 out of necessity for having arrived late and needing a place to stay. Shirtless/shoeless people working on cars in the parking lot. VERY MISLEADING pictures online. Outdoor cement hallways/staircases were very stained and gross. Room smelled a bit. Lobby wreaked of smoke. Shocked that this place has the name La Quinta",February 2023,none,none,none,2.0 of 5 bubbles,none,none,none,none,none,2,28
none,3 contributions,3.0 of 5 bubbles,Not Ready for Wyndham,"The Staff wasn't ready for Early arrival at 2 pm as the Wyndham's said it would be available. They were un prepared to to give me my room after 5 pm and asked me to wait in the lobby. The room was nice and indicative of La Quinta comfort, I liked the room.",February 2023,none,none,none,3.0 of 5 bubbles,none,none,none,none,none,3,28
none,1 contribution,1.0 of 5 bubbles,Nothing positive to say.,"Everything about my stay here was terrible. First, they changed my room last minute to a completely different one to the one I had originally reserved. Then, they gave me one next to another room where they played loud music all night and the staff did nothing about it, even though they were notified. I would really not recommend anyone, specially if traveling for business purposes, to stay in this place.",February 2023,none,Traveled on business,none,2.0 of 5 bubbles,none,none,none,none,none,4,28
none,1 contribution,1.0 of 5 bubbles,Worst hotel stay of my life. Dirty & disgusting.,The room was filthy. The front desk didn't speak or understand English. We only saw one worker the entire stay & he wouldn't room move us or give us clean towels or do anything to fix our issues. Cockroaches in the lobby the front desk clerk did nothing about. I am appalled at how terrible this place is. Prostitutes all over the place. The noise from the traffic is so loud you can't hear the TV. I've never had a more terrible hotel stay than I have at this place. Worst place ever. I though la quinta had higher standards but apparently it's just a cheap place for hookers. The 'hot breakfast' they serve is just prepackaged pastries in raisin flavor & that's it! I was so disappointed. I would just comdemn this place it was so terrible.,February 2023,none,none,none,1.0 of 5 bubbles,none,none,none,none,none,5,28
none,none,2.0 of 5 bubbles,Check-in rip off,I booked a room on the Wyndham Hotel website and guaranteed the room rate and reservation with a credit card.  When I arrived a short time later the person at the desk at check-in refused to honor the rate and proceeded to charge me an extra $9 saying that it was for County tax.  There is no County room tax only in 8% city tax which was included what I paid online. Wyndham customer service was of little assistance. They said I would hear back from them within a week and it's been 12 days and nothing.,February 2023,none,Traveled with friends,none,none,none,none,none,none,none,6,28
none,1 contribution,1.0 of 5 bubbles,Costa Mesa - La Quinta I n,"Do not stay here!! It’s the worst hotel experience I have ever had. Dirty, smelly and does not have breakfast like it states on the site. The rating is a ZERO not even a one star. The room have a smell",February 2023,none,none,none,1.0 of 5 bubbles,none,none,none,none,none,7,28
none,none,2.0 of 5 bubbles,Not a good experience,"I travel a lot for work and choose my hotels carefully. They advertised that they have a fitness center, but they didn't have one. Very disappointing news to here off the bat. Free breakfast the next morning? terrible coffee and  bad pastries. Not enough towels and no lotion. Not one Do Not Disturb signs. Mild dank smell in the bathroom.The front desk buy was a dullard. Not coming back for sure.",February 2023,"No Fitness Center as advertised,  ""Free Breakfast"" is misleading.",Traveled on business,none,5.0 of 5 bubbles,none,none,none,none,none,8,28
none,1 contribution,1.0 of 5 bubbles,If minus points could be given....,"No hot breakfast, rooms were unclean, people not friendly, juice and coffee were old, noise abounds, place is very unattractive.  Nothing about this place was good.  At least the internet worked.  I would urge you to find other lodging in the area.  I'm trying to get some refunding of my money because this was such a dump.",January 2023,none,Traveled on business,none,1.0 of 5 bubbles,none,none,none,none,none,9,28
none,1 contribution,1.0 of 5 bubbles,Stinky and Rude,"I had to play musical rooms right from the start  #1 was way too stinky even though we asked for non- smoking, #2 the toilet failed to flush within 10 mins of our stay. # 3 was not at all just right. It was also stinky. When I asked for more pillows- I was given a set of sheets. I was told that they don't have extra pillows. When I went in for breakfast, the coffee was disgusting and all they offered was sweet rolls.  Nothing fresh at all. The hotel is near the highway and you can hear the traffic in a closed room from bed. The clerk who was rude btw never mentioned  when check out was. At Noon a man and woman showed up at my room while I was trying to pack my luggage. They were very rude. I do not recommend this hotel.",February 2023,none,Traveled on business,none,none,none,none,none,none,none,10,28
none,1 contribution,2.0 of 5 bubbles,Quiet with easy access to the freeway,"Our room was dirty, plumbing was backed up, some of the outlets didn't work but we had clean sheets. If it's a last minute room, it's ok but you might want to check out other rooms. Booked the room months in advance and was overcharged upon check in. Be careful and definitely bring footwear to walk around in the room. My husband's feet turned gray after a few steps. But the staff are decent and when I informed the front desk of the sink and tub being backed up, it was fixed before we got back to the room.",January 2023,none,none,none,none,none,none,none,none,none,11,28
none,2 contributions,1.0 of 5 bubbles,Worst hotel stay in a long time,"When I extended my stay they had to take my deposit a second time.  When I asked to speak to the Manager, he was very rude.  They have lots of homeless sleeping in their parking lot, so coming out of their vehicles at all times of the night. I mentioned this three times to management.  Coffee wasn’t made two mornings and I had to wait a very long time.   The heat wasn’t working, so the room was very cold.  Never book this hotel!",January 2023,none,none,none,none,none,none,none,none,none,12,28
none,2 contributions,2.0 of 5 bubbles,Noisy and Poor Breakfast Choices,Freeway noise was overwhelming.  Smoke smell lingers even though all rooms are non-smoking. Needs ozone deodorization.  Breakfast was a joke. Insufficient electrical outlets. Needs larger and fluffier bath towels.,December 2022,none,none,none,none,none,none,none,none,none,13,28
none,1 contribution,1.0 of 5 bubbles,Dirty and not true the breakfast,"Dirty and not true the breakfast, wouldn't recommend stay here. Too long to get my deposit back, after a week. The room was full of hair when I arrived. There were flyng bugs in the whole room, had to throw away my pizza. Mediocre breakfast, it is a lie what they advertise about the hot breakfast, it is just the coffee.",December 2022,none,none,none,none,none,none,none,none,none,14,28
1 helpful vote,3 contributions,1.0 of 5 bubbles,Runaway - horrible,"I had to leave on second day due to dirty sheets and cockroaches in room, in addition they charged me for the entire stay, still dealing for my reimbursement. Please spend 20 dlls more and avoid this hotel.",November 2022,none,none,none,none,none,none,none,none,none,15,28
1 helpful vote,7 contributions,1.0 of 5 bubbles,Disgusting- don’t stay here,"The room looked like it was not cleaned. There was hair in the shower, on the floor, and on the bathroom counter. Sheets were stained and had hair. Pillows were covered in sweat stains. Luckily I had disinfecting wipes in my car so we wiped everything down. Ending up buying our own sheets and pillow cases. Located right next to the freeway and the door didn’t seal all the way so it was really loud all night. There was people doing drugs in different spots around the property. There’s a motel 6 down the street that is significantly cleaner",December 2022,none,none,none,none,none,none,none,none,none,16,28
none,1 contribution,1.0 of 5 bubbles,"Dirty hotel, cockroach in the bathroom","This was the dirtiest hotel I have ever encountered. The photos on their direct website are false, they look nothing like the room. Dirty bed sheets, towels, and floors. There was a cockroach in the bathroom. Front Desk Staff were very unprofessional. Wyndham seriously needs to look at disenfranchising this location.",November 2022,none,none,none,none,none,none,none,none,none,17,28
none,1 contribution,1.0 of 5 bubbles,Get what youpay for,"Dirty linens, beds were just remade from previous occupants. Load, right next to the freeway. What do you expect for the price. Some unsavory people walking around the property all night long. They do allow pets which is a positive for me.",November 2022,none,none,none,none,none,none,none,none,none,18,28
none,none,1.0 of 5 bubbles,Crime scene at this La Quinta property in Costa Mesa CA,"This La Quinta property in Costa Mesa CA is a daily crime scene and should be closed down.  Daytime crime on the La Quinta property tolerated by staff; Front office staff with complete disregard for guest safety; Hazardous and broken furnishings in room; Filthy room; Missing castor on chair risking serious head injury as chair tips over against desk; No Microwave, no refrigerator, no phone, no coffee maker, no clock, no shampoo, 1 tiny bar of soap; Filthy breakfast area with put of coffee only - no other breakfast items.  A La Quinta hotel guest was going door-to-door peddling food stamps for sale to other guests.  Stolen equipment was being offered for sale to drivers on hotel property parking areas.  Wrecked vehicles with broken glass on the ground were being stored in the",October 2022,none,none,none,none,none,none,none,none,none,19,28
none,1 contribution,1.0 of 5 bubbles,Dirty place with no house keeper with broken bed,Dirty sheet no house keeper always short of staff accidentally change me twice never give me my refund. Broken bed folded bathroom and manager recommended to use out side bathroom. All items on roo. Not working properly. Never find the front desk,October 2022,none,none,none,none,none,none,none,none,none,20,28
none,1 contribution,1.0 of 5 bubbles,They are Fraud,"Find other place, don't be fooled by their discounts or Offer! .. In fact they're truly Cheap, dirty and no professional staff.  Their manager is so proud to be the ""Hotel Guru"" master in hotel industry, This is how he introduced himself to me, Acted so rudely and so disrespectful.",October 2022,none,none,none,none,none,none,none,none,none,21,28
none,1 contribution,1.0 of 5 bubbles,Better off sleeping in your car,"Less than clean room and bathroom, 1/2 inch gap in entry door.  Noise from major freeway that is literally 100 feet from the room.  Hotel staff indifferent.  Refrigerator inoperative. List goes on It says I need more characters, they really don’t want me to go on!",October 2022,none,none,none,none,none,none,none,none,none,22,28
2 helpful votes,1 contribution,1.0 of 5 bubbles,Sleepless night in a filthy hotel!!!,"We drove 5 hours and it was late and we were ready for a good night's sleep.  Wrong! Our room smelled and it was used! Fresh ice in ice bucket, bed was used, trash, dirty towels, filthy tub. Overall discusting!!!  Front desk just wanted to give us a clean sheet and said they had no other rooms. After being firm, They ended up giving us another room. But we could not sleep, afraid to get beg bugs. Started coughing...unclean AC unit? Couldnt wait for morning. Sleepless night in a filthy hotel!!!",October 2022,none,none,none,none,none,none,none,none,none,23,28
none,1 contribution,1.0 of 5 bubbles,Fithy,"Room was dirty. Bedding was stained. A/C unit was leaking so the floor was wet and we were afraid to turn it on. When I went back to the front desk I was told they couldn't do anything, including move me to another room because it took me too long to come back to let them know. It took me time because I called the corporate office. Cold water in shower was not working so it was scalding hot. Beyond disappointed! I've stay in $50 hotel rooms that were better.",October 2022,none,none,"Hi Demara, We are very sorry to hear that you had so many issues during your recent stay. Our primary goal is always to exceed expectations of comfort, convenience, and quality amenities. For that reason, we certainly take this very seriously and have forwarded your comments to management for review. We apologize for all the inconveniences that you faced and hope we will have another opportunity to host you more successfully in the future.  Best Regards, Guest Experience Team",none,none,none,none,none,none,24,28
2 helpful votes,13 contributions,4.0 of 5 bubbles,Costa Mesa LaQuinta,"We enjoyed our stay.  Room was clean and beds were comfortable.  Even though I was told there was no microwave or refrigerator we had both in our room.  Breakfast was very minimal, sweet rolls, coffee and juice.  Ask for a room away from the noisy freeway.  We will stay there again if in the Costa Mesa area.",September 2022,none,none,"Hey Karen, Thank you for the positive rating. We are pleased to hear that you enjoyed your stay with us. We are glad that you found the room clean and the beds comfortable, and we hope the availability of a microwave and refrigerator in the room was convenient for you. Your comment about breakfast is duly noted, and we are sorry that it fell short of your expectations. We do review our breakfast offering regularly, and we will take your feedback into consideration when next doing so. As for the external noise, as you rightly pointed out, we can try our very best to assign prospective guests quieter rooms facing the backside, should they give us a call ahead of time. We are happy to know that we remain your accommodation of choice here for future visits, and we look forward to having you back soon for another pleasant stay during your next trip to the area.  Best Regards, Guest Experience Team",none,none,none,none,none,none,25,28
none,1 contribution,1.0 of 5 bubbles,Santa Ana not Costa Mesa,Single women travelers probably should not stay here. Rooms accessed by exterior doors facing parking lot in an industrial area. Window screens torn or ripped. Felt too unsafe to stay here. Pictures do not reflect the property.,September 2022,none,none,"Hi Jessica, We are very sorry to read your review of our hotel. Our guests' safety and security are our top priorities; thus, we certainly take this very seriously and have forwarded your comments to management for review. We hope you will give us another chance down the road as we are eager to make this right!  Best Regards, Guest Experience Team",none,none,none,none,none,none,26,28
none,1 contribution,1.0 of 5 bubbles,Don’t recommend to no one,"Dirty room, bad smell, sink didn’t work. Bathroom had mold. One of the lights didn’t work. Floor was dirty and noticed there was hair inside my bed before I layed down. Employees here are unapologetic, & have no sense of care ect.  I could see many improvements, by far one of the worst hotels I visited.",September 2022,none,none,"Dear guest, We appreciate that you have taken the time to let us know how you perceived our accommodation and find your review very disappointing. While it is somewhat discouraging, feedback such as yours helps us to improve our product and service. We will take all of your observations in relation to our staff and property and attempt to make several improvements for the enjoyment of our future guests. Thank you for your business and your review. We sincerely hope that you will give us a chance to redeem ourselves with you and restore your faith in our hotel and hospitality.  Best Regards, Guest Experience Team",none,none,none,none,none,none,27,28
1 helpful vote,2 contributions,1.0 of 5 bubbles,Horrible!!!,"The room was filthy, bugs, sink was plugged, TV wouldn't turn on for starters.  Graffiti, no electrical outlet covers, etc.  Was charged $50 for incidentals.  I was there less than an hour and told the front desk it was too dirty to stay.  They 'cancelled' the reservation, no questions asked.  A week later, they still charged my credit card the $50 and refuse to answer their phone.  Wouldn't stay here for free!",September 2022,none,none,"Dear guest, We are sorry to hear that you chose not to stay with us recently. Our aim is to provide a clean, comfortable and pleasant place to stay, and we sincerely apologize that our hospitality and attention to detail left something to be desired in this case. Guest satisfaction is important to us, and we will take all of your observations in relation to our hotel and attempt to make several improvements for the enjoyment of our future guests. Sorry to hear that you are waiting for your deposit to be refunded to you. We have noted your concern and alerted our team to your comments. Please rest assured that deposits are refundable if there are no incidental charges or damages to the property. Thank you for considering our hotel for your stay in Costa Mesa and for taking the time to post your review. We regret that our accommodation was not suitable for your needs, but we appreciate you staying with us on this visit.  Best Regards, Guest Experience Team",none,none,none,none,none,none,28,28
none,1 contribution,1.0 of 5 bubbles,Wouldn't stay for free,"Rooms were filthy, bathtub looked like a murder scene, front desk were rude, smelled of cigarette smoke and was non smoking. Breakfast was a joke and they had the audacity to charge 6 bucks extra a day per person.",August 2022,none,none,"Hi Gilbert, We are very sorry to hear that you had so many issues during your recent stay. We apologize for the aspects of your visit that did not impress you, and we regret any inconvenience caused. Please rest assured that we will take all of your observations in relation to our service and property and attempt to make several improvements for the satisfaction of our future guests. Furthermore, we will see to it that our housekeeping team does a better job of preparing/airing out the rooms moving forward. As for breakfast, we do review our breakfast offering regularly, and we will take your feedback into consideration when next doing so. Thank you for considering our accommodation for your stay in Costa Mesa and for taking the time to post your review. We know we can do better, and it would be an honor to have a chance to redeem ourselves with you and restore your faith in our hotel and hospitality.  Best Regards, Guest Experience Team",none,none,none,none,none,none,29,28
none,1 contribution,1.0 of 5 bubbles,Terrible Hotel,The water pressure in the shower was bad. The tub was apparently clogged because the water drained so slow that there was standing water around your feet. The TV was broken in my room and the hotel pool was closed by the health department so we couldn't swim. No breakfast either. Overall a waste of money.,August 2022,none,none,"Hi Adriane, It is noticeable that we have failed to meet your expectations on this visit, and we regret the poor experience during your recent stay. Your comfort and satisfaction are of the utmost importance to us, and we have noted all your concerns for the betterment of the guest experience. We also want you to know that certain services and amenities, including food and beverage offerings, may be reduced or unavailable at the moment due to COVID-19 precautions. This is to limit personal contact and minimize viral risks during the pandemic. Thank you for considering our accommodation for your stay in Costa Mesa and for taking the time to post your review. We appreciate both and hope we will have the opportunity to host you more successfully in the future.  Best Regards, Guest Experience Team",none,none,none,none,none,none,30,28
none,1 contribution,1.0 of 5 bubbles,worst,"never stay this place even if you get free or discounted rate, they mention about the breakfast but not single item was available they lie on website, even no one show up to clean your room until the check out i stay three nights and mention and requested for clean the room but no one stop by",August 2022,none,none,"Dear guest, We are very disappointed to learn about your recent experience at our hotel. We are sorry that your stay fell short of your expectations, and we deeply regret any inconvenience caused. We appreciate your voicing your concerns to us, as this allows us the opportunity to improve future guest satisfaction. We hope you will give us another chance down the road as we are eager to make this right!  Best Regards, Guest Experience Team",none,none,none,none,none,none,31,28
none,1 contribution,1.0 of 5 bubbles,Dont stay here or with Wyndham hotels anywhere!,"I had stayed here several years ago and I have trusted the La Quinta name in the past. This recent stay however was one of the most disgusting experiences I have ever had. Totally run down with stained mattresses and from the start where they try to add another ""service charge"" on top of the previously agreed total cost. Horrible room with black cold in the bathroom dirty floors, crummy thin bedding. Got very little sleep due to neighbor noises. Front desk doesn't care. The ""to go"" breakfast is a joke --some mangy looking cake with horrible coffee. I will never stay with anybnhoetel that is owned by Wyndham again. The whole thing is disgraceful.",August 2022,none,none,"Hi Robert, We are very sorry to hear that you were so disappointed with your stay at our hotel. It certainly does not sound as if you had the experience that we strive to provide for our guests, and we sincerely apologize for any failure in delivering on our commitment to provide you with a clean, comfortable, and pleasant place to stay. We take guest feedback very seriously, and we will put all your comments to good use for the improvement of our product and service. We also want you to know that we certainly understand that any unexpected fees can be an inconvenience, so we do our very best to make sure that all information is clear. All our fees are always disclosed, so it is strange that any particular charge came as a surprise to you. Thank you for your business and your review. We appreciate both and wish you nothing but pleasant travels ahead.  Best Regards, Guest Experience Team",none,none,none,none,none,none,32,28
none,1 contribution,1.0 of 5 bubbles,Don’t book here,"If I could leave a 0/5 star review I would, this hotel is the worst I’ve ever stayed at, the floor was disgustingly sticky and dirty the day we checked in, there were bugs and we asked for them to clean the floor properly and didn’t do it until the 3rd day even if we asked everyday and they promised they would, we talked to other people and they also had the same issues. On the website the had pictures of an American breakfast with waffles and lots of food but there was nothing except some coffee, watered down juice, no tables of chairs and if your lucky a muffin or two, when we went to go talk to them they removed the pictures from the website and that they were sorry but that was the breakfast they offered. The bathroom walls have mold, the bathtub doesn’t drain properly,",August 2022,none,none,none,none,none,none,none,none,none,33,28
none,1 contribution,1.0 of 5 bubbles,Crime Scene,"Stay away, this place is a crime scene like literally a memorial in the parking with two crosses next to each other. rooms are a disgust and uh morning breakfast, yeah cold nasty coffee and a hard wrap expired bread, hope you enjoy. Customers Service, they all from India so good luck with that, I made a 3 day reservation and left the next day with no refund , they want to keep all your money it's all a scam. I figured my life is worth more than $300. Hotels.com you suck",August 2022,none,none,none,none,none,none,none,none,none,34,28
