Helpful Vote,Contributions,Overall Rating,Summary Heading,Summary,Date of Stay,Room tip,Trip Type,Manager Response,Location Rating,Cleanliness Rating,Service Rating,Value Rating,Rooms Rating,Sleep Quality Rating,Review Number,Index
5 helpful votes,4 contributions,4.0 of 5 bubbles,Great hotel for long term stay,The King bed suite was spacious and comfortable for 3 adults. We stayed there for 8 nights. The complimentary breakfast had good options and variety. The front staff is extremely helpful and friendly. I appreciated the free washing machines and dryers although they're old but they did the job. The hotel had many families with young kids yet was surprisingly quiet!,July 2022,none,none,none,none,none,none,none,none,none,1,335
none,1 contribution,4.0 of 5 bubbles,"Good hotel, nice staff, rooms were very nice.","We spent 1 night at the hotel, the suites were well equiped and suitable for an extended stay.  Its located away from the freeway in a area that feels very safe to stay in. It has a pool, basketball court and gym.  Honestly we would make this a regular stay except there was a bunch of people who started smoking marajuana in the basketball court and the hallway reeked of marajuana, it was pretty obvious that was going on. So we probably won't stay here again since that is allowed.",July 2022,none,none,none,4.0 of 5 bubbles,none,none,none,none,none,2,335
4 helpful votes,14 contributions,5.0 of 5 bubbles,High quality stay with great amenities. We spent 5 nights. Hot bfast fantastic!,"My 11 year old son and I enjoyed this hotel immensely. He said it should be a 5 star. The hot breakfast had many options and was high quality. The evening happy hour had great variety and was tasty. The pool is small but clean. Basketball court and outdoor area provide nice relaxation areas for families. Our favorite part was the ping pong table in the (free!) laundry area. We borrowed the paddles and played often! Super fun. Nice staff, too.  Pillows were high quality and comfy. The bed was a bit hard but that’s my only semi- negative aspect of the review. Satellite tv was a little glitchy. We would def stay again.  Great area close to many restaurants and stores for essentials.",June 2022,Safe area w free parking,Traveled with family,none,none,none,none,none,none,none,3,335
75 helpful votes,160 contributions,5.0 of 5 bubbles,Better than expected,"A comfortable suite with a full size fridge, microwave, dishwasher, and cooktop  was all we needed for our 4-day stay.  As a bonus, the hotel had a social in the lobby for 2 of the nights, with tasty and complementary beer and wine.  The room also included a free hot breakfast, which was far above the powdered eggs and cereal typical of hotels in this category.  Overall, I was pleasantly surprised with the cleanliness and amenities.",February 2022,"Hotel is not located on busy street, so exterior noise was not an issue",none,none,5.0 of 5 bubbles,none,none,none,none,none,4,335
76 helpful votes,77 contributions,4.0 of 5 bubbles,Great stay while relocating,"I really have no complaints about our 2wk stay. The location is fabulous - so close to multiple stores.  We really appreciated the meals - made it super easy for our life change of moving to another state. The kitchenette was sparsely outfitted but I brought some things w/ us in preparation for such. Having a full-size fridge & dishwasher was fantastic. I'm sure I could've called for additional items, but it wasn't necessary. The laundry could get a little busy, but I appreciated being able to do it on property. My girls enjoyed the hot tub every evening while we set up for sleeping. The grounds are great, as is the exercise facility.  Mimi at the front desk was incredibly helpful & so kind. I needed legal-size paper for paperwork for my daughter's new school & couldn't find it",September 2021,"Patrons w/ pets are required to stay on the 1st floor, so if you want to avoid that I'd ask...",none,none,5.0 of 5 bubbles,none,none,none,none,none,5,335
none,4 contributions,1.0 of 5 bubbles,GM gets an F,I stayed at the staybridge for almost a week. The general employees were good but from the get go I had issues with the GM understanding my reservation status that required multiple calls with customer service reps just to straighten out. It wasn't until we had the cs team call the GM directly to sort things out. It was never a pleasant experience talking with their management as I got the impression they felt higher than their customer. I requested a minor room cleaning and was told they wouldn't do it. Overall cleanliness was not bad and the general atmosphere including the other people staying here was good. Just caution you may have some problems when interfacing with their management.,August 2021,Use your GPS to find this place,Traveled on business,"Dear Prxmt, Thank you for your feedback regarding your experience with our hotel, especially management. I'm terribly sorry you feel that management wasn't pleasant and I can assure you that that's never our intention or goal. We take pride in treating each and every guest fairly and equally. I'm not sure what challenges you are referring to in particular but a ""minor room clean"" is not an issue and we would gladly honorsucv  a simple request any chance we can. Maybe it was requested after hours when staff is not available or its  COVID related as we are not entering guests rooms daily for the safety of our guests and staff. We are certainly not ""higher"" than our customers. that goes against our principles as hotel professionals and if any one on our team felt that way, we would recommend a different line of work to those individuals right away. We will take you comments and share them as a team and look for areas to improve.  Thank You,",none,none,none,none,none,none,6,335
128 helpful votes,119 contributions,5.0 of 5 bubbles,Crowded and a little noisy but a decent option for the area,Stayed over a Thursday night on a free night award. The hotel kindly upgraded us from a studio to a one bedroom suite due to our Spire status.  It was very crowded and almost fully booked. There was a team of student athletes checking in ahead of me and there was only one person manning the front desk in the evening so there was a bit of a wait. The sports team was very loud but thankfully we were not assigned a room near them. We were on the ground floor in the East side (I think that's where many people with pets are assigned) since we had our dog with us ($75 fee). FYI - there are waste bag stations in the parking lot and some grassy patches that run along the sidewalk on the North side of the hotel.  The room had very dated decor but was surprisingly clean. Even before,July 2021,none,none,none,none,none,none,none,none,none,7,335
20 helpful votes,12 contributions,5.0 of 5 bubbles,Excellent Hotel for Families and Groups,"My family and I stayed at this hotel with another 15 families for a youth sports tournament. This is a great hotel for families and groups. We booked a two bedroom suite with a one queen bed in one and two more the other bedroom. The suite had a living/dining room area with a kitchenette which has a full-size refrigerator, an electric stove-top with two burners, a microwave and a dishwasher.  The staff was very friendly and helpful. Whether we needed bucket-loads of ice for the coolers, reserving the BBQ area in the courtyard for dinner, hooking up a laptop to the TVs in the dining area to review games, etc. everything we asked for we received.  Breakfast is included and so is a manager's dinner Monday through Thursday.  We will definitely come back.",July 2021,none,none,none,none,none,none,none,none,none,8,335
3 helpful votes,16 contributions,1.0 of 5 bubbles,Do not stay!,"Be careful not to book through CCI/Getaroom/Guestreservations as this company is a big money grab. However, Staybridge seems content to work with them. TripAdvisor reviews show up on the Getaroom site, so here I am. This hotel and Getaroom worked together to bait and switch my family. Good price, HUGE fees, downgraded room to one bed instead of three. Staybridge refused to refund or give me the right room. So did Getaroom until I reviewed them online. Issued a refund (we will see if I get it) but started emailing to tell me to change my rating. Absolutely not. Staybridge Lake Forest plays a mean game of “Who? Me?” but then said they could give me the room I had reserved (which she previously said was sold out) only if I cancelled with the third party and rebooked with them at",July 2021,none,Traveled with family,"Dear MomWantsaCleanRoom, Thanks yo for taking the time to write a review.we take our guests comments and feedback serious and will share with our team to help us be better at taking care of our guest. I truly understand your frustration in the situation that happened with your reservation. unfortunately, the reservation you booked with the third party company and the reservations sent to us was not the same. We made the reservation(system generated by your third party supplier) based on what was sent to us. We also were sold out on the night of your arrival so we had no recourse but to offer you the room that was booked for you by the third party. of course if we had the room you needed available, we would have help find a solution that would have gotten you the room type you were expecting. We try our best to provide a great experience for every guest and this was one of those situations where there was absolutely nothing we could do about the room the booked between you and the third party agency. ""the right room"" simply wasn't available as an option due to being sold out. I'm also sorry that the company you booked with wouldn't help accommodate you if a larger room was needed as we tried to help by cancelling the reservation which will allow them to book you elsewhere that had the room type you needed. I would love for you to give us another try... book with us directly and i'll personally make sure yo have everything you need leading up to your arrival. If you would like to stay again and get the correct experience, please contact m and i'll work out dates thats best for you and we have the availability.  Take Care, Rodd Smith",none,none,none,none,none,none,9,335
4 helpful votes,16 contributions,5.0 of 5 bubbles,"Lots of room to sleep, prepare food and relax","This place appeared to be in a business park area for folks staying for more then a few days. We had gone to Laguna Beach and couldn't afford a room in that town. This was a short 20 minute drive from there. How nice and roomy. We had a full sized fridge, so there was no wondering how to fit our cooler food in the fridge. Thank for the free water bottles. We didn't use the coffee maker since the package makes 4 cups and my husband would only drink 1. The shower door slid open effortlessly. Everything felt clean. I like that the beds are placed away from the door so you're less likely to hear hallway noise.",April 2021,none,none,none,3.0 of 5 bubbles,none,none,none,none,none,10,335
31 helpful votes,31 contributions,5.0 of 5 bubbles,Wonderful Place To Stay,"Our large extended family needed accommodations to attend a funeral.  Rod was very welcoming, knowledgeable and set us up with rooms that met the needs for each one of our individual families.  The entire staff was very friendly and always greeted us with a smile. Rod made it a point to stop by to say hi and to see if there was anything we needed.  The rooms were clean and very spacious!  The buffets were fabulous and the indoor and outdoor spaces for us to gather were perfect.  I will not hesitate to stay here again and highly recommend this hotel.",October 2019,none,none,none,none,none,none,none,none,none,11,335
207 helpful votes,3130 contributions,4.0 of 5 bubbles,2nd stay,"We stayed here 2 years ago and loved the hotel. Close to my husband's meeting location, free parking, a buffet breakfast included (lots of choices) and mini meals/snacks some evenings.  We didn't have the same room as two years ago. This time our room was located just outside the breakfast/common area (but on the next floor up). It's all open to the area below and I found sound really traveled up. I could hear conversations clearly.  Also, our room was supposed to have a queen bed but it seemed more like a double bed to me. I also found the bed hard, but some people like a hard bed.  Other than those two little things, I really like this hotel. The room is large with a kitchen. The bathroom was big. It was a wheelchair accessible room and no complaints about accessibility.  The",February 2020,none,none,none,none,none,none,none,none,none,12,335
15 helpful votes,7 contributions,5.0 of 5 bubbles,Mike Marzouk,"Good hotel, clean, comfortable, friendly staff. It was easy to access. The breakfast was generous. All amenities were available in the room with free parking and free WiFi. I would highly recommend it specially for families.",February 2020,none,none,none,none,none,none,none,none,none,13,335
77 helpful votes,68 contributions,5.0 of 5 bubbles,Another Excellent Stay At Our Home Away From Home,"In the Lake Forest area you really should stay here at the Staybridge Suites.  They have an excellent hotel staff in all departments.  The property is located within 1/2 mile of many restaurants, grocery & drug stores if needed.  Also great views of the snow cap mountain. Free breakfast 7 days a week & a Happy Hour Monday thru Thursday.  We had a 1 bedroom suite with 2 double beds for the 3 of us.  Room was clean and very functional for our needs.  So I would encourage anyone traveling to the Lake Forest, Trabuco Can, Mission Viejo & Irvine to look into staying here.",December 2019,none,none,none,none,none,none,none,none,none,14,335
45 helpful votes,34 contributions,5.0 of 5 bubbles,Fabulous Stay During our Home Renovation Week!,"We live very close to the Staybridge Suites and when my husband and I needed a comfortable ""home away from home"" last week while the drywall contractor worked on renovating our ceilings, we were oh-so-thrilled we chose to stay here.  We visited various hotels in our neighborhood to check out the accommodations and prices and even before we checked in, we knew this was the most elegant value for the price.  When I explained our situation to Mimi at the front desk, she was very eager to work with our situation, providing a flexible check-in and possible check-out time. Moises, apparently a new employee, showed us one of the 1 bedroom King bed suites, as well as a tour of the grounds.  Elizabeth at the front desk was fabulous, as was everybody there. Such a friendly, customer",January 2019,none,none,none,none,none,none,none,none,none,15,335
none,1 contribution,5.0 of 5 bubbles,Superb Accommodations and Staff!,"Gloria Wu and her incredible staff provided my family with a level of care that we could not have anticipated when we started our 10 week stay due to a slab leak at our house.  Staybridge became our new home and we could not have asked for more.  The team there were always helpful and friendly and the amenities from the breakfasts/dinners, free laundry, pool, gym, etc. all made our stay beyond comfortable.  We were spoiled!  Gloria on several occasions personally contacted us to make sure the hotel was meeting our needs.  Taking care of my family was the most important consideration for me....it was also the most important consideration for the Staybridge East Irvine/Lake Forest team.  I am extremely thankful and can not recommend the hotel enough!",October 2018,none,none,none,none,none,none,none,none,none,16,335
none,7 contributions,5.0 of 5 bubbles,Excellent Value,"We stayed two weeks at this location. It is a very safe location. The quality of the bed is excellent and we slept very well. The staff was very accommodating and friendly; the lobby, dining area and grounds were clean; food served for AM and PM was hot and of general good quality. Laundry facility was excellent. Carpet in the room seemed clean. This property is an excellent value. I would definitely stay again.   Areas for improvement - Dog potty area has too much dirt and little grass. Having gravel in this area would be cleaner. Tile floor in kitchen and bath appeared clean but was very dirty when wiped with a wet cloth and cleaner.",December 2018,none,none,none,none,none,none,none,none,none,17,335
17 helpful votes,32 contributions,4.0 of 5 bubbles,Decent Mainstream suites,Very happy with Staybridge suites at Lake Forest.  Rooms are clean and reasonable size.  Breakfast is very good (although as a UK visitor I am always amused to have to eat off cardboard plates and with plastic cutlery.)  Hotel could do with having a proper bar.  Enjoyable stay on business.,October 2018,none,none,none,none,none,none,none,none,none,18,335
6 helpful votes,46 contributions,5.0 of 5 bubbles,An Excellent Staybridge,"Staybridge Suites is my favorite hotel brand for business travel, and this property is an excellent example of how good the brand can be.  I had a one-bedroom suite for a week, and it was really roomy, clean, and fresh-smelling – no overwhelming scent of deodorizer that I have found in other suites-style hotel rooms.  Both the heating and air conditioning worked well, and the Wi-Fi was absolutely perfect – fast and solid.  In fact, I noticed a Wi-Fi router right in the room, next to the desk.  There is a fully equipped kitchen (but no oven), and coffee, tea, and a pack of popcorn are supplied.  The front desk also gave me a nice little package of snacks and candies when I arrived, which was quite nice.  The hotel provides complimentary breakfast and an evening reception that was",November 2018,none,none,none,none,none,none,none,none,none,19,335
95 helpful votes,413 contributions,5.0 of 5 bubbles,Very Enjoyable,"I stayed two nights.  All the employees are friendly, helpful and do there jobs well.  The hotel is spotless. The rooms are large and so comfotable.  Breakfast was delicious with so many choices.  The evening reception was also well done - nice Mexican food the first night and burgers the next plus a fantastic salad bar.  I stay at a lot of hotel and I am now going to be disappointed after staying at this Staybridge Suites.  I will definitely return on my next visit to Orange County.",November 2018,none,none,none,none,none,none,none,none,none,20,335
4 helpful votes,15 contributions,5.0 of 5 bubbles,Nice surprise!,We had to move in here with our 2 grown children and 2 dogs very late at night after a severe plumbing leak in our house. They were wonderful about suggesting a better cheaper suite that would hold our whole family instead of the two individuals Suites that we had reserved. Then a week later they were wonderful to switch us to a first-floor suite when my husband had knee surgery. The complimentary hot breakfast and basically free dinners were an added treat.,October 2018,none,none,none,none,none,none,none,none,none,21,335
none,1 contribution,5.0 of 5 bubbles,I really do recommend this hotel.,"The best hotel I've ever stayed at and ive stayed at pretty much every hotel in orange county. it's such a good price. Everything is great from the management, hotel staff and maids, the rooms are very cool they have rooms that are like a one bedroom apartment cuz u get a living room area, a kitchen already equipped with cooking pots and eating utensils, a bedroom that u can close out the living room and with a big walk in bathroom with closet. Oh and FREE BREAKFAST EVERY MORNING.",September 2018,none,none,none,none,none,none,none,none,none,22,335
119 helpful votes,247 contributions,4.0 of 5 bubbles,"Good Sized Suites, Friendly Staff, Good Value (and noisy HVAC)","For the money, Staybridge offers well laid out and furnished suites, with useful and well appointed kitchens and a decent breakfast buffet.  Nothing fancy here, but it's very clean, well run and the staff is friendly and responsive.  The suites have a good sitting area and large TVs in both sitting area and bedrooms.  Bathrooms are large, with good showers (OK, a bit more water pressure would be nice) and linens are more than adequate.  The only fault, and this is normal for any hotel in this class, is that the HVAC units are wall mounted (at least in our room) and noisy.  In our case this was made worse by the fact that the unit was mounted in the bedroom with the main outlet near the foot of the bed.  The unit is noisy enough to preclude sleep for any but the soundest",September 2018,none,none,none,none,none,none,none,none,none,23,335
2 helpful votes,4 contributions,5.0 of 5 bubbles,Superior Service,"Claudia at the front desk always providing great service, Jimmy has a great attitude, all staff great, rooms and facilities clean, fitness room well equip, food service excellent , Staybridge suites it is worth it, accomodations are highly recommended",August 2018,none,none,none,none,none,none,none,none,none,24,335
2 helpful votes,2 contributions,1.0 of 5 bubbles,If I could give a 0 Star I certainly would.,I booked this room for my adult kids to have a nice place to stay and this hotel turned them away at 11:30 pm at night because they were not 21 (oldest was 20). I have booked rooms for them previously thru IHG and never had a problem. I was horrified that they would be treated that way and had to scramble to find another place to stay that late at night. Never will I stay at this hotel or possibly this chain. My next move is to call Customer Support.,July 2018,none,none,"Hello Jessica, We understand how you must have felt regarding your adult kids unable to check into the hotel. I must tell you that our staff treats everyone, regardless of age, with respect and the utmost hospitality possible so please do not look at the unfortunate situation with your kids as being mistreated. Please understand that  because the hotel serves alcohol to our adult guests through the ""honor system"" (no one serving or monitoring the dispenser) and no charge, Our hotel policy of being 21 to check-in is to ensure that everyone registered to a room has the ability to legally access and handle alcoholic beverages as well as look after their under-aged guests traveling with them to make sure that those that are legal to drink adult beverages are the only guests that are drinking. Because your kids were attempting to check-in with no one of legal age, we were left with no other options but to decline their reservation. Whether its 11:30am or 11:00pm its our responsibility to apply this policy to all guests. Although you may not agree with this policy, its truly a safety policy for all of our guests and potentially future guests once they become 21 and over. We hope you reconsider our hotel or brand in the future as we have great value to offer to you and your kids.   Warmest wishes,",none,none,none,none,none,none,25,335
48 helpful votes,56 contributions,5.0 of 5 bubbles,Lovely cosy place for business trips or holidays,My stay was 6 nights on a business trip. The check-in was smooth. Room #230 was comfortable and spacious. Got a kitchenette and used it for my heat and eat stuff. Buffet breakfast is sumptuous and with very tasty choices. I even got my Amazon Big-day orders delivered there.,July 2018,none,none,"Dear Valued Guest,  'Thank you for taking the time to tell us about your experience at Staybridge Suites IRVINE EAST/LAKE FOREST.  Please know that your feedback is extremely valuable to us. We use feedback, such as yours, to continuously make changes to our brand to improve the guest experience. We hope that you will give us the opportunity to serve you again in the future.  Again, thank you for choosing Staybridge Suites, and if I can be of assistance to you, please contact us directly.  Sincerely, General Manager",none,none,none,none,none,none,26,335
none,2 contributions,4.0 of 5 bubbles,Orange Co Ca business trip,"Breakfast was Quite a variety and satisfying, buffet style make your on waffles. Pool is very nice, plenty of towels. It does loose the sun early afternoon. The staff is delightful and very helpful. WiFi recently updated",May 2018,none,none,"Thank you for taking the time to tell us about your experience at Staybridge Suites IRVINE EAST/LAKE FOREST.  Please know that your feedback is extremely valuable to us. We use feedback, such as yours, to continuously make changes to our brand to improve the guest experience. We hope that you will give us the opportunity to serve you again in the future.  Again, thank you for choosing Staybridge Suites, and if I can be of assistance to you, please contact me directly at  or rod@lakeforestsbs.com.  Sincerely, General Manager",none,none,none,none,none,none,27,335
207 helpful votes,3130 contributions,5.0 of 5 bubbles,Great hotel,"My husband and I stayed for a week in February. He was in Lake Forest on business.  We stayed in a wheelchair accessible room.  I believe all rooms are suites in this hotel. Our room was huge with a separate bedroom with king bed, fully equipped kitchen, living room area and huge bathroom.  Free parking, full buffet breakfast (free) and 4 evenings a week (Monday to Thursday) there is a small meal (fajitas, hot dogs, wings, etc).  The location was great for my husband, only a few minutes to his office each day. Lots of shopping and restaurants nearby.  The lovely courtyard has a basketball court, pool, seating area with fountain and BBQ's.  No complaints about this hotel at all, the staff were very friendly as well.",February 2018,none,none,none,none,none,none,none,none,none,28,335
