Helpful Vote,Contributions,Overall Rating,Summary Heading,Summary,Date of Stay,Room tip,Trip Type,Manager Response,Location Rating,Cleanliness Rating,Service Rating,Value Rating,Rooms Rating,Sleep Quality Rating,Review Number,Index
54 helpful votes,110 contributions,5.0 of 5 bubbles,Flawless!,"We are a family of four (two adults, two pre-teens) traveling with my father, so we decided to stay in a two-bedroom suite.  Wow! the suite was huge, the size of a regular two-bedroom apartment! One bedroom had a king sized bed, the second one had two queens.  Each had its own large en-suite bath.  The living room, dining room and kitchen were all big.  the kitchen had *full size* stove and fridge.  The suite was quiet and spotless.  Wi fi was strong and broadband.  Three flat screen TVs with full menu of channels.  Free breakfast was one of the best I have experienced.  Multiple choices for hot breakfast, American and Asian.  Food was cooked in the hotel's own kitchen (not ready made microwaveable).  This is something I would pay money for.  The property was large and well",February 2015,none,none,none,none,none,none,none,none,none,103,335
97 helpful votes,105 contributions,4.0 of 5 bubbles,Nice hotel,"We stayed here last night, and for the most part, we really liked it.  Check in was easy.  We did not take advantage of the evening light meal that was served, however, the menu posted on the fridge looked good.  The room was clean and comfortable.  The pool, which was right by our room, closes at 9.  After 9, there were still noisy people at the pool, but a call to the front desk resolved that quickly.  There were two things that we didn't like.  First, the information sheet for the hotel says they have ""grab and go"" breakfasts, and there were none.  The second thing is that the hair dryer in room 145 did not work.  We stay near Tustin almost every Thursday during the school year, and with those two exceptions, liked it enough that if it was closer, we would probably stay here",March 2015,none,none,none,none,none,none,none,none,none,104,335
18 helpful votes,19 contributions,5.0 of 5 bubbles,Great stay,"Brilliant time at the Stay bridge Suites in Lake Forest. The rooms are mini apartments with a bedroom bathroom kitchen and lounge in each. Very clean and attentive staff, I'd stay there again without a doubt if I was in Lake Forest again.",March 2015,none,none,none,none,none,none,none,none,none,105,335
1 helpful vote,1 contribution,5.0 of 5 bubbles,"Excellent property, helpful and happy staff, and great rooms","By far the best hotel property I have lived in so far in all my travels. And I have traveled a lot. This has been a warm, wonderful experience. The reception staff is always perky, peppy and helpful at all times. They are wonderful to speak to and they ensure that I had all I needed. I would definitely recommend this property any time you are in the Lake Forest area.   I thoroughly enjoyed my time here and I would come back right here anytime I am in the area. Bobby, Erica, Jericho ...they go a long way to make the guest feel right at home. Especially guests that are away from home for extended times. A lot of hotel properties really have to learn a lot from these guys. Thank you. It has been a pleasure.  Note: They have a manager's reception in the evening with complimentary",March 2015,none,none,none,none,none,none,none,none,none,106,335
9 helpful votes,132 contributions,5.0 of 5 bubbles,This hotel has everything you need,"If you don't have a car, don't worry - the hotel has a free shuttle bus that will bring you to local businesses. Restaurants and shopping are within walking distance (about 15 minutes on foot), where you will a variety of foods, a cinema and Walmart just to mention a few. The hotel is in a quiet area with excellent value for money - free breakfast, wifi and social hour are included in the reasonable price. The food was good and there is a nice variety. You can use the laundry room free of charge too. Staff was very helpful and friendly. Business associates gathered for the social hour and discussed not just work but also non-work related topics, in a relaxed setting that was appreciated by all. I can recommend this hotel to all types of travelers.",February 2015,none,none,none,none,none,none,none,none,none,107,335
229 helpful votes,232 contributions,5.0 of 5 bubbles,Long Overdue RE-Review,"We stayed at this Staybridge Suites in September, when we moved to Irvine.  We had stayed here a month earlier, and did not have the best stay.  I gave them a two on my original review, and was promptly contacted by the hotel apologizing, and wanting a second chance to make things right.    We gave them another chance...and they did not disappoint.  The room was perfect, and the service was exceptional.  This was just an overnight stay, after a long drive from the Bay Area with a moving truck.  We arrived at a busy hotel in the evening, and were warmly welcomed by the front desk staff.  The suite on the 2nd floor was quiet, clean and very comfortable.  Much better than our first stay.  Breakfast the next morning offered a nice variety of items to get us ready for ""move-in"" day.",October 2014,none,none,none,none,none,none,none,none,none,108,335
37 helpful votes,104 contributions,5.0 of 5 bubbles,Nice hotel stay,"My husband has been staying at this Staybridge Suites for a few days every other week or so the past few months on business. I finally had the opportunity to go with him last week and I saw why he always chose this hotel.  It is comfortable, well-kept, quiet and friendly. The room was large, combination bedroom- living room-kitchen. Also has a nice big desk for work. The bathroom was nice and large too. Bed was comfortable and windows had the best curtains to keep the room dark when sleeping late.   The location is great, near many restaurants and stores and has a beautiful view of mountains, which are a short drive away.   The free breakfast was very good and they have a nice variety.  There is also a light dinner 4 days a week - tacos, hamburgers, chicken wings, salad and the",January 2015,none,none,none,none,none,none,none,none,none,109,335
65 helpful votes,120 contributions,4.0 of 5 bubbles,Great visit,"Clean, comfortable and great breakfast. Evenings had a reception with some light bites. Close to highway, stores and restaurants.  Staff was great. Really a pleasant visit. Not a destination hotel, but good business hotel or for a family travelling through.  I did not know was that they are part of holiday inn chain.",January 2015,none,none,"Hi ComapssJohn, We appreciate the great feedback and are pleased that you a enjoyed your stay with us. Our entire staff thanks you for choosing us and we hope that we'll get another chance to deliver great service and a smile the next time you are in the area.  Take Care,",none,none,none,none,none,none,110,335
none,1 contribution,5.0 of 5 bubbles,Great hotel and staff,"We spent two months at the hotel for corporate housing.  It was hard to believe, but not only did we get a great one bedroom suite, but we also had free breakfast and dinner included in our stay.  The staff was incredibly friendly and helpful.  We especially want to thank Bobby and Cleo at the lobby front desk.  Too bad that we were there during the winter, because the pool looked very inviting.  The courtyard is very relaxing, with a nice fountain and gazebo with barbecues available.  I would highly recommend this hotel to anyone looking for a hotel in the Irvine area.  Now we are spoiled from not having to cook and clean for two months.  Back to reality!",November 2014,none,none,"Dear GregR462, We appreciate all of your positive feedback and are very happy you enjoyed your stay with us. We pride ourselves on making sure you have the move comfortable expereriance as possible. I guess you'll just have to come back in the summer and enjoy our pool, we'll be waiting for you.  Take Care,",none,none,none,none,none,none,111,335
none,1 contribution,4.0 of 5 bubbles,Great place to stay,The staff are very friendly and customer focused. The hotel rooms are well maintained. Complementary breakfast and dinner with ample selection.  I have had wonderful stays and great support from the staff.,December 2014,none,none,"Hi Paul, We're pleased to hear that you had another great stay with us. Its always our goal to make sure you have a great experience each and everytime you visit. so, on behalf of our entire team, THANK YOU!  Take Care,",none,none,none,none,none,none,112,335
34 helpful votes,68 contributions,5.0 of 5 bubbles,Great place,"Stayed 3 nights at the end of November, were upgraded to 1 bed suite.  Had a wonderful stay, plenty of space, good staff, a great base to get around. Would definitely stay again if in the area, absolutely great value for money.",November 2014,none,none,"Hi andy F, thanks for the great feedback. we're happy you enjoyed the hotel and its location. If you are ever back in the area, please choose to stay with us again. We won't let you down.  Take Care,",none,none,none,none,none,none,113,335
150 helpful votes,290 contributions,5.0 of 5 bubbles,Awesome Stay,I stayed there for almost a month for a business trip and it was fun staying there. Beautiful & bg rooms. Complementary breakfast & dinner. Ample of options for breakfast. Complementary wi-fi. Big parking space. Small gym. Swimming pool. Basketball court. Friendly staff. Close to shopping center. Awesome experience. I would definitely recommend this hotel to my fellow travelers.,December 2014,none,none,"Dear vauled guest, Thank you so much for the great feedback. We understand how difficult it can be to travel away from home for a month or longer so we work hard to make sure you have all the amenities and service you need to make sure your time with us is a wonderful experience.  We appreciate yo and your company choosing us.  Take Care,",none,none,none,none,none,none,114,335
1 helpful vote,2 contributions,3.0 of 5 bubbles,Good Stay Overall,"After leaving another hotel, our stay here was adequate. The front desk was very friendly and we had no problems with our room. The bathroom was clean as well as the rest of our room and there was hardly any noise from any of the other guests. Overall, our stay was OK.",November 2014,none,none,"Dear Laura E,  Thank you so much for taking the time to leave us your feedback. Your comments are highly valuable to us and will assist us in our continuous efforts to maintain and improve the service level we aim for. I am pleased to know that you had a satisfactory stay at our hotel and are delighted to hear that you found our front desk friendly and rooms clean. I appreciate feedback that we receive, whether positive and negative to ensure we provide the best level of service and facilities that we can give to our guests. Thank you again for your review and I hope to have an opportunity of welcoming you back again soon.  Sincerely,  Krysllin G. Case Manager IHGCare",none,none,none,none,none,none,115,335
11 helpful votes,24 contributions,5.0 of 5 bubbles,"Great place to stay, highly recommended!!","Tidy clean rooms, attentive and friendly staff, quiet location, elegant decor, complementary food and drink, complementary internet, and dvds at reception. Good location not far from shops, smoking area, plenty of parking. I will definitely stay here again. Thank you Cleo, Bobby, Mimi, Reggie, Claudia and Co.",October 2014,none,none,"Hi Mytewcents, You opinion is very valuable (more than tew cents). we appreciate the positive feedback and hope you  plan to return and stay with us again. We look forward to your visit in the future.  Take Care,",none,none,none,none,none,none,116,335
20 helpful votes,13 contributions,4.0 of 5 bubbles,"Few Broken Appliances, but a Good, Clean Hotel","We had a great 5 day stay at Staybridge Suites.  Depending on your needs, it is located in a convenient area, outside of the hustle and bustle, but less than 5 minutes from a Target, a few restaurants and shopping areas. We were going to a conference at Saddleback Church, which was also about 5 minutes away.  Our only issues were regarding some appliances not working.  For the first 3 days, the fridge/freezer in their Hotel Shop was broken, so no cold or frozen food/snacks available (though it was fixed the last 2 days).  Then, one of the three washers was broken the first time I used it.  Two days later, two of the three were broken.  Other than these slight problems, I would recommend the hotel and would stay there again.",October 2014,none,none,"Dear f8thfull21, thanks so much for the constructive and positive feedback. We try to stay on top of these small but common issues when many people are using the equipment. rest assured these issue have been address and plans are in place to minimize these types of incidents in the future. we hope that you return and stay with us in the near future to complete your wonderful experience while staying with us.  Take Care,",none,none,none,none,none,none,117,335
10 helpful votes,25 contributions,5.0 of 5 bubbles,Excellent,"We stayed here for two weeks, so my review comes from a relatively long experience.  Located in a quite business park, with very little traffic. Within 5 mins drive there are plenty of shopping and dinning options. within a 20 mins drive to all Orange County attractions, Disneyland, Newport Beach, Fashion Island ...etc. Advantageous location if you are planning to visit San Diego, only 1 hr drive.  Suites are spacious with a separate living and bedroom. One LCD in each room. Well equipped kitchen and full size fredg.  Amenities and facilities are top qualities and very well maintained. Free wifi. Good breakfast. Free laundry.  Staff are excellent and very helpful.",October 2014,none,none,"Hi curioustraveller78, Thank you so much for the great feedback. We truly pride ourselves on providing the best service and amenities possible. We know you have coices so we appreciate you staying with us and hope to have you back in the future.  Take Care,",none,none,none,none,none,none,118,335
none,1 contribution,5.0 of 5 bubbles,Should be a 4 star hotel!!,"My fiance, daughter and I stayed for a night on the 18th(Saturday) until we checked out on Sunday and this is my honest review. The rooms were a nice size comparable to a studio apartment and it included a 42 inch flat screen tv with a nice queen bed which was very comfortable. The fold out couch was a nice addition but the cushions were worn a little and had 2 6 inch tears in them (not a big deal but should be replaced someday) the carpet was newer and the room smelled great. It had a on counter burner for cooking food. (No oven) Dishwasher, microwave, toaster. The bathroom was very large with a nice sized closet and a bathtub/Shower combo. Overall it was a pleasant experience and I would recommend this to other family's with 1-2 kids. The breakfast buffet was a nice addition",October 2014,none,none,"Hi DannyJ, Thak you for choosing to stay with us and we are so pleased that you had a great experience while stay with us. Our staff tryly takes pride in making sure guests like yourself have a wonderful experience under our care. please come back and stay with us soon.  Take Care,",none,none,none,none,none,none,119,335
3 helpful votes,2 contributions,5.0 of 5 bubbles,Excellence!,"I stay at this location at least one week a month for the last year and have never been disappointed.  The staff is outstanding, rooms are clean and comfortable. Free breakfast and evening dinner are decent. Overall always an excellent experience.  BOBBY, CLEO, CLAUDIA and MIMI are the best!",October 2014,none,none,"Hi DevonW, thanks for the great feedback and support of our hotel and staff. we'll continue to do our best to support and take care of you whiles staying with us.  Take Care,",none,none,none,none,none,none,120,335
90 helpful votes,92 contributions,3.0 of 5 bubbles,"Old people's home feel, ok for a night or two if you must.","Have stayed here a number of times over the years on business trips. Staff are very friendly. The breakfast is acceptable, but the dinner that used to get served Mon-Thursday was barely palatable and boring. Decided to break rank and now stay in either Holiday Inn in spectrum or Laguna Beach.",February 2014,none,none,"Dear RakishDriver,  Thank you so much for your review of our hotel. We are pleased to know you liked the friendliness of our staff. However, we're sorry our dinner options did not live up to your expectations. Please be assured that your comments have been documented and will be used for review and improvements. Thank you for staying and we all hope to have an opportunity to serve you again on your next future visit.  Sincerely,  Anthony M Case Manager IHGCare",none,none,none,none,none,none,121,335
none,2 contributions,5.0 of 5 bubbles,Extremely happy with friendliness and responsiveness of staff,"I've stayed at Staybridge for at least two months spread across three different stays and every time has been great. The rooms are very spacious, housekeeping does a good job. I have one minor complaint in that the toilet paper wasn't always replenished in good time, but other than that everything with my stays have been great. Bobby and Claudia from reception were both exceptionally helpful and responsive to any issues/requirements I had and were very friendly and professional.",September 2014,none,none,"Hi Tom K, thank you so much for your positive feedback. Our entire team including Bobby and Claudia take great pride in making sure you have a wonderful stay from check-in to check-out. We know you have choices and appreciate you choosing to stay with us. we'll do our best to continue providing yuo with a great experience. looking forward to seeing you in the near future.  Thank You,",none,none,none,none,none,none,122,335
148 helpful votes,893 contributions,4.0 of 5 bubbles,Very good value for the money,"We took a two bedroom suite and it was very spacious Breakfast was not bad at all Free wifi all over the hotel Very quite area Free parking  Speedy service Nice little lobby Located off Bake Parkway which gives it easy access Very close to Towne Center shopping area; Target, WalMart,,,,",October 2013,none,none,"Dear Almaziad, Thank You for your great feedback and our entire staff appreciate you choosing to stay with us. We pride ourselves on providing the best hotel experience in the Lake Forest area. We hope you are back in the area soon and choose us again. i'm sure we will work just as hard to ensure a fabulous stay.  Take Care,",none,none,none,none,none,none,123,335
24 helpful votes,49 contributions,5.0 of 5 bubbles,Weekend getaway,"STAY: 4nights/3days (first time)  EVENT: Couple weekend get-away  ROOM: Just as advertised, clean and you have what you need for the kitchen, bathroom and bedroom  PLUS:  1. Free breakfast (you really have a variety to choose from, the meat varies daily, the servers are always checking for anything that need more, also i like having ""real"" plates, glass and utensils available) 2. I was worried about cooking or heating up food because of the smell but suprisingly the vent did realllllly work. 3. The place was NOT noisy nor unsafe, close to places that we planned on visiting. 4. Staff was friendly and helpful. ( We called to have the top floor and end-of-hallway room and that what we got)  WILL I GO BACK: Yes",September 2013,none,none,"Dear mem68ber, We are happy you enjoyed your stay with us. thank you so much for the great feedback and for choosing to stay with us. We hope that you choose to come back during your next visit to the area.  Take Care,",none,none,none,none,none,none,124,335
3 helpful votes,11 contributions,2.0 of 5 bubbles,Be sure to specify non-smoking room if you want one.,"Disgusting smoking room assigned by mistake. Entire floor reeked! Room stuck of cloying air freshener attempting, but failing, to cover it up.  Front desk attendant hesitated in moving us, taking 20 minutes to get approval from manager by phone. Once moved, the new room (on an entirely different wing of building) was more than adequate.",June 2014,none,none,"Hello  DS32588, Thank you for taking the time to comment on your experience staying with us. although it is never our intent to place a non-smoking guest in a smoking room, We apologize that you had to stay in one of the few smoking rooms we have. In most cases we can avoid these situations but in the busier months, when we are sold out each night, situations like this occur and we do our very best to prevent it from happening or to rectify the situation as soon as we can. We will also begin renovation of the hotel by the end of the year which will eliminate any smoking rooms from the hotel all together. we appreciate your constructive feedback and hope that you allow us another opportunity to provide you with a great hotel stay.  Take Care,",none,none,none,none,none,none,125,335
81 helpful votes,74 contributions,4.0 of 5 bubbles,Good hotel in between San Diego and Los Angeles,"Nice property in Lake Side. 5 minute drive to a major shopping center with restaurants and stores (Target, Walmart). We had a two room suite. We stayed four nights at this property. The hotel is clean and staff are friendly. Breakfast was decent with hot and cold choices. There is a pool, basketball court, and free laundry.",July 2014,none,none,"Dear AFshinM, Thanks so much for the positive feedback, our staff appreciates your business as we all know you have choices. We hope to earn your business again in the near future.  Take Care,",none,none,none,none,none,none,126,335
1 helpful vote,1 contribution,5.0 of 5 bubbles,Amazing customer service!!!,"From the time we checked in until the time we checked out, nothing but superior front desk services, friendly housekeeping and guest services, and truly professional management.  Thank you Cleo, Mimi, and all the employees of Staybridge Suites Irvine for taking care of the Hawaii Rush Soccer Club.  Aloha!!!",July 2014,none,none,"Hellow Wahine kapu, We enjoyed having you and the entire rush organization stay with us. Our team wanted your team to have the best expeience possible after traveling from Hawaii and and being so far away from home while competing in orange county. We're happy to hear everything went well for you and hope to see you again next year. Go Rush!!!  Take Care,",none,none,none,none,none,none,127,335
33 helpful votes,51 contributions,5.0 of 5 bubbles,Great stay for a wedding weekend!,"We stayed here for a wedding weekend, along with all of our other friends. The hotel was great. The location is convenient for the area, it is nicely and comfortably decorated, very clean, and they have a full breakfast available in the mornings! Couldn't have asked for anything better for the weekend.",January 2014,none,none,"Hi Melissa, Thaks for the great comments during your stay and thank you choosing Staybridge Suites lake Forest/Irvine East. please visit us again when visiting the area. We'd love to have you back.  Take Care,",none,none,none,none,none,none,128,335
94 helpful votes,88 contributions,4.0 of 5 bubbles,"Very good value, rooms...  What else do you need.","Booked this hotel for both it's rate and general location.  You are near every possible restaurant and national store.  Breakfast is excellent and the hotel is very quiet.  Rooms are borderline huge.  I have stayed in other Staybridge and these rooms are probably 80 sq ft bigger.   Fellow guests at least during our stay seemed to be families, many of whom were headed out to church during our breakfast.  The courtyard area was open and nice with grills and a large pool and good sized hot tub. Staff were always helpful when we needed them and took care of any request immediately.   The exact location is not visible from the main road, I drove right by it originally.  That said a really good hotel at a really good price.",May 2014,none,none,"Dear Disneyland Family, Thank You for choosing Staybridge Suites lake forest/irvine East. We really appreciate your wonderful comments we're very happy that yo enjoyed your stay. Our goal is to make sure everyone enjoys their time while staying with us and we hope to have you back in the near future.  Enjoy,",none,none,none,none,none,none,129,335
1 helpful vote,1 contribution,5.0 of 5 bubbles,Fantastic!,"I love this hotel! Breakfast and dinner is always awesome.  But the staff makes the place worth it.  Special thanks to Bobby he has been a great help to my entire stay, every hotel needs a guy like him!",May 2014,none,none,"Hi Noelm99, Thanks so much for the positive feedback. We appreciate you choosing us as your hotel and we hope to have you back very soon. our entire team, including bobby are looking forward to it.  Take Care,",none,none,none,none,none,none,130,335
5 helpful votes,13 contributions,5.0 of 5 bubbles,Great Hotel,"Loved everything about this hotel:  really comfortable beds, modern and clean suites, well-equipped kitchen, excellent food at the breakfast buffet and the one evening reception attended, quiet location off the main roads, very friendly and helpful staff (thanks especially to Bobby).  Perfect temperature control in the rooms.  Plenty of free parking was also a plus in this area.  I look forward to coming back.",March 2014,none,none,"Hello 20Anne20, Thanks so much for taking the time to write such positive feedback. our entire staff, including Bobby takes pride in making sure you have a wonderful stay whille staying with us. We all hope to have you back  really soon.  Take Care,",none,none,none,none,none,none,131,335
