Helpful Vote,Contributions,Overall Rating,Summary Heading,Summary,Date of Stay,Room tip,Trip Type,Manager Response,Location Rating,Cleanliness Rating,Service Rating,Value Rating,Rooms Rating,Sleep Quality Rating,Review Number,Index
1 helpful vote,3 contributions,4.0 of 5 bubbles,Great Stay,"I stayed here this past weekend in a Studio Suite. Overall, my stay was great except for a few minor inconveniences.   PROS: The agent at the front desk upon check-in was very nice as was all of the other staff. The room was very clean and the complimentary breakfast was great!  CONS: I had been looking forward to getting into the hot tub, only to realize when I got there that the jets were not working properly. Then, I realized that the towel rack was completely empty. We had to go to the front desk to request towels for the pool. Also, we did not have a can opener in our room and upon requesting one they brought us one that did not work!  Overall the pros definitely outweigh the cons and I would definitely stay here again!",March 2014,none,none,"Dear Karina, Thank you for both the positve and constructive feedback. We take great pride in improving our level of service and will take these comments seriously. the moter in the hottub went down and we did everthing in our power to get it up and running as quckly as possible. I'm sure if you stay with us again, you hot tub experience wil be much better as it should be working just fine. Please give us an opportunity to improve on your last experience. Just contact us whne making your next reservations.  Take Care,",none,none,none,none,none,none,132,335
17 helpful votes,28 contributions,5.0 of 5 bubbles,"Very clean, nice for families or groups","Have stayed here twice for junior sports travel events (weekend water polo tournament). Rooms are nice and big, boys have have had large rooms while parents had suites with kitchens.  Last stay was February 2014.  Staff is super helpful. Breakfast is nicely done, with eggs, bacon, pancakes and the usual other continental stuff. Kitchen staff even filled our huge cooler with ice for us.  Outside areas are clean and attractive. Pool and basketball court kept the teen boys happy and occupied. Barbeque area has plenty of seating.   Hotel always seems to have several traveling teams staying, yet we've never had an issue with noise or late night antics -- ,maybe because the kids are tired out, are serious about their sports and are well chaperoned.  Big mall is about a mile away,",February 2014,none,none,"Dear Dan B, Thank you for the great feedback and comments regarding our hotel. We're happuy you enjoyed your stay and your endorsement really makes our staff feel proud about the service they try to provide each and everyday. Please continue to be an advocate of Staybridge and  we hope to have you back with us very soon.  Take Care,",none,none,none,none,none,none,133,335
23 helpful votes,14 contributions,4.0 of 5 bubbles,Good overall,"My family stayed in a 2-bedroom suite for a week and enjoyed our stay overall.  Pros: 1) Two full bathrooms in the suite.  2) Good daily breakfast. 3) Free laundry facilities. 4) Close to restaurants, grocery stores, and shopping.  Cons: 1) The room was starting to show its age.  There was a crack in the shower, as if someone had punched the wall.  The bathroom floor was uneven.  2) The garbage bins are too small.  We often filled another bag and left it by the bin to be disposed of by Housekeeping.  3) Most of the staff was great, although we did encounter a couple employees in the breakfast area who ignored us when we pointed out the malfunctioning waffle batter contraption.  They did fix it, but didn't speak the entire time and acted like we were inconveniencing them.  4)",December 2013,none,none,"Dear vauled guest, We appreciate both the positive and constructive comments. It's the mission of our entire staff to ensure that you have a great expeerince while staying with us, from the check-in process to the comfort of your suite. We will soon begin a reneovation of our hotel so please consider giving us another try when you return to the area.  Sincerely General Manager",none,none,none,none,none,none,134,335
9 helpful votes,42 contributions,5.0 of 5 bubbles,Nice place to stay,"I needed a place to stay on a Friday night as I was on my way north of Los Angeles from San Diego.  Rather than battle the LA traffic at 5:00 pm on a Friday night, I elected to stay here for the night and make my escape from LA early Saturday morning.  Check in was quick and painless.  The room was a large and comfortable suite with kitchenette, couch, and queen size bed.  The front desk was helpful when I asked about nearby restaurants.  They directed me to a large shopping center that had plenty of options for dinner.  I checked out of the hotel early Saturday morning and was on my way.  The room was pleasant, the price was right, and I had just what I needed ... a place to stay until I could make my escape through LA.",December 2013,none,none,"Hello BB, Thank you for the kind comments and we are especially happy to hear that you enjoyed your stay. Our staff takes pride in making sure you have the best experience possible so if ever in the area again, please consider us and i'm sure we will give a maximum effort to repeat our performance.  Sincerely,",none,none,none,none,none,none,135,335
17 helpful votes,77 contributions,5.0 of 5 bubbles,A great place to stay if you are in the area,"This is a modern hotel with a variety of amenities, from basketball courts to a great swimming pool, to even the presence of barbeques in a garden-like setting. Breakfast was nice and totally satisfying. We were a bit disconcerted at first when we realized the hotel was in the middle of a seemingly deserted area, but were quickly put at ease when we learned that, a scant two blocks away, there was a commercial area with stores, supermarkets, and restaurants. We would certainly recommend this hotel if someone has business to transact in the surrounding area.",October 2013,none,none,"Dear Valued Guest, Our entire staff thanks you for the positive comments. We work hard to make you stay as enjoyable as we can. We know you have choices so we appreciate your business and hope to see you back with us soon.",none,none,none,none,none,none,136,335
86 helpful votes,140 contributions,4.0 of 5 bubbles,Perfect corporate hotel - would go back!,"This hotel is in the middle of a block of corporate offices so there is definitely not much going on around at night but this Staybridge Suites plans for your business trip:  1) They offer a shuttle to the local offices (Wonderware, Oakley, Black & Decker) and will pick you up and drop you off as needed, just schedule with the front desk 2) A hot breakfast is included with your room which is great - includes coffee, fruit, and various buffet items that are actually edible 3) A hot dinner is served Monday through Thursday nights including beer and wine. You can't beat that! Salad bar is pretty full and there are three hot items. The nights I was there they had chicken cordon bleu one night and wings the next.  4) Internet is decent, not spotty. Fast enough to work on.  Perfect",November 2013,none,none,"Dear valued guest, Thanks so much for choosing to stay with us during your business trip. our entire takes pride in making sure you have a great stay. We'll continue to do our best to see to it that your experience remains consistent. Hope to see you soon.",none,none,none,none,none,none,137,335
87 helpful votes,75 contributions,5.0 of 5 bubbles,Return guest....and will see you again next year!,"Clean, clean & clean.  Stayed there last year while visiting family and again this year.  Easy access to most everything in Orange County.  Wonderful value:  breakfast & wi-fi included, washer/dryer for guest use, biz center w/computer & printer access.  Because there are so many biz people using their facility they even offer a mixer dinner 3 nites a week including beer & wine.  I am a vegetarian - there was always something for me to eat.  Dining staff was always attentive and cleaning in/around the areas.  Outside area has pool, hottub, basketball court and nice places to sit & read.  Staybridge suites is also safety minded.....with key card access to workout room, laundry, biz center etc.  Only negative was that the computers run VERY slow.  We will be back again next year.",October 2013,none,none,"Dear valued guest, We are happy to hear that you'll return for another visit. Our entire team takes pride in making sure you have a wonderful experience when staying with us and look forward to seeing you again soon.",none,none,none,none,none,none,138,335
20 helpful votes,60 contributions,5.0 of 5 bubbles,Thank you Staybridge staff for providing me with such a great stay! Highly recommended!,"Today is my last night here and I am so pleased with my stay that I would like to pass along this great experience. I am attending a training from Omnex that was happening at this hotel so staying here was the obvious choice. Anyhow, I was not disappointed at all with the place, the rooms are big, clean, comfortable, have a mini kitchen, large flat screen, and free-fast wireless! In addition, a great breakfast and dinner buffet were included on my stay. I travel at lot for business and leisure and this was the FIRST time that I had no consumption at a hotel, I haven't spent a penny more than what I prepaid for the room. Parking was also complementary and the gym has a excellent Treadmill! The only small downside is that the AC is kind of loud, but still I would give them a 95%",September 2013,none,none,"Dear valued guest, Thank you for choosing to stay with us. We know you have choices and we are extremely happy for the opportunity to make your trip the best experience possible. We hope to see you again soon.",none,none,none,none,none,none,139,335
4 helpful votes,7 contributions,5.0 of 5 bubbles,BEST hotel EVER!,"I had to stay here for business and was BEYOND amazed!  The rooms are so comfy, so roomy and don't feel like a hotel at all.  They are equipped with a kitchenette, cookware, serveware and utentsils and a full-sized refrigerator.  The beds are very comfortable and come with plenty of pillows.  Rooms come with a DVD player in the room, so you can bring your own DVDs to watch or rent some from the front desk.  The bathrooms are great!  Big beautiful bathrooms with a nice, large closet, full-sized shower and bathtub.  The best part is they serve the best breakfast every morning and all-you-can-eat dinner.  The breakfast is not cheap continental breakfast either.  Oatmeal, eggs, bacon, sausage, fresh fruit and coffee, tea, milk and plenty of juice choices.  With dinner, FREE wine and",May 2013,none,none,"Dear valued guest, We're  so happy that you enjoyed your stay with us. our goal is to make sure that all of your lodging needs are met when traveling to our area and give you that ""home away from home"" experience. It sounds like we accomplished that and hope that you give a chance to do again and again. thanks you for choosing Staybridge Suites - Lake Forest.",none,none,none,none,none,none,140,335
106 helpful votes,299 contributions,4.0 of 5 bubbles,Comfortable Stay,"My family and I stayed here for 3 nights in June for a vacation. I am a Priority Club Platinum member.  Location: The hotel is located in a quiet business park in Lake Forest. It's close to the 241 (tollway) and only a few miles from the I-5. It appears the hotel caters primarily to business guests who have work in the area. There is not much going on in the immediate vicinity as it's mostly office buildings along Bake Parkway. There are some restaurants just north of the 241. As long as you have a car, you can find pretty much anything within a 10 minute drive.   Check-In: We arrived around 9pm on a Friday night and it was quiet. Check-in was fast. The front desk staff was pretty helpful and we received some snack bags for the kids.  Property/Room: The property looks relatively",June 2013,none,none,"Dear intlSalesguy, Wow! Thank you for the great feedback and comments of our hotel and location. You did an excellent job of describing us. we are in a very quiet area and away from all the crazy OC traffic but we are close enough to get to the most popular destinations in no time. Thank you for choosing us and we hope that you and your family decide to stay with us again if you are in the area.  Take Care,",none,none,none,none,none,none,141,335
52 helpful votes,62 contributions,3.0 of 5 bubbles,"A decent hotel, but nothing special","Having stayed in an excellent Staybridge Suites in another state, I had high expectations for this hotel. We were generally disappointed. The rooms were okay, not great. The office chair was falling apart. The beds are not comfortable, and as mentioned in previous reviews, the hotel has only ridiculous square pillows. The funny thing is, the hotel puts an ad on your bed bragging about those mediocre square pillows.    The included breakfast is good, and the staff is friendly. Overall, it is a decent hotel, but nothing more.",July 2013,none,none,"Dear Macdaddy18,  Thank you so much for your candid review of our hotel. I apologize you were not fully satisfied with your accommodations. We just want to assure you that our hotel is very proud of its level of service, cleanliness and quality of its product. We regret falling short of your expectations on this particular day. I have taken note of your comments and we will use these to monitor and improve the quality of product and services we offer to our guests.  Thank you for staying with us and we hope that we can better serve you next time.  Sincerely,  Connie D Case Manager IHGCare",none,none,none,none,none,none,142,335
10 helpful votes,14 contributions,5.0 of 5 bubbles,This is a very nice facility,"Enjoyed a great and comfortable bed, extraordinary breakfast, helpful staff, nice pool, jacuzzi and peaceful courtyard with a small-scale basketball court and surprised to have a free dinner moal three nights a week.  The room was spacious and nicely appointed , including a comfortable pullout sofa bed.  Spent a week here am am very satisfied.",August 2013,none,none,"Hi Chazdt, thanks you for taking the ime to provide your feedback of our hotel. We are very pleased that you enjoyed yourself and hope that you decide to choose us if ever back in the area. we know you have choices so thank you for choosing us to host your stay.  Take Care,",none,none,none,none,none,none,143,335
1 helpful vote,1 contribution,5.0 of 5 bubbles,Excellent customer support,I was staying in the stay bridge suites in lake forest CA due to a business trip and received the upmost customer care. I was left carless due to unfortunate circumstances and was instructed by the front desk where the local target store was located. I walked the 1 mile and ran into one of the front desk specialist who happened to be off from work. Claudia was the young lady's name gave me a ride back to the hotel even though she was technically not on the clock.  That there is awesome customer service to the finest. Thank you to Claudia and the staff of Staybridge in lake forest CA,August 2013,none,none,"Hi FreddyB, Thanks so much for taking the time to comment on our staff and customer service. Our entire staff including Claudia takes pride in making sure you have the most comfortable hotel experience while away from home. Please come back and stay with us again if you are in the area and we'll continue to take good care of you while hosting your stay.  take care,",none,none,none,none,none,none,144,335
6 helpful votes,4 contributions,3.0 of 5 bubbles,Nice place - but Internet is very bad,"This is a good clean place to stay. The staff was nice, and the breakfast was OK. The rooms are very comfortable. But they have a major lack of internet bandwidth and it is extremely slow. I discussed with the front desk and they said they knew about the problem and were sorry they couldn't do anything about it. The wireless is actually very strong, but the internet line the hotel has just can't handle the capacity. I would recommend this place, unless you need to use the internet during your stay.",July 2013,none,none,"Dear Bob E ,  Thank you so much for taking the time to provide us with such important information about your recent stay. I would like to apologize for any inconvenience you experienced while visiting our hotel. I have taken note of your comments regarding the internet service and your review will be used to reconsider improvements needed and I hope that you would give us a chance to make your stay as best as it can be.  Again, many thanks for the feedback and our apologies for the shortcomings.  Sincerely,  Connie D Case Manager IHGCare",none,none,none,none,none,none,145,335
51 helpful votes,116 contributions,3.0 of 5 bubbles,A good place for a longer stay,"It's perfect for business travelers who need to stay several days. With almost direct access to your room straight from the parking lot, you don't bother other travelers. The main room is the place where all get together for complimentary breakfast and diner. There's an open air pool and gym as well  Rooms offer kitchen and two large TV screens. Wifi is complimentary. A place to recommend!",June 2013,none,none,"Dear MPH010,  Thank you for taking the time to write your review regarding your recent stay. We appreciate all feedback we receive and use it to help develop the product and the service we offer.  We are pleased to note that you enjoyed your overall experience with us. Our aim  is to make sure that we provide an environment of comfort and value to our guests and I am glad that you were satisfied with the services and amenities that we have to offer.   Thank you again for staying with us and for recommending our hotel to other travelers. We hope you continue to choose us in the future.   Sincerely,   Dhan M Case Manager IHGCare",none,none,none,none,none,none,146,335
43 helpful votes,68 contributions,4.0 of 5 bubbles,Great for Groups,Our daughter's soccer team stayed here for a tournament in Mission Viejo.  Great family accomodations!  Nice pool with clean and very well kept grounds.  Picnic and barbeque areas are fantastic.  Clean grills!  The breakfast is one of the best I've tasted and with great variety.  The lobby area and common areas are very clean and comfortable.  The rooms are nice and the bedding is decent but the pillows are HORRIBLE.  Bring your own!  The bathrooms could also use some repair as they do not match the rest of the hotel that looks nice and well kept.  We stayed only two nights and it met our needs very well.,June 2013,none,none,"Hello Webinvensible, Thank you so much for yor comments and feedback. Our entire staff is always looking to improve our performance and our guest's experience. Althourgh we still have work to do, we are in the process of upgrading our pillows package with the brand as well as renovating the hotel soon(including the bathrooms). These changes will help improve your personal experince at our  hotel if you are so kind to give us another opportunty to completely satisfy you during your next stay in the area.  If there is anything we can do to help when planning your next stay, please feel free to contact us.  Sincerely,  General Manager",none,none,none,none,none,none,147,335
18 helpful votes,18 contributions,5.0 of 5 bubbles,Great experience,"I stayed for business. The rate seemed comparable for the area. Unless you want to stay in a motel 6, you are going to end up paying in the $125 - $150/night range.  Firstly, they have a free lunch AND dinner buffet nightly (although I think the dinner may only be during the week).  Its more of a light dinner with rotating menu but it was pretty good nonetheless. Full salad bar, chicken strips, french fries, etc.  And a nice big room with lots of tables and some big screen TV's.  They also have free sodas and fruit juices and then best of all a free ""help yourself"" beer tap.  In the morning the breakfast was pretty nice. Eggs, potato thingies, some meat, cereal, make your own waffles, rice (who eats rice for breakfast??), fruit juices, and soda. No beer for breakfast tho.  Rooms",May 2013,none,none,"Dear Valued Guest, We are very happy to hear that you enjoyed your stay with us. Our team works hard to ensure that you have the best experieince as possible so we are happy to read responses like yours. We know that you have choices so thank you for choosing to stay with us. As for the pillows, we have larger pillows avaialble for guest that perfer larger sizes such as yourself. Let us know about your next stay with us and we'll have those larger pillows waiting for you.  Sincerely,",none,none,none,none,none,none,148,335
1 helpful vote,8 contributions,5.0 of 5 bubbles,Top Notch!,"We stayed here for 1 night when we had some work done on our house.  We were extremely satisfied!  We enjoyed the ""happy hour"" (hot dogs, chili, chips, salsa, drinks, and much more) and the breakfast buffet.  The attention to detail is amazing!  In addition, our suite was great (it was more like an apartment - 1 bedroom with a full kitchen).  If the need arises, I will not hesitate to book a stay here in the future!",May 2013,none,none,"Dear Valued guest, Thank yo for the positive feed back. We are an extended stay hotel but we also feel that we work just as well for travelers like yourself who may prefer the extras space for a night or two. we realize that yo have chices and thank you so much for choosing Staybridge Suites Lake Forest.  Sincerely,",none,none,none,none,none,none,149,335
1 helpful vote,1 contribution,5.0 of 5 bubbles,Above and beyond helpful staff,"My daughter stayed with her basketball team for 2 nights.  They loved the suites they stayed in and really enjoyed the entire set up of the property!!  They stated it was beautiful and fancy!! When the team got on the road heading back to Utah my daughter realized she left her homework, calculator and text books in a drawer in the room.  We called when she got home and the staff called me back after they had located the lost items.  They were very professional and thorough with the mailing of my daughters items!!  They were also careful to try to locate the least expensive way to ship the items to us and to let me know the amount that was charged to my credit card!  Thank you so very much for going the extra mile and for the remainder of your staff being honest by turning in the",April 2013,none,none,"Dear Valued Guest, Thank you for the positive feedback regarding your Daughter's experience when staying woith us. We take so much pride in providing the highes level of service as we can. Our team  wants everyone to come back and stay with us over and over again so we want to ensure that our guest enjoy thier time with us as well depend on us when they are gone to continue to help anyway we can. We look forward to seeing your daughter and her team again and we would love to meet yo too.  Sincerely,",none,none,none,none,none,none,150,335
4 helpful votes,4 contributions,5.0 of 5 bubbles,Clean hotel and great value for families.,"I would recommend this hotel to anyone.  Easy choice.   I came here on vacation with my wife and baby and were so happy with the full kitchen that was in our suite.  It is very helpful to have a full size fridge for my son's milk and baby food.  We also were able to cook for lunch and dinner a couple of times too.  The rooms were very clean and modern with a flat screen TV.  There is free breakfast every day of the week and free dinner on the M-Th.  They change the menu daily which is great.The staff were super friendly and very helpful with helping us find things to do around the area and with directions.  They have lots of free amenities like WIFI and laundry machines.  Overall I was really happy with our stay here and so was my wife, who is a very picky customer.",April 2013,none,none,"Dear Valued Guest, We are pleased to hear that you and your wife enjoyed your stay with us. we know you have choices and appreciate that you gave us a chance to take care of you during your travels. Our entire staff take pride in doing what we can to proved the best experirence possible. we look forward to seeing you again soon.  Sincerely,",none,none,none,none,none,none,151,335
60 helpful votes,445 contributions,5.0 of 5 bubbles,"very good stay, very safe neighbourhood","Summary of our first stay ever at any Staybridge Suites: very good stay, would come again any time, very safe neighbourhood. Reading on the internet that Lake Forest, CA, is ranked as one of the safest cities in the US, we knew this would be a good place to stay in the greater LA area if one is not familiar with LA. We booked this Staybridge Suites for two weekend nights via internet directly with the main Holiday Inn website, basic room type: studio suite, one queen bed non-smoking, request for a quiet room.  We arrived in the evening. Trainee at check-in was unprofessional, things were prepared, but credit card details could not be changed, “please do it tomorrow”. “Light Touch” housekeeping service on weekends by request only. The front desk trainee was first unwilling to",March 2013,none,none,"Dear valued guest, We thank you for the positive feedback regarding your experience with our hotel. We pride ourselves with doing the best job possible of taking care of our guest from the check-in process through check-out. We also know that you have choices so we appreciate you choosing Staybridge Suites Lake Forest.",none,none,none,none,none,none,152,335
