Helpful Vote,Contributions,Overall Rating,Summary Heading,Summary,Date of Stay,Room tip,Trip Type,Manager Response,Location Rating,Cleanliness Rating,Service Rating,Value Rating,Rooms Rating,Sleep Quality Rating,Review Number,Index
51 helpful votes,42 contributions,4.0 of 5 bubbles,Great view,"I was here for a weekend to visit friends between business meetings. Overall, it’s a nice resort in a great location.  My room (2306) was spacious and nicely decorated. The view from the balcony was the best part about it. They have Fresh bath products which I loved and the bathroom had a huge soaked tub and dual vanities. My safe wasn’t working when I checked in but maintenance arrived quickly to fix it. Everyone on staff was super friendly and came across as genuinely gracious, especially Becca at the front desk & the waitstaff at A&O and the Blend.  I was a little bugged by some minor things that I only mention in case it’s a big deal for other readers. The pillows didn’t appear to have pillow protectors on them under the pillow cases. The towels weren’t very soft / a little",March 2019,none,none,"Thank you for sharing your Balboa Bay Resort experience with us, beekac. We are glad to hear that you enjoyed your stay at the Resort and that our staff was helpful and you loved our waterfront location and views. We appreciate your feedback about the towels and pillows and will be sure to address this with housekeeping. Our Balboa Bay Club Members pool is very popular on warm weekends, and we appreciate you sharing your experience with your room on that side of the Resort & Club. We hope to welcome you back soon!",none,none,none,none,none,none,452,98
73 helpful votes,190 contributions,5.0 of 5 bubbles,Lovely Location,We found the Balboa Bay Resort to be very beautiful and a convenient location to all the area attractions.  We enjoyed their Happy Hour in the bar and only wished the weather had been warmer so we could have been outside more! Every staff member was friendly and helpful. The valet parking was quick and effficient (and attentive!) Thank you for a great weekend experience.,March 2019,none,none,"Thank you for sharing your five star experience with us, JanT56737. We are very glad to hear that the Resort's waterfront location, helpful staff and happy hour options made your stay a great one! We can't wait to welcome you back soon to enjoy some California sunshine!",none,none,none,none,none,none,453,98
none,1 contribution,5.0 of 5 bubbles,Terrific Resort,Wonderful resort with an amazing staff. Becca at the front desk was especially helpful in making some local recommendations. Ive stayed multiple times over the past few years for both business and just to get away. The on site bar A&O is a great place to grab a cocktail and relax by the fire!,March 2019,none,none,"Thank you for sharing your five-star Balboa Bay Resort review, rwh2019. We are so happy to hear that your trips to the Resort have been great and that our helpful staff and waterfront dining help to make your stays even better. We can't wait to welcome you back to the Resort!",none,none,none,none,none,none,454,98
none,1 contribution,5.0 of 5 bubbles,Company Meeting - 2 days,The staff were amazing to work with from their management to the servers.  Everyone took pride in the hotel and their work.  The food and presentation was excellent and tasted amazing.  I highly recommend the hotel and would work with them again.,February 2019,none,none,"Thank you for sharing your Balboa Bay Resort experience with us, Compass24359204824. We are very happy to hear that your time at the Resort and meetings went great. It is great to hear that our staff were able to help during your stay and that your dining experiences were exceptional. We can't wait to welcome you back to the Resort soon!",none,none,none,none,none,none,455,98
36 helpful votes,39 contributions,5.0 of 5 bubbles,"Nice property, great service","We really enjoyed our stay. All staff was very friendly. Felt like the front desk folks got to know us pretty quickly into our stay, and as such were able to provide some nice recommendations in the area.   Valet service was commendable. Often the valet experience can be frustrating at hotels, but we were impressed with how well-managed the valet service was at Balboa.   The onsite A&O restaurant was very good. We visited for dinner and the bartender Jill was top notch. Really knew her stuff and provided great menu guidance.   Property is pet friendly (for a fee) but note that on-site pet relief areas are limited to patches of grass in the parking lot. There is not off leash area on the premises (though there is a dog park nearby after a 7-min drive).   Gym facility was pretty",February 2019,none,none,"Thank you for sharing your five star review, Bryan M. We are happy to hear that you had a great stay at the Resort and that our helpful staff and accommodations helped you enjoy your time with us. We can't wait to welcome you back soon!",none,none,none,none,none,none,456,98
22 helpful votes,102 contributions,5.0 of 5 bubbles,Don't miss the Balboa beach resort,"We have stayed at many resorts and I have to say this was one of the best, if you are in southern California don't miss staying here.  The rooms, service and food couldn't be better along with a wonderful brunch on Sunday's.",February 2019,none,none,"Thank you for sharing your Balboa Bay Resort experience, fhoward416. We are so happy to hear that you loved your stay at the Resort and that our room accommodations, helpful staff and dining made it even better. We can't wait to welcome you back soon!",none,none,none,none,none,none,457,98
none,1 contribution,5.0 of 5 bubbles,Staycation for the Ages!,"From check-in to the restaurants and amenities, we had a fantastic 3 night stay. The brunch at Waterline was an ideal way to spend a Sunday afternoon on the water in Newport Beach. The bar staff at the lounge bar was accommodating and knowledgeable. The staff was friendly and helpful, resort wide.",January 2019,none,none,"Thank you for sharing your five star Balboa Bay Resort experience, J2486LUromanf. We are so glad to hear that you enjoyed your stay and that our helpful staff and Sunday brunch made it even better! We can't wait to welcome you back again.",none,none,none,none,none,none,458,98
8 helpful votes,7 contributions,1.0 of 5 bubbles,"Rude, expensive and overpriced food",This place is nice but the food and service failed me. I felt like at any point someone might come over and ask us to leave. (for talking to loud}. I get it I wasn't wearing a USC hat or a vineyard vines shirt. The bartender sighed when we asked for a second round of drinks. WTH never going back !,January 2019,none,none,none,none,none,none,none,none,none,459,98
none,7 contributions,5.0 of 5 bubbles,What a wonderful resort!,"My stay at Balboa Bay was the best! Everyone is so friendly and so attentive. The Valet team, the Front Desk Staff, the Bellman, the Housekeeping Staff...I mean everyone! They all work hard to make guests feel special.  My room was clean and comfortable and view of the bay was so peaceful (spent every evening on my terrace to watch the sunset). I highly recommend staying here when you visit Newport Beach. I can't wait to come back and stay again - top notch!",February 2019,none,none,"Thank you for sharing your five star review, TarheelTraveler89. It's great to hear that our helpful staff were able to make your stay a memorable one. We can't wait to welcome you back to Newport Beach and the Resort soon!",none,none,none,none,none,none,460,98
53 helpful votes,20 contributions,5.0 of 5 bubbles,LOVE LOVE LOVE this place!!!,"This is our new favorite SoCal location! Rooms are beautiful. On site restaurants are terrific and service is IMPECCABLE!!! Every single staff member was helpful, gracious, and all smiles! We particularly love Becca at the front desk!!! She hooked us up with the room we wanted, gave great dining suggestions and treated us like a member of the family! We will definitely make this our home away from home!",February 2019,none,none,"Thank you for sharing your Balboa Bay Resort Experience, DcavuM. We are so glad that you had a great stay with us and loved our comfortable rooms, helpful staff and waterfront location. We can't wait to welcome you back soon!",none,none,none,none,none,none,461,98
none,2 contributions,5.0 of 5 bubbles,Fabulous,Wonderful Resort and Employees.  Everyone was very helpful and caring.  The location is picturesque.  Newport Beach is a fabulous town only topped by the quality of the resort.  Will come back any chance I get.  You should too!,February 2019,none,none,"Thank you for sharing your five star Balboa Bay Resort experience, Fearless51110443867. We are pleased to hear that you had a great stay with us and that our helpful staff and waterfront views made it memorable. We can't wait to welcome you back to the Resort and Newport Beach!",none,none,none,none,none,none,462,98
269 helpful votes,477 contributions,4.0 of 5 bubbles,Superb hotel with great bar,"This is very much a Four Seasons style quality hotel , very classy , had a beautiful large , well specified room , the onsite bar is great and quite lively with a restaurant, pool , outside seating and great bay views .. it’s at the top end of the price spectrum in the area but certainly lives up to the price tag . Highly recommended",January 2019,none,none,"Thank you for taking the time to review Balboa Bay Resort, TonyF22. We are glad to hear that you enjoyed your stay with us including our dining options, amenities and waterfront views. We hope to welcome you back to the Resort soon!",none,none,none,none,none,none,463,98
5 helpful votes,17 contributions,5.0 of 5 bubbles,Escaped Super Bowl madness in ATL!,"Room with a view! Had a great Massage at the Spa from Olga-thanks! Spa area was also very well equipped and has relaxing venues as well as sauna, whirlpool, & steam. Alberto was very cheerful and attentive in the dining room. Great get-away spot! The location is great and Balboa Bay provides shuttle service to nearby restaurants.",February 2019,none,none,"Thank you for sharing your five-star Balboa Bay Resort experience, ClaudiaN60YA. We are so happy to hear that you loved your spa getaway and our waterfront location! We can't wait to welcome you back soon.",none,none,none,none,none,none,464,98
none,1 contribution,5.0 of 5 bubbles,Excellent service!,Service is top notch - rooms are beautiful and comfortable.  Amenities are amazing.  This is a wonderful place for a meeting and the area allows for extra activities and places to eat.  Outdoor activities for my team to run or walk along the coast was relaxing after a long day of meetings.,January 2019,none,none,"Thank you for sharing your five-star review, Fearless62124884295. We are so glad to hear that you enjoyed your time at the Resort and that your meeting was a success. We are also glad that our helpful staff and amenities made your time even better. We can't wait to welcome you back soon!",none,none,none,none,none,none,465,98
1 helpful vote,13 contributions,5.0 of 5 bubbles,December overnight get-a-way,Looking forward to a return trip to this beautiful hotel. Great location with very attentive staff. Highly recommend this resort. Bay view rooms are worth the $$$$. The spa will definitely be on our agenda on a return trip.,December 2018,none,none,"Thank you for sharing your five-star Balboa Bay Resort experience with us, Dlilly956. We are so happy to hear that you loved our waterfront location and views and helpful staff. We can't wait to welcome you back soon!",none,none,none,none,none,none,466,98
48 helpful votes,155 contributions,5.0 of 5 bubbles,Excellent Resort and Location,"We stayed here for four nights in January, the hotel is excellent, very clean and staff very warm and welcoming. The outside pool area is spacious and very attractive, There is outdoor dining alongside the marina which we unfortunately did not get to take advantage of as we hit the one week of Southern California rains. The resort fee is high but comparable to other similar hotels in the area. Would definitely stay again.",January 2019,none,none,"Thank you for sharing your Balboa Bay Resort experience, Kathy J. We are very happy to hear that you enjoyed your stay with us, especially our kind staff and amenities. We hope to welcome you back soon to experience more of the great California sunshine!",none,none,none,none,none,none,467,98
none,1 contribution,5.0 of 5 bubbles,Beautiful resort,The resort is gorgeous.  The customer serve and food was excellent.  I would definitely stay again.  I was on a business trip so we had the food catered by the resort and the food was delicious.  The hospitality of the staff was exceptional!,January 2019,none,none,"Thank you for sharing your five-star Balboa Bay Resort experience, Flyer45257440369. We are thrilled to hear that you loved our helpful staff and dining options! We can't wait to welcome you back, for business or leisure, again!",none,none,none,none,none,none,468,98
49 helpful votes,303 contributions,4.0 of 5 bubbles,"Beautiful room, great coffee shop, modern look","Blend Coffee shop has the best coffees and smoothies! I enjoyed the shopping experience at the boutique as well. It is a busy hotel which caters for a lot of conferences.  Breakfast was good and room service was delivered with a rose and a smile from Emilio!   The room is spacious and modern, the bed is super comfy and big. I would have appreciated being asked if I preferred a quiet room but fortunately I had my earplugs packed and ready for the noisy street side.  The shuttle only covers a 3mile radius so I could go to Fashion Island for lunch and shopping.   I had to pay 25 dollars for 30min later check out, although I am a Discovery member. Late check out totally depends on availability. Friendly staff.  Great spa facilities and the massage was good. Nothing ‘wow’ but overall",January 2019,none,none,"Thank you for taking the time to review Balboa Bay Resort, theresapilates. We are happy to hear that you enjoyed our comfortable accommodations, dining options and spa. We can't wait to welcome you back to the Resort!",none,none,none,none,none,none,469,98
none,1 contribution,4.0 of 5 bubbles,Excellent Hotel - Beautiful location,Fantastic staff - great views - nice pool with large Jacuzzi - great relaxed vibe - terrific in house coffee shop - view are wonderful if you get a bay view room - pool view is not bad either - nice range of restaurants - one relaxed and one more higher end,January 2019,none,none,"Thank you for sharing your Balboa Bay Resort experience, Cruiser22245973001. We are so glad to hear that you enjoyed your stay with us and that our helpful staff, dining options and waterfront views were able to make your stay great. We can't wait to welcome you back soon!",none,none,none,none,none,none,470,98
19 helpful votes,228 contributions,5.0 of 5 bubbles,Rows of yachts parked in front,This is what I would call the Billionaires row in Southern California.. I only went for a gig. Expect to pay high prices but premium service. Parking alone was $25.  Stroll on the walkways next to the ocean. Very romantic.,January 2019,none,none,"Thank you for sharing your Balboa Bay Resort experience, CambodiaTravelsGuide. We are glad to hear that you enjoyed our waterfront location and helpful staff. We hope to welcome you back soon!",none,none,none,none,none,none,471,98
32 helpful votes,60 contributions,5.0 of 5 bubbles,Wonderful Stay!,"We thoroughly enjoyed our entire stay at the Balboa Bay Resort and within the Club facilities. The accommodations were beautiful and relaxing - (loved the “Fresh”  bathroom product essentials!). All of the food/beverages from the coffee shop to the waterfront dining was top notch! A special thank you to Taylor B, Damian G. and Rosalie U. for going out of their way to help us facilitate our amazing New Years Eve plans.The care the entire staff extended to us is to be commended and we will most definitely be back!",December 2018,none,none,"Thank you for sharing your five-star review with us, jackieg121. We are so glad to hear that you enjoyed your stay with us and that our accommodations, dining and helpful staff were able to enhance your experience! We can't wait to welcome you back soon.",none,none,none,none,none,none,472,98
none,1 contribution,3.0 of 5 bubbles,Great hotel with a lot of hidden charges,"Great hotel but they will with out notifying charge you for Wi-fi, water, wine and the swimming pool. It's 2019 and no serious hotel should charge for water and wi-fi, come on guys! Today's gold is = communication, transparency and referrals. Time to adapt.",January 2019,none,none,"Thank you for taking the time to review Balboa Bay Resort, Camper10922728139. We apologize for any confusion regarding our Resort Fee. The fee is common amongst resort properties throughout the country, and covers many amenities including WiFi, in-room bottled water, wine, and the fitness amenities, which you mentioned.  This fee is listed on our booking page within the price breakdown and it also noted on the confirmation letters. We do appreciate your feedback and hope that you will return to the Resort soon.",none,none,none,none,none,none,473,98
92 helpful votes,261 contributions,5.0 of 5 bubbles,Calm and Relaxation,"Many places to ""meet"" and hang out on the first floor,  beautifully decorated for the holidays, pool looked inviting and well maintained.    Stayed here for a work party, did the spa also, they treated me right!   I did a massage and salt scrub.  The only down side is you can hear the basketball court and weight room slightly in parts of the spa.  Nice soaking tub, and all the amenities you need to be refreshed after your treatments.   This seems a pretty popular place, and it everything was pretty busy.  I ordered food to go, the staff was super polite and did a great job, got my food right out to me even with special diet restrictions.    Went down towards the marina and watched the lighted boats tooling around, very fun to see.   Rooms were very relaxing, bedding was",December 2018,none,none,"Thank you for sharing your five-star experience, RoxAnnaF. We are so glad to hear that you had a great stay with us and that your time at the spa, restaurants and in your room were enjoyable. We can't wait to welcome you back!",none,none,none,none,none,none,474,98
none,2 contributions,4.0 of 5 bubbles,"Great Hotel, Poor Timing","My wife and I wanted to watch the annual Newport Beach Christmas Boat Parade and booked one of their rooms that was closest to the water well in advance. The valet, the front desk people, and everyone was very friendly and accommodating. The room and the view was epic. We got to see the whole parade from the front row.  After the parade was over, we were tired and wanted to turn in early for the night, but the room we selected was noisy due to the throngs of visitors at the hotel and resort. We would probably have been better off in another view room, because there was a party on the floor just above us with loud music and we could hear people walking around on the wood floors. Unfortunate...and we should have known better.  We complained about the noise and our locations, and",December 2018,none,none,"Thank you for taking the time to review Balboa Bay Resort, bss51. We are happy to hear that you enjoyed your view of the Newport Beach Christmas Boat Parade and that our helpful staff were able to make your stay enjoyable. We apologize for any inconvenience the noise from the Boat Parade festivities caused you. We hope that you will stay with us again soon and for the Boat Parade in the coming years.",none,none,none,none,none,none,475,98
28 helpful votes,17 contributions,1.0 of 5 bubbles,UNASHAMED GREED,"Stayed here for the first time and unfortunately will not be returning.  On top of already premium room rates, be very aware that you will have to pay $30 per room, per night resort fee AND $30-$35 per night parking.  All very excessive for cheap bottle of wine and 2 “complimentary” small bottles of water.  Unfortunately this type of daylight robbery is becoming the norm for larger hotels, hiding the true cost of your stay.  I will search harder for those hotels that give a true cost of a nights’ stay!!!",January 2019,none,none,"Thank you for taking the time to review Balboa Bay Resort, G1631CMchristiner. We apologize for any disappointment you experienced during your stay. We work hard to ensure every guest enjoys their time at the Resort, and will pass your feedback about our Resort fee and parking fees to the team. We hope you will return to experience the Resort again.",none,none,none,none,none,none,476,98
1 helpful vote,5 contributions,5.0 of 5 bubbles,Great resort!,Great place to stay. Staff at resort are exceptional with great attention to customer satisfaction. Views of marina and sunsets are truly amazing. Place has a unique ambiance complimented by attentive staff.,December 2018,none,none,"Thank you for sharing your five-star Balboa Bay Resort experience, Navigate646735. We are so happy to hear that our waterfront views and helpful staff were able to make your stay great. We can't wait to welcome you back soon!",none,none,none,none,none,none,477,98
1 helpful vote,9 contributions,5.0 of 5 bubbles,Lovely,"Balboa Bay Resort  is a beautiful hotel with outstanding views of the bay. The rooms were well appointed and the beds were super comfy. Also the employees continuously made us feel welcome! Becca at the front desk gave us great recommendations on restaurants and places to see. She treated us with genuine warmth and hospitality. Tara, who worked at the bar/restaurant A and O, was also very friendly and made a point of remembering our wine choices and what our vacation plans were. Lovely. Finally, Victoria was an excellent server at the Waterline. We will definitely be back next year!",December 2018,none,none,"Thank you for sharing your five-star Balboa Bay Resort experience! We are so happy to hear that you enjoyed our bay front views, comfortable beds and helpful staff. We can't wait to welcome you back to Newport Beach and the Resort soon!",none,none,none,none,none,none,478,98
1 helpful vote,4 contributions,5.0 of 5 bubbles,Very Nice hotel,Booked an overnight stay in a  waterfront room for viewing Xmas parade of boats.  We had two queen beds and the room was still spacious and comfortable. The bed was one of the most comfortable I've slept in. Hotel Xmas decorations were fabulous. Staff was courteous and attentive. Enjoyed my stay!,December 2018,none,none,"Thank you for taking the time to share your Balboa Bay Resort experience, @njmstrip589! The Christmas Boat Parade is our favorite event of the year, and we're happy that you were able to enjoy it with us. We look forward to sharing your kind words with our staff, as well as welcoming you back to the Resort!",none,none,none,none,none,none,479,98
4 helpful votes,20 contributions,5.0 of 5 bubbles,"Less Than an Hour Away From LA, a Beautiful Oasis of Relaxation and Luxury","I planned my trip to Balboa Bay Club for a Christmas getaway.  The minute I arrived, I felt like I was in a Christmas Wonderland.  The hotel was decked out to the hilt with decorations, lights, trees, glitter.  It was stunning.  I completed a quick check in and was escorted to my spacious room.  I quickly unpacked, and headed to the A&O restaurant for lunch.  The view is spectacular -- right smack dab on the bay. with a bunch of large yachts dockside to make the scenario high glam.  Later that evening, we walked to a little grassy area on the hotel grounds, facing the bay, for the 110th Annual Boat Parade. It was a parade of large boats (aka yachts) on the water, totally decorated for the holidays.  So pretty!  We sipped yummy hot chocolate and nibbled on Christmas cookies, both",December 2018,none,none,"Thank you for celebrating the holidays with us, BarbaraB! We are thrilled to hear that you enjoyed so much of the Resort, including the Spa, restaurants, and Boutique. As you mentioned, The Christmas Boat Parade is a wonderful and unique holiday experience, and we're happy to hear that you enjoyed watching it from our Bayfront Lawn. Thank you again for sharing your experience -- we look forward to not only sharing your kind words with our staff, but also to welcoming you back to the Resort!",none,none,none,none,none,none,480,98
14 helpful votes,79 contributions,5.0 of 5 bubbles,Excellent stay,"We decided to stay here while being in Newport during the holidays. This resort is definitely a nice place to stay. It's not cheap but for us, it was worth the stay for a few nights.  The staff is super friendly.... the valet, the front desk, housekeepers, etc  The rooms all come with a balcony. We had a partial water view which still allowed for a great view to hang out on the balcony.  The rooms are good size. The two double queen beds in the room still allowed for adequate space for my wife, daughter, and me.  The location is about a 2 mile walk to the center of Balboa Island or the center of Newport Beach. We actually did the walk and back to Balboa Island with our 2yr old. It wasn't bad at all...and safe to walk.  The resort overlooks one of the many marinas in Newport and",December 2018,none,none,"Thank you for joining us this holiday season, @pennstathah, as well as sharing your experience! We are so happy to hear that you enjoyed your family getaway, as well our location and service, and look forward to welcoming you back to the Resort!",none,none,none,none,none,none,481,98
