Helpful Vote,Contributions,Overall Rating,Summary Heading,Summary,Date of Stay,Room tip,Trip Type,Manager Response,Location Rating,Cleanliness Rating,Service Rating,Value Rating,Rooms Rating,Sleep Quality Rating,Review Number,Index
16 helpful votes,28 contributions,5.0 of 5 bubbles,Wonderful Hotel,"We booked a anniversary weekend getaway and this hotel did not disappoint! From the moment we checked in Jazmin made sure our check in was flawless and asked us the reason for our stay. She sent a special anniversary token to our room that set a great vibe from the minute we walked in the room. After dinner, we came back to the room and saw we had night service. Our room had been cleaned up and our bed was made simply to just lay down without having to take decor pillows out.  They have a beautiful restaurant over looking the bay with sofas & fireplace, beautiful area to people watch and live music Saturday night. Sonya was great server.  This hotel blew my mind. A 10/10, we will certainly be back.",March 2023,none,Traveled as a couple,none,none,none,none,none,none,none,1,98
1 helpful vote,3 contributions,5.0 of 5 bubbles,We Love The Balboa Bay Club,"It is a treat for us to be in Newport Beach a couple times a year and we have loved returning to the resort the last five years! The service and attention to detail are top notch. Our favorite is to be in a room on the water watching the boats go by and enjoy watching or not all the action on the water no matter what time of day, dusk, nighttime or early morning! Joey greeted us with a smile and was terrific throughout our stay. Collin had helped us with luggage last year, and this time as well. We had a second floor middle over the restaurant, which we thought might be a bummer, and it wasn’t! We enjoyed the live music from our patio with a glass of wine. The housekeeping staff were all familiar to us, especially Lucia, who we love. We didn’t want service this time around,  but",July 2022,"Bay view rooms are gorgeous and you choose noise level by being on the patio, in the room door...",none,Thank you for sharing your experience with us and for choosing Balboa Bay Resort for the last 5 years! We are happy to hear that you enjoyed the resort along with our Bayview room and the many amenities on property. We appreciate you recognizing our staff that made your stay so memorable and we are excited for your return very soon.,5.0 of 5 bubbles,none,none,none,none,none,2,98
none,1 contribution,5.0 of 5 bubbles,The Boutique save's the day!,Last minute emergency meant we needed nice clothes and fast.  We stopped into the boutique and Danielle and Thalia rushed to our rescue.  Clothes purchased and all on sale.  Our thanks to these incredible women for saving the day!!  We are staying at the resort for ten days and it's great knowing they are here for us!  Thank you!!,February 2023,none,Traveled with family,"Thank you for telling us about your great experience at the Bayfront Boutique. We are so happy to hear that you found new outfits for your emergency. Thank you for choosing Balboa Bay Resort for your ten day stay and we hope to welcome you back again soon! Sincerely, Balboa Bay Resort Management Team",none,none,none,none,none,none,3,98
none,none,5.0 of 5 bubbles,Balboa bay resort,Danielle at the BayFront Boutique was extremely helpful with helping me find the perfect gift for my Daughter's 16th birthday. I couldn't have done it without her help! The hotel itself was fantastic. Very clean rooms.,January 2023,none,Traveled on business,"We're so grateful that you took the time to share your feedback with us.  It's great to hear that you had a positive experience.  We are glad that you were able to find your daughter a gift in our boutique and that you were provided with excellent service.   We hope you can stay with us again soon. Sincerely, Balboa Bay Resort Management Team",none,none,none,none,none,none,4,98
2 helpful votes,8 contributions,5.0 of 5 bubbles,"Friendly staff - excellent breakfast buffet, the store carries great items.","My room was well maintained and the housekeeping staff paid attention to details.  My room was immaculately kept.  The grounds were well kept and the staff very helpful and welcoming.  The gym was clean and had multiple exercise options (Peloton, Mirror, treadmill, etc).",January 2023,none,Traveled on business,"Hello Vanessa,  We appreciate you taking the time to provide us feedback on your stay.  We are happy to hear that you enjoyed the resorts amenities! We hope to welcome you back to the resort soon. Sincerely, Balboa Bay Resort Management Team",none,none,none,none,none,none,5,98
3 helpful votes,4 contributions,1.0 of 5 bubbles,"The service is so bad, please avoid this Hotel","Staying at Balboa Bay Resort is the worst travel experiences in my life. I stayed Balboa Bay Resort from 12/28 to 12/30  I usually only stay in large hotel chains but I decided to give it a try since Balboa Bay Resort is Amex Hotel collection, which was a huge mistake. The service was so bad, worse than many two star hotels. Balboa Bay Resort  is a 4 star and historic hotel, so I can’t help wondering if they are just reluctant to serve colored people  We checked in at around 3pm and found the AC at the room was not functioning, there was only heat. My husband called front desk and guest services multiple times (at least 3 times), but no one answered.  When the engineer came, the temperature was 84 degree. We had been at a room with such high temperature for more than one hour.",December 2022,none,Traveled as a couple,"Hi Connie, On behalf of Balboa Bay Resort, we are so sorry that your stay was unsatisfactory. We continue to take full responsibility for the issues and inconvenience you experienced. We have extended an offer to welcome you back for a complimentary overnight stay. We encourage you to please contact us at fdmanagement@balboabayresort.com and we would be happy to arrange at your convenience. Again, we are very sorry about the negative experience and hope we can welcome you back to the resort soon.  Thank you, Balboa Bay Resort Management Team",1.0 of 5 bubbles,none,none,none,none,none,6,98
20 helpful votes,16 contributions,1.0 of 5 bubbles,The worst experience ever,The worst experience ever. We celebrated the New Year due to fantastic experience of previous Year. For sure smth has changed on the management or even on ownership bcs it  was far from one year ago. The menu of ala cart dinner was strange with 3 different red wines and one glass për  each!!!! The band was low quality (less paid) compared with the previous one…,January 2023,none,Traveled with family,"Thank you for taking the time to provide us your feedback on your New Year's Eve experience. We sincerely apologize that your experience was not what you expected. We take pride in providing high quality holiday events with top tier dining and service, as our goal is create an unforgettable experience for our guests. If you would like to discuss this directly with a member of our management team, please reach out to us at fbmanagers@balboabayresort.com and we will be happy to hear more from you. We hope we can welcome you back to the resort soon for another opportunity to exceed your expectations.  Sincerely, Balboa Bay Resort Management Team",none,none,none,none,none,none,7,98
1 helpful vote,1 contribution,4.0 of 5 bubbles,"Worst Hostesses Ever @ A+O Restaurant, Balboa Bay Resort, Newport Beach, CA","Hotels stay is very nice. A+O Restaurant's foods are super delicious, and the waiter is A+++ services . However, we got the terrible experiences with the Balboa Bay Resort A + O  Restaurant / Bar's three hostesses on Saturday night, 12/3/2022.  Reserved for 3 adults and 2 kids at 7 p.m. around 4 p.m. same day. Arrived to restaurant, one of the three rude hostesses told to wait as table was not ready. After a while, a second very unfriendly one told us we need to seat with others guest!!! She told with an attitude to wait after we refused. Another 3rd one told us to come in with instruction that 3 adults will be sitting on the bar-like table with white tall chair, and 2 kids will be sitting on a different lower table!!! Another waiting game with those 3, we finally got in and had",December 2022,none,none,"Hello, Thank you for providing us your feedback. We are thrilled to know that you enjoyed the food and service, but sincerely apologize that your experience did not meet our standards. We have passed along your message to our team so that we can improve. If you would like to provide us any more information, you can reach out to us at fbmanagers@balboabayresort.com. We hope to welcome you back to the resort in the future so that we can have another chance to provide an amazing dining experience at A+O Restaurant | Bar.  Sincerely, Balboa Bay Resort Management Team",none,none,none,none,none,none,8,98
24 helpful votes,34 contributions,5.0 of 5 bubbles,Nicest 4-star hotel,"Wow! What a beautiful hotel. Don't be fooled by its  4* rating. It is probably the nicest 4* star hotel.  With that being said, there is no beach access and there is nothing to explore within walking distance (except Ferrari and Maserati dealerships!). But Fashion Island, Balboa Island are not far. And free Evian and Pinot Noir bottles are a nice touch!",November 2022,none,Traveled on business,"Thank you so much for your feedback. Although we do not have instant beach access, our valet offers a shuttle service that can take you to the nearest beach as well as Fashion Island or any other nearby stores or restaurants. We are glad that you enjoyed your stay with us and we hope to see you back with us again soon!",none,none,none,none,none,none,9,98
none,1 contribution,5.0 of 5 bubbles,Spa treatment- Diamond Facial,"Was very pleased with the customer service extended to me. It was positively memorable. Everyone that I came in contact with greeted me and ensured I was comfortable and well taken cared of. Would highly recommend Angeline. Previously had facials done in Dallas, Pebble, etc.. I have to say, Angeline is top tier. So wonderful.. I was struggling not to fall asleep. lol.  Ally - Locker room staff was friendly and was a pleasure to chat with. She expressed gratitude about her day. Corina and Jocelyn at the front desk were very nice.  Goal met with staff customer service. Excellent.  T’was a great day. I’ll be back again!!",November 2022,none,Traveled solo,Thank you for sharing your positive experience with us. We appreciate you recognizing those team members that made your stay so memorable and are happy to hear that you enjoyed your time at the Spa. We look forward to seeing you again!,none,none,none,none,none,none,10,98
none,5 contributions,5.0 of 5 bubbles,Outstanding service!,"Nice hotel with nice amenities. But the service is what really sets this hotel apart! The conference room support from Miguel and his team was amazing...from the meal service to the IT support! The check-in staff was great, the concierge was great, the housekeeping staff was very friendly, and the wait staff at the bar and restaurant were great! Rooms were spacious, clean, and well-appointed.",November 2022,none,none,Thank you so much for sharing your positive experience. We are happy to hear that you enjoyed your stay with us and will make sure to relay this message to our team. We hope to see you again very soon!,none,none,none,none,none,none,11,98
22 helpful votes,17 contributions,3.0 of 5 bubbles,Make sure to get a Bay-side room if you want a quiet stay,"Very nice and comfortably furnished rooms. BUT many rooms face on Hwy 1 which is very busy and loud with motorcycle and hot car mufflers. When I asked if my room was considered a quiet room, I was told yes, and it faces ""our neighborhood"". Rooms facing away from the highway carry a $150-300 surcharge. They did not do a good job when building the hotel to install proper soundproofing.",October 2022,none,none,"Thank you for taking the time to provide us with your feedback. While we are located on the Pacific Coast Highway, we are fortunate enough to also be located right on the water and offer multiple room types and views to accommodate all preferences. We also offer ear plugs for any noise that may impact the guest experience. We apologize that your stay was not what you expected and we hope to have another opportunity to exceed those expectations in the future. Please feel free to reach out to us at reservations@balboabayresort.com for your next visit so that we may personally assist you in making your reservation.",none,none,none,none,none,none,12,98
1 helpful vote,3 contributions,4.0 of 5 bubbles,Comfortable Clean but Overpriced hotel. Restaurant was delicious. Resort fee $30 will be extra and self park is $39,I would rate this place 3.8. Its nice but it is older style nice. Many things are dated and the pricing is as if its ultra modern chic with a great view. Its very overpriced. But it is clean. The view is of the marina but the marina is stacked with boats where you can barely see water so its just ok. It has access to a dock which is good if you have a boat. The restaurant had delicious food. The rooms are clean. The TVs are older. They charge $30 for resort fee and $39 to self park in a parking lot which is a walk away from the place.  Which basically means all rooms are $69 more expensive then what they quote. If you get a room not with a view you face the road which is not pleasant. But almost all rooms have a balcony. The pool was nice also but simple and much older. Thank,October 2022,none,none,"We appreciate you taking the time to provide us with your feedback. We are proud to offer an array of amenities included in the resort fee such as wifi, pool, fitness center access, shuttle, and more. Our self parking fee is $36 to safely park on property instead of the busy Pacific Coast Highway. We are happy to hear that you enjoyed your overall stay and hope to see you back with us again soon! Please reach out to us at reservations@balboabayresort.com so we can personally assist with your next reservation.",none,none,none,none,none,none,13,98
none,1 contribution,5.0 of 5 bubbles,Blend coffee shop,Be sure to check out the resort’s coffee shop. You will be treated very well by Michael Johnson and Reagan Temple. They both went above and beyond with their customer service by making sure all our drinks were perfect. We will be coming back because of them.,October 2022,none,none,Thank you for taking the time to share your positive experience with us. We are happy to hear that you enjoyed our coffee shop and appreciate you recognizing those team members that made your experience memorable. We will be sure to relay the information onto our team and look forward to your return visit to Blend!,none,none,none,none,none,none,14,98
1 helpful vote,1 contribution,3.0 of 5 bubbles,"Good Convention / Wedding Venue, Not Resort Stay",Newer remodeled hotel on marina. Upon seeing the hotela nd surroundings we realized it was not the resort setting we had hoped. Rooms and pool are basic and hotel Sterile. To add insult they held us to our reservation when we asked to cancel upon seeing the hotel. Not happy about that nor the Bed and Breakfast special we thought was a Food & Beverage credit but learned it all had to be used for breakfast. Clearly not a mgmt team looking to inpsire trust and good will to guests they hope would return. If it is a resort setting you are looking for this is not the place.,October 2022,none,none,Thank you for taking the time to provide us with your feedback. The Bed and Breakfast package states on our website and email confirmation that there is a 5 day cancellation policy and a daily breakfast credit. We apologize for any confusion you may have experienced. We strive to provide excellent customer service to our guests and we apologize if your stay with us was not what you expected.,none,none,none,none,none,none,15,98
28 helpful votes,8 contributions,4.0 of 5 bubbles,Great Place,"This is the second time we've stayed there.  We went there for a few days a few weeks ago.  Our room wasn't ready yet, so they offered us a glass of wine.  After just a few minutes wait, the room was ready.  Up at the room, there was a bottle of wine in the frig.  Our room was very clean and the view was amazing!  Later in the early evening we received a charcuterie board with lots of yummies.  The staff was very friendly.  We will be back!!",September 2022,none,none,Thank you for sharing your positive experience with us. We are happy to hear that you enjoyed your stay and the many amenities we had to offer. We look forward to your return visit for another memorable stay!,none,none,none,none,none,none,16,98
85 helpful votes,75 contributions,3.0 of 5 bubbles,"Some very nice featuring, but many gating factors","I recently stayed at the hotel for 10 days.  The first several days were on my own; the last half of the stay my husband joined me.  Due to lack of room availability (my issue since I booked late), I had a room that overlooked the driveway for the first part of my stay, and a beautiful Bay Room for the second part of the stay.  For context, pre-COVID I travelled around 120 - 150 days a year for work.   I am just getting back into travel mode, and boy everything feels more difficult these days.  I am a total princess when it comes to hotels, and tend to stay at Four Seasons, Langham, Peninsula, Mandarin - you get the idea.    The reason for the choice of this hotel was that I am a member of a reciprocal club, and that gave me access to the Balboa Bay Club, which is right beside",September 2022,none,none,none,none,none,none,none,none,none,17,98
4 helpful votes,7 contributions,3.0 of 5 bubbles,Hotel was fine. Not great but not bad,"The hotel was fine.  They did give us a complimentary bottle of champagne for our anniversary and my husband’s 60th bday. This was a nice treat.   The biggest disappointment is there isn’t much to see or do at this hotel. There is no beach and a small pool area that is not very nice. Also we tried to go for a walk in the morning but there is no where to walk to. You can go on PCH but it’s high traffic and there is nothing close by. No shops, boutique or cafes are within walking distance. You would need to drive. There is a small bay in front of the hotel that you can see water but there are so many giant boats in front that it blocks the view. And you can’t walk at their bay front because the hotel’s portion of the bay is super small.  The pool was a bit depressing. Needs",September 2022,none,none,"Thank you for taking the time to provide us with your feedback. We are happy that our customer service exceeded your expectations, but apologize that the entirety of the stay was not what you expected. Since we are located on Pacific Coast Highway, it can be fairly busy in the surrounding area. Therefore, we do our best to offer shuttles to and from the beach, Fashion Island and other hotspots in the Newport Beach area. Our goal is to provide our guests with exceptional service so we will make sure to pass along your concerns to our management team so that we may improve for the future. If you have any further questions or concerns, please do not hesitate to contact us at reservations@balboabayresort.com.",none,none,none,none,none,none,18,98
1 helpful vote,1 contribution,1.0 of 5 bubbles,weekend visit,"My review is based on Value-Cost vs. experience.  This is at best a 1 star value-let me explain, first we are paying an astronomical price for a 1 bedroom suite-we agreed to it, so that is on us, but I am willing to pay up for great service and amenities, this is anything but.  Second there are an incredible amount of fees and taxes on top of my astronomical room rate, amounts to about 30% of room rate-occupancy tax, sales tax, resort fees, parking, etc, no other hotel in the area I could find has this level of fees and couldn't find anyone else charging a 10% occupancy tax.  Second room is Ok, good view but overlooking club pool that is extremely loud, so making difficult to enjoy our balcony view.  Room air conditioning is barely working so it was hot in bedroom and bathroom",September 2022,none,none,"We appreciate you taking the time to provide us with your feedback. We apologize that your stay did not meet your value cost vs. experience expectations. Many resorts charge a resort fee and charge for parking in addition to the room or suite rate. Hotel taxes in this area amount to 13.25% which can seem like a lot when you add it to the price of a suite. Although some of our rooms are located on the club side, we do offer similar amenities on the resort side as well as a shuttle to nearby beaches. Our staff normally points that out during the check in process. We hope that you will give us another chance to exceed your expectations if you find yourself in the Newport Beach area again. Please do request the resort side so we can make sure you have a more quiet experience overlooking the water. Do not hesitate to reach out to us if you would like to discuss further at reservations@balboabayresort.com.",none,none,none,none,none,none,19,98
1784 helpful votes,1247 contributions,2.0 of 5 bubbles,"Underwhelmed, beach and pool areas of property for members only and not hotel guests","Had huge expectations for the visit based on reviews but very underwhelmed by the boxy property that lacked warmth, originality, or options to enjoy the bay.  Small beachfront area on the bay and that is displayed in advertising was not open to guests as the property doubles as a private club that allows only members to use the beach and pool area.  The hotel space seems to be set up for banquets more than an intimate hotel space.  Also very high priced for the room and the food.",June 2022,none,none,"Thank you for providing us with your feedback. We apologize that your experience with us did not exceed your expectations. Although our beachfront area is restricted to members, we are proud to offer our courtyard pool on the resort side of our property as well as shuttles to take guests to nearby beaches. We hope to welcome you back to our property soon!",none,none,none,none,none,none,20,98
none,1 contribution,5.0 of 5 bubbles,Sensational getaway !,"Last minute trip down to Newport Beach found balboa bay club thru a friend and so thrilled we stayed there. It’s the perfect spot to enjoy the area. Natalie the manager was professional ,welcoming and always made us feel special. Alberto in AO restaurant is a gem - you must eat there and ask for him . Can’t wait to return.",August 2022,none,none,Thank you for sharing your positive experience with us and for pointing out the team members that made your stay memorable. We are glad that you enjoyed your time at Balboa Bay Resort and enjoyed the area as well. We hope to see you back with us again very soon!,none,none,none,none,none,none,21,98
none,1 contribution,5.0 of 5 bubbles,"Treat yourself to the backdrop of yachts, breezy open air restaurant and chill vibe of the pool with cocktail bar.","I stayed here for a few days on business, but it felt like a vacation. From the moment you enter the serene lobby, to the friendly front desk( Natalie), to eating delicious seafood at A & O, to the fun bartenders at the pool bar..you will feel pampered. The excellent service at A&O by Lucias and Didi, and Tara at the bar, is refreshing and great hospitality. Room service for breakfast is great and very quick and the individual business rooms helped me work on the go. Valet( Darren) will kindly take you to the beach and Pier and the Shop by the spa had nice staff and great branded sweatshirts( bought one for my Dad). Overall, the staff and positive vibes of this resort are amazing.",August 2022,none,none,Thank you so much for sharing your positive experience with us. We are happy to hear that you enjoyed your stay with us for your business trip. We truly appreciate you recognizing those team members that made it so memorable and hope to see you back with us again very soon!,none,none,none,none,none,none,22,98
13 helpful votes,12 contributions,4.0 of 5 bubbles,Girls Trip,"Quick weekend girls trip! We have stayed a number of times at Balboa Bay and never have been disappointed.  Valet and Front desk staff were fantastic! It was very busy , but they are a well oiled machine.  Room was spacious and very clean! Had lunch at A + O and the food was delicious.  Pool has plenty of seating and live music on the weekends.  We sat on our patio and listened to the musician.  Coffee shop is great for breakfast. It is centrally located to restaurants and shopping.  No beach access unless you are a member, but even then I wouldn’t consider that a true beach.  It is an easy drive to Newport Beach.  Will definitely be back!",August 2022,none,none,Thank you for choosing us for your girls trip weekend. We are happy to hear that you enjoyed the resort and the many amenities it has to offer. We hope you enjoyed the Newport Beach area and look forward to your return visit!,none,none,none,none,none,none,23,98
