Helpful Vote,Contributions,Overall Rating,Summary Heading,Summary,Date of Stay,Room tip,Trip Type,Manager Response,Location Rating,Cleanliness Rating,Service Rating,Value Rating,Rooms Rating,Sleep Quality Rating,Review Number,Index
6 helpful votes,11 contributions,1.0 of 5 bubbles,Terrible front desk service,"Beware that this hotel is very inflexible on bookings. I had booked a trip for my wife and daughter for a trip away for 4 nights through hotels.com. We needed to change to 3 nights due to change in school spring break dates but were told upon check in that this was not possible and we would be charged for 4 nights. There was no flexibility at all. We went back to Hotels.com, who were very helpful and were willing to make the change without cost....however the Balboa Resort refused. Really poor customer service......",March 2018,none,none,"Hello Francis C,  Thank you for sharing your comments. I truly sympathize and apologize for the trouble and frustration you experienced with you reservation change request. Unfortunately, when a reservation is made through an OTA, like Hotels.com, the actual confirmation comes from them directly, not Balboa Bay Resort. While we strive to accommodate our guests in anyway, we aren’t always able to adjust OTA reservation requests based on present availability. I apologize we were not able to make the reservation change. Please know your comments regarding the poor customer service will be reviewed and thoroughly discussed. I hope you will give us another opportunity as some point in the future. Warmest Regards,  Sam El-Rabaa General Manager Balboa Bay Resort",none,none,none,none,none,none,606,98
51 helpful votes,27 contributions,5.0 of 5 bubbles,Love the Balboa!,"This is a wonderful spot  - fabulous staff, nice rooms, pool area very relaxing, lovely new spa, good food and such a pretty location on the water. Can't wait to return! Even though it's close to the main road, its secluded enough to enjoy peace and quiet.",March 2018,none,none,"Hello Suzzywalsh,  Thank you for sharing your recent experience at Balboa Bay Resort. I’m delighted how much you enjoyed our property and had the opportunity to experience so many of the wonderful amenities. I’m most pleased to hear that our staff provided fabulous service. We truly look forward to having you back the next time you visit Newport Beach.      Warm Regards,  Sam El-Rabaa General Manager Balboa Bay Resort",none,none,none,none,none,none,607,98
2 helpful votes,6 contributions,5.0 of 5 bubbles,It Couldn't Have Been Any Better!!,"We held our annual Luncheon at the hotel and everything was fabulous; as a matter of fact, it couldn't have been any better. From the time we contracted and started working with the catering and logistics staff, we knew that we had selected the right place. Everyone went out of their way to make sure that they accurately understood what our goals were so they could help us reach them - and we did! We smoothly transitioned 250 guests through a pop-up boutique, silent auction and luncheon with fashion show without a hitch. We were delighted with the service we received and actually were able to enjoy the event as much as our guests did. Job well done!",March 2018,none,none,"Hello sccjohnson,  Thank you for sharing your wonderful luncheon experience at Balboa Bay Resort. I’m so thrilled how much you and your guests enjoyed the event, and especially love to hear that our staff provided such attentive and professional service. I’ll certainly share your remarks with our entire team and we look forward to having you join us again soon for another luncheon hopefully very soon.    Warm Regards,  Sam El-Rabaa General Manager Balboa Bay Resort",none,none,none,none,none,none,608,98
none,3 contributions,4.0 of 5 bubbles,Much needed relaxation,"Stayed here for four nights and was very happy with our accommodations. The room was spacious and quiet with a great view. The staff was friendly and helpful. Fitness center, pool and hot tub were all well maintained. Would definitely come here again!",March 2018,none,none,"Hello Beth C,  Thank you for sharing your recent experience at Balboa Bay Resort. I’m thrilled how much you enjoyed your four-night stay and were so pleased with your spacious guest room and the resort’s amenities. I especially love to hear about the friendly and helpful service you received from our entire team. I always love reading when we deliver a true Newport Beach experience to our guests. I’ll certainly share your comments with everyone and we look forward to having you stay with us again soon.       Warm Regards,  Sam El-Rabaa General Manager Balboa Bay Resort",none,none,none,none,none,none,609,98
64 helpful votes,165 contributions,5.0 of 5 bubbles,Beautiful Balboa,"I have stayed here twice now by choice. We have two rooms one bayfront and one standard for our sons. It is worth every penny for the bayview room with balcony. The decor is pleasant, room service is excellent. We ate onsite in a gastropub type ambiance. Very nice food with live music when we were there on a Friday night. Outside there is comfortable seating and firepits. There is a pool with sunbeds in an enclosed courtyard type area. When checking in I would advise against being put in the other building, the main building is much better. The hotel is not overbig but good location. There is valet parking, selfserve isnt woth the hassle they valet men are superquick and polite. This hotel is not cheap but you get what you pay for and I love it.",September 2017,none,none,"Hello benmores,  Thank you for sharing your recent experience at Balboa Bay Resort. I’m thrilled how much you and your family enjoyed your time with us for the second time. I love to hear your comments regarding the décor, atmosphere and satisfaction of your dining experiences, both at A&O and in your guest room. You can be certain your comments with be shared with our team and we look forward to having you and family stay with us again very soon.   Warm Regards,  Sam El-Rabaa General Manager Balboa Bay Resor",none,none,none,none,none,none,610,98
none,1 contribution,5.0 of 5 bubbles,Beautiful Balboa Bay Resort,"Wonderful place to stay and refresh.  The staff is over the top friendly and helpful.  Plenty of dining options and good night life as well.  Rooms are very clean, quiet and comfortable.  We will be back.",February 2018,none,none,"Hello thruby,  Thank you for sharing your recent experience at Balboa Bay Resort. I’m thrilled how much you enjoyed your refreshing stay in our clean and comfortable guest rooms, and had the opportunity to have some great dining experiences with good night life. I’m most pleased to hear about the exceptional over the top service you received from our entire team. I always love reading when we deliver a true Newport Beach experience to our guests. You can be certain I’ll share your comments with everyone here on property and we look forward to having you stay with us again during your next to the area.      Warm Regards,  Sam El-Rabaa General Manager Balboa Bay Resort",none,none,none,none,none,none,611,98
1 helpful vote,4 contributions,4.0 of 5 bubbles,"High-End rooms, great location","I went to this hotel on company business and never saw the bill, so I can't speak much about price, however my room was very nice and clean.  The bed was very comfortable.  My room had a small balcony seating area which I would likely have used if I was there longer. Table w/2 chairs and 2 additional cushioned chairs.  Extra large shower, no tub. separate toilet area, Keurig machine.  In room medium sized Evion water I saw had a 8.00 price tag!!! Ouch!!!  Staff was all very nice and helpful.  We took about a 15 minute drive to Mastro's...that is a must go to restaurant that is nearby.",February 2018,none,none,"Hello cdjopinion,   Thank you for choosing to stay at Balboa Bay Resort and sharing your comments. I’m pleased you enjoyed your guest room and very much like to hear that our staff provided friendly and helpful service. I’ll certainly share your remarks with team and hope to welcome you back for business or leisure the next time you visit Newport Beach.    Warm Regards,  Sam El-Rabaa General Manager Balboa Bay Resort",none,none,none,none,none,none,612,98
none,2 contributions,5.0 of 5 bubbles,Amazing hotel,"I stayed here for one night celebrating my friend’s birthday and we had a great time. Everyone from valet to housekeeping was fantastic. Damian and Brianna at the front desk made our stay even better by putting balloons and some truffles in our room while we were at dinner. Food at A&O was great for dinner, having a cocktail at the fire pits with the view of the harbor is priceless. Will definitely come back!”",February 2018,none,none,"Hello,  Thank you for taking the time to review experience. I’m so pleased you and your friend choose Balboa Bay Resort to celebrate this special birthday and delighted to hear how much you enjoyed everything, especially the friendly and personalized service you received from Damian, Brianna, and our entire team. You can be certain your comments will be shared with our entire team. We look forward to having you and your friend back for many more memorable experiences very soon.     Warmest Regards,  Sam El-Rabaa General Manager Balboa Bay Resort",none,none,none,none,none,none,613,98
5 helpful votes,10 contributions,5.0 of 5 bubbles,Doesn't get any better,"My wife and I stayed for a quick getaway weekend and it was magic!  We were greeted by JR who welcomed us and diecrted us to check in.  Damien and his team were amazing and made check in so easy.  In fact every staff member we ran into was so nice and so friendly.  We had happy hour drinks in A&O and Tara was so helpful and friendly and after drinks we took the shuttle to a local restaurant for dinner.  Our room was amazing with a stunning view of the bay behind the resort.   It was hard to leave and I wish we had booked a longer stay.  I wish I could give extra stars,",February 2018,none,none,"Hello Lawrence B.,  Thank you for choosing Balboa Bay Resort to enjoy a quick getaway weekend and sharing your experience. I absolutely love to hear about the personalized and friendly service you received upon arrival from JR, during check in from Damian, as well as our entire team throughout the duration of your stay. It’s wonderful to also hear how much you enjoyed A&O and your guest room. You can be sure your comments will be shared with everyone. We truly look forward to having you and your wife back the next time you’re looking to enjoy a quick weekend getaway.   Warmest Regards,  Sam El-Rabaa General Manager Balboa Bay Resort",none,none,none,none,none,none,614,98
139 helpful votes,317 contributions,5.0 of 5 bubbles,SERVICE PERSONIFIED!,I love this hotel. Great location and water views. The thing that stands out for me is the service. It is outstanding!  The ambiance is what you would expect from a 5 Star but being on the water adds a little something extra.,February 2018,none,none,"Hello Gbusiek,  Thank you for choosing Balboa Bay Resort and sharing your experience. I’m delighted how much you loved the hotel, location and atmosphere. I’m especially pleased to hear about the outstanding 5-star level service you received from our entire team. You can be sure your comments will be shared with everyone and we look forward to hosting you for another great experience the next time you visit Newport Beach.   Warmest Regards,  Sam El-Rabaa General Manager Balboa Bay Resort",none,none,none,none,none,none,615,98
63 helpful votes,80 contributions,5.0 of 5 bubbles,Bliss and Beauty,"We loved our stay at Balboa Bay Resort. It has all the bells and whistles. Spacious rooms, large comfortable baths and great service.  Every aspect of the staff from parking valets to front desk to wait staff to housekeeping are exceptional. The location is easy to access and right on the harbor. Highly recommended.",February 2018,none,none,"Hello Anglophile20, Thank you for sharing your recent experience at Balboa Bay Resort. I’m thrilled how much you loved your stay and the entire atmosphere of the property, specifically the spacious and guest rooms. I’m most pleased to hear about the exceptional service you received from our entire team. I always love reading when we deliver a true Newport Beach experience to our guests. You can be certain I’ll share your comments with everyone here on property and we look forward to having you stay with us again during your next to the area.      Warm Regards,  Sam El-Rabaa General Manager Balboa Bay Resort",none,none,none,none,none,none,616,98
19 helpful votes,64 contributions,5.0 of 5 bubbles,Beautiful little gem!,"I recently stayed at this beautiful boutique style hotel. The accommodations are Gorgeous! They are veryluxurious with Frette linens and fresh bath products.  Rooms are spacious, light, and airy. This hotel has a definite coastal feel and is located bayfront. I dined at both restaurants at the hotel, A&O and Waterline. Brunch and dinner or both amazing! Both are lively spots and the bar has live music at night. Cocktails and food are reasonably priced. Valet parking is quick and easy!  There is also a spa located on site with very competitive pricing. The grounds are immaculate, and the views are breathtaking. There is outdoor seating at both restaurants, although I do recommend a reservation for preferred seating. I will definitely return.",February 2018,none,none,"Hello MDKlein43,  Thank you for sharing your recent experience at Balboa Bay Resort. I’m delighted how much you enjoyed our beautiful boutique style hotel and atmosphere. I love to hear your comments regarding your spacious and airy guest room and wonderful dining experiences at both Waterline and A&O. I’m also very pleased to hear about quick, efficient and friendly service you receive from our valet team. I’ll definitely share your wonderful comments with our entire team. We truly look forward to having you stay with us again the next time you are in town.      Warm Regards,  Sam El-Rabaa General Manager Balboa Bay Resort",none,none,none,none,none,none,617,98
none,1 contribution,5.0 of 5 bubbles,N\A,Just would like to be on the third floor when situated with a view of the drive up to see the Bay otherwise the room area was still good and convenient and noise level was fine and did not disturb us.,January 2018,none,none,"Hello Gayle F.,   Thank you for choosing Balboa Bay Resort. While I understand a view of the beautiful Balboa bay adds to the overall experience, I’m pleased you enjoyed your room and had a convenient stay. I hope you will choose to saty with us the next time you frequent Newport Beach.    Warmest Regards,  Sam El-Rabaa General Manager Balboa Bay Resort",none,none,none,none,none,none,618,98
none,2 contributions,5.0 of 5 bubbles,Clean/Friendly People,Very nice hotel with many amenities that is excellent for corporate events.  The staff and workers are very friendly and helpful.  Located conveniently off the PCH with many activity options available nearby.,February 2018,none,none,"Hello danielpX7104UG,   Thank you for choosing to stay at Balboa Bay Resort and sharing your comments. I’m very pleased you enjoyed the property, location and our many great amenities for corporate events. I’m most pleased to hear that our staff was friendly and helpful. I’ll certainly share your remarks with our entire team and we look forward to having you join us again soon the next time you visit Newport Beach.    Warm Regards,  Sam El-Rabaa General Manager Balboa Bay Resort",none,none,none,none,none,none,619,98
27 helpful votes,14 contributions,5.0 of 5 bubbles,"Newport Beach, CA hotel","The Balboa Bay Resort is a gem nestled in the Newport Beach harbor.  The view of all of the yachts tied up at the doc, the wonderful rooms, the great bar and the fine breakfast room make for a great place to stay if your travels bring you to Newport Beach.",July 2017,none,none,"Hello Kenneth E N,  Thank you for sharing your recent experience at Balboa Bay Resort. I’m delighted you enjoyed so many of the resort’s amenities and atmosphere. We are very proud of our location and delivery a true Newport Beach experience to our guests. I’ll definitely share your comments with our entire staff and we look forward to having you stay with us again during your next visit to Newport Beach.      Warm Regards,  Sam El-Rabaa General Manager Balboa Bay Resort",none,none,none,none,none,none,620,98
9 helpful votes,12 contributions,5.0 of 5 bubbles,Great stay in a beautiful location,"Stayed here for two days on a business trip. Conference facilities were good for a small group. Room was great and the view over the bay was gorgeous. Everything, including food and service, was excellent.",February 2018,none,none,"Hello Francesa,   Thank you for choosing Balboa Bay Resort for your two-day business trip and sharing your experience. I’m delighted you enjoyed the food, meeting rooms, guest room and views of the gorgeous Balboa Bay. I also very much like to hear about the excellent service you received from our staff. You can be certain your comments will be shared with our team and we look forward to having you stay with us the next time business brings you to the area.   Warmest Regards,  Sam El-Rabaa General Manager Balboa Bay Resort",none,none,none,none,none,none,621,98
none,1 contribution,5.0 of 5 bubbles,Perfect Two-Day Stay,"Valet parking service is the best.  The staff is courteous, friendly and very helpful.  The servers in restaurants were also courteous, friendly and very helpful.  Our room had major upgrades since the last time we stayed here. Indeed, the entire hotel has been upgraded.  We barely recognized the lobby.  This is a 5 star luxury hotel in my opinion.",January 2018,none,none,"Hello J621KHdanielg,  Thank you for sharing your recent experience at Balboa Bay Resort. I’m delighted how much you enjoyed our recently enhanced property and felt it is a 5-star luxury hotel. I’m especially pleased to hear about courteous, friendly and helpful service you received from our valet team, restaurant staff and entire team. I’ll definitely share your comments with everyone and we look forward to having you stay with us again the next time you choose to visit Newport Beach.      Warm Regards,  Sam El-Rabaa General Manager Balboa Bay Resort",none,none,none,none,none,none,622,98
7 helpful votes,6 contributions,5.0 of 5 bubbles,"Great Memorable Weekend,","I decided to celebrate my wife’s birthday and our anniversary at this resort and, I’m so happy we stayed here. Everything was first class from check-in to check-out. Great location with amazing staff especially Damian who made our weekend so special.",January 2018,none,none,"Hello S B,  Thank you for choosing Balboa Bay Resort to celebrate your wife’s birthday and sharing your experience. I love to hear how much you enjoyed everything from check-in to check-out, and most pleased to hear about the friendly and personalized service you received from Damian to make it such a memorable weekend. We look forward to having you and your wife join us again the next time you’re looking to celebrate a special occasion.   Warmest Regards,  Sam El-Rabaa General Manager Balboa Bay Resort",none,none,none,none,none,none,623,98
47 helpful votes,131 contributions,4.0 of 5 bubbles,Love the Location and the Service is Super!,"Spent a couple of work/fun days with my gal. The hotel is great. Service wonderful. View - right on the water. Only downside was our room (#115) was directly across the fitness center. Nothing like hearing doors open, weights being dropped, treadmill running at 5:30 am.  That being said, we would definitely come back again.",January 2018,none,none,"Hello rmarkman,   Thank you for taking the time to review your experience at Balboa Bay Resort. I’m so pleased to hear that you enjoyed the entire property and views of the water. I do apologize however for the noise coming from our fitness studio across from your guestroom. I’m very glad to hear it didn’t impede upon your time with your significant other and you plan to return for another great experience soon. We look forward to having you back the next time you frequent the area.  Warm Regards,  Sam El-Rabaa General Manager Balboa Bay Resort",none,none,none,none,none,none,624,98
none,5 contributions,5.0 of 5 bubbles,Best Birthday at Balboa Bay Resort!,"My husband booked this hotel for my birthday, and we had a wonderful time. The view from our room was spectacular. Loved the Frette robes and sheets, felt so pampered and slept fabulously. A big thanks goes out to Damian at the front desk, not sure how he knew it was my birthday, but he went out of his way to make my birthday that much more special. The staff was awesome, and they made our stay so memorable that I can't wait to come back. Thanks again, Damian.",January 2018,none,none,"Hello Peggy B.,   Thank you for taking the time to review your birthday experience. I’m so pleased your husband choose to celebrate your special day with us at Balboa Bay Resort and delighted to hear how much you enjoyed everything, especially the friendly and personalized service you received from Damian and our entire staff. You can be certain your comments will be shared with our entire team. We look forward to having you back for many more memorable experiences some time very soon.     Warmest Regards,  Sam El-Rabaa General Manager Balboa Bay Resort",none,none,none,none,none,none,625,98
none,2 contributions,5.0 of 5 bubbles,Simply amazing,"I cannot describe how beautiful the room and view was.  Upon my arrival, the sun was setting against the enormous yachts providing us a breathtaking view.  The room was perfect...and clean!  So clean in fact, my wife took a bath, which I have never seen her do in a hotel restroom.  She did a little cleanliness test, and it passed.  We even used the comforter while sleeping The food was excellent and staff was even better.  We had a 2 day workshop and they provided us top notch service.  After setting down a dirty dishes on the tray, they were immediately  picked up.  All servers had a smile and were eager to tend to all our needs.",January 2018,none,none,"Hello Mike B., Thank you for sharing your recent experience at Balboa Bay Resort. I’m delighted how much you enjoyed your guest room and the entire atmosphere of the property. I’m especially pleased to hear about the top-notch and friendly service you received from our catering and banquet team. I’ll definitely share your comments with our entire staff. We look forward to having you stay with us again during your next workshop or leisure visit to Newport Beach.      Warm Regards,  Sam El-Rabaa General Manager Balboa Bay Resort",none,none,none,none,none,none,626,98
4 helpful votes,3 contributions,3.0 of 5 bubbles,"Great setting, staff need hospitality training","Beautiful setting but the staff consistently lacked enthusiasm and basic hospitality skills. The front desk staff seemed more interested in catching up with each other than taking care of welcoming our stay. Someone came to clear our table and I thought he was some guy off the street as he had casual clothing on and didn't smile, introduce himself, etc. I gave him a look like what's up and he abruptly responded I'm here to clear the plates... just not the service I expect at a high end establishment. I really like the location, rooms, etc.. just a little basic hospitality could go a long way",January 2018,none,none,"Hello Rosemary F.,  Thank you for taking the time to review your experience at Balboa Bay Resort. While pleased to hear you enjoyed the beautiful setting of the property, I’m disappointed to read that our level of staff service missed the mark. We truly strive and train our team to deliver personalized, attentive, welcoming and friendly service for each and every guest, so I never like to hear when we fall short of our goals. Please know your comments will be share with our entire team so we can use this for learning and continued growth. I hope you choose to stay with us at Balboa Bay Resort so we can deliver the experience I know we’re capable of providing.   Warm Regards,  Sam El-Rabaa General Manager Balboa Bay Resort",none,none,none,none,none,none,627,98
87 helpful votes,430 contributions,4.0 of 5 bubbles,Spacious waterside hotel and restaurants,"Great location right by the harbor, next to boats at their slips.  Room was large, quiet, clean and comfortable.  Front-desk and restaurant service was faultless.  Bar was buzzing on a Friday night with live music.",January 2018,none,none,"Hello Jon H.,  Thank you for choosing to stay at Balboa Bay Resort and sharing your experience. I’m so pleased to hear how much you enjoy your clean, spacious and comfortable guestroom and had the chance to enjoy live music and the energy of A&O. I’m especially like to hear your comments about the faultless service you received from our teams at the front desk and A&O. I never tier of hearing these great comments and knowing we are achieving our goals. I’ll definitely share your comments with our entire team and we look forward to having you stay with us again.      Warm Regards,  Sam El-Rabaa General Manager Balboa Bay Resort",none,none,none,none,none,none,628,98
