Helpful Vote,Contributions,Overall Rating,Summary Heading,Summary,Date of Stay,Room tip,Trip Type,Manager Response,Location Rating,Cleanliness Rating,Service Rating,Value Rating,Rooms Rating,Sleep Quality Rating,Review Number,Index
1 helpful vote,1 contribution,5.0 of 5 bubbles,Awesome stay,Balboa Bay Resort is as luxurious as it is beautiful. You won't regret your stay. The staff are exceptional and the food is awesome. If you have the chance to stay in one of the bay suites enjoy the view with a drink. It's so worth it.,August 2020,none,none,"Thank you for sharing your five star review with us, clwyhwh4. We are so happy to hear that you enjoyed your stay and that our kind staff, dining options and waterfront location made your stay even better. We can't wait to welcome you back again soon.",none,none,none,none,none,none,233,98
1 helpful vote,1 contribution,2.0 of 5 bubbles,Overall very disappointing,Poor maintenance in room. Plumbing was poor. Loud banging at night. Air conditioning was not functioning well. Room service was poor. Food at the pool was overpriced and very mediocre. For the money we expected much more. Room was also not very clean. Unfortunately we won’t be staying here again,August 2020,none,none,"Thank you for taking the time to provide feedback about your most recent stay with us anycl1339ZE. First off, we want to apologize for the experience you had in your guest room. As customer service is our passion, it saddens us to heat that we did not meet expectations. It is our hope that you will give us another opportunity to serve you in the future so that we can be sure to turn this around for you during your next visit.",none,none,none,none,none,none,234,98
1 helpful vote,1 contribution,1.0 of 5 bubbles,A getaway,"Room smelled like dog urine, tv in the bathroom did not work, shower drain took forever to drain. No body enforced wearing a mask. They had a wedding going on music way to loud for people to enjoy sitting out on a balcony. Hardly no one wearing a mask at the wedding. Just a very horrible experience.  You think staying in the governors suit things would be amazing. It wasn’t!",August 2020,none,none,"Thank you for taking the time to review Balboa Bay Resort, Getawayallover. We appreciate your feedback regarding your room and apologize for any inconvenience regarding potential noise from our outdoor intimate wedding. Our team is enforcing mask wearing as best we can, but can always work to improve. We hope to welcome you back again to show you our high levels of service standards.",none,none,none,none,none,none,235,98
36 helpful votes,28 contributions,5.0 of 5 bubbles,Incredible staff and great hotel!,"I enjoyed my time at the BBR so much that I stayed again the following week. The bay front location is great (ask for a corner room), and the food is California fresh done right. What makes this place is the staff, though. Always friendly, and really good at their jobs. Francesca at valet went above and beyond, but worth mentioning also: Raymon from valet, Isaiah at front desk, and Stephanie, Alba, José, and Emilio from Room Service.   I appreciate the lengths they go to during the pandemic, like keeping rooms vacant 24 hours between each guest. All staff wear masks.   Because I love BBR so much and look forward to many future stays, or joining the club, a couple things I’d like to see improved: better comforters, and a no political flags/signs policy (I did not enjoying having",August 2020,none,none,"Thank you for sharing your five star review with us, veronicacI2795YS. We are so happy to hear that you enjoyed your stays at the Resort, including our helpful staff and waterfront location. We appreciate your feedback and will share it with our team. We hope to welcome you back soon, as a guest or a member.",none,none,none,none,none,none,236,98
41 helpful votes,20 contributions,5.0 of 5 bubbles,Burthday,Great staff and resort! Great restuarants. Nice bay for runs on the Duffy. Room are big and quiet. Didn't want to leave but other life calls for work to get done🙂 Lots of nice restaurants along pch as well. They allow to bring your doggy also,August 2020,none,none,"Thank you for sharing your five star review with us, sirputz2017. We are so happy to hear that you enjoyed your stay with us, especially our spacious rooms and waterfront location. We look forward to welcoming you back again soon.",none,none,none,none,none,none,237,98
1 helpful vote,7 contributions,3.0 of 5 bubbles,Just so--so,"Traveling during a pandemic can be very challenging.....having said that, this hotel did nothing to provide any discounts due to the lack of amenities! Parking could have been waived for the guests at the hotel and the hotel fee!  Absolutely ridiculous for the amount of amenities it lacked!",July 2020,none,none,"Thank you for sharing your Resort experience iwth us, kjmille. We appreciate your feedback and are working hard to continue to provide the best possible service and amenities during this time. Our resort fee covers the wifi, pool usage, business center, wine in the room and other items, all of which are still available to guests. We hope to welcome you back again.",none,none,none,none,none,none,238,98
1 helpful vote,1 contribution,5.0 of 5 bubbles,Staycation in Newport Beach,"We picked this resort because it had great reviews and was part of the Preferred Hotels brand.  The hotel is also very welcoming for dogs which was also a major consideration on our staycation.  Location is fantastic and the service and attention to detail was excellent.  Did not disappoint and would highly recommend the hotel. Considering we are in a pandemic, we were pleasantly surprised at what you could still do.  We were limited in choices and cant wait until everything opens up again.",July 2020,none,none,"Thank you for sharing your Balboa Bay Resort experience with us, tomalioto. We are glad to hear that you and your pup had a great stay with us and that our helpful staff made it even better. We can't wait to welcome you back again soon.",none,none,none,none,none,none,239,98
1 helpful vote,1 contribution,5.0 of 5 bubbles,Balboa Bay Resort,This place is awesome. I will always stay here when in Newport Beach. The bay view room was great. The staff was very friendly and professional. I invited friends to join me in celebration of my birthday and they all enjoyed themselves.,August 2020,none,none,"Thank you for sharing your five star review with us, Relax534584. We are so happy to hear that you enjoyed your stay with us, especially our bay views and helpful staff. We can't wait to welcome you back again soon.",none,none,none,none,none,none,240,98
17 helpful votes,12 contributions,4.0 of 5 bubbles,Great resort!,"Had a wonderful time at this resort.  All front desk staff and valet staff were excellent at their jobs.  Housekeeping was responsive.  Good job with Covid safety in the resort but still many younger adults with no masks throughout the facility :-(  Also, guests should be notified if their rooms are located above the restaurants/bars that there will be noise in the evenings.",July 2020,none,none,"Thank you for sharing your Resort experience with us, O7351SBbarbarac. We are happy to hear that you enjoyed your stay and that our helpful staff made it even better. We appreciate your feedback regarding other guests wearing masks and do work hard to encourage all guests to wear masks in our spaces. We hope to welcome you back again soon.",none,none,none,none,none,none,241,98
1 helpful vote,1 contribution,5.0 of 5 bubbles,Perfect staycation destination❤️,"My family and I loved staying at the Balboa Bay Resort. They get 5 stars on service, food, accommodations. Over all, great experience!!  Every staff member were helpful and beyond kind. I love how everyone knows everyone’s names on the same day that we check in. Very friendly and family environment. Super clean and sanitized. We can’t wait to go back!!",July 2020,none,none,"Thank you for sharing your five star review with us, gabbyenriquez2020. We are happy to hear you and your family had a great stay with us including our helpful staff and cleanliness standards. We look forward to welcoming you back again soon.",none,none,none,none,none,none,242,98
1 helpful vote,1 contribution,5.0 of 5 bubbles,Excellent Stay,Absolutely wonderful location and amenities.   Close to shopping and water activities Staff wonderful and positive.   Hotel was clean and Covid 19 precautions were addressed.  On site restaurants were friendly and food was excellent,July 2020,none,none,"Thank you for sharing your five star review with us, maryslittlelambs1. We are so happy to hear that you enjoyed our waterfront location and cleanliness standards. We hope to welcome you back again soon.",none,none,none,none,none,none,243,98
3 helpful votes,3 contributions,4.0 of 5 bubbles,Exhausted from moving,We just needed one night of rest during our home relocation. The food and the food servers were great! The room was clean and nice. We would have provided 5 stars if the initial front desk person would have been more engaged and offered additional options for our room. It gets a little chilly on the patio if not right next to the fire/heater. Nice place and nice people,July 2020,none,none,"Thank you for sharing your Resort experience with us, jwhite537. We are glad to hear that you enjoyed your night at the Resort including our food options and cleanliness. We look forward to welcoming you back again soon.",none,none,none,none,none,none,244,98
1 helpful vote,1 contribution,5.0 of 5 bubbles,Mr,"It was such an amazing experience since I checked in, the front desk was really nice and helpful specially  Isaiah.  The room is clean and nice. Want to the swimming had an amazing drinks at the pool bar a huge thank you to Ray the bartender, Julian, Peter and Keri",July 2020,none,none,"Thank you for sharing your Balboa Bay Resort experience with us, YSY133. We are happy to hear that you enjoyed your stay and that our helpful staff at the front desk and pool made it even better. We can't wait to welcome you back again soon.",none,none,none,none,none,none,245,98
1 helpful vote,1 contribution,5.0 of 5 bubbles,Nayelli at Blend was super nice,I went to the blend coffee shop and   NAYELLI KNOCKED IT OUT OF THE PARK.  GREAT COFFEE! GREAT SERVICE! SHE'S A PRO!  i didn't know what to get so she recommended something to me and i put all my faith in her and she did not disappoint.,July 2020,none,none,"Thank you for sharing your five star review with us, shrekfan. We are so happy to hear that you enjoyed your time at the Resort and your experience with Blend Café. We can't wait to welcome you back again soon.",none,none,none,none,none,none,246,98
9 helpful votes,8 contributions,5.0 of 5 bubbles,Wonderful weekend getaway,So nice to get away for the weekend.  The room was great!  Pool was great and service was great!  Love to sit out on the terrace having coffee and watching all the yachts go by. Definitely will return when we can take advantage of all the amenities when all this COVID craziness is over.,July 2020,none,none,"Thank you for sharing your five star review with us, Cindy G. We are so happy to hear that you enjoyed your stay with us, especially our pool and waterfront views. We look forward to welcoming you back again soon.",none,none,none,none,none,none,247,98
59 helpful votes,56 contributions,5.0 of 5 bubbles,"Beautiful, Friendly, Thourghtful","Balboa Bay Resort offers a beautiful setting by the marina, a short drive from most restaurants and the beach.  The room was spacious; the open-air restaurant was very nice; and the staff was wonderful.  The hotel seems to be taking good precautions during this difficult time:  everyone wears masks indoors, the very quick elevators are restricted to one family per trip; lounge chairs at the pool are clumped in appropriately distant groupings; etc.  Overall, our family had a great experience here during what was an important trip.  We plan to return.",July 2020,none,none,"Thank you for sharing your Balboa Bay Resort experience with us, FSN_13. We are happy to hear that you and you family had a great stay with us and enjoyed our spacious rooms, friendly staff and cleanliness standards. We can't wait to welcome you back again soon!",none,none,none,none,none,none,248,98
65 helpful votes,33 contributions,2.0 of 5 bubbles,Unless you like cold showers stay elsewhere!,"Stayed 4 nights but didn't have warm or hot water until the final day. We encountered several members of the staff that were generally not helpful and on multiple occasions rude. Valet, Bell, and pool staff were all very helpful and pleasant to interact with.",July 2020,none,none,Thank you for taking the time to review Balboa Bay Resort Darren M. We appreciate your feedback regarding your water temperature. If a guest lets our team know if this issue we try our best to get our team to fix this in a timely manner. We do hope that we can welcome you back again to show you our high levels of service standards.,none,none,none,none,none,none,249,98
1 helpful vote,1 contribution,5.0 of 5 bubbles,Everything was perfect!,"My only complaint was the down pillows in the room(not a fan) but i always bring my own so that wasn't a big issue. Also, getting incorrectly charged for 3 cars, (but Jennifer took care of that for me so no worries!) Everything else was perfect. The massage at the spa, the sunset at the restaurant, the pool, the service, all were great. It was the best time I've had alone. Thank you! I will be back :)",July 2020,none,none,"Thank you for sharing your five star review with us, Alleena O. We are happy to hear you enjoyed your stay including our pool and helpful staff. We look forward to welcoming you back again soon.",none,none,none,none,none,none,250,98
2 helpful votes,4 contributions,5.0 of 5 bubbles,Getaway,"Loved this classy resort and bay club!  From the Valet to the front desk. Style and grace. Needed a little getaway after 2020 shutdown and they came through on every level. Pool side and the attendants were perfectly on point. Drinks and food are top shelf and fine dining. Management, bartenders, and security made us feel fabulous.   Thank you Balboa Bay club and resort for the amazing getaway!!!",June 2020,none,none,"Thank you for sharing your Balboa Bay Resort experience with us, 374chelseat. We are so happy to hear that you had a great stay with us and enjoyed our amenities, helpful staff and dining! We can't wait to welcome you back again soon.",none,none,none,none,none,none,251,98
1 helpful vote,1 contribution,5.0 of 5 bubbles,Timothy at the front desk,He helped us with our reservation on the phone to accommodating us finding a dog sitter. The nicest gentlemen ever. We enjoyed his 5 star service. When booking our next stay I will certainly ask to speak with him.,July 2020,none,none,"Thank you for sharing your five star review with us, heatherwN7402DA. We are so happy to hear that Timothy was able to make your stay with us a memorable one! We can't wait to welcome you back again soon.",none,none,none,none,none,none,252,98
3 helpful votes,3 contributions,5.0 of 5 bubbles,Exceeded expectations,I've heard of the BBR for many years but never stayed. Now it's going to an an annual staycation. The room was delightful. The service outstanding and the food and beverage service was fresh and innovative in their offerings.,July 2020,none,none,"Thank you for sharing your five star review with us, Peter B. We are so happy to hear that you enjoyed your time at the Resort and are looking forward to welcoming you back regularly!",none,none,none,none,none,none,253,98
20 helpful votes,15 contributions,5.0 of 5 bubbles,Wonderful Resort & staff,"Def recommend! Wonderful & attentive staff, Jennifer Nguyen and the front Desk concierge helped celebrate since we came to make my mom happy from her Health recovery & Her nursing license Dream come true. They gave cute balloons, wine, & chocolates which made her so happy! What a wonderful place",July 2020,none,none,"Thank you for sharing your Balboa Bay Resort experience, Liltwinkoez. We are so happy to hear that you had a great celebratory stay! We look forward to welcoming you back again soon.",none,none,none,none,none,none,254,98
1 helpful vote,1 contribution,5.0 of 5 bubbles,Amazing!,We just got a basic room but it still felt and looked like I got a suit anyway. Was so excited to stay there. We will be coming back for our yearly family trip! Hopefully we won't have to wear masks when we come back hahaha but had an amazing couple days.,June 2020,none,none,"Thank you for sharing your five star review with us, Joeyherm. We are so happy to hear that you enjoyed your stay including our spacious rooms. We can't wait to welcome you back again.",none,none,none,none,none,none,255,98
1 helpful vote,1 contribution,5.0 of 5 bubbles,4th of July Holiday Weekend,"Arrived on the Thursday prior to the holiday and everything was great until the day we checked out (7/4/2020).  Young adults staying directly across the room from us and already starting to ""party"" at 7am isn't quite the way you want to be awakened.  Checking out was all good until another young adult group checked in and attempted to ""push their weight"" around verbally degrading the front desk staff trying to help them out.  Having money and flashing it for everyone to see isn't a way to get the service you want.  Just because you have money doesn't give anyone the right to treat anyone else rude.",July 2020,none,none,"Thank you for sharing your five star review with us, Marlo C. We are happy to hear that you enjoyed your holiday weekend at the Resort. We hope to welcome you back again soon to enjoy the Resort.",none,none,none,none,none,none,256,98
1 helpful vote,1 contribution,3.0 of 5 bubbles,Disappointed,"Great location and potential but the hotel did not live up to the hype or the price.  Charged a resort fee for amenities that weren't available and staff, though very friendly, really did not know what was happening",June 2020,none,none,"Thank you for sharing your Resort experience with us, Howard M. We are happy to hear that you enjoyed our waterfront location. We appreciate your feedback regarding the Resort Fee. The fee does cover WiFi, in-room wine upon check in, the Resort pool and Fitness Center which is open by appointment. We hope to welcome you back again.",none,none,none,none,none,none,257,98
5 helpful votes,7 contributions,5.0 of 5 bubbles,Well done during COVID,"Just had a fabulous stay for 2 nights.  Staff takes COVID seriously.  With limited numbers at pool, empty rooms, even plastic bags over the remotes. Great food on site, pool, setting, decor, comfortable beds.  We felt well taken care of .",June 2020,none,none,"Thank you for sharing your Balboa Bay Resort experience with us, Amy T. We are so happy to hear that you had a great stay with us and that our cleanliness standards and other resort amenities made your stay even better. We look forward to welcoming you back again soon!",none,none,none,none,none,none,258,98
14 helpful votes,13 contributions,5.0 of 5 bubbles,Gem,"Had a great stay at Balboa Bay resort over the Fourth of July. The Bay view room was the perfect place to watch the boats go by and get some fresh air. Beds are comfy, room is spacious, everyone is very helpful and courteous, and close proximity to everything. We will definitely be back!",July 2020,none,none,"Thank you for sharing your five star review with us, iberg5. We are so happy to hear that you enjoyed our bay views and helpful staff. We look forward to welcoming you back again!",none,none,none,none,none,none,259,98
7 helpful votes,3 contributions,5.0 of 5 bubbles,"Great Hotel, Great Location","Great views, great service, good sized rooms. This hotel has it all. I’ll definitely be back. If you can, get a bay view. You won’t be disappointed. The restaurant was very nice and the tables outside by the fire pit is where you should eat. Chicken sandwich was average at best, but rest of the menu was really good",June 2020,none,none,"Thank you for sharing your five star review with us, Anthony J. We are so happy to hear that you had a great stay with us and enjoyed our bay views and dining options. We can't wait to welcome you back again soon.",none,none,none,none,none,none,260,98
1 helpful vote,1 contribution,1.0 of 5 bubbles,Unfriendly Front Desk Staff,Celebrated my 14th wedding anniversary here. The Property is Excellent and the views from the Bayview room is superb. The only issue I had is when I asked for a late checkout I was denied rudely by the front desk. I called them twice to reason with them but the lady at the front desk wasn’t budging and was very dry and rude. It’s a shame as this would have been an excellent experience but the last impression I have before I leave the Resort is a Rude front desk staff. To be fair it was only the lady at the front desk the morning we checked out however the other staff members were professional and very helpful.,July 2020,none,none,"Thank you for sharing your Balboa Bay Resort experience with us, Luv2travel1818. We are happy to hear that you enjoyed our waterfront location and views. We appreciate your feedback regarding your check out experience and apologize that we were not able to accommodate a late check out. Due to the COVID-19 pandemic, we are not able to accommodate late check outs so we can properly clean and sanitize all spaces. We hope to welcome you back to show you our high levels of service standards.",none,none,none,none,none,none,261,98
14 helpful votes,11 contributions,5.0 of 5 bubbles,Beautiful property,Lovely resort on the Bay. I would recommend paying a bit more for a bay view room. Great location between Newport Beach and Balboa Island. The front desk staff was very helpful. Felt clean and safe during this COVID reopening.,June 2020,none,none,"Thank you for sharing your Balboa Bay Resort experience, Linda M. We are so happy to hear that you enjoyed our bayfront location and helpful staff. We hope to welcome you back again soon!",none,none,none,none,none,none,262,98
2 helpful votes,1 contribution,3.0 of 5 bubbles,Average Stay for an Above Average Priced Room,"Based on the cost of the room, I would rate our stay as simple ""average"". There was zero patio furniture on the room's patio to enjoy the view of the bay (which was the reason we purchased a bay view room) and were told there was nothing they could do when we called down to ask about it after check-in. We were also erroneously charged for room items post-check out and the follow-up to get these charges removed was not great. Probably wouldn't stay here again based on overall value.",June 2020,none,none,"Thank you for sharing your Resort experience with us, Wanderer436713. We appreciate your feedback regarding the amenities in your room. We work had to ensure each guest has the best experience possible and hope to welcome you back again to show you our high levels of service standards.",none,none,none,none,none,none,263,98
4 helpful votes,2 contributions,5.0 of 5 bubbles,Amazing!,I brought my husband here to celebrate his birthday and our stay was perfect’ Everyone we came in contact with was extremely helpful and friendly.  Our room was clean and beautiful. And we loved the location. Right on the water! Would definitely return!,June 2020,none,none,"Thank you for sharing your 5 star review with us, Sandiegoann2016. We are happy to hear that you and your husband enjoyed your celebratory getaway at the Resort and that our waterfront location and kind staff made it even better. We hope to welcome you back again soon!",none,none,none,none,none,none,264,98
3 helpful votes,1 contribution,1.0 of 5 bubbles,Worst hotel experience I’ve ever had.,"Terrible. Terrible. Terrible. I mean I don’t even know where to start. From the second we arrived we were not treated well. Valet was told not to put windows down in my car and before I even walked away they did it in front of me. Luckily there was no damage to the fresh tints that were installed. Once we walked in I would expect at least a smile and to be welcomed in. We payed close to $400 for the room for one night and I’ve had better service at a $60 motel. The lady at the front named Sylvia is the one who is responsible for this terrible review. She didn’t welcome me with a smile, but rather with a scowl and said “I’ll take you over here.” I thought it was pretty unprofessional but I didn’t make it a big deal. I thought I’d just smile and be nice, and maybe she would be",June 2020,none,none,none,none,none,none,none,none,none,265,98
2 helpful votes,1 contribution,5.0 of 5 bubbles,Enjoyable time!,"We loved our large room, great view of the pool area, the cleanliness, the quality of the food, the location and the pool. We had a relaxing time! It was just what we were looking for and a much needed break during this social distancing time.",June 2020,none,none,"Thank you for sharing your Balboa Bay Resort review with us, jennifermr4. We are so happy to hear that you had a great getaway with us and enjoyed our spacious rooms and resort amenities. We can't wait to welcome you back again.",none,none,none,none,none,none,266,98
